number,value,datetime_start,datetime_complete,duration,params_activation,params_dropout,params_hidden_size,params_lr,params_scale_target,params_scaler_post_pca,params_weight_decay,state
0,183.8569305419922,2026-01-02 12:55:17.379253,2026-01-02 12:55:58.601769,0 days 00:00:41.222516,silu,0.24660889197238434,59,0.07254460012524483,True,minmax,3.858410136341305e-06,COMPLETE
1,231.0443603515625,2026-01-02 12:55:58.609791,2026-01-02 12:56:33.003081,0 days 00:00:34.393290,relu,0.4127040812102646,9,0.006661704831062097,True,none,1.0081465761133494e-05,COMPLETE
2,,2026-01-02 12:56:33.009702,2026-01-02 12:57:07.234362,0 days 00:00:34.224660,mish,0.4101744601031275,16,0.02160746324331729,False,none,5.33404467851293e-05,FAIL
3,370.70765991210936,2026-01-02 12:57:07.245518,2026-01-02 12:57:37.717470,0 days 00:00:30.471952,relu,0.26504668756737476,6,0.048003901278300065,False,minmax,3.0828913754307267e-06,COMPLETE
4,191.21823272705078,2026-01-02 12:57:37.724330,2026-01-02 12:58:08.192994,0 days 00:00:30.468664,silu,0.2686220378975357,11,0.0031019311600365665,False,none,0.00037302316629102316,COMPLETE
5,325.6378005981445,2026-01-02 12:58:08.198570,2026-01-02 12:58:42.314477,0 days 00:00:34.115907,relu,0.46425542090102934,21,0.021911502054735653,False,minmax,7.446411954001944e-05,COMPLETE
6,181.82596130371093,2026-01-02 12:58:42.326562,2026-01-02 12:59:20.696855,0 days 00:00:38.370293,mish,0.3800869634228028,25,0.07618714090688272,True,none,0.0006673455121279557,COMPLETE
7,184.80040740966797,2026-01-02 12:59:20.705951,2026-01-02 12:59:56.119429,0 days 00:00:35.413478,mish,0.38644607216883475,27,0.0033574014558830057,False,minmax,3.171137939106181e-05,COMPLETE
8,,2026-01-02 12:59:56.124904,2026-01-02 13:00:33.972765,0 days 00:00:37.847861,gelu,0.4648629970366428,37,0.04979044706698038,False,none,0.00016355408027056786,FAIL
9,,2026-01-02 13:00:33.979012,2026-01-02 13:01:11.524492,0 days 00:00:37.545480,gelu,0.2639560654631495,26,0.040723885646306135,False,none,0.00013017770280172603,FAIL
10,219.1274627685547,2026-01-02 13:01:11.531430,2026-01-02 13:01:43.388037,0 days 00:00:31.856607,mish,0.44196792214323866,5,0.004100663460322011,True,none,0.0007664151756599678,COMPLETE
11,371.04737243652346,2026-01-02 13:01:43.394125,2026-01-02 13:02:19.379498,0 days 00:00:35.985373,gelu,0.4089377863304413,11,0.05671190099988865,False,minmax,7.492610534272348e-05,COMPLETE
12,208.34852752685546,2026-01-02 13:02:19.385068,2026-01-02 13:02:54.080282,0 days 00:00:34.695214,relu,0.4292779946991788,31,0.00230646213071367,True,none,1.0904491752430493e-06,COMPLETE
13,176.96037902832032,2026-01-02 13:02:54.085857,2026-01-02 13:03:36.141392,0 days 00:00:42.055535,mish,0.12512255581209672,57,0.0176358241791496,True,none,0.00023383400132030184,COMPLETE
14,178.28133697509764,2026-01-02 13:03:36.147506,2026-01-02 13:04:19.541653,0 days 00:00:43.394147,mish,0.1007842125117024,63,0.015824126536312565,True,none,0.00024305185034402218,COMPLETE
15,182.8096954345703,2026-01-02 13:04:19.547605,2026-01-02 13:05:03.104859,0 days 00:00:43.557254,mish,0.10359947641230956,63,0.015793059046748353,True,none,0.00015771132261641174,COMPLETE
16,175.91263580322266,2026-01-02 13:05:03.111925,2026-01-02 13:05:44.336725,0 days 00:00:41.224800,mish,0.10630398808132903,43,0.02363018158461626,True,none,0.00022895206807109237,COMPLETE
17,190.36118927001954,2026-01-02 13:05:44.342202,2026-01-02 13:06:25.876801,0 days 00:00:41.534599,gelu,0.17808091983652252,41,0.0010080367744529986,True,none,8.960985852267778e-05,COMPLETE
18,179.65621643066407,2026-01-02 13:06:25.882276,2026-01-02 13:07:06.681477,0 days 00:00:40.799201,mish,0.17323891461697555,39,0.028063626076842846,True,none,2.307829046531753e-05,COMPLETE
19,184.28712463378906,2026-01-02 13:07:06.688495,2026-01-02 13:07:43.249814,0 days 00:00:36.561319,mish,0.1679625827010266,17,0.00907501882170599,True,none,0.0001967488856753033,COMPLETE
20,180.36052017211915,2026-01-02 13:07:43.255572,2026-01-02 13:08:23.034185,0 days 00:00:39.778613,mish,0.21042743067978104,43,0.03294853932722058,True,none,0.000943881110400357,COMPLETE
21,179.2951690673828,2026-01-02 13:08:23.040592,2026-01-02 13:09:02.596073,0 days 00:00:39.555481,gelu,0.131228837447218,44,0.013228776815738127,True,none,3.8848686462366874e-05,COMPLETE
22,192.27544097900392,2026-01-02 13:09:02.601484,2026-01-02 13:09:38.208956,0 days 00:00:35.607472,silu,0.3430560001194312,18,0.006757453798582662,True,none,0.000293994688232753,COMPLETE
23,177.83527755737305,2026-01-02 13:09:38.214746,2026-01-02 13:10:16.486654,0 days 00:00:38.271908,mish,0.3229017415272157,33,0.041073932442362106,True,none,0.0001149770927003957,COMPLETE
24,181.61083602905273,2026-01-02 13:10:16.492078,2026-01-02 13:10:54.833260,0 days 00:00:38.341182,mish,0.3478490529260777,34,0.037618629930664144,True,none,0.00011408254256268563,COMPLETE
25,183.52055969238282,2026-01-02 13:10:54.838977,2026-01-02 13:11:35.996978,0 days 00:00:41.158001,mish,0.303567000772182,50,0.02234754169740216,True,none,0.000509728971094169,COMPLETE
26,169.0216552734375,2026-01-02 13:11:36.002395,2026-01-02 13:12:14.181941,0 days 00:00:38.179546,mish,0.14588543006053015,31,0.04143496911851454,True,none,0.0001524355673427964,COMPLETE
27,179.48003692626952,2026-01-02 13:12:14.188898,2026-01-02 13:12:51.427010,0 days 00:00:37.238112,mish,0.13476722019700665,24,0.022783200825744757,True,none,4.356800802268768e-05,COMPLETE
28,169.52764816284179,2026-01-02 13:12:51.432453,2026-01-02 13:13:32.426240,0 days 00:00:40.993787,mish,0.2129401743362211,50,0.09073292552425086,True,none,0.00040324349544479285,COMPLETE
29,,2026-01-02 13:13:32.432306,2026-01-02 13:14:11.451128,0 days 00:00:39.018822,mish,0.214850210528566,49,0.09167434155574719,False,minmax,0.000412839317915025,FAIL
30,,2026-01-02 13:14:11.457655,2026-01-02 13:14:49.988151,0 days 00:00:38.530496,mish,0.21056571139207217,48,0.08811467495203772,False,minmax,0.00040599068170538464,FAIL
31,,2026-01-02 13:14:49.993433,2026-01-02 13:15:25.192575,0 days 00:00:35.199142,mish,0.22340180672964968,14,0.05790868733659464,False,minmax,0.0004673604936807658,FAIL
32,,2026-01-02 13:15:25.198936,2026-01-02 13:16:00.285774,0 days 00:00:35.086838,mish,0.2094645460784091,14,0.09144227498792219,False,minmax,0.00041993100290286064,FAIL
33,,2026-01-02 13:16:00.291092,2026-01-02 13:16:38.835555,0 days 00:00:38.544463,mish,0.212128294222772,48,0.09717891975709336,False,minmax,0.00045145934754486347,FAIL
34,,2026-01-02 13:16:38.841035,2026-01-02 13:17:17.961448,0 days 00:00:39.120413,mish,0.21631630033223817,48,0.09343539811252972,False,minmax,0.00044208644612813775,FAIL
35,,2026-01-02 13:17:17.967471,2026-01-02 13:17:56.849890,0 days 00:00:38.882419,mish,0.20563230160332777,49,0.08765510427828868,False,minmax,0.0004329976871745592,FAIL
36,,2026-01-02 13:17:56.855050,2026-01-02 13:18:31.980574,0 days 00:00:35.125524,mish,0.21358568942205475,14,0.08869527489468669,False,minmax,0.0004496733502667436,FAIL
37,,2026-01-02 13:18:31.986063,2026-01-02 13:19:11.303615,0 days 00:00:39.317552,mish,0.21606986623972974,47,0.058300803783476664,False,minmax,0.00043547307355857657,FAIL
38,,2026-01-02 13:19:11.310296,2026-01-02 13:19:49.985580,0 days 00:00:38.675284,mish,0.22846750405820684,48,0.09084463169541684,False,minmax,0.00040168145326071274,FAIL
39,,2026-01-02 13:19:49.991534,2026-01-02 13:20:25.460531,0 days 00:00:35.468997,mish,0.22250799720171532,14,0.09591924736963874,False,minmax,0.0004313786165207797,FAIL
40,,2026-01-02 13:20:25.467215,2026-01-02 13:21:00.906746,0 days 00:00:35.439531,mish,0.21066625398980032,14,0.09024005684669888,False,minmax,0.00038358113954445745,FAIL
41,,2026-01-02 13:21:00.912653,2026-01-02 13:21:36.102284,0 days 00:00:35.189631,mish,0.2163425081635432,14,0.09154289780248989,False,minmax,0.0004122016064904818,FAIL
42,,2026-01-02 13:21:36.108171,2026-01-02 13:22:12.633151,0 days 00:00:36.524980,mish,0.21381762822258543,31,0.09733376313687797,False,minmax,0.0004284783408717527,FAIL
43,,2026-01-02 13:22:12.638369,2026-01-02 13:22:51.202863,0 days 00:00:38.564494,mish,0.21414243939163247,48,0.08775257533695813,False,minmax,1.5401307588779155e-05,FAIL
44,,2026-01-02 13:22:51.208038,2026-01-02 13:23:27.714634,0 days 00:00:36.506596,mish,0.2162449732736717,31,0.09645034720521597,False,minmax,0.00037430652000028863,FAIL
45,,2026-01-02 13:23:27.721524,2026-01-02 13:24:06.345678,0 days 00:00:38.624154,mish,0.21526783455625736,48,0.08697972134944701,False,minmax,0.00040763061822688697,FAIL
46,,2026-01-02 13:24:06.350884,2026-01-02 13:24:44.933748,0 days 00:00:38.582864,mish,0.21418143874262566,48,0.09714865932289378,False,minmax,0.00047891477125089864,FAIL
47,,2026-01-02 13:24:44.938934,2026-01-02 13:25:20.025016,0 days 00:00:35.086082,mish,0.19798969401741917,14,0.08916182314777207,False,minmax,0.000445283123603938,FAIL
48,,2026-01-02 13:25:20.030965,2026-01-02 13:25:58.938585,0 days 00:00:38.907620,mish,0.2269435487812756,48,0.09398492753551721,False,minmax,0.0004030930904523328,FAIL
49,,2026-01-02 13:25:58.944466,2026-01-02 13:26:37.822467,0 days 00:00:38.878001,mish,0.2126509096520151,50,0.09060131078795483,False,minmax,0.0003831988247348265,FAIL
50,,2026-01-02 13:26:37.827739,2026-01-02 13:27:16.580386,0 days 00:00:38.752647,mish,0.2112864049079219,48,0.09621473651477648,False,minmax,0.00039805117613282964,FAIL
51,,2026-01-02 13:27:16.585800,2026-01-02 13:27:53.018987,0 days 00:00:36.433187,mish,0.20484127787879303,30,0.09223380839730222,False,minmax,0.00043365523792285245,FAIL
52,,2026-01-02 13:27:53.025434,2026-01-02 13:28:31.882853,0 days 00:00:38.857419,mish,0.21518553704254756,47,0.0857873538691458,False,minmax,0.00044261959059412016,FAIL
53,,2026-01-02 13:28:31.888137,2026-01-02 13:29:08.667871,0 days 00:00:36.779734,mish,0.21330386981914698,30,0.08011595015426777,False,minmax,0.0004130535781493077,FAIL
54,,2026-01-02 13:29:08.673173,2026-01-02 13:29:47.469434,0 days 00:00:38.796261,mish,0.20547778466188407,48,0.08576099773639645,False,minmax,0.00039825867469029384,FAIL
55,,2026-01-02 13:29:47.476069,2026-01-02 13:30:27.109982,0 days 00:00:39.633913,mish,0.21709142288346328,50,0.09970555965913236,False,minmax,0.00039224478170080194,FAIL
56,,2026-01-02 13:30:27.121488,2026-01-02 13:31:06.173400,0 days 00:00:39.051912,mish,0.21327558592529286,47,0.081307406043608,False,minmax,0.000445699264806039,FAIL
57,,2026-01-02 13:31:06.178613,2026-01-02 13:31:45.255093,0 days 00:00:39.076480,mish,0.213589524725052,49,0.09459224530985037,False,minmax,0.00047040498331108154,FAIL
58,,2026-01-02 13:31:45.262343,2026-01-02 13:32:22.214692,0 days 00:00:36.952349,mish,0.21920275038325754,32,0.09760094720458565,False,minmax,0.00044184142647763863,FAIL
59,,2026-01-02 13:32:22.220247,2026-01-02 13:32:57.658387,0 days 00:00:35.438140,mish,0.2144591618656545,14,0.09799765282484481,False,minmax,0.0005316962793910694,FAIL
60,,2026-01-02 13:32:57.664990,2026-01-02 13:33:32.966633,0 days 00:00:35.301643,mish,0.2133052261044996,14,0.09079513327076523,False,minmax,0.0004341876212233242,FAIL
61,,2026-01-02 13:33:32.971807,2026-01-02 13:34:12.053627,0 days 00:00:39.081820,mish,0.2049020316072512,47,0.08999870074992858,False,minmax,0.0004089567641543775,FAIL
62,,2026-01-02 13:34:12.059123,2026-01-02 13:34:50.888581,0 days 00:00:38.829458,mish,0.22339509380849368,48,0.09069720751463968,False,minmax,0.0004939937089047067,FAIL
63,,2026-01-02 13:34:50.894021,2026-01-02 13:35:26.336939,0 days 00:00:35.442918,mish,0.215647839982889,14,0.09930311643779327,False,minmax,0.000328771244910885,FAIL
64,,2026-01-02 13:35:26.342842,2026-01-02 13:36:05.632144,0 days 00:00:39.289302,mish,0.22061737336871778,50,0.08829525919195033,False,minmax,0.00040298060046421486,FAIL
65,,2026-01-02 13:36:05.637603,2026-01-02 13:36:44.656622,0 days 00:00:39.019019,mish,0.2190495786714749,47,0.09962459478566243,False,minmax,0.0004234525775802411,FAIL
66,,2026-01-02 13:36:44.662477,2026-01-02 13:37:20.047384,0 days 00:00:35.384907,mish,0.22709315758121437,14,0.09268877745994343,False,minmax,1.3848541611367217e-05,FAIL
67,,2026-01-02 13:37:20.053043,2026-01-02 13:37:56.716408,0 days 00:00:36.663365,mish,0.20310601833135783,30,0.09114452532184202,False,minmax,0.00043991666570309095,FAIL
68,,2026-01-02 13:37:56.721810,2026-01-02 13:38:33.399754,0 days 00:00:36.677944,mish,0.18072855768144763,31,0.09963251158093175,False,minmax,0.00042844254433306166,FAIL
69,,2026-01-02 13:38:33.406176,2026-01-02 13:39:12.567825,0 days 00:00:39.161649,mish,0.19922742497054252,47,0.09637145473539412,False,minmax,0.00042018830012632,FAIL
70,,2026-01-02 13:39:12.573315,2026-01-02 13:39:48.044544,0 days 00:00:35.471229,mish,0.22314360957224905,14,0.09463477086698492,False,minmax,0.0004323911795781761,FAIL
71,,2026-01-02 13:39:48.051565,2026-01-02 13:40:27.183046,0 days 00:00:39.131481,mish,0.21484065338742814,47,0.09907524903792697,False,minmax,0.0004326822297100139,FAIL
72,,2026-01-02 13:40:27.188591,2026-01-02 13:41:02.886607,0 days 00:00:35.698016,mish,0.21052957064073355,14,0.07716797483965206,False,minmax,0.00041934633965270583,FAIL
73,,2026-01-02 13:41:02.892392,2026-01-02 13:41:39.651587,0 days 00:00:36.759195,mish,0.2141146080312294,30,0.0923635329956246,False,minmax,0.00039805845550396963,FAIL
74,,2026-01-02 13:41:39.657381,2026-01-02 13:42:19.067931,0 days 00:00:39.410550,mish,0.21042138696156065,49,0.08068206633362301,False,minmax,0.00043106363489715577,FAIL
75,,2026-01-02 13:42:19.076708,2026-01-02 13:42:54.644578,0 days 00:00:35.567870,mish,0.21340431291018921,14,0.09203390902615953,False,minmax,0.0003990138387138832,FAIL
76,,2026-01-02 13:42:54.650022,2026-01-02 13:43:35.055382,0 days 00:00:40.405360,mish,0.20606372804231232,48,0.09825104092132049,False,minmax,0.00045573817925940964,FAIL
77,,2026-01-02 13:43:35.062285,2026-01-02 13:44:14.654255,0 days 00:00:39.591970,mish,0.21671052822320014,49,0.07665608788449514,False,minmax,0.00042615263625578087,FAIL
78,,2026-01-02 13:44:14.659700,2026-01-02 13:44:50.126276,0 days 00:00:35.466576,mish,0.20761024661318017,14,0.08807034427203392,False,minmax,0.0003999375387626813,FAIL
79,,2026-01-02 13:44:50.131425,2026-01-02 13:45:29.239153,0 days 00:00:39.107728,mish,0.21662137704997103,47,0.07452039279338052,False,minmax,0.0004098924762379202,FAIL
80,,2026-01-02 13:45:29.245006,2026-01-02 13:46:08.513869,0 days 00:00:39.268863,mish,0.19913585780118498,47,0.09835172332020707,False,minmax,0.00038569809561201886,FAIL
81,,2026-01-02 13:46:08.519266,2026-01-02 13:46:47.662654,0 days 00:00:39.143388,mish,0.21267858379279314,49,0.09967654400908531,False,minmax,0.0004343928438218446,FAIL
82,,2026-01-02 13:46:47.668082,2026-01-02 13:47:27.372096,0 days 00:00:39.704014,mish,0.2130962044757308,49,0.09982839629211321,False,minmax,0.00045632783665345395,FAIL
83,,2026-01-02 13:47:27.377987,2026-01-02 13:48:06.399353,0 days 00:00:39.021366,mish,0.21382519870224598,48,0.09085214209070823,False,minmax,0.00035576723230486615,FAIL
84,,2026-01-02 13:48:06.404801,2026-01-02 13:48:43.616801,0 days 00:00:37.212000,mish,0.2134371920869604,31,0.09858613097297009,False,minmax,0.00043858247166963144,FAIL
85,,2026-01-02 13:48:43.621987,2026-01-02 13:49:19.213078,0 days 00:00:35.591091,mish,0.21712971766080297,14,0.09005737053900394,False,minmax,0.00040688035234579656,FAIL
86,,2026-01-02 13:49:19.220097,2026-01-02 13:49:54.878409,0 days 00:00:35.658312,mish,0.2055520203689296,14,0.09642575277486083,False,minmax,0.0004653486327006274,FAIL
87,,2026-01-02 13:49:54.883889,2026-01-02 13:50:30.876240,0 days 00:00:35.992351,mish,0.21809349973182346,14,0.09927120396813113,False,minmax,0.0004544502126202881,FAIL
88,,2026-01-02 13:50:30.883267,2026-01-02 13:51:11.164058,0 days 00:00:40.280791,mish,0.20949440017636248,47,0.08367326293559041,False,minmax,0.0004355958410611452,FAIL
89,,2026-01-02 13:51:11.170460,2026-01-02 13:51:50.814147,0 days 00:00:39.643687,mish,0.2073518108028796,49,0.08235698984662596,False,minmax,0.0004476184258167955,FAIL
90,,2026-01-02 13:51:50.820894,2026-01-02 13:52:27.957814,0 days 00:00:37.136920,mish,0.20807825364280705,31,0.09534303586564326,False,minmax,0.00042846434997863015,FAIL
91,,2026-01-02 13:52:27.963474,2026-01-02 13:53:05.040154,0 days 00:00:37.076680,mish,0.2143557894036107,31,0.08666473842478466,False,minmax,0.0004402225296212852,FAIL
92,,2026-01-02 13:53:05.045661,2026-01-02 13:53:40.642060,0 days 00:00:35.596399,mish,0.21418941685464196,14,0.09228220932827666,False,minmax,0.00039509956311169686,FAIL
93,,2026-01-02 13:53:40.647761,2026-01-02 13:54:19.784778,0 days 00:00:39.137017,mish,0.20993149807342334,48,0.09568349382799597,False,minmax,0.0004269121265343666,FAIL
94,,2026-01-02 13:54:19.790598,2026-01-02 13:55:00.023582,0 days 00:00:40.232984,mish,0.20795443001872604,47,0.09524748522473019,False,minmax,0.0004642193678015014,FAIL
95,,2026-01-02 13:55:00.030678,2026-01-02 13:55:39.408911,0 days 00:00:39.378233,mish,0.22081863490368608,48,0.08801133773812118,False,minmax,0.00048606686080685435,FAIL
96,,2026-01-02 13:55:39.414297,2026-01-02 13:56:19.124660,0 days 00:00:39.710363,mish,0.21022594530249758,50,0.09213727821643754,False,minmax,0.0004132303697728158,FAIL
97,,2026-01-02 13:56:19.131125,2026-01-02 14:10:23.603013,0 days 00:14:04.471888,mish,0.21222712818829492,14,0.061155776985140735,False,minmax,0.0003662010253590501,FAIL
98,,2026-01-02 14:10:23.614688,2026-01-02 14:11:01.931252,0 days 00:00:38.316564,mish,0.21759064761418095,47,0.06298869641325738,False,minmax,0.00041317528558775847,FAIL
99,,2026-01-02 14:11:01.937470,2026-01-02 14:11:39.225527,0 days 00:00:37.288057,mish,0.1951358874400524,49,0.08588612224316919,False,minmax,0.0004114585494548231,FAIL
100,,2026-01-02 14:11:39.230536,2026-01-02 14:12:16.675885,0 days 00:00:37.445349,mish,0.20147166917362508,49,0.06765077589535898,False,minmax,0.00046218021013389864,FAIL
101,,2026-01-02 14:12:16.682865,2026-01-02 14:12:53.680131,0 days 00:00:36.997266,mish,0.21709014759366252,47,0.0905940844360381,False,minmax,0.00044186938169341847,FAIL
102,,2026-01-02 14:12:53.685200,2026-01-02 14:13:26.873626,0 days 00:00:33.188426,mish,0.23134024608592157,14,0.08840524822847758,False,minmax,0.0003342056535994308,FAIL
103,,2026-01-02 14:13:26.879809,2026-01-02 14:14:04.869065,0 days 00:00:37.989256,mish,0.21444555983661825,49,0.0981984173366775,False,minmax,0.0004116140207656382,FAIL
104,,2026-01-02 14:14:04.874818,2026-01-02 14:14:39.477738,0 days 00:00:34.602920,mish,0.21529509779710687,14,0.08410914209328187,False,minmax,0.00035071750744072205,FAIL
105,,2026-01-02 14:14:39.484217,2026-01-02 14:15:14.423977,0 days 00:00:34.939760,mish,0.19921412677070716,14,0.08829278459755686,False,minmax,0.00038575187888978673,FAIL
106,,2026-01-02 14:15:14.429854,2026-01-02 14:15:53.889844,0 days 00:00:39.459990,mish,0.21372055930318445,48,0.09148633387724267,False,minmax,0.00046517460830309865,FAIL
107,,2026-01-02 14:15:53.895178,2026-01-02 14:16:33.584962,0 days 00:00:39.689784,mish,0.2153869074752947,49,0.09865561675614454,False,minmax,0.0004584776320369226,FAIL
108,,2026-01-02 14:16:33.595313,2026-01-02 14:17:13.373547,0 days 00:00:39.778234,mish,0.20973585219876323,47,0.09489557704214113,False,minmax,1.6816327393168978e-05,FAIL
109,,2026-01-02 14:17:13.379106,2026-01-02 14:17:50.954303,0 days 00:00:37.575197,mish,0.21077784065900035,33,0.09661551745573459,False,minmax,0.0004553910909426241,FAIL
110,,2026-01-02 14:17:50.959877,2026-01-02 14:18:31.232164,0 days 00:00:40.272287,mish,0.2085846550941574,47,0.09978272203809288,False,minmax,0.00043214879581397286,FAIL
111,,2026-01-02 14:18:31.238566,2026-01-02 14:19:07.490424,0 days 00:00:36.251858,mish,0.2171641251456793,14,0.08368577191306871,False,minmax,0.0004391766799070151,FAIL
112,,2026-01-02 14:19:07.495878,2026-01-02 14:19:47.888970,0 days 00:00:40.393092,mish,0.2191739545978136,48,0.09340069957094205,False,minmax,0.0004154582225974331,FAIL
113,,2026-01-02 14:19:47.895979,2026-01-02 14:20:28.754242,0 days 00:00:40.858263,mish,0.21442172160735148,47,0.081429110816856,False,minmax,0.0004042145553214224,FAIL
114,,2026-01-02 14:20:28.761761,2026-01-02 14:21:12.395145,0 days 00:00:43.633384,mish,0.21913364934008359,50,0.0912864926040954,False,minmax,0.0003884631077335928,FAIL
115,,2026-01-02 14:21:12.402697,2026-01-02 14:21:49.190614,0 days 00:00:36.787917,mish,0.21092606585198811,14,0.06977850492727135,False,minmax,0.00041493938549594085,FAIL
116,,2026-01-02 14:21:49.395652,2026-01-02 14:22:30.551320,0 days 00:00:41.155668,mish,0.21744813255295853,47,0.08572427810176982,False,minmax,0.0004348675773177272,FAIL
117,,2026-01-02 14:22:30.559836,2026-01-02 14:23:11.812130,0 days 00:00:41.252294,mish,0.21063116300136325,48,0.09845996907120552,False,minmax,0.0004930220340527209,FAIL
118,,2026-01-02 14:23:11.818944,2026-01-02 14:23:48.935193,0 days 00:00:37.116249,mish,0.20949710644290193,14,0.09545570948253933,False,minmax,0.00040969610280512013,FAIL
119,,2026-01-02 14:23:48.941099,2026-01-02 14:24:26.094382,0 days 00:00:37.153283,mish,0.2059189148574139,14,0.0847282042835312,False,minmax,0.00039983418928604187,FAIL
120,,2026-01-02 14:24:26.100862,2026-01-02 14:25:07.606034,0 days 00:00:41.505172,mish,0.21155128754717167,49,0.09716054026349803,False,minmax,0.000441447729345832,FAIL
121,,2026-01-02 14:25:07.611922,2026-01-02 14:25:44.896663,0 days 00:00:37.284741,mish,0.2122986548037451,14,0.09251003437765055,False,minmax,0.0003694632906403619,FAIL
122,,2026-01-02 14:25:44.904979,2026-01-02 14:26:26.789246,0 days 00:00:41.884267,mish,0.22247693676555763,47,0.09394285488227355,False,minmax,0.00044670734784435723,FAIL
123,,2026-01-02 14:26:26.796229,2026-01-02 14:27:08.454881,0 days 00:00:41.658652,mish,0.21668840568637268,48,0.0998538276329141,False,minmax,0.0005104448615446389,FAIL
