number,value,datetime_start,datetime_complete,duration,params_activation,params_dropout,params_gaussian_noise,params_hidden_size,params_lr,params_scale_target,params_scaler,params_weight_decay,state
102,160.2337646484375,2026-01-20 17:11:09.082549,2026-01-20 17:11:11.242978,0 days 00:00:02.160429,relu,0.11754698548711359,0.025197515382874434,23,0.09946133499780895,True,standard,0.00017961211309483775,COMPLETE
103,170.2604217529297,2026-01-20 17:11:11.248065,2026-01-20 17:11:13.615637,0 days 00:00:02.367572,relu,0.12331809937461141,0.034724575921506705,19,0.076467526616246,True,standard,7.876986218264706e-05,COMPLETE
104,158.7821807861328,2026-01-20 17:11:13.621235,2026-01-20 17:11:15.775897,0 days 00:00:02.154662,relu,0.10627574476867521,0.026212774487156774,20,0.09740835965009781,True,standard,0.00017877295070849454,COMPLETE
105,164.3848876953125,2026-01-20 17:11:15.779776,2026-01-20 17:11:17.928368,0 days 00:00:02.148592,relu,0.10602120179013036,0.024296735185165237,20,0.09387197495636761,True,standard,0.00017666592952755503,COMPLETE
106,164.562255859375,2026-01-20 17:11:17.932967,2026-01-20 17:11:20.097987,0 days 00:00:02.165020,relu,0.10094715764346908,0.0332692755285475,20,0.0998089785398139,True,standard,0.0008151585152862194,COMPLETE
107,266.0982507324219,2026-01-20 17:11:20.102558,2026-01-20 17:11:22.142667,0 days 00:00:02.040109,silu,0.11631849942234658,0.029589540636259352,19,0.000977305244349411,False,minmax,0.00026333163841567455,COMPLETE
108,158.44676208496094,2026-01-20 17:11:22.147341,2026-01-20 17:11:24.490395,0 days 00:00:02.343054,relu,0.139487612435944,0.027906110513753676,62,0.06427734882316166,True,standard,7.691063559104248e-06,COMPLETE
109,160.5911102294922,2026-01-20 17:11:24.494428,2026-01-20 17:11:26.706720,0 days 00:00:02.212292,relu,0.11076049132132243,0.027352417790517176,50,0.06424424020504087,True,standard,7.4641663907399365e-06,COMPLETE
110,160.1433563232422,2026-01-20 17:11:26.710398,2026-01-20 17:11:28.999350,0 days 00:00:02.288952,relu,0.1107759474660534,0.02774418743700559,64,0.0630101636698767,True,standard,8.521266604830437e-06,COMPLETE
111,160.54542541503906,2026-01-20 17:11:29.003707,2026-01-20 17:11:31.222076,0 days 00:00:02.218369,relu,0.11267730303465087,0.028648342377861916,62,0.061261753856446624,True,standard,4.912586864989284e-06,COMPLETE
112,162.47958374023438,2026-01-20 17:11:31.226105,2026-01-20 17:11:33.425956,0 days 00:00:02.199851,relu,0.11160650179058841,0.02756515495066325,64,0.06254329101752515,True,standard,4.65467373010826e-06,COMPLETE
113,156.83363342285156,2026-01-20 17:11:33.430114,2026-01-20 17:11:35.653498,0 days 00:00:02.223384,relu,0.1209131631806777,0.039267546647251336,62,0.05342629261431023,True,standard,6.089536977622378e-06,COMPLETE
114,159.20663452148438,2026-01-20 17:11:35.657623,2026-01-20 17:11:37.878226,0 days 00:00:02.220603,relu,0.12444674889153633,0.03726764205468424,62,0.050675215454111924,True,standard,7.556705003818822e-06,COMPLETE
115,165.66519165039062,2026-01-20 17:11:37.882471,2026-01-20 17:11:40.089242,0 days 00:00:02.206771,relu,0.10654232144229721,0.04154447310148436,61,0.03785195844800631,True,standard,8.417382000713104e-06,COMPLETE
116,163.2834930419922,2026-01-20 17:11:40.093337,2026-01-20 17:11:42.395263,0 days 00:00:02.301926,relu,0.12591429115874575,0.03637158964170458,62,0.0516170178879758,True,standard,3.2907994916744655e-06,COMPLETE
117,177.3616485595703,2026-01-20 17:11:42.399580,2026-01-20 17:11:44.896869,0 days 00:00:02.497289,mish,0.14266236497128473,0.030477703239495696,57,0.04213892976821192,True,standard,6.2687984600871385e-06,COMPLETE
118,167.62255859375,2026-01-20 17:11:44.901341,2026-01-20 17:11:47.136249,0 days 00:00:02.234908,relu,0.10149886075314796,0.04825497218648688,57,0.03246898980189977,True,standard,1.1256899282646056e-05,COMPLETE
119,158.49850463867188,2026-01-20 17:11:47.140211,2026-01-20 17:11:49.416285,0 days 00:00:02.276074,relu,0.1112595870205007,0.043792000971620344,62,0.05402322287461122,True,standard,7.364029697665665e-06,COMPLETE
120,182.9049530029297,2026-01-20 17:11:49.421331,2026-01-20 17:11:51.675653,0 days 00:00:02.254322,relu,0.12154324883573601,0.04450603035130388,54,0.05312668166380708,True,none,5.117923720492049e-06,COMPLETE
121,157.1648406982422,2026-01-20 17:11:51.679675,2026-01-20 17:11:54.028709,0 days 00:00:02.349034,relu,0.11140621637226339,0.03960974933076818,59,0.06803611776993247,True,standard,7.596847433371949e-06,COMPLETE
122,161.87179565429688,2026-01-20 17:11:54.033143,2026-01-20 17:11:56.254251,0 days 00:00:02.221108,relu,0.1148208799783421,0.03983414068877509,59,0.07183699949710763,True,standard,9.128713258605722e-06,COMPLETE
123,160.22036743164062,2026-01-20 17:11:56.258221,2026-01-20 17:11:58.576068,0 days 00:00:02.317847,relu,0.13981151741518677,0.04347262736114509,62,0.04622200766853,True,standard,4.149405259009594e-06,COMPLETE
124,164.75074768066406,2026-01-20 17:11:58.580356,2026-01-20 17:12:00.799340,0 days 00:00:02.218984,relu,0.13714127009283456,0.05167227528047609,64,0.0350059665402355,True,standard,1.3674505015823371e-05,COMPLETE
125,171.0126953125,2026-01-20 17:12:00.803502,2026-01-20 17:12:03.042790,0 days 00:00:02.239288,relu,0.12834624645111692,0.04303904256030362,59,0.023369311563407894,True,standard,3.074581595557719e-06,COMPLETE
126,169.7985382080078,2026-01-20 17:12:03.048582,2026-01-20 17:12:05.331031,0 days 00:00:02.282449,relu,0.14219064701877032,0.04650519463759152,62,0.028756099448970424,True,standard,3.944566543459025e-06,COMPLETE
127,181.21981811523438,2026-01-20 17:12:05.335306,2026-01-20 17:12:07.561346,0 days 00:00:02.226040,relu,0.14944170806907228,0.03749812298978158,54,0.005419198951143508,True,standard,6.759086245871172e-06,COMPLETE
128,202.8310137939453,2026-01-20 17:12:07.566619,2026-01-20 17:12:09.748993,0 days 00:00:02.182374,gelu,0.12785047085237683,0.035249052883556224,59,0.000981397637076455,False,standard,7.774825143921268e-06,COMPLETE
129,161.12075805664062,2026-01-20 17:12:09.752537,2026-01-20 17:12:11.994921,0 days 00:00:02.242384,relu,0.100785377991607,0.03901490176065914,58,0.050124202644120215,True,standard,1.0429235209249607e-05,COMPLETE
130,164.08203125,2026-01-20 17:12:11.999351,2026-01-20 17:12:14.183186,0 days 00:00:02.183835,relu,0.12145203005058251,0.042754147292121535,64,0.04349560781616951,True,standard,5.7461666876616286e-06,COMPLETE
131,159.74899291992188,2026-01-20 17:12:14.188752,2026-01-20 17:12:16.652548,0 days 00:00:02.463796,relu,0.11344917135096258,0.030663748178776085,62,0.05849935852023768,True,standard,4.882145805616881e-06,COMPLETE
132,160.0350341796875,2026-01-20 17:12:16.656940,2026-01-20 17:12:18.897661,0 days 00:00:02.240721,relu,0.13540499929211017,0.0484334441535149,55,0.07340344957221448,True,standard,2.8266289176777025e-06,COMPLETE
133,162.6595916748047,2026-01-20 17:12:18.903786,2026-01-20 17:12:21.153435,0 days 00:00:02.249649,relu,0.11049548642216177,0.055373414221771076,55,0.05507147404241966,True,standard,4.142948309484089e-06,COMPLETE
134,168.37118530273438,2026-01-20 17:12:21.157558,2026-01-20 17:12:23.424486,0 days 00:00:02.266928,relu,0.4485283074726374,0.04559123860367295,52,0.07023698659127642,True,standard,2.639797352102485e-06,COMPLETE
135,163.1859588623047,2026-01-20 17:12:23.428825,2026-01-20 17:12:25.758894,0 days 00:00:02.330069,relu,0.12172947901766785,0.03142971213781631,62,0.046104795648648216,True,standard,5.689657783044105e-06,COMPLETE
136,200.56747436523438,2026-01-20 17:12:25.762853,2026-01-20 17:12:28.033414,0 days 00:00:02.270561,relu,0.13029984180747528,0.041390111587382435,61,0.0032959202698093805,True,minmax,6.727156346499591e-06,COMPLETE
137,176.0253448486328,2026-01-20 17:12:28.037736,2026-01-20 17:12:30.332297,0 days 00:00:02.294561,silu,0.1176314435145497,0.04721945148676948,57,0.062106497862382246,True,standard,1.958660589701238e-06,COMPLETE
138,154.2215118408203,2026-01-20 17:12:30.337960,2026-01-20 17:12:32.621638,0 days 00:00:02.283678,relu,0.10028921054305676,0.03301875337980109,60,0.07118070110163098,True,standard,2.9600820526497433e-06,COMPLETE
139,158.17262268066406,2026-01-20 17:12:32.664514,2026-01-20 17:12:34.975267,0 days 00:00:02.310753,relu,0.1007494643404761,0.049861906492068994,60,0.0728572396074492,True,standard,3.494596090523331e-06,COMPLETE
140,161.4053955078125,2026-01-20 17:12:34.979301,2026-01-20 17:12:37.167716,0 days 00:00:02.188415,relu,0.1060668386478895,0.03365390057608495,60,0.07378825903709459,True,standard,3.7485049826653667e-06,COMPLETE
141,158.88320922851562,2026-01-20 17:12:37.172192,2026-01-20 17:12:39.358655,0 days 00:00:02.186463,relu,0.10729220541572061,0.048212692833395195,63,0.05529338369737691,True,standard,2.8381844952253984e-06,COMPLETE
142,159.9971466064453,2026-01-20 17:12:39.362884,2026-01-20 17:12:41.567612,0 days 00:00:02.204728,relu,0.10774002820778271,0.04997592472365793,64,0.06691206442533404,True,standard,2.881917139940478e-06,COMPLETE
143,159.76377868652344,2026-01-20 17:12:41.571243,2026-01-20 17:12:43.758131,0 days 00:00:02.186888,relu,0.10722435678201095,0.05058818810632714,60,0.054915762492491936,True,standard,2.6574806991739085e-06,COMPLETE
144,165.2709503173828,2026-01-20 17:12:43.762432,2026-01-20 17:12:45.951728,0 days 00:00:02.189296,relu,0.10294393711854814,0.05453158159424614,58,0.03848793913039608,True,standard,1.7985834604076388e-06,COMPLETE
145,161.50120544433594,2026-01-20 17:12:45.956745,2026-01-20 17:12:48.144314,0 days 00:00:02.187569,relu,0.10179868208811921,0.05985130927094183,60,0.05480474248870496,True,standard,1.3439764451080884e-06,COMPLETE
146,179.40457153320312,2026-01-20 17:12:48.148799,2026-01-20 17:12:50.349906,0 days 00:00:02.201107,relu,0.11691322389866911,0.052564613973716076,61,0.007301200258722877,True,standard,2.317197434083033e-06,COMPLETE
147,175.07601928710938,2026-01-20 17:12:50.354005,2026-01-20 17:12:52.795120,0 days 00:00:02.441115,mish,0.10040598400142164,0.05914232851779999,63,0.05634872303824577,True,standard,3.04300734654912e-06,COMPLETE
148,186.2503662109375,2026-01-20 17:12:52.799638,2026-01-20 17:12:55.017537,0 days 00:00:02.217899,relu,0.11130234820360901,0.05000818008256268,58,0.07039956512463447,True,none,3.383099226707678e-06,COMPLETE
149,160.7406768798828,2026-01-20 17:12:55.021436,2026-01-20 17:12:57.228692,0 days 00:00:02.207256,relu,0.12595256026002843,0.037846351593231464,56,0.07913592286666567,True,standard,1.4640824486188166e-06,COMPLETE
