number,value,datetime_start,datetime_complete,duration,params_activation,params_dropout,params_gaussian_noise,params_hidden_size,params_lr,params_scale_target,params_scaler,params_weight_decay,state
0,176.4409637451172,2026-01-20 17:07:19.668194,2026-01-20 17:07:22.809061,0 days 00:00:03.140867,mish,0.1855168696274495,0.019388068367976963,31,0.04486096090715905,True,standard,2.0922851365015864e-05,COMPLETE
1,200.98219299316406,2026-01-20 17:07:22.813850,2026-01-20 17:07:25.012253,0 days 00:00:02.198403,silu,0.12391416669459475,0.07420930624100551,30,0.005100097130477121,True,minmax,0.0001127995274044097,COMPLETE
2,374.98527343750004,2026-01-20 17:07:25.016014,2026-01-20 17:07:27.108179,0 days 00:00:02.092165,silu,0.1963638596249509,0.04447463203102552,30,2.7495268572938703e-05,False,minmax,3.124542410404125e-05,COMPLETE
3,192.54080200195312,2026-01-20 17:07:27.112202,2026-01-20 17:07:29.436231,0 days 00:00:02.324029,relu,0.3202174428014625,0.06195115816716963,38,0.0021278732094020766,True,standard,0.00011007308305057873,COMPLETE
4,220.2893829345703,2026-01-20 17:07:29.440639,2026-01-20 17:07:31.681028,0 days 00:00:02.240389,silu,0.3454210421230609,0.0467512487649308,60,0.0002399232366798736,True,robust,0.000333785887576073,COMPLETE
5,179.59756469726562,2026-01-20 17:07:31.686563,2026-01-20 17:07:34.102798,0 days 00:00:02.416235,silu,0.1550134391318909,0.05636612118729391,46,0.08503324468578018,True,robust,9.680053755265293e-06,COMPLETE
6,373.37384155273435,2026-01-20 17:07:34.115049,2026-01-20 17:07:36.506452,0 days 00:00:02.391403,mish,0.31802202818057185,0.00373132406073734,16,6.15844017032669e-05,False,minmax,1.2164753943489103e-06,COMPLETE
7,368.4969812011718,2026-01-20 17:07:36.510641,2026-01-20 17:07:38.746547,0 days 00:00:02.235906,silu,0.11462251262387167,0.03247090511299277,56,9.823605936587577e-05,False,robust,2.5409339415941257e-06,COMPLETE
8,208.3221893310547,2026-01-20 17:07:38.751174,2026-01-20 17:07:40.986028,0 days 00:00:02.234854,mish,0.2831029013132379,0.05209439574011402,21,0.0006932461335389443,True,none,3.352670835380042e-05,COMPLETE
9,200.6859130859375,2026-01-20 17:07:40.990458,2026-01-20 17:07:43.205200,0 days 00:00:02.214742,mish,0.28393647228740354,0.03664026046329429,18,0.000825374425104202,True,standard,1.6650533666909185e-05,COMPLETE
10,376.05487792968745,2026-01-20 17:07:43.209050,2026-01-20 17:07:45.272479,0 days 00:00:02.063429,gelu,0.46563741389646557,0.09724630438945488,23,1.0813386391439907e-05,False,standard,0.00069984495834392,COMPLETE
11,162.2245330810547,2026-01-20 17:07:45.276263,2026-01-20 17:07:47.575147,0 days 00:00:02.298884,relu,0.1958271797531713,0.01835844828344184,42,0.09915944693717425,True,robust,6.864281189147699e-06,COMPLETE
12,184.52200317382812,2026-01-20 17:07:47.578938,2026-01-20 17:07:50.048050,0 days 00:00:02.469112,relu,0.21123198075531868,0.012736158784592742,40,0.09085272565064709,True,none,6.101253858906327e-06,COMPLETE
13,180.24085998535156,2026-01-20 17:07:50.052014,2026-01-20 17:07:52.308664,0 days 00:00:02.256650,relu,0.22167294725807823,0.02106089280010701,26,0.021892813294959495,True,robust,4.2637662352296435e-06,COMPLETE
14,179.14035034179688,2026-01-20 17:07:52.312161,2026-01-20 17:07:54.769764,0 days 00:00:02.457603,gelu,0.40165705901836085,0.025397920098234158,36,0.02174434301013217,True,standard,5.068685662344027e-05,COMPLETE
15,176.1508331298828,2026-01-20 17:07:54.774341,2026-01-20 17:07:57.248406,0 days 00:00:02.474065,relu,0.24395935256385418,0.0012538026126011556,48,0.032548161061780476,True,robust,1.0861206405382078e-05,COMPLETE
16,182.77536010742188,2026-01-20 17:07:57.252310,2026-01-20 17:07:59.553738,0 days 00:00:02.301428,relu,0.2453559604229905,0.005491952736048238,47,0.010212183539270642,True,robust,1.6206176361251815e-06,COMPLETE
17,178.3833465576172,2026-01-20 17:07:59.557878,2026-01-20 17:08:01.750384,0 days 00:00:02.192506,relu,0.3789844985972861,0.0005373490429145268,51,0.024488820603527247,True,robust,9.12845622253493e-06,COMPLETE
18,355.0425231933594,2026-01-20 17:08:01.754564,2026-01-20 17:08:03.888427,0 days 00:00:02.133863,relu,0.16200781516395604,0.014602546905609179,42,0.00024076691691639874,False,robust,3.496016578819653e-06,COMPLETE
19,183.1597137451172,2026-01-20 17:08:03.892537,2026-01-20 17:08:06.046541,0 days 00:00:02.154004,relu,0.25576116080035805,0.0323277650235849,54,0.009007529177983172,True,robust,7.772605548283555e-05,COMPLETE
20,186.5644989013672,2026-01-20 17:08:06.050463,2026-01-20 17:08:08.365462,0 days 00:00:02.314999,relu,0.4928205153698041,0.0683284043470194,47,0.04525645590152938,True,none,1.063672505932571e-05,COMPLETE
21,177.04637145996094,2026-01-20 17:08:08.369554,2026-01-20 17:08:10.776265,0 days 00:00:02.406711,mish,0.1753101756636794,0.015006063621182883,34,0.043036058608952384,True,standard,2.093336196269491e-05,COMPLETE
22,176.25601196289062,2026-01-20 17:08:10.780234,2026-01-20 17:08:13.107872,0 days 00:00:02.327638,mish,0.23956875794761603,0.023184761664255368,32,0.050178972098436,True,standard,1.6886791262509047e-05,COMPLETE
23,176.005615234375,2026-01-20 17:08:13.111436,2026-01-20 17:08:15.264991,0 days 00:00:02.153555,gelu,0.2520089921554512,0.00874095678767244,26,0.09689282982823946,True,robust,5.73767694101399e-06,COMPLETE
24,177.09835815429688,2026-01-20 17:08:15.269249,2026-01-20 17:08:17.424682,0 days 00:00:02.155433,gelu,0.2654407799121012,0.009688659615468734,26,0.0978285692490262,True,robust,5.535486186175228e-06,COMPLETE
25,180.62875366210938,2026-01-20 17:08:17.428481,2026-01-20 17:08:19.661100,0 days 00:00:02.232619,gelu,0.13428570776799226,0.0012831721871238433,64,0.03035238355644802,True,robust,2.1305186438551748e-06,COMPLETE
26,267.86256042480466,2026-01-20 17:08:19.665721,2026-01-20 17:08:21.896053,0 days 00:00:02.230332,gelu,0.2204610931700427,0.007983380300938288,43,0.0007673220681891417,False,robust,7.558725671802939e-06,COMPLETE
27,189.69261169433594,2026-01-20 17:08:21.900150,2026-01-20 17:08:24.059695,0 days 00:00:02.159545,gelu,0.3493156048812439,0.02788290736594904,26,0.01488486189296424,True,robust,3.5992072379463544e-06,COMPLETE
28,199.00399780273438,2026-01-20 17:08:24.064284,2026-01-20 17:08:26.255092,0 days 00:00:02.190808,relu,0.2900195109565914,0.08632298304088278,22,0.0026243133732020696,True,robust,1.2624548248923227e-05,COMPLETE
29,169.43350219726562,2026-01-20 17:08:26.258921,2026-01-20 17:08:28.631833,0 days 00:00:02.372912,relu,0.1910165400527032,0.01672330359607043,34,0.0609242426842407,True,robust,2.9557188481978894e-05,COMPLETE
30,186.88552856445312,2026-01-20 17:08:28.636720,2026-01-20 17:08:30.942528,0 days 00:00:02.305808,gelu,0.19130265708856548,0.04012117823104684,28,0.06344682427931869,True,minmax,3.174360732121332e-05,COMPLETE
31,168.9267120361328,2026-01-20 17:08:30.946785,2026-01-20 17:08:33.523612,0 days 00:00:02.576827,relu,0.22956489586327147,0.018002855014271586,35,0.06178174046021331,True,robust,2.333386712675405e-05,COMPLETE
32,169.61880493164062,2026-01-20 17:08:33.527815,2026-01-20 17:08:35.912209,0 days 00:00:02.384394,relu,0.14644931032849803,0.01689222116519218,33,0.06650352484630406,True,robust,5.296626603392989e-05,COMPLETE
33,169.82766723632812,2026-01-20 17:08:35.916434,2026-01-20 17:08:38.190760,0 days 00:00:02.274326,relu,0.14783462152837593,0.018046942241831263,34,0.05852271963422675,True,robust,6.6404970701802e-05,COMPLETE
34,200.0765380859375,2026-01-20 17:08:38.195007,2026-01-20 17:08:40.741683,0 days 00:00:02.546676,relu,0.11041347594248116,0.02979672690624434,37,0.006165914800408491,True,minmax,0.00018947303472005312,COMPLETE
35,181.29833984375,2026-01-20 17:08:40.782483,2026-01-20 17:08:43.027310,0 days 00:00:02.244827,relu,0.18383830562329612,0.019818140715745503,30,0.015476079389684032,True,robust,4.275106335532829e-05,COMPLETE
36,182.1134033203125,2026-01-20 17:08:43.031487,2026-01-20 17:08:45.189661,0 days 00:00:02.158174,relu,0.20303903656150582,0.03846980947847659,32,0.03917363360568461,True,none,0.00016366433970460524,COMPLETE
37,258.4652508544922,2026-01-20 17:08:45.194010,2026-01-20 17:08:47.364828,0 days 00:00:02.170818,relu,0.14192886193728865,0.024189091078341843,40,0.0008572841287379059,False,robust,2.2032130368465892e-05,COMPLETE
38,192.87777709960938,2026-01-20 17:08:47.371077,2026-01-20 17:08:49.666889,0 days 00:00:02.295812,silu,0.1693312342426248,0.04387546003505277,35,0.06853602958862853,True,minmax,0.0001038280720315852,COMPLETE
39,192.18215942382812,2026-01-20 17:08:49.670496,2026-01-20 17:08:51.961535,0 days 00:00:02.291039,relu,0.12854215210069608,0.01669870457135226,29,0.004175453587699442,True,robust,2.743260981123874e-05,COMPLETE
40,255.41779052734378,2026-01-20 17:08:51.966655,2026-01-20 17:08:54.276179,0 days 00:00:02.309524,relu,0.19243986864346485,0.052610071852474474,39,0.0008769794272388579,False,robust,4.859473378430365e-05,COMPLETE
41,168.50387573242188,2026-01-20 17:08:54.280358,2026-01-20 17:08:56.695236,0 days 00:00:02.414878,relu,0.10275585182321256,0.01978478778319787,33,0.06182801278623544,True,robust,7.258077065264652e-05,COMPLETE
42,168.0209503173828,2026-01-20 17:08:56.699985,2026-01-20 17:08:58.904122,0 days 00:00:02.204137,relu,0.10773642664974545,0.012064323708029793,32,0.06801657904092792,True,robust,0.00014760443178216186,COMPLETE
43,175.6688690185547,2026-01-20 17:08:58.908568,2026-01-20 17:09:01.182432,0 days 00:00:02.273864,relu,0.10077019179134078,0.011238302720573742,37,0.03135351929641153,True,robust,0.00029887742784864206,COMPLETE
44,179.19992065429688,2026-01-20 17:09:01.186392,2026-01-20 17:09:03.318036,0 days 00:00:02.131644,silu,0.1151232701127705,0.03268740894298985,28,0.06738389405436344,True,robust,0.00015876101899946207,COMPLETE
45,171.3888702392578,2026-01-20 17:09:03.322834,2026-01-20 17:09:05.580618,0 days 00:00:02.257784,relu,0.22372176311131237,0.02234548115900074,42,0.048506417231590424,True,robust,8.535257815881635e-05,COMPLETE
46,183.20201110839844,2026-01-20 17:09:05.584872,2026-01-20 17:09:07.700111,0 days 00:00:02.115239,relu,0.16713201196054517,0.02747397382092929,32,0.016420349523663006,True,none,0.0005941791471121052,COMPLETE
47,164.39732360839844,2026-01-20 17:09:07.705160,2026-01-20 17:09:09.976167,0 days 00:00:02.271007,relu,0.3075241840209755,0.0052797582942087995,44,0.07604589524108368,True,robust,0.0003800678985933995,COMPLETE
48,267.3012524414063,2026-01-20 17:09:09.979920,2026-01-20 17:09:12.150633,0 days 00:00:02.170713,relu,0.3234746722905295,0.005142147823392359,43,0.0009161117806729149,False,minmax,0.00046753781247022686,COMPLETE
49,182.23248291015625,2026-01-20 17:09:12.155564,2026-01-20 17:09:14.375530,0 days 00:00:02.219966,silu,0.3075599228994661,0.01124634425438538,51,0.07770129587679117,True,robust,0.000999984967701597,COMPLETE
50,183.73989868164062,2026-01-20 17:09:14.379148,2026-01-20 17:09:16.842070,0 days 00:00:02.462922,mish,0.2754230149435428,0.06155748844838715,45,0.02605564769829685,True,robust,0.00023912895717218365,COMPLETE
51,176.42959594726562,2026-01-20 17:09:16.847039,2026-01-20 17:09:19.129602,0 days 00:00:02.282563,relu,0.342823700057131,0.0053213694279850565,39,0.04094469511478786,True,robust,0.00043962063902509103,COMPLETE
52,164.91943359375,2026-01-20 17:09:19.133623,2026-01-20 17:09:21.375533,0 days 00:00:02.241910,relu,0.1230460426963975,0.013695940410803187,36,0.09774611890520114,True,robust,0.00013412476594847915,COMPLETE
53,163.6044464111328,2026-01-20 17:09:21.381003,2026-01-20 17:09:23.580135,0 days 00:00:02.199132,relu,0.1247662018670547,0.01186640826475108,30,0.09867831822117745,True,robust,0.00020674847767615656,COMPLETE
54,167.6826171875,2026-01-20 17:09:23.584223,2026-01-20 17:09:25.752392,0 days 00:00:02.168169,relu,0.10019009414184582,0.012157129086972963,31,0.0836348480395353,True,robust,0.0001279574062287308,COMPLETE
55,158.35604858398438,2026-01-20 17:09:25.756040,2026-01-20 17:09:27.923346,0 days 00:00:02.167306,relu,0.12586631441235943,0.007256830938336106,30,0.09676405654538106,True,standard,0.00012293557840602906,COMPLETE
56,159.905517578125,2026-01-20 17:09:27.927531,2026-01-20 17:09:30.072199,0 days 00:00:02.144668,relu,0.12509809155909482,0.00011970094799957504,28,0.09073769181585795,True,standard,0.00031590464424302806,COMPLETE
57,166.42117309570312,2026-01-20 17:09:30.076167,2026-01-20 17:09:32.252064,0 days 00:00:02.175897,relu,0.12371737735391106,0.00035249849848229686,24,0.09658739427638463,True,standard,0.0002446999413941296,COMPLETE
58,167.0351104736328,2026-01-20 17:09:32.256164,2026-01-20 17:09:34.454333,0 days 00:00:02.198169,relu,0.15872247870471604,0.006584102514194647,19,0.08349821582499929,True,standard,0.00032627101320334347,COMPLETE
59,210.82983032226565,2026-01-20 17:09:34.458977,2026-01-20 17:09:36.646022,0 days 00:00:02.187045,mish,0.12961903277502324,0.003492276046449436,28,0.0009354553550605097,False,standard,0.00038225221923136545,COMPLETE
60,193.57388305664062,2026-01-20 17:09:36.650259,2026-01-20 17:09:38.905479,0 days 00:00:02.255220,relu,0.38798023043394686,0.008170778520903617,50,0.0015727999726130582,True,standard,0.00023581491324251543,COMPLETE
61,161.83358764648438,2026-01-20 17:09:38.909885,2026-01-20 17:09:41.028911,0 days 00:00:02.119026,relu,0.13220138569714326,0.0010310479211663127,24,0.0917255950273522,True,standard,0.00023029888357201092,COMPLETE
62,160.60403442382812,2026-01-20 17:09:41.033585,2026-01-20 17:09:43.345118,0 days 00:00:02.311533,relu,0.12190054402991884,0.0032004261465369676,24,0.09536525986387666,True,standard,0.0005876828172913868,COMPLETE
63,168.12698364257812,2026-01-20 17:09:43.349869,2026-01-20 17:09:45.554595,0 days 00:00:02.204726,relu,0.1401745725080291,0.0034530658243199924,24,0.049357408202518854,True,standard,0.0006935143986655271,COMPLETE
64,173.99085998535156,2026-01-20 17:09:45.558623,2026-01-20 17:09:47.749727,0 days 00:00:02.191104,relu,0.15285357653499607,0.00025381347526734325,20,0.03768412650417981,True,standard,0.0005736988302855481,COMPLETE
65,166.4351348876953,2026-01-20 17:09:47.753561,2026-01-20 17:09:50.216818,0 days 00:00:02.463257,relu,0.12151376449519466,0.007923725784502095,25,0.04813514618111013,True,standard,0.0008703963961713911,COMPLETE
66,162.591796875,2026-01-20 17:09:50.221107,2026-01-20 17:09:52.432442,0 days 00:00:02.211335,relu,0.1741272788828105,0.0025117465239649114,23,0.07927328234158337,True,standard,0.00020142641868009414,COMPLETE
67,203.8158721923828,2026-01-20 17:09:52.436505,2026-01-20 17:09:54.756278,0 days 00:00:02.319773,silu,0.17884260955473763,0.0025560081843212217,22,0.00031712951884237594,True,standard,0.00020099951507078847,COMPLETE
68,168.21456909179688,2026-01-20 17:09:54.760106,2026-01-20 17:09:56.965645,0 days 00:00:02.205539,relu,0.15702907628688414,0.008973734890469614,16,0.0999408761475592,True,standard,0.0002984540096568192,COMPLETE
69,168.31393432617188,2026-01-20 17:09:56.969879,2026-01-20 17:09:59.247118,0 days 00:00:02.277239,relu,0.13721446420115255,0.014479875036745209,27,0.053306481627595555,True,standard,0.00010201499781157909,COMPLETE
70,176.8997344970703,2026-01-20 17:09:59.251415,2026-01-20 17:10:01.507134,0 days 00:00:02.255719,mish,0.16735306223165655,0.003265926022493618,17,0.03656692702452509,True,standard,0.0005021459914230116,COMPLETE
71,165.55467224121094,2026-01-20 17:10:01.511814,2026-01-20 17:10:03.746158,0 days 00:00:02.234344,relu,0.11475113761424079,0.007263243200759807,23,0.07895383400407388,True,standard,1.0192150431056716e-06,COMPLETE
72,166.1509246826172,2026-01-20 17:10:03.751314,2026-01-20 17:10:05.863090,0 days 00:00:02.111776,relu,0.20916320382218112,0.005573365015723957,30,0.07618297830581426,True,standard,0.00020410783924598594,COMPLETE
73,173.8473358154297,2026-01-20 17:10:05.867531,2026-01-20 17:10:07.986834,0 days 00:00:02.119303,relu,0.42013749968783287,0.0006304070038911629,25,0.08288186786246078,True,standard,0.0003400181810986064,COMPLETE
74,172.9064483642578,2026-01-20 17:10:07.991735,2026-01-20 17:10:10.098597,0 days 00:00:02.106862,relu,0.1491669617589399,0.09956757269427194,21,0.05450213279066816,True,standard,0.0006914824939590556,COMPLETE
75,160.43154907226562,2026-01-20 17:10:10.104884,2026-01-20 17:10:12.361057,0 days 00:00:02.256173,relu,0.1367408080478566,0.009956940788267091,27,0.07865849472230019,True,standard,0.00039826659050840567,COMPLETE
76,206.9266955566406,2026-01-20 17:10:12.365773,2026-01-20 17:10:14.450397,0 days 00:00:02.084624,relu,0.1306037143674687,0.08427379452140984,27,0.0009708221997406974,False,standard,0.00026914059639251276,COMPLETE
77,174.1664581298828,2026-01-20 17:10:14.454761,2026-01-20 17:10:16.637541,0 days 00:00:02.182780,relu,0.14122142222448344,0.010367890752399137,23,0.027586380592439858,True,standard,0.00019307691946630234,COMPLETE
78,175.3610382080078,2026-01-20 17:10:16.641318,2026-01-20 17:10:18.804881,0 days 00:00:02.163563,relu,0.1767077331798118,0.015057368989441886,25,0.019210595141672383,True,standard,0.00042241111941955045,COMPLETE
79,173.0734405517578,2026-01-20 17:10:18.809258,2026-01-20 17:10:20.990376,0 days 00:00:02.181118,gelu,0.11647209329522759,0.01027038029456437,29,0.0558689239859472,True,standard,0.0005900764296236406,COMPLETE
80,182.0582733154297,2026-01-20 17:10:20.995554,2026-01-20 17:10:23.154438,0 days 00:00:02.158884,relu,0.15467880007478868,0.0031864611892345467,27,0.011136239378795291,True,none,9.016133514893918e-05,COMPLETE
81,166.61630249023438,2026-01-20 17:10:23.158733,2026-01-20 17:10:25.316929,0 days 00:00:02.158196,relu,0.13590961744549832,0.0059050883142084,22,0.07075762341227813,True,standard,0.000372976750988407,COMPLETE
82,158.03775024414062,2026-01-20 17:10:25.321352,2026-01-20 17:10:27.681360,0 days 00:00:02.360008,relu,0.11267693017286937,0.005237544039136889,57,0.08143549130187508,True,standard,0.00017267076397765432,COMPLETE
83,161.68319702148438,2026-01-20 17:10:27.685884,2026-01-20 17:10:29.849232,0 days 00:00:02.163348,relu,0.11805162296655178,0.013756586918394714,24,0.08810162416006542,True,standard,0.00017304588755091051,COMPLETE
84,163.8307647705078,2026-01-20 17:10:29.853208,2026-01-20 17:10:32.065572,0 days 00:00:02.212364,relu,0.10992935562905698,9.137238694735127e-05,60,0.044475318194387256,True,standard,0.00015315281999905828,COMPLETE
85,163.162841796875,2026-01-20 17:10:32.070407,2026-01-20 17:10:34.243886,0 days 00:00:02.173479,relu,0.16351289836683763,0.021058545877788513,24,0.060638116249772105,True,standard,0.00011674987397233925,COMPLETE
86,173.26693725585938,2026-01-20 17:10:34.249266,2026-01-20 17:10:36.404561,0 days 00:00:02.155295,relu,0.14561538983988068,0.008425875001077398,21,0.03317248716651005,True,standard,6.386685462293121e-05,COMPLETE
87,175.14231872558594,2026-01-20 17:10:36.408790,2026-01-20 17:10:38.642199,0 days 00:00:02.233409,silu,0.11106560152295342,0.015507354383285859,56,0.080832184584401,True,standard,0.0002686105301536246,COMPLETE
88,211.3996838378906,2026-01-20 17:10:38.646325,2026-01-20 17:10:40.695039,0 days 00:00:02.048714,relu,0.13262068979986782,0.003597173209582404,26,0.0009706925345592633,False,standard,1.5927423018265685e-05,COMPLETE
89,168.9995574951172,2026-01-20 17:10:40.699541,2026-01-20 17:10:42.862571,0 days 00:00:02.163030,relu,0.1824343483642093,0.01290804671419847,23,0.06697681409374283,True,standard,0.0005322968694034573,COMPLETE
90,166.7536163330078,2026-01-20 17:10:42.866160,2026-01-20 17:10:45.043767,0 days 00:00:02.177607,relu,0.19969898021927032,0.01935797118091424,29,0.08662840553392522,True,standard,0.0001714613837877888,COMPLETE
91,168.75112915039062,2026-01-20 17:10:45.047455,2026-01-20 17:10:47.215304,0 days 00:00:02.167849,relu,0.17292270092584586,0.0066185352336958795,24,0.05750263041220684,True,standard,0.00012109588887334717,COMPLETE
92,163.57711791992188,2026-01-20 17:10:47.219944,2026-01-20 17:10:49.375687,0 days 00:00:02.155743,relu,0.16002853895755936,0.021552455731105265,24,0.06902067152822453,True,standard,2.2687129703569357e-06,COMPLETE
93,178.21444702148438,2026-01-20 17:10:49.379706,2026-01-20 17:10:51.528437,0 days 00:00:02.148731,relu,0.11824931388956077,0.0020702640633721743,25,0.058667999054338754,True,minmax,0.0001173454582568869,COMPLETE
94,162.70126342773438,2026-01-20 17:10:51.532764,2026-01-20 17:10:53.740008,0 days 00:00:02.207244,relu,0.16513382938521132,0.009662299431005869,27,0.08834611110508066,True,standard,0.0001438932675990201,COMPLETE
95,174.86424255371094,2026-01-20 17:10:53.744010,2026-01-20 17:10:56.029875,0 days 00:00:02.285865,mish,0.14610533611529905,0.00961182952966313,31,0.08335097577874176,True,standard,0.00023209318770524626,COMPLETE
96,165.3925018310547,2026-01-20 17:10:56.034428,2026-01-20 17:10:58.203285,0 days 00:00:02.168857,relu,0.10533701155434212,0.004311347358429577,27,0.09846846136551768,True,standard,0.00016895773810239977,COMPLETE
97,179.80294799804688,2026-01-20 17:10:58.207314,2026-01-20 17:11:00.394128,0 days 00:00:02.186814,gelu,0.12695031011714286,0.007230746084460839,28,0.04353372605124129,True,none,0.0002954188154557543,COMPLETE
98,171.2806854248047,2026-01-20 17:11:00.398530,2026-01-20 17:11:02.575978,0 days 00:00:02.177448,relu,0.19025857844590682,0.016838644310973715,22,0.0707661398303144,True,standard,0.00014093321239990326,COMPLETE
99,162.2412567138672,2026-01-20 17:11:02.579990,2026-01-20 17:11:04.743104,0 days 00:00:02.163114,relu,0.13524545088765702,0.025250184804018617,21,0.08612908301537345,True,standard,0.00010054710909871296,COMPLETE
100,169.60104370117188,2026-01-20 17:11:04.747393,2026-01-20 17:11:06.900633,0 days 00:00:02.153240,relu,0.1331715923350534,0.0134809469942162,21,0.04897738873487611,True,standard,9.444216811487107e-05,COMPLETE
101,163.65524291992188,2026-01-20 17:11:06.904696,2026-01-20 17:11:09.078493,0 days 00:00:02.173797,relu,0.15249233676312596,0.010210431354376243,26,0.08548194194496486,True,standard,3.841406090663339e-05,COMPLETE
