number,value,datetime_start,datetime_complete,duration,params_activation,params_dropout,params_hidden_size,params_lr,params_n_layers,params_scale_target,params_scaler,params_weight_decay,state
335,146.24879455566406,2026-01-03 19:30:42.601226,2026-01-03 19:30:53.783105,0 days 00:00:11.181879,relu,0.11344355387158842,30,0.0701963401306806,2,True,standard,6.818406617865179e-05,COMPLETE
336,143.76768493652344,2026-01-03 19:30:53.797135,2026-01-03 19:31:05.447540,0 days 00:00:11.650405,relu,0.1185394671398521,32,0.08828131374583328,2,True,standard,9.841367064347544e-05,COMPLETE
337,172.50454711914062,2026-01-03 19:31:05.461062,2026-01-03 19:31:18.123873,0 days 00:00:12.662811,relu,0.10934389928457278,29,0.07807682560944243,2,True,none,7.951094911332565e-05,COMPLETE
338,141.12820434570312,2026-01-03 19:31:18.139413,2026-01-03 19:31:30.417741,0 days 00:00:12.278328,relu,0.12302128894916055,31,0.08832127642604155,2,True,standard,9.28948775220396e-05,COMPLETE
339,146.24215698242188,2026-01-03 19:31:30.430255,2026-01-03 19:31:43.123945,0 days 00:00:12.693690,relu,0.12233990512780805,28,0.09878699488123742,2,True,standard,9.286616542180249e-05,COMPLETE
340,168.4280242919922,2026-01-03 19:31:43.136979,2026-01-03 19:31:54.646708,0 days 00:00:11.509729,gelu,0.1142408707839136,8,0.08746935235793925,2,True,standard,8.218615127280417e-05,COMPLETE
341,144.5993194580078,2026-01-03 19:31:54.656283,2026-01-03 19:32:05.156189,0 days 00:00:10.499906,relu,0.12743290348410755,30,0.08773063391489036,2,True,standard,0.00011221042652399288,COMPLETE
342,158.81192016601562,2026-01-03 19:32:05.170711,2026-01-03 19:32:15.834224,0 days 00:00:10.663513,relu,0.26511062634693067,31,0.09990278799179934,2,True,robust,0.00012415736553189827,COMPLETE
343,143.5940399169922,2026-01-03 19:32:15.845349,2026-01-03 19:32:26.292750,0 days 00:00:10.447401,relu,0.10705732922146065,27,0.06784836002774222,2,True,standard,9.053483698966735e-05,COMPLETE
344,146.4235382080078,2026-01-03 19:32:26.306793,2026-01-03 19:32:36.464870,0 days 00:00:10.158077,relu,0.12388911799052534,29,0.08341527551481746,2,True,standard,7.067694490275641e-05,COMPLETE
345,142.04432678222656,2026-01-03 19:32:36.476395,2026-01-03 19:32:46.790265,0 days 00:00:10.313870,relu,0.11643933998556114,30,0.0997214132390498,2,True,standard,9.772223431454347e-05,COMPLETE
346,142.06983947753906,2026-01-03 19:32:46.802778,2026-01-03 19:32:56.900442,0 days 00:00:10.097664,relu,0.11364810201034209,30,0.0983740926004231,2,True,standard,0.00011936231903974052,COMPLETE
347,143.4600830078125,2026-01-03 19:32:56.914463,2026-01-03 19:33:06.963017,0 days 00:00:10.048554,relu,0.10864303212923368,28,0.08846325904622898,2,True,standard,6.026599818222319e-05,COMPLETE
348,142.49285888671875,2026-01-03 19:33:06.975038,2026-01-03 19:33:17.100687,0 days 00:00:10.125649,relu,0.11444098745503009,30,0.08849537534957755,2,True,standard,9.676392114528195e-05,COMPLETE
349,145.18626403808594,2026-01-03 19:33:17.112205,2026-01-03 19:33:28.822837,0 days 00:00:11.710632,relu,0.10750107893791895,26,0.06948926145492992,2,True,standard,9.884641191560321e-05,COMPLETE
350,142.80369567871094,2026-01-03 19:33:28.837876,2026-01-03 19:33:42.073373,0 days 00:00:13.235497,relu,0.11622979149198616,29,0.08081986506628926,2,True,standard,0.00011510737538911649,COMPLETE
351,156.49594116210938,2026-01-03 19:33:42.087921,2026-01-03 19:33:53.913999,0 days 00:00:11.826078,mish,0.11500874626443791,27,0.0880108203571015,2,True,standard,9.53139915230009e-05,COMPLETE
352,143.03517150878906,2026-01-03 19:33:53.926022,2026-01-03 19:34:04.323849,0 days 00:00:10.397827,relu,0.10508387203830104,30,0.060869993039661244,2,True,standard,7.93985839213446e-05,COMPLETE
353,144.36146545410156,2026-01-03 19:34:04.334876,2026-01-03 19:34:14.740850,0 days 00:00:10.405974,relu,0.11280304990344099,30,0.09999356772213228,2,True,standard,0.00010651830187709663,COMPLETE
354,163.8543243408203,2026-01-03 19:34:14.751371,2026-01-03 19:34:25.052640,0 days 00:00:10.301269,silu,0.1176821149661471,28,0.07796195314717917,2,True,standard,0.00013163820779302256,COMPLETE
355,198.2155038113064,2026-01-03 19:34:25.062156,2026-01-03 19:34:34.376676,0 days 00:00:09.314520,relu,0.10354881283126889,28,0.0009949279570361442,2,False,standard,8.921025672011716e-05,COMPLETE
356,169.80010986328125,2026-01-03 19:34:34.388197,2026-01-03 19:34:44.582138,0 days 00:00:10.193941,relu,0.11956112401346893,29,0.07456766230605366,2,True,minmax,0.00010264984798807189,COMPLETE
357,144.060302734375,2026-01-03 19:34:44.595169,2026-01-03 19:34:56.192910,0 days 00:00:11.597741,relu,0.11150965515463233,30,0.08812368829848621,2,True,standard,0.00011689440562676014,COMPLETE
358,148.72152709960938,2026-01-03 19:34:56.204007,2026-01-03 19:35:05.999380,0 days 00:00:09.795373,relu,0.10055797770637281,27,0.05259591413781344,2,True,standard,7.810701663428227e-05,COMPLETE
359,142.9172821044922,2026-01-03 19:35:06.011899,2026-01-03 19:35:17.253634,0 days 00:00:11.241735,relu,0.12196145470312625,31,0.0999554815004653,2,True,standard,0.0001356179113534071,COMPLETE
360,148.57484436035156,2026-01-03 19:35:17.264662,2026-01-03 19:35:29.031902,0 days 00:00:11.767240,relu,0.1284567206422721,29,0.06586786093624292,2,True,standard,8.983654706444088e-05,COMPLETE
361,183.1583251953125,2026-01-03 19:35:29.043924,2026-01-03 19:35:39.097493,0 days 00:00:10.053569,relu,0.1105681839032612,6,0.07926750774102749,2,True,standard,0.00011540043676900794,COMPLETE
362,196.93875122070312,2026-01-03 19:35:39.108506,2026-01-03 19:35:49.124629,0 days 00:00:10.016123,relu,0.11686561069906502,30,0.0005581833969003697,2,True,standard,6.491120823241783e-05,COMPLETE
363,172.37368774414062,2026-01-03 19:35:49.135141,2026-01-03 19:36:00.240363,0 days 00:00:11.105222,relu,0.12778615866220494,31,0.08831955979876117,2,True,none,0.00010063584419410285,COMPLETE
364,143.665283203125,2026-01-03 19:36:00.252390,2026-01-03 19:36:11.910448,0 days 00:00:11.658058,relu,0.10011432757097039,28,0.0706057353296438,2,True,standard,0.00013452072699342787,COMPLETE
365,276.34027099609375,2026-01-03 19:36:11.920963,2026-01-03 19:36:23.369782,0 days 00:00:11.448819,gelu,0.12008984648577296,31,0.00011174406182250586,2,True,standard,8.030122462002072e-05,COMPLETE
366,150.46658325195312,2026-01-03 19:36:23.382303,2026-01-03 19:36:32.985895,0 days 00:00:09.603592,relu,0.11012456527662816,26,0.08829712751482527,2,True,robust,0.00011127584194593752,COMPLETE
367,144.6302032470703,2026-01-03 19:36:32.999917,2026-01-03 19:36:42.866938,0 days 00:00:09.867021,relu,0.13076056687939647,30,0.07737543673296989,2,True,standard,9.433449565393557e-05,COMPLETE
368,144.6885986328125,2026-01-03 19:36:42.878453,2026-01-03 19:36:53.856788,0 days 00:00:10.978335,relu,0.120958627179508,29,0.06394195374261057,2,True,standard,0.0001473313995255137,COMPLETE
369,141.94198608398438,2026-01-03 19:36:53.867814,2026-01-03 19:37:06.088329,0 days 00:00:12.220515,relu,0.11101170682122642,32,0.08855779519055171,2,True,standard,0.00012240699660926642,COMPLETE
370,143.56651306152344,2026-01-03 19:37:06.102865,2026-01-03 19:37:19.990021,0 days 00:00:13.887156,relu,0.10954285869221692,32,0.05749729700691681,2,True,standard,0.00012297054863715583,COMPLETE
371,166.0264434814453,2026-01-03 19:37:20.001542,2026-01-03 19:37:30.297785,0 days 00:00:10.296243,relu,0.3544693249878157,31,0.06969356626191492,2,True,standard,0.00010770650290921553,COMPLETE
372,143.05360412597656,2026-01-03 19:37:30.310300,2026-01-03 19:37:40.605597,0 days 00:00:10.295297,relu,0.1072483758481368,29,0.08108985438958792,2,True,standard,0.00013458539311262207,COMPLETE
373,144.4517059326172,2026-01-03 19:37:40.618115,2026-01-03 19:37:51.328662,0 days 00:00:10.710547,relu,0.11600157551506417,32,0.08825893986195214,2,True,standard,0.00016280202695892227,COMPLETE
374,198.06472737630207,2026-01-03 19:37:51.340179,2026-01-03 19:38:00.785838,0 days 00:00:09.445659,relu,0.10610770151094147,28,0.0009940150517885578,2,False,standard,7.408919858135251e-05,COMPLETE
375,158.16307067871094,2026-01-03 19:38:00.796355,2026-01-03 19:38:11.789016,0 days 00:00:10.992661,mish,0.115371050985824,30,0.09989467220942747,2,True,standard,9.345082160292053e-05,COMPLETE
376,142.58670043945312,2026-01-03 19:38:11.801049,2026-01-03 19:38:23.343364,0 days 00:00:11.542315,relu,0.12358049976638603,32,0.07301057639519608,2,True,standard,0.0001226022282840224,COMPLETE
377,170.797119140625,2026-01-03 19:38:23.359884,2026-01-03 19:38:34.123905,0 days 00:00:10.764021,relu,0.11456069862461689,9,0.07971128039075163,2,True,standard,0.00010568316655127051,COMPLETE
378,171.10281372070312,2026-01-03 19:38:34.134420,2026-01-03 19:38:44.330946,0 days 00:00:10.196526,relu,0.3748486573652958,30,0.06478745675411365,2,True,standard,8.493578624069656e-05,COMPLETE
379,144.41957092285156,2026-01-03 19:38:44.343977,2026-01-03 19:38:54.749275,0 days 00:00:10.405298,relu,0.12748173435394913,27,0.08788428502438912,2,True,standard,0.00014527667606462958,COMPLETE
380,168.33811950683594,2026-01-03 19:38:54.761296,2026-01-03 19:39:05.050908,0 days 00:00:10.289612,silu,0.12145162604623262,31,0.07565677593840041,2,True,standard,5.4030830436508475e-05,COMPLETE
381,195.5174102783203,2026-01-03 19:39:05.063942,2026-01-03 19:39:14.648298,0 days 00:00:09.584356,relu,0.49390594711449487,29,0.08798551301544486,2,True,minmax,0.00022638378062163523,COMPLETE
382,169.7755889892578,2026-01-03 19:39:14.657819,2026-01-03 19:39:24.890333,0 days 00:00:10.232514,relu,0.10763196864257452,14,0.057517955196697605,2,True,standard,0.00016618637344627176,COMPLETE
383,149.42616271972656,2026-01-03 19:39:24.902354,2026-01-03 19:39:35.808622,0 days 00:00:10.906268,relu,0.10056148300245871,28,0.06877069985176036,2,True,standard,0.0001234875871643098,COMPLETE
384,139.89950561523438,2026-01-03 19:39:35.820137,2026-01-03 19:39:46.595080,0 days 00:00:10.774943,relu,0.13178459342954738,31,0.08845701150409455,2,True,standard,0.00010055606298530036,COMPLETE
385,152.41903686523438,2026-01-03 19:39:46.605597,2026-01-03 19:39:57.714964,0 days 00:00:11.109367,relu,0.13388026355842872,32,0.049018165326297096,2,True,standard,0.00011183953818016802,COMPLETE
386,144.68881225585938,2026-01-03 19:39:57.729068,2026-01-03 19:40:08.992130,0 days 00:00:11.263062,relu,0.1302872578760006,32,0.09933459579767184,2,True,standard,6.749279190014578e-05,COMPLETE
387,145.4207000732422,2026-01-03 19:40:09.005656,2026-01-03 19:40:20.090148,0 days 00:00:11.084492,relu,0.12464284932234457,31,0.07750839624336549,2,True,standard,0.0001401010092473817,COMPLETE
388,144.3199920654297,2026-01-03 19:40:20.100665,2026-01-03 19:40:31.080205,0 days 00:00:10.979540,relu,0.13203692797385444,29,0.07925396600668613,2,True,standard,0.00018896436217772763,COMPLETE
389,191.112060546875,2026-01-03 19:40:31.144837,2026-01-03 19:40:43.679218,0 days 00:00:12.534381,gelu,0.12066811078910031,26,0.0024995708249450016,2,True,standard,8.909883666995481e-05,COMPLETE
390,170.98675537109375,2026-01-03 19:40:43.697141,2026-01-03 19:40:54.982204,0 days 00:00:11.285063,relu,0.113278344815071,31,0.066400347080143,2,True,none,0.00010486343137878401,COMPLETE
391,176.60304260253906,2026-01-03 19:40:54.994729,2026-01-03 19:41:06.199590,0 days 00:00:11.204861,relu,0.133175866266733,30,0.013898528064423864,2,True,robust,0.00016348663947751728,COMPLETE
392,198.475375773112,2026-01-03 19:41:06.217625,2026-01-03 19:41:16.970345,0 days 00:00:10.752720,relu,0.12325105283460284,32,0.0009949127689730139,2,False,standard,0.00021620152894380354,COMPLETE
393,170.32838439941406,2026-01-03 19:41:16.988381,2026-01-03 19:41:27.895744,0 days 00:00:10.907363,relu,0.10761817001003904,11,0.08756533320409607,2,True,standard,0.000125609796139085,COMPLETE
394,144.12075805664062,2026-01-03 19:41:27.905262,2026-01-03 19:41:38.707493,0 days 00:00:10.802231,relu,0.11954413767914059,27,0.07264308905324426,2,True,standard,7.857168472778348e-05,COMPLETE
395,140.75538635253906,2026-01-03 19:41:38.717586,2026-01-03 19:41:49.838762,0 days 00:00:11.121176,relu,0.10010882753400863,30,0.0906942176736129,2,True,standard,0.00011529085491309117,COMPLETE
396,176.38182067871094,2026-01-03 19:41:49.853798,2026-01-03 19:42:01.135956,0 days 00:00:11.282158,relu,0.10160796787202987,30,0.007255812610310028,2,True,standard,0.00010190579797293722,COMPLETE
397,165.63487243652344,2026-01-03 19:42:01.150983,2026-01-03 19:42:12.569232,0 days 00:00:11.418249,relu,0.341058084748067,31,0.08862595739437124,2,True,standard,0.00011210716949437606,COMPLETE
398,141.93222045898438,2026-01-03 19:42:12.582257,2026-01-03 19:42:23.812967,0 days 00:00:11.230710,relu,0.1067290330657542,29,0.09877922080387676,2,True,standard,8.778241580927759e-05,COMPLETE
399,142.0706787109375,2026-01-03 19:42:23.826487,2026-01-03 19:42:35.156163,0 days 00:00:11.329676,relu,0.10017208999433559,29,0.07826217640967363,2,True,standard,6.9526229070648e-05,COMPLETE
400,151.28317260742188,2026-01-03 19:42:35.167679,2026-01-03 19:42:47.013737,0 days 00:00:11.846058,mish,0.10196752117351007,28,0.09966509705861158,2,True,standard,8.501906989600974e-05,COMPLETE
401,148.5990447998047,2026-01-03 19:42:47.026549,2026-01-03 19:42:58.797092,0 days 00:00:11.770543,relu,0.10153329878467336,29,0.07637832023914852,2,True,standard,6.826627253631312e-05,COMPLETE
402,162.89186096191406,2026-01-03 19:42:58.812658,2026-01-03 19:43:10.206455,0 days 00:00:11.393797,relu,0.2787913014034356,28,0.09952273640207683,2,True,standard,5.630134532339086e-05,COMPLETE
403,142.2275390625,2026-01-03 19:43:10.215969,2026-01-03 19:43:21.595076,0 days 00:00:11.379107,relu,0.10810377178509,29,0.06219256744504875,2,True,standard,7.694582315651344e-05,COMPLETE
404,159.59060668945312,2026-01-03 19:43:21.605595,2026-01-03 19:43:32.961191,0 days 00:00:11.355596,silu,0.10030123116379944,30,0.09982026580146526,2,True,standard,8.925930366838222e-05,COMPLETE
405,144.7584228515625,2026-01-03 19:43:32.978714,2026-01-03 19:43:44.198368,0 days 00:00:11.219654,relu,0.10833168224762786,27,0.07103764201897396,2,True,standard,7.253874307711079e-05,COMPLETE
406,169.6614990234375,2026-01-03 19:43:44.216399,2026-01-03 19:43:55.548776,0 days 00:00:11.332377,relu,0.11095273123517632,29,0.08024668759031026,2,True,minmax,9.303892045451207e-05,COMPLETE
407,141.4546661376953,2026-01-03 19:43:55.562809,2026-01-03 19:44:06.908552,0 days 00:00:11.345743,relu,0.10039265784431824,30,0.08899026815679675,2,True,standard,0.00012211781783275511,COMPLETE
408,144.61788940429688,2026-01-03 19:44:06.920071,2026-01-03 19:44:17.840120,0 days 00:00:10.920049,relu,0.10701802756071395,30,0.05963032769227924,2,True,standard,0.00013495835896186725,COMPLETE
409,169.28396606445312,2026-01-03 19:44:17.850139,2026-01-03 19:44:28.608483,0 days 00:00:10.758344,relu,0.10181101140820796,10,0.08042901599816672,2,True,standard,0.00012047174928925035,COMPLETE
410,162.57858276367188,2026-01-03 19:44:28.623015,2026-01-03 19:44:39.813215,0 days 00:00:11.190200,relu,0.25423570452604344,26,0.06880800228154896,2,True,standard,0.0001232226000458158,COMPLETE
411,144.27896118164062,2026-01-03 19:44:39.827734,2026-01-03 19:44:50.952083,0 days 00:00:11.124349,relu,0.11013587584876201,28,0.08907580945357886,2,True,standard,0.00015446800733930692,COMPLETE
412,141.98825073242188,2026-01-03 19:44:50.963601,2026-01-03 19:45:01.138185,0 days 00:00:10.174584,relu,0.10925729595722392,32,0.07862328129366246,2,True,standard,0.00010105220040123519,COMPLETE
413,197.22356363932292,2026-01-03 19:45:01.150208,2026-01-03 19:45:10.617152,0 days 00:00:09.466944,relu,0.10038349556800157,32,0.0009946333286226234,2,False,none,0.0001045058197217845,COMPLETE
414,149.7700958251953,2026-01-03 19:45:10.627670,2026-01-03 19:45:20.929827,0 days 00:00:10.302157,relu,0.10790955479083954,31,0.050982357119434385,2,True,standard,8.174091690184304e-05,COMPLETE
415,140.0741424560547,2026-01-03 19:45:20.939344,2026-01-03 19:45:31.344651,0 days 00:00:10.405307,relu,0.1003213059677251,32,0.06870819044817696,2,True,standard,0.00013556800724753422,COMPLETE
416,156.78810119628906,2026-01-03 19:45:31.355170,2026-01-03 19:45:43.757307,0 days 00:00:12.402137,gelu,0.10254901344235358,32,0.06080250108969281,2,True,standard,9.876116818708492e-05,COMPLETE
417,140.9185333251953,2026-01-03 19:45:43.774341,2026-01-03 19:45:54.269070,0 days 00:00:10.494729,relu,0.10679803659972173,32,0.06966430439769192,2,True,standard,0.00011508586547711872,COMPLETE
418,141.29627990722656,2026-01-03 19:45:54.281109,2026-01-03 19:46:04.772398,0 days 00:00:10.491289,relu,0.10089692366128403,32,0.057537506926049586,2,True,standard,0.00010991431073398399,COMPLETE
419,156.69496154785156,2026-01-03 19:46:04.784420,2026-01-03 19:46:15.447164,0 days 00:00:10.662744,relu,0.10032148289074862,32,0.04420818007285334,2,True,robust,4.541171767213223e-05,COMPLETE
420,143.27552795410156,2026-01-03 19:46:15.457685,2026-01-03 19:46:25.975403,0 days 00:00:10.517718,relu,0.10048708154209379,32,0.05873460395008016,2,True,standard,0.00011019914588164032,COMPLETE
421,151.36007690429688,2026-01-03 19:46:25.986926,2026-01-03 19:46:36.487303,0 days 00:00:10.500377,relu,0.1077701167499577,31,0.052430679420916886,2,True,standard,9.63045516226425e-05,COMPLETE
422,184.3705596923828,2026-01-03 19:46:36.502342,2026-01-03 19:46:46.423967,0 days 00:00:09.921625,relu,0.10897410942371927,5,0.065715814361102,2,True,standard,0.00011798442118088238,COMPLETE
423,145.08059692382812,2026-01-03 19:46:46.432483,2026-01-03 19:46:57.027622,0 days 00:00:10.595139,relu,0.10952795325690383,32,0.05717191968563671,2,True,standard,6.293915935225191e-05,COMPLETE
424,144.10214233398438,2026-01-03 19:46:57.039258,2026-01-03 19:47:07.682969,0 days 00:00:10.643711,relu,0.10158441703189444,31,0.06811525299205175,2,True,standard,7.970698145615639e-05,COMPLETE
425,145.66647338867188,2026-01-03 19:47:07.698992,2026-01-03 19:47:18.169276,0 days 00:00:10.470284,relu,0.11333065764474531,30,0.07170789314776023,2,True,standard,9.530743591568593e-05,COMPLETE
426,162.0634765625,2026-01-03 19:47:18.179799,2026-01-03 19:47:29.309762,0 days 00:00:11.129963,mish,0.1137913842888918,32,0.07271422018527345,2,True,standard,0.00011565191892339658,COMPLETE
427,147.03623962402344,2026-01-03 19:47:29.324284,2026-01-03 19:47:39.876414,0 days 00:00:10.552130,relu,0.1004030328250752,29,0.055352290913199084,2,True,standard,8.681198208210134e-05,COMPLETE
428,145.8927001953125,2026-01-03 19:47:39.886933,2026-01-03 19:47:50.416570,0 days 00:00:10.529637,relu,0.10818220699569597,30,0.06456188797032768,2,True,standard,0.0001047336764946219,COMPLETE
429,141.65457153320312,2026-01-03 19:47:50.429596,2026-01-03 19:48:00.697305,0 days 00:00:10.267709,relu,0.11364595459803566,31,0.07775994809760944,2,True,standard,0.00013262732773301622,COMPLETE
430,170.2783966064453,2026-01-03 19:48:00.708931,2026-01-03 19:48:10.915914,0 days 00:00:10.206983,silu,0.11602599217636624,7,0.07540190405712975,2,True,standard,0.00014384551349477554,COMPLETE
431,142.3360595703125,2026-01-03 19:48:10.928936,2026-01-03 19:48:21.613789,0 days 00:00:10.684853,relu,0.11440025247194363,31,0.06726256086350083,2,True,standard,0.00012864138437068852,COMPLETE
432,140.55764770507812,2026-01-03 19:48:21.627307,2026-01-03 19:48:32.034459,0 days 00:00:10.407152,relu,0.11699573200283526,32,0.07691713208213109,2,True,standard,0.00012020525486352095,COMPLETE
433,171.7305908203125,2026-01-03 19:48:32.048079,2026-01-03 19:48:42.845456,0 days 00:00:10.797377,relu,0.11749584631313367,32,0.056844495455177405,2,True,minmax,0.0001446246449507556,COMPLETE
434,198.23946112738716,2026-01-03 19:48:42.858475,2026-01-03 19:48:53.188641,0 days 00:00:10.330166,relu,0.10789221857531153,32,0.00099506508981201,2,False,standard,0.00011220261842923448,COMPLETE
435,148.05429077148438,2026-01-03 19:48:53.201680,2026-01-03 19:49:04.214974,0 days 00:00:11.013294,relu,0.11814177032014188,31,0.04786500200048689,2,True,standard,0.00012827386827738758,COMPLETE
436,145.7491912841797,2026-01-03 19:49:04.227588,2026-01-03 19:49:15.207992,0 days 00:00:10.980404,relu,0.10828198342194965,32,0.06990155022922938,2,True,standard,0.00016092402555504954,COMPLETE
437,160.8041534423828,2026-01-03 19:49:15.219585,2026-01-03 19:49:25.939746,0 days 00:00:10.720161,relu,0.3041094866627351,31,0.0778819405694823,2,True,standard,9.725815608291704e-05,COMPLETE
438,181.1432647705078,2026-01-03 19:49:25.951772,2026-01-03 19:49:36.529121,0 days 00:00:10.577349,relu,0.11904277371740042,32,0.005537690207824295,2,True,standard,0.00011148015814132973,COMPLETE
439,169.3755645751953,2026-01-03 19:49:36.538634,2026-01-03 19:49:47.329861,0 days 00:00:10.791227,relu,0.10829044727917572,30,0.06344117157821344,2,True,none,2.08936396864732e-06,COMPLETE
440,195.36734008789062,2026-01-03 19:49:47.340386,2026-01-03 19:49:57.276110,0 days 00:00:09.935724,relu,0.11916923036403516,4,0.07938379943777876,2,True,standard,0.00013725075010904929,COMPLETE
441,158.7531280517578,2026-01-03 19:49:57.288641,2026-01-03 19:50:09.687390,0 days 00:00:12.398749,gelu,0.11386071896329446,31,0.05996116065534652,2,True,standard,0.00017927008045532256,COMPLETE
442,144.78225708007812,2026-01-03 19:50:09.698266,2026-01-03 19:50:20.330879,0 days 00:00:10.632613,relu,0.10630024100935577,30,0.0725990752458384,2,True,standard,0.00010128776817891597,COMPLETE
443,152.1727752685547,2026-01-03 19:50:20.342394,2026-01-03 19:50:31.235041,0 days 00:00:10.892647,relu,0.12549989015177254,29,0.08374532883271359,2,True,robust,0.0001264705489280152,COMPLETE
444,143.25369262695312,2026-01-03 19:50:31.249072,2026-01-03 19:50:41.617208,0 days 00:00:10.368136,relu,0.11849945171593171,32,0.06834481422808647,2,True,standard,8.698162564939575e-05,COMPLETE
445,143.1479034423828,2026-01-03 19:50:41.631246,2026-01-03 19:50:52.019991,0 days 00:00:10.388745,relu,0.10743855604558741,31,0.07952721642763312,2,True,standard,2.635597899102303e-06,COMPLETE
446,148.3797149658203,2026-01-03 19:50:52.032509,2026-01-03 19:51:02.260643,0 days 00:00:10.228134,relu,0.11399704332647609,30,0.05297162174759749,2,True,standard,0.00014721103636529075,COMPLETE
