number,value,datetime_start,datetime_complete,duration,params_activation,params_dropout,params_hidden_size,params_lr,params_n_layers,params_scale_target,params_scaler,params_weight_decay,state
0,190.5194549560547,2026-01-03 18:23:23.896456,2026-01-03 18:23:33.649016,0 days 00:00:09.752560,gelu,0.48717507844762753,13,0.038372250384464505,2,True,standard,2.1057249878584985e-06,COMPLETE
1,341.612545437283,2026-01-03 18:23:33.660017,2026-01-03 18:23:42.181694,0 days 00:00:08.521677,gelu,0.4086120782270629,10,5.924900895684408e-05,2,False,none,1.95852103415482e-06,COMPLETE
2,176.7728271484375,2026-01-03 18:23:42.189702,2026-01-03 18:23:49.719658,0 days 00:00:07.529956,gelu,0.1426556315817865,29,0.049679502200920225,1,True,minmax,0.00023167456801701227,COMPLETE
3,293.7834789360894,2026-01-03 18:23:49.731658,2026-01-03 18:23:56.500079,0 days 00:00:06.768421,gelu,0.2346751283056655,5,0.00035885270995245864,1,False,robust,1.0098055438468925e-06,COMPLETE
4,196.26016235351562,2026-01-03 18:23:56.674607,2026-01-03 18:24:04.308746,0 days 00:00:07.634139,gelu,0.2331773026489241,30,0.015899274064496316,1,True,minmax,3.238951290955007e-06,COMPLETE
5,192.77386474609375,2026-01-03 18:24:04.318749,2026-01-03 18:24:11.610924,0 days 00:00:07.292175,mish,0.44089623094964747,32,0.0017298577019442516,1,True,standard,0.00023161189605410562,COMPLETE
6,176.80697631835938,2026-01-03 18:24:11.622440,2026-01-03 18:24:18.775614,0 days 00:00:07.153174,silu,0.13283840372544686,9,0.08377041908086573,2,True,none,7.963341879121187e-06,COMPLETE
7,283.5393981933594,2026-01-03 18:24:18.786638,2026-01-03 18:24:27.564841,0 days 00:00:08.778203,gelu,0.28242821915918326,5,0.00011887384217733469,2,True,none,7.302784709361377e-06,COMPLETE
8,198.84426879882812,2026-01-03 18:24:27.573349,2026-01-03 18:24:33.951148,0 days 00:00:06.377799,silu,0.32395042273212615,14,0.0025439341645457393,1,True,minmax,9.961342791921566e-06,COMPLETE
9,241.93363240559893,2026-01-03 18:24:33.959662,2026-01-03 18:24:41.291691,0 days 00:00:07.332029,silu,0.4965103536992248,23,0.0005706327073976341,2,False,robust,0.0008983087251239809,COMPLETE
10,371.58371270073786,2026-01-03 18:24:41.300208,2026-01-03 18:24:47.090508,0 days 00:00:05.790300,relu,0.10050032209455356,19,1.285199010540008e-05,1,False,minmax,8.575113571596447e-05,COMPLETE
11,173.58343505859375,2026-01-03 18:24:47.098019,2026-01-03 18:24:54.071576,0 days 00:00:06.973557,silu,0.1006090126210977,9,0.06879659105065929,2,True,none,4.0900894683612215e-05,COMPLETE
12,199.46722412109375,2026-01-03 18:24:54.080087,2026-01-03 18:25:00.465554,0 days 00:00:06.385467,relu,0.1747941281631461,7,0.013678096151991457,1,True,minmax,4.446720509925644e-05,COMPLETE
13,193.41917419433594,2026-01-03 18:25:00.474068,2026-01-03 18:25:07.739720,0 days 00:00:07.265652,mish,0.17580684740535674,7,0.010453453605861224,2,True,none,0.00023022272013657437,COMPLETE
14,177.23475646972656,2026-01-03 18:25:07.919963,2026-01-03 18:25:14.115218,0 days 00:00:06.195255,silu,0.1006966878104113,17,0.06943970739671644,1,True,none,0.00018897399100253564,COMPLETE
15,198.08209228515625,2026-01-03 18:25:14.123733,2026-01-03 18:25:21.318802,0 days 00:00:07.195069,silu,0.17855914254976732,7,0.027462644883874326,2,True,minmax,2.7639336733926598e-05,COMPLETE
16,200.08070373535156,2026-01-03 18:25:21.326314,2026-01-03 18:25:27.107370,0 days 00:00:05.781056,mish,0.3143732868472178,4,0.005616196825909345,1,True,robust,0.0008960139496064163,COMPLETE
17,180.94822692871094,2026-01-03 18:25:27.115893,2026-01-03 18:25:33.942046,0 days 00:00:06.826153,relu,0.23018118937702536,12,0.035678360497035065,2,True,standard,8.333341726564849e-05,COMPLETE
18,356.9904998101128,2026-01-03 18:25:33.949570,2026-01-03 18:25:41.298707,0 days 00:00:07.349137,silu,0.1416185109680644,23,1.502051393987781e-05,2,False,none,2.3775521637924653e-05,COMPLETE
19,200.13137817382812,2026-01-03 18:25:41.306220,2026-01-03 18:25:48.283309,0 days 00:00:06.977089,gelu,0.34494275306497973,8,0.005596299217934282,1,True,minmax,0.00043443102796751143,COMPLETE
20,175.6865997314453,2026-01-03 18:25:48.292823,2026-01-03 18:25:56.259554,0 days 00:00:07.966731,gelu,0.2699836795654271,16,0.08268941331750748,1,True,minmax,9.152196905005684e-05,COMPLETE
21,174.76974487304688,2026-01-03 18:25:56.270602,2026-01-03 18:26:03.800709,0 days 00:00:07.530107,gelu,0.27078109135825323,18,0.09908846144094964,1,True,minmax,9.440653112668495e-05,COMPLETE
22,176.81820678710938,2026-01-03 18:26:03.810735,2026-01-03 18:26:10.725565,0 days 00:00:06.914830,gelu,0.26760433525886407,16,0.09334541692451344,1,True,minmax,5.8958466474052074e-05,COMPLETE
23,195.55050659179688,2026-01-03 18:26:10.734085,2026-01-03 18:26:17.620073,0 days 00:00:06.885988,gelu,0.3484156078351024,22,0.02571847876749947,1,True,minmax,0.00012138600093012121,COMPLETE
24,186.1536407470703,2026-01-03 18:26:17.627585,2026-01-03 18:26:24.409077,0 days 00:00:06.781492,gelu,0.37920784799215246,11,0.05665918388384787,1,True,minmax,1.5875888618731116e-05,COMPLETE
25,186.99107360839844,2026-01-03 18:26:24.418599,2026-01-03 18:26:30.817103,0 days 00:00:06.398504,silu,0.26183847362156243,15,0.09804521566552449,1,True,none,4.859776838945764e-05,COMPLETE
26,219.23638075086805,2026-01-03 18:26:30.825623,2026-01-03 18:26:37.938882,0 days 00:00:07.113259,relu,0.20307102045319153,20,0.0008054395200082468,2,False,robust,0.00010566895289359444,COMPLETE
27,176.97586059570312,2026-01-03 18:26:37.946398,2026-01-03 18:26:44.270618,0 days 00:00:06.324220,mish,0.3032861548961091,9,0.023303631442812382,1,True,standard,0.0003975408928148916,COMPLETE
28,201.66897583007812,2026-01-03 18:26:44.278638,2026-01-03 18:26:52.533235,0 days 00:00:08.254597,gelu,0.38014652905788077,12,0.008066914819968166,2,True,minmax,1.4444326152872885e-05,COMPLETE
29,172.27783203125,2026-01-03 18:26:52.540246,2026-01-03 18:26:59.422478,0 days 00:00:06.882232,gelu,0.45159618929470857,26,0.04026486621645695,1,True,standard,4.1186302507910196e-05,COMPLETE
30,179.57275390625,2026-01-03 18:26:59.430481,2026-01-03 18:27:07.132034,0 days 00:00:07.701553,silu,0.4537742766989117,28,0.04132610606954375,2,True,standard,3.827333239786553e-05,COMPLETE
31,172.15243530273438,2026-01-03 18:27:07.140047,2026-01-03 18:27:13.926199,0 days 00:00:06.786152,gelu,0.46276998330003893,25,0.051379181994378485,1,True,standard,0.00013809049154656558,COMPLETE
32,173.50942993164062,2026-01-03 18:27:13.933714,2026-01-03 18:27:20.800169,0 days 00:00:06.866455,gelu,0.46320757246656546,26,0.03935346314925561,1,True,standard,0.0001349168944948928,COMPLETE
33,174.612548828125,2026-01-03 18:27:20.808684,2026-01-03 18:27:27.757222,0 days 00:00:06.948538,gelu,0.44268627585614406,26,0.018796673621316137,1,True,standard,0.00015525341705218592,COMPLETE
34,200.7356557888455,2026-01-03 18:27:27.766745,2026-01-03 18:27:34.183745,0 days 00:00:06.417000,gelu,0.47541876986347165,24,0.0008523414380778842,1,False,standard,0.00045802699788101853,COMPLETE
35,173.07676696777344,2026-01-03 18:27:34.192251,2026-01-03 18:27:41.090056,0 days 00:00:06.897805,gelu,0.41007819124816747,27,0.04098630265711371,1,True,standard,6.38523274343135e-05,COMPLETE
36,172.9268798828125,2026-01-03 18:27:41.099575,2026-01-03 18:27:47.923193,0 days 00:00:06.823618,gelu,0.41429202915627733,27,0.03757513043748356,1,True,standard,6.42346088369681e-05,COMPLETE
37,170.4734649658203,2026-01-03 18:27:47.932705,2026-01-03 18:27:54.848123,0 days 00:00:06.915418,gelu,0.41598708034575604,32,0.052758337683037976,1,True,standard,6.178216578221692e-05,COMPLETE
38,198.61625291612413,2026-01-03 18:27:54.857147,2026-01-03 18:28:01.364782,0 days 00:00:06.507635,gelu,0.41735077021475514,32,0.0008659033685527796,1,False,standard,2.5607140925722915e-05,COMPLETE
39,176.2034454345703,2026-01-03 18:28:01.375301,2026-01-03 18:28:08.225794,0 days 00:00:06.850493,gelu,0.39347618202070267,21,0.018232970579540257,1,True,standard,3.152064723070448e-06,COMPLETE
40,170.87741088867188,2026-01-03 18:28:08.233311,2026-01-03 18:28:15.151386,0 days 00:00:06.918075,gelu,0.43418277239240394,32,0.054620485155672,1,True,standard,1.6521916219920743e-05,COMPLETE
41,171.65829467773438,2026-01-03 18:28:15.160900,2026-01-03 18:28:22.036408,0 days 00:00:06.875508,gelu,0.4296332133399078,30,0.05138286345185787,1,True,standard,1.6370219106701946e-05,COMPLETE
42,171.34815979003906,2026-01-03 18:28:22.043925,2026-01-03 18:28:28.948601,0 days 00:00:06.904676,gelu,0.4337569502385562,32,0.05491609932506888,1,True,standard,1.6719931385382085e-05,COMPLETE
43,170.7571563720703,2026-01-03 18:28:28.957122,2026-01-03 18:28:35.927827,0 days 00:00:06.970705,gelu,0.4294373527413772,30,0.058442103061198486,1,True,standard,1.550200166177063e-05,COMPLETE
44,170.5629425048828,2026-01-03 18:28:35.936347,2026-01-03 18:28:42.791640,0 days 00:00:06.855293,gelu,0.42753091924561043,30,0.06231011187010315,1,True,standard,6.151712290136227e-06,COMPLETE
45,175.66563415527344,2026-01-03 18:28:42.799649,2026-01-03 18:28:49.723191,0 days 00:00:06.923542,gelu,0.47963286464219124,31,0.027569862978904833,1,True,standard,5.820997148909258e-06,COMPLETE
46,170.90237426757812,2026-01-03 18:28:49.732707,2026-01-03 18:28:56.518493,0 days 00:00:06.785786,gelu,0.3934750098280896,32,0.06351831277459295,1,True,standard,4.2642565441073825e-06,COMPLETE
47,198.2980006917318,2026-01-03 18:28:56.527012,2026-01-03 18:29:02.836925,0 days 00:00:06.309913,mish,0.3588272370480743,29,0.0009009254419915444,1,False,standard,4.5433448522418955e-06,COMPLETE
48,177.8310089111328,2026-01-03 18:29:02.845439,2026-01-03 18:29:09.631099,0 days 00:00:06.785660,gelu,0.3697047588739863,23,0.012139964492188316,1,True,standard,9.552640431385391e-06,COMPLETE
49,173.96200561523438,2026-01-03 18:29:09.639110,2026-01-03 18:29:16.037633,0 days 00:00:06.398523,relu,0.4948003380207676,29,0.07408721343174993,1,True,robust,1.7144345985162954e-06,COMPLETE
50,171.4901885986328,2026-01-03 18:29:16.047146,2026-01-03 18:29:22.873460,0 days 00:00:06.826314,gelu,0.39638575771254253,20,0.06844085870820116,1,True,standard,3.0019080052221015e-06,COMPLETE
51,170.40318298339844,2026-01-03 18:29:22.880967,2026-01-03 18:29:29.701529,0 days 00:00:06.820562,gelu,0.42986892576758723,32,0.0561853535183808,1,True,standard,1.1521005081967355e-05,COMPLETE
52,170.4088592529297,2026-01-03 18:29:29.709533,2026-01-03 18:29:36.600770,0 days 00:00:06.891237,gelu,0.42441089579522157,32,0.06115348953133941,1,True,standard,1.1274648364467474e-05,COMPLETE
53,173.0665283203125,2026-01-03 18:29:36.609784,2026-01-03 18:29:43.496151,0 days 00:00:06.886367,gelu,0.425018671234801,29,0.0312507090220361,1,True,standard,1.076769666279853e-05,COMPLETE
54,175.5052032470703,2026-01-03 18:29:43.505667,2026-01-03 18:29:50.431807,0 days 00:00:06.926140,gelu,0.40247513471750784,28,0.023160698964009362,1,True,standard,2.1487279776481807e-05,COMPLETE
55,190.54600524902344,2026-01-03 18:29:50.441321,2026-01-03 18:29:57.732408,0 days 00:00:07.291087,gelu,0.4437660531932893,25,0.0020073516893597703,1,True,standard,7.2726159548995775e-06,COMPLETE
56,174.54067993164062,2026-01-03 18:29:57.740923,2026-01-03 18:30:04.411994,0 days 00:00:06.671071,mish,0.4694170340973852,32,0.047617093462713624,1,True,standard,1.1618478463170935e-05,COMPLETE
57,170.09620666503906,2026-01-03 18:30:04.420501,2026-01-03 18:30:11.318737,0 days 00:00:06.898236,gelu,0.33275841172864334,22,0.07300979721278866,1,True,standard,6.556057383530346e-06,COMPLETE
58,172.4490203857422,2026-01-03 18:30:11.327758,2026-01-03 18:30:17.732083,0 days 00:00:06.404325,relu,0.3315276467700894,22,0.07865128277195271,1,True,robust,6.665919710668744e-06,COMPLETE
59,211.86136128743493,2026-01-03 18:30:17.743123,2026-01-03 18:30:24.175978,0 days 00:00:06.432855,gelu,0.38014882936939276,6,0.0009378002705531884,1,False,standard,4.931119086730842e-06,COMPLETE
60,172.71603393554688,2026-01-03 18:30:24.183493,2026-01-03 18:30:31.012802,0 days 00:00:06.829309,gelu,0.36268550211552847,18,0.03311200268806799,1,True,standard,2.51941991602386e-06,COMPLETE
61,171.53878784179688,2026-01-03 18:30:31.022314,2026-01-03 18:30:37.848352,0 days 00:00:06.826038,gelu,0.420981821722041,24,0.06496953211669007,1,True,standard,8.932245354801189e-06,COMPLETE
62,170.20681762695312,2026-01-03 18:30:37.856869,2026-01-03 18:30:44.730747,0 days 00:00:06.873878,gelu,0.43375969728890534,30,0.09999752840146836,1,True,standard,1.2310034156914307e-05,COMPLETE
63,170.03384399414062,2026-01-03 18:30:44.740268,2026-01-03 18:30:51.653679,0 days 00:00:06.913411,gelu,0.45210231163322034,29,0.09659998257226926,1,True,standard,1.236667853275822e-05,COMPLETE
64,183.11459350585938,2026-01-03 18:30:51.663198,2026-01-03 18:30:58.517637,0 days 00:00:06.854439,gelu,0.4529654943254526,28,0.09590695927408459,1,True,none,1.2122858764883503e-05,COMPLETE
65,171.10348510742188,2026-01-03 18:30:58.525156,2026-01-03 18:31:05.373007,0 days 00:00:06.847851,gelu,0.48297456329733623,24,0.0801911484966007,1,True,standard,3.3378683197198336e-05,COMPLETE
66,169.22756958007812,2026-01-03 18:31:05.381521,2026-01-03 18:31:12.336062,0 days 00:00:06.954541,gelu,0.40881888531922883,30,0.09903264761219198,1,True,standard,2.174825462845502e-05,COMPLETE
67,187.3727569580078,2026-01-03 18:31:12.345580,2026-01-03 18:31:18.882112,0 days 00:00:06.536532,mish,0.33376121368136175,27,0.004321117673466315,1,True,standard,3.1524058370063826e-05,COMPLETE
68,193.40206909179688,2026-01-03 18:31:18.891626,2026-01-03 18:31:25.527762,0 days 00:00:06.636136,gelu,0.4069317965534169,4,0.0977272747070207,1,True,robust,2.0439741001320747e-05,COMPLETE
69,168.79283142089844,2026-01-03 18:31:25.536277,2026-01-03 18:31:31.858701,0 days 00:00:06.322424,relu,0.2849985004926099,22,0.046102309245532005,1,True,standard,1.2975368738086577e-05,COMPLETE
70,198.67018832736545,2026-01-03 18:31:31.867218,2026-01-03 18:31:37.824138,0 days 00:00:05.956920,relu,0.24186002133578371,14,0.0009510424435920351,1,False,standard,8.131997579756295e-06,COMPLETE
71,165.07948303222656,2026-01-03 18:31:37.832656,2026-01-03 18:31:44.071511,0 days 00:00:06.238855,relu,0.2846440380140163,21,0.04596305556059208,1,True,standard,1.3273069967650653e-05,COMPLETE
72,198.47994995117188,2026-01-03 18:31:44.080559,2026-01-03 18:31:50.409876,0 days 00:00:06.329317,relu,0.303694620703411,21,0.0002584813204194662,1,True,standard,1.2811632593126055e-05,COMPLETE
73,162.10244750976562,2026-01-03 18:31:51.022845,2026-01-03 18:31:57.304671,0 days 00:00:06.281826,relu,0.2925632847287628,22,0.07656654924547533,1,True,standard,1.9909484293125288e-05,COMPLETE
74,168.19479370117188,2026-01-03 18:31:57.314190,2026-01-03 18:32:03.743664,0 days 00:00:06.429474,relu,0.2887823400289222,19,0.08059198353278496,1,True,standard,1.9719453322379206e-05,COMPLETE
75,182.65866088867188,2026-01-03 18:32:03.754190,2026-01-03 18:32:10.105986,0 days 00:00:06.351796,relu,0.2854768024412249,18,0.08005340912579845,1,True,none,1.983758342043735e-05,COMPLETE
76,164.07847595214844,2026-01-03 18:32:10.114507,2026-01-03 18:32:16.464100,0 days 00:00:06.349593,relu,0.24264289154184904,19,0.04465994826612108,1,True,standard,2.977846445251704e-05,COMPLETE
77,169.5947265625,2026-01-03 18:32:16.473618,2026-01-03 18:32:22.718667,0 days 00:00:06.245049,relu,0.2876771405636512,16,0.0449425613977449,1,True,standard,2.978407293768311e-05,COMPLETE
78,167.41183471679688,2026-01-03 18:32:22.728189,2026-01-03 18:32:29.003340,0 days 00:00:06.275151,relu,0.24869790771403538,16,0.044679310846289684,1,True,standard,2.7908749106019767e-05,COMPLETE
79,173.43545532226562,2026-01-03 18:32:29.012852,2026-01-03 18:32:35.607567,0 days 00:00:06.594715,relu,0.2462100179682193,16,0.019835693080530077,1,True,standard,2.958377989384142e-05,COMPLETE
80,166.0837860107422,2026-01-03 18:32:35.618085,2026-01-03 18:32:42.336978,0 days 00:00:06.718893,relu,0.22518522234900434,19,0.04500892508745207,1,True,standard,2.3372301140364868e-05,COMPLETE
81,167.4188690185547,2026-01-03 18:32:42.346499,2026-01-03 18:32:48.833827,0 days 00:00:06.487328,relu,0.2209911151819192,19,0.04669680224273282,1,True,standard,2.65520015712484e-05,COMPLETE
82,168.3658447265625,2026-01-03 18:32:48.844344,2026-01-03 18:32:55.333136,0 days 00:00:06.488792,relu,0.21482799704690508,19,0.032053006333155026,1,True,standard,5.054224500744911e-05,COMPLETE
83,165.88031005859375,2026-01-03 18:32:55.342646,2026-01-03 18:33:01.859679,0 days 00:00:06.517033,relu,0.21351682288239168,19,0.030812315737353727,1,True,standard,3.6944361494764865e-05,COMPLETE
84,167.2389373779297,2026-01-03 18:33:01.869202,2026-01-03 18:33:08.360903,0 days 00:00:06.491701,relu,0.20969438297374848,19,0.02998036630867212,1,True,standard,5.485917126932405e-05,COMPLETE
85,165.4473876953125,2026-01-03 18:33:08.369424,2026-01-03 18:33:14.781579,0 days 00:00:06.412155,relu,0.2086014036983913,19,0.02819376529296751,1,True,standard,3.511421135314566e-05,COMPLETE
86,176.6475372314453,2026-01-03 18:33:14.791093,2026-01-03 18:33:21.280421,0 days 00:00:06.489328,relu,0.1956746833561213,17,0.016396245387767783,1,True,none,5.360315212556879e-05,COMPLETE
87,171.79747009277344,2026-01-03 18:33:21.289939,2026-01-03 18:33:27.746921,0 days 00:00:06.456982,relu,0.21779155336537465,14,0.027307984048945768,1,True,standard,7.571423276799628e-05,COMPLETE
88,207.1369583468967,2026-01-03 18:33:27.755929,2026-01-03 18:33:33.810999,0 days 00:00:06.055070,relu,0.1623468419910417,20,0.0009649252498168121,1,False,robust,3.933733554489516e-05,COMPLETE
89,177.6920623779297,2026-01-03 18:33:33.819514,2026-01-03 18:33:40.374620,0 days 00:00:06.555106,relu,0.2566610894127725,17,0.009629060462975608,1,True,standard,3.4774608262679404e-05,COMPLETE
90,196.1582489013672,2026-01-03 18:33:40.382135,2026-01-03 18:33:46.804190,0 days 00:00:06.422055,relu,0.2265201254340673,15,0.013682472674235563,1,True,minmax,2.622885234671755e-05,COMPLETE
91,164.94943237304688,2026-01-03 18:33:46.812710,2026-01-03 18:33:53.241142,0 days 00:00:06.428432,relu,0.19539844394019676,19,0.03809163698148429,1,True,standard,4.455961900797698e-05,COMPLETE
92,166.7301788330078,2026-01-03 18:33:53.250658,2026-01-03 18:33:59.711845,0 days 00:00:06.461187,relu,0.19382220336222328,17,0.036787905244557544,1,True,standard,7.415455149497806e-05,COMPLETE
93,171.1527862548828,2026-01-03 18:33:59.720363,2026-01-03 18:34:06.221084,0 days 00:00:06.500721,relu,0.19756359809000626,15,0.02172142824308399,1,True,standard,4.167460923340697e-05,COMPLETE
94,166.2892303466797,2026-01-03 18:34:06.229611,2026-01-03 18:34:12.670735,0 days 00:00:06.441124,relu,0.16281136730301332,13,0.033208921956326264,1,True,standard,7.526805820574769e-05,COMPLETE
95,172.18582153320312,2026-01-03 18:34:12.679253,2026-01-03 18:34:19.117762,0 days 00:00:06.438509,relu,0.16760885729930236,13,0.03481357652631825,1,True,standard,7.685815345998521e-05,COMPLETE
96,170.57833862304688,2026-01-03 18:34:19.127267,2026-01-03 18:34:25.622358,0 days 00:00:06.495091,relu,0.1870029813155833,11,0.029104767755131253,1,True,standard,9.83111999025286e-05,COMPLETE
97,168.99615478515625,2026-01-03 18:34:25.649420,2026-01-03 18:34:32.119249,0 days 00:00:06.469829,relu,0.15307107988127105,18,0.025338275609283097,1,True,standard,5.007134643283031e-05,COMPLETE
98,161.26034545898438,2026-01-03 18:34:32.127272,2026-01-03 18:34:39.701271,0 days 00:00:07.573999,relu,0.12593637681071962,21,0.03847212024933485,2,True,standard,6.924280781563029e-05,COMPLETE
99,166.69161987304688,2026-01-03 18:34:39.709794,2026-01-03 18:34:47.472905,0 days 00:00:07.763111,relu,0.18556101232374314,21,0.04117299251588981,2,True,standard,0.00011669107084765272,COMPLETE
100,166.63076782226562,2026-01-03 18:50:52.919383,2026-01-03 18:51:01.480677,0 days 00:00:08.561294,relu,0.11982534731496146,21,0.03825489187475642,2,True,standard,0.0001759279359713934,COMPLETE
101,157.4201202392578,2026-01-03 18:51:01.489676,2026-01-03 18:51:08.437714,0 days 00:00:06.948038,relu,0.10709670697381746,21,0.04040205722236046,2,True,standard,0.0001733414631505203,COMPLETE
102,162.16600036621094,2026-01-03 18:51:08.445717,2026-01-03 18:51:15.370729,0 days 00:00:06.925012,relu,0.11274237386059743,20,0.037464223494954416,2,True,standard,0.00019767982113760548,COMPLETE
103,165.87442016601562,2026-01-03 18:51:15.378729,2026-01-03 18:51:22.236269,0 days 00:00:06.857540,relu,0.11416522115556121,20,0.02294623573331912,2,True,standard,0.0005593414449797623,COMPLETE
104,165.57321166992188,2026-01-03 18:51:22.244273,2026-01-03 18:51:29.291449,0 days 00:00:07.047176,relu,0.12044680317830986,23,0.02315183968665462,2,True,standard,0.00032015332282029675,COMPLETE
105,165.71470642089844,2026-01-03 18:51:29.299448,2026-01-03 18:51:36.198958,0 days 00:00:06.899510,relu,0.11138701910765983,23,0.02238581058298707,2,True,standard,0.0003514051527342712,COMPLETE
106,175.086669921875,2026-01-03 18:51:36.205957,2026-01-03 18:51:43.235982,0 days 00:00:07.030025,silu,0.11361592764684081,23,0.02071045020823739,2,True,standard,0.00031977369905964207,COMPLETE
107,201.66346218532985,2026-01-03 18:51:43.245991,2026-01-03 18:51:50.021539,0 days 00:00:06.775548,relu,0.13201849936313215,24,0.0009734345863767275,2,False,minmax,0.0007848165773291989,COMPLETE
108,171.50387573242188,2026-01-03 18:51:50.030538,2026-01-03 18:51:56.945521,0 days 00:00:06.914983,relu,0.11182179717220311,20,0.01628506405621232,2,True,standard,0.00028178715898093294,COMPLETE
109,167.7953643798828,2026-01-03 18:51:56.953527,2026-01-03 18:52:04.189650,0 days 00:00:07.236123,relu,0.142611128560139,22,0.023741627087569626,2,True,standard,0.0005620169751699962,COMPLETE
110,175.62380981445312,2026-01-03 18:52:04.196649,2026-01-03 18:52:11.172147,0 days 00:00:06.975498,relu,0.13019297856456324,25,0.017831853099360803,2,True,robust,0.0002186709705904162,COMPLETE
