number,value,datetime_start,datetime_complete,duration,params_activation,params_dropout,params_hidden_size,params_lr,params_n_layers,params_scale_target,params_scaler,params_weight_decay,state
223,144.888671875,2026-01-03 19:09:45.637484,2026-01-03 19:09:56.621972,0 days 00:00:10.984488,relu,0.1186733555487336,31,0.0767337559500944,2,True,standard,0.00016788613119888258,COMPLETE
224,147.14627075195312,2026-01-03 19:09:56.632486,2026-01-03 19:10:07.369394,0 days 00:00:10.736908,relu,0.13471391877862912,29,0.0835237561249783,2,True,standard,0.00034204278421891694,COMPLETE
225,146.14854431152344,2026-01-03 19:10:07.386428,2026-01-03 19:10:18.198040,0 days 00:00:10.811612,relu,0.12714893727649107,32,0.0675375549480488,2,True,standard,0.00014231242120043875,COMPLETE
226,197.7656707763672,2026-01-03 19:10:18.208628,2026-01-03 19:10:28.674191,0 days 00:00:10.465563,relu,0.13819183676277874,5,0.08436747650219545,2,True,standard,0.0005466597146865581,COMPLETE
227,149.718505859375,2026-01-03 19:10:28.685715,2026-01-03 19:10:39.593170,0 days 00:00:10.907455,relu,0.11223213930299256,31,0.08293378009633726,2,True,standard,0.0006500261555647281,COMPLETE
228,172.6006622314453,2026-01-03 19:10:39.603684,2026-01-03 19:10:50.513412,0 days 00:00:10.909728,relu,0.12934775834815784,29,0.058034215006713886,2,True,none,0.0005086398489073499,COMPLETE
229,146.37448120117188,2026-01-03 19:10:50.525440,2026-01-03 19:11:01.583836,0 days 00:00:11.058396,relu,0.12025501477817627,28,0.07152807649078424,2,True,standard,0.0002156037367651634,COMPLETE
230,143.6405792236328,2026-01-03 19:11:01.595488,2026-01-03 19:11:12.625584,0 days 00:00:11.030096,relu,0.13941602143660106,30,0.08556777327359184,2,True,standard,0.00028955971767523526,COMPLETE
231,150.2566680908203,2026-01-03 19:11:12.638106,2026-01-03 19:11:23.648872,0 days 00:00:11.010766,relu,0.13958041281621,30,0.08497141431922815,2,True,standard,0.000471866559987269,COMPLETE
232,141.34530639648438,2026-01-03 19:11:23.657391,2026-01-03 19:11:34.714598,0 days 00:00:11.057207,relu,0.1318004336056373,32,0.08593092964163045,2,True,standard,0.00028213862417456926,COMPLETE
233,143.79481506347656,2026-01-03 19:11:34.726628,2026-01-03 19:11:45.930683,0 days 00:00:11.204055,relu,0.13161586596237657,32,0.07594108466374876,2,True,standard,0.00029509758533813037,COMPLETE
234,148.07806396484375,2026-01-03 19:11:45.944226,2026-01-03 19:11:56.981199,0 days 00:00:11.036973,relu,0.13879954211522116,32,0.06774957921785676,2,True,standard,0.0002739590450875692,COMPLETE
235,147.13934326171875,2026-01-03 19:11:56.991715,2026-01-03 19:12:07.614443,0 days 00:00:10.622728,relu,0.15254597250941884,32,0.07253207427103196,2,True,standard,0.00030312134104978905,COMPLETE
236,146.14111328125,2026-01-03 19:12:07.625962,2026-01-03 19:12:19.112587,0 days 00:00:11.486625,relu,0.13376285082963252,31,0.08685684672216165,2,True,standard,0.0003627110196134243,COMPLETE
237,147.13681030273438,2026-01-03 19:12:19.128116,2026-01-03 19:12:30.661500,0 days 00:00:11.533384,relu,0.14658850644904498,30,0.06260668943465401,2,True,standard,0.00028935160463071125,COMPLETE
238,168.79319763183594,2026-01-03 19:12:30.673544,2026-01-03 19:12:40.383533,0 days 00:00:09.709989,relu,0.1316038002431264,10,0.07632556096937378,2,True,standard,0.00036465907629586614,COMPLETE
239,148.62673950195312,2026-01-03 19:12:40.393047,2026-01-03 19:12:51.486965,0 days 00:00:11.093918,relu,0.1393588486827897,32,0.08634780727645917,2,True,standard,0.0003166177971796399,COMPLETE
240,147.04638671875,2026-01-03 19:12:51.500488,2026-01-03 19:13:01.910619,0 days 00:00:10.410131,relu,0.12727352953881996,31,0.08629205640152064,2,True,standard,0.0005429874362775599,COMPLETE
241,148.01828002929688,2026-01-03 19:13:01.921134,2026-01-03 19:13:14.395526,0 days 00:00:12.474392,relu,0.12385603682020759,30,0.07735430769702621,2,True,standard,0.00024626247128283195,COMPLETE
242,142.0029296875,2026-01-03 19:13:14.408042,2026-01-03 19:13:25.388605,0 days 00:00:10.980563,relu,0.13099863819316807,29,0.08656223857479624,2,True,standard,0.00020961784955983207,COMPLETE
243,143.9878692626953,2026-01-03 19:13:25.399624,2026-01-03 19:13:36.225189,0 days 00:00:10.825565,relu,0.1319413688221462,31,0.08737732597320999,2,True,standard,0.0002036151077688423,COMPLETE
244,145.8058319091797,2026-01-03 19:13:36.233699,2026-01-03 19:13:47.285942,0 days 00:00:11.052243,relu,0.1426853972159366,30,0.09987546269636896,2,True,standard,0.00019930933445455408,COMPLETE
245,143.1925811767578,2026-01-03 19:13:47.295459,2026-01-03 19:13:58.685405,0 days 00:00:11.389946,relu,0.13488450689999062,31,0.08727997311538002,2,True,standard,0.00018922083216710972,COMPLETE
246,142.448974609375,2026-01-03 19:13:58.696928,2026-01-03 19:14:08.252568,0 days 00:00:09.555640,relu,0.13077518934338006,28,0.08905554632520223,2,True,standard,0.00017170004380698994,COMPLETE
247,144.53372192382812,2026-01-03 19:14:08.268095,2026-01-03 19:14:17.837588,0 days 00:00:09.569493,relu,0.13116253260583827,28,0.08787240609230602,2,True,standard,0.0001375398170171803,COMPLETE
248,148.27777099609375,2026-01-03 19:14:17.849107,2026-01-03 19:14:27.372268,0 days 00:00:09.523161,relu,0.15059689702991744,29,0.06892751331217065,2,True,standard,0.00015882915790610736,COMPLETE
249,137.5039520263672,2026-01-03 19:14:27.381787,2026-01-03 19:14:37.585429,0 days 00:00:10.203642,relu,0.13508185106519627,30,0.08717315365854672,2,True,standard,0.0001855726801633577,COMPLETE
250,146.27972412109375,2026-01-03 19:14:37.598947,2026-01-03 19:14:47.280435,0 days 00:00:09.681488,relu,0.13692478039903547,30,0.0856339126369676,2,True,standard,0.00017030190179634776,COMPLETE
251,167.6964111328125,2026-01-03 19:14:47.291459,2026-01-03 19:14:58.107569,0 days 00:00:10.816110,mish,0.13588695353967006,32,0.0647648004762713,2,True,standard,0.00015875435693640203,COMPLETE
252,145.793212890625,2026-01-03 19:14:58.119086,2026-01-03 19:15:10.359807,0 days 00:00:12.240721,relu,0.14734413497664756,30,0.08937576892109157,2,True,standard,0.00020354665191917528,COMPLETE
253,144.05435180664062,2026-01-03 19:15:10.376840,2026-01-03 19:15:26.654090,0 days 00:00:16.277250,relu,0.13080596167360758,31,0.0985098092932544,2,True,standard,0.00019407092782015327,COMPLETE
254,198.2538475884332,2026-01-03 19:15:26.665605,2026-01-03 19:15:39.028794,0 days 00:00:12.363189,silu,0.15462099750954436,29,0.000994243291036134,2,False,standard,0.00011525605988668302,COMPLETE
255,176.34475708007812,2026-01-03 19:15:39.047343,2026-01-03 19:15:53.203228,0 days 00:00:14.155885,relu,0.1385348075359668,32,0.07165074850690004,2,True,minmax,0.0002720184806796409,COMPLETE
256,149.42857360839844,2026-01-03 19:15:53.217349,2026-01-03 19:16:06.975147,0 days 00:00:13.757798,relu,0.12714606006945875,30,0.0550169791074487,2,True,standard,0.00018417132464207378,COMPLETE
257,145.63323974609375,2026-01-03 19:16:06.988260,2026-01-03 19:16:19.247183,0 days 00:00:12.258923,relu,0.14808553415522516,28,0.08784634414978917,2,True,standard,0.00021249827404352698,COMPLETE
258,164.5135955810547,2026-01-03 19:16:19.262819,2026-01-03 19:16:32.658813,0 days 00:00:13.395994,relu,0.31527055728825853,30,0.07325151701291166,2,True,standard,0.00018455290013291538,COMPLETE
259,143.5269012451172,2026-01-03 19:16:32.671846,2026-01-03 19:16:46.487561,0 days 00:00:13.815715,relu,0.1423571264472836,32,0.08963003343874701,2,True,standard,0.0001511430453741411,COMPLETE
260,144.9095916748047,2026-01-03 19:16:46.499077,2026-01-03 19:16:59.264217,0 days 00:00:12.765140,relu,0.1425712321972054,27,0.08938629046001126,2,True,standard,0.00012953808066820715,COMPLETE
261,173.5914764404297,2026-01-03 19:16:59.273733,2026-01-03 19:17:11.283079,0 days 00:00:12.009346,relu,0.12497535988875264,31,0.09984211350728484,2,True,none,0.000149633586059174,COMPLETE
262,149.42605590820312,2026-01-03 19:17:11.295601,2026-01-03 19:17:25.056839,0 days 00:00:13.761238,relu,0.14144255199880626,29,0.06358781239144495,2,True,standard,0.0002274350822608509,COMPLETE
263,143.65609741210938,2026-01-03 19:17:25.069361,2026-01-03 19:17:39.776246,0 days 00:00:14.706885,relu,0.15835914061151818,31,0.09989910719475568,2,True,standard,0.00016213158051911882,COMPLETE
264,144.54049682617188,2026-01-03 19:17:39.791277,2026-01-03 19:17:55.907085,0 days 00:00:16.115808,relu,0.15341125903622027,32,0.09956131316106277,2,True,standard,0.00014413566252611848,COMPLETE
265,146.05514526367188,2026-01-03 19:17:55.925135,2026-01-03 19:18:12.564603,0 days 00:00:16.639468,relu,0.16535712479334108,31,0.07691152052936263,2,True,standard,0.00016951841367261178,COMPLETE
266,197.82821655273438,2026-01-03 19:18:12.574122,2026-01-03 19:18:25.657300,0 days 00:00:13.083178,relu,0.1545857283894262,30,0.0005607889499810979,2,True,standard,0.0001998406846174972,COMPLETE
267,145.18836975097656,2026-01-03 19:18:25.670324,2026-01-03 19:18:36.321250,0 days 00:00:10.650926,relu,0.15708944012956383,32,0.08649574552360899,2,True,standard,0.00012140192697541621,COMPLETE
268,147.13388061523438,2026-01-03 19:18:36.331764,2026-01-03 19:18:46.950566,0 days 00:00:10.618802,relu,0.14637159974689792,28,0.07148216754787796,2,True,standard,0.00015917641213897713,COMPLETE
269,141.56936645507812,2026-01-03 19:18:46.963597,2026-01-03 19:18:58.756364,0 days 00:00:11.792767,relu,0.13460868771758874,31,0.08682813548101374,2,True,standard,0.0001900231193224969,COMPLETE
270,146.3957061767578,2026-01-03 19:18:58.767882,2026-01-03 19:19:09.246292,0 days 00:00:10.478410,relu,0.16381345385137847,31,0.08845382892412915,2,True,standard,0.00019512921404974442,COMPLETE
271,144.10426330566406,2026-01-03 19:19:09.258812,2026-01-03 19:19:19.991513,0 days 00:00:10.732701,relu,0.1397061183728965,32,0.09942410506609622,2,True,standard,0.00024014225465770824,COMPLETE
272,198.48917256673178,2026-01-03 19:19:20.004045,2026-01-03 19:19:30.853198,0 days 00:00:10.849153,relu,0.13414958254363554,30,0.0009939472044083208,2,False,standard,0.0002667786594300202,COMPLETE
273,145.98497009277344,2026-01-03 19:19:30.866721,2026-01-03 19:19:41.548112,0 days 00:00:10.681391,relu,0.14738930232643185,31,0.08733577474229687,2,True,standard,0.00017543955748157024,COMPLETE
274,164.96420288085938,2026-01-03 19:19:41.558630,2026-01-03 19:19:54.182542,0 days 00:00:12.623912,mish,0.12117392635416029,29,0.06440557413781763,2,True,standard,0.00020935253732078273,COMPLETE
275,143.09854125976562,2026-01-03 19:19:54.194061,2026-01-03 19:20:05.956552,0 days 00:00:11.762491,relu,0.14129028596565407,32,0.0757120417385569,2,True,standard,0.0003058705061674382,COMPLETE
276,148.38075256347656,2026-01-03 19:20:05.969582,2026-01-03 19:20:18.258010,0 days 00:00:12.288428,relu,0.1768355715617044,32,0.0714079043544321,2,True,standard,0.00032690738460641397,COMPLETE
277,170.7011260986328,2026-01-03 19:20:18.270037,2026-01-03 19:20:28.572543,0 days 00:00:10.302506,silu,0.14318923908586773,27,0.05800692622324454,2,True,standard,0.00029386969890394425,COMPLETE
278,150.67617797851562,2026-01-03 19:20:28.583062,2026-01-03 19:20:38.982673,0 days 00:00:10.399611,relu,0.1571417825041632,32,0.07699369367778192,2,True,standard,0.0003388004904662522,COMPLETE
279,171.25796508789062,2026-01-03 19:20:38.992193,2026-01-03 19:20:49.100575,0 days 00:00:10.108382,relu,0.13952148707513412,30,0.08665826503586242,2,True,minmax,0.0004321197655556441,COMPLETE
280,146.3094024658203,2026-01-03 19:20:49.112098,2026-01-03 19:20:59.914743,0 days 00:00:10.802645,relu,0.14650264019986167,29,0.06688230498803238,2,True,standard,0.00026031791904267116,COMPLETE
281,142.81777954101562,2026-01-03 19:20:59.927261,2026-01-03 19:21:12.132209,0 days 00:00:12.204948,relu,0.12412247795295402,32,0.09954855409750903,2,True,standard,0.00015267314862811685,COMPLETE
282,144.3831787109375,2026-01-03 19:21:12.144238,2026-01-03 19:21:22.859353,0 days 00:00:10.715115,relu,0.11838524688504842,28,0.09769100347899695,2,True,standard,9.991962745979972e-05,COMPLETE
283,142.11083984375,2026-01-03 19:21:22.871880,2026-01-03 19:21:33.494254,0 days 00:00:10.622374,relu,0.12481764306483215,30,0.09982026028876524,2,True,standard,0.00014008101750494136,COMPLETE
284,142.15634155273438,2026-01-03 19:21:33.506775,2026-01-03 19:21:44.829619,0 days 00:00:11.322844,relu,0.11144050258066523,30,0.0897468576164416,2,True,standard,0.00013242776572360018,COMPLETE
285,146.2040252685547,2026-01-03 19:21:44.840137,2026-01-03 19:21:54.914673,0 days 00:00:10.074536,relu,0.10799490051217943,29,0.098256144003321,2,True,standard,0.00012875581931565182,COMPLETE
286,179.01095581054688,2026-01-03 19:21:54.924194,2026-01-03 19:22:04.733515,0 days 00:00:09.809321,relu,0.11096906606643785,30,0.09929859877290163,2,True,none,0.0001444956127332366,COMPLETE
287,143.7491912841797,2026-01-03 19:22:04.747035,2026-01-03 19:22:14.365873,0 days 00:00:09.618838,relu,0.1192305448936754,28,0.09983023295778838,2,True,standard,0.00012168645957191561,COMPLETE
288,142.40028381347656,2026-01-03 19:22:14.375389,2026-01-03 19:22:24.380434,0 days 00:00:10.005045,relu,0.12296069760124537,31,0.08631002492613349,2,True,standard,0.0001072384962907275,COMPLETE
289,141.57484436035156,2026-01-03 19:22:24.388941,2026-01-03 19:22:34.163835,0 days 00:00:09.774894,relu,0.11114568804033842,29,0.0855774075940093,2,True,standard,0.00010338822183887926,COMPLETE
290,145.67825317382812,2026-01-03 19:22:34.175858,2026-01-03 19:22:44.003318,0 days 00:00:09.827460,relu,0.10607952243808338,27,0.08070687151216037,2,True,standard,8.744712113334589e-05,COMPLETE
291,145.20901489257812,2026-01-03 19:22:44.014838,2026-01-03 19:22:53.743391,0 days 00:00:09.728553,relu,0.11281967287448608,29,0.07142675917880396,2,True,standard,0.0001358784361748715,COMPLETE
292,198.21831556532115,2026-01-03 19:22:53.753905,2026-01-03 19:23:03.475461,0 days 00:00:09.721556,relu,0.1184114781734529,31,0.0009941004438962047,2,False,standard,0.00011628884507885956,COMPLETE
293,139.87313842773438,2026-01-03 19:23:03.488489,2026-01-03 19:23:15.058474,0 days 00:00:11.569985,relu,0.10940295409292024,32,0.08650829285710776,2,True,standard,0.00010359318187423375,COMPLETE
294,188.65420532226562,2026-01-03 19:23:15.072005,2026-01-03 19:23:27.044025,0 days 00:00:11.972020,relu,0.10890448269089369,28,0.0040873893976283385,2,True,robust,9.2215794633113e-05,COMPLETE
295,192.49996948242188,2026-01-03 19:23:28.757992,2026-01-03 19:23:40.588114,0 days 00:00:11.830122,relu,0.10005981876557027,30,0.001984405464694273,2,True,standard,0.00010914709511231926,COMPLETE
296,139.94178771972656,2026-01-03 19:23:40.599638,2026-01-03 19:23:52.211808,0 days 00:00:11.612170,relu,0.11387061012395755,31,0.0780842961578277,2,True,standard,0.00010250330944062094,COMPLETE
297,146.8056182861328,2026-01-03 19:23:52.224325,2026-01-03 19:24:03.854864,0 days 00:00:11.630539,relu,0.11412739230374186,32,0.05603943884730833,2,True,standard,9.754516308098637e-05,COMPLETE
298,147.90390014648438,2026-01-03 19:24:03.867894,2026-01-03 19:24:16.246346,0 days 00:00:12.378452,relu,0.10769558105806444,31,0.06401631146264185,2,True,standard,0.0001090991936818132,COMPLETE
299,162.3482208251953,2026-01-03 19:24:16.256866,2026-01-03 19:24:27.493238,0 days 00:00:11.236372,mish,0.1192392828566346,29,0.07672817599182431,2,True,standard,0.0001137212714751554,COMPLETE
300,144.59628295898438,2026-01-03 19:24:27.502757,2026-01-03 19:24:38.259324,0 days 00:00:10.756567,relu,0.1102989597597204,31,0.07082159840860522,2,True,standard,9.009760897522353e-05,COMPLETE
301,141.47865295410156,2026-01-03 19:24:38.269845,2026-01-03 19:24:48.802289,0 days 00:00:10.532444,relu,0.12280640709780566,32,0.08094354913878743,2,True,standard,8.207794801971118e-05,COMPLETE
302,147.50845336914062,2026-01-03 19:24:48.813807,2026-01-03 19:24:59.310842,0 days 00:00:10.497035,relu,0.12405586179252606,32,0.051893526716195716,2,True,standard,7.267075454559928e-05,COMPLETE
303,164.8636016845703,2026-01-03 19:24:59.324362,2026-01-03 19:25:09.973136,0 days 00:00:10.648774,silu,0.11647738073636307,29,0.06284343442357111,2,True,standard,8.527611030611967e-05,COMPLETE
304,199.7390594482422,2026-01-03 19:25:09.983652,2026-01-03 19:25:19.920414,0 days 00:00:09.936762,relu,0.12318486986409853,6,0.08049476510720166,2,True,minmax,0.00010361291268088785,COMPLETE
305,143.7377166748047,2026-01-03 19:25:19.929924,2026-01-03 19:25:30.368240,0 days 00:00:10.438316,relu,0.10685451679624129,27,0.08311467510693328,2,True,standard,6.207103685463342e-05,COMPLETE
306,146.5961456298828,2026-01-03 19:25:30.379756,2026-01-03 19:25:40.917790,0 days 00:00:10.538034,relu,0.11418182149176383,30,0.0711997362505517,2,True,standard,0.00012868092296505117,COMPLETE
307,163.3825225830078,2026-01-03 19:25:40.928320,2026-01-03 19:25:50.967455,0 days 00:00:10.039135,relu,0.12445232522322697,12,0.08557955316665192,2,True,standard,7.9314377203443e-05,COMPLETE
308,145.44589233398438,2026-01-03 19:25:50.978485,2026-01-03 19:26:01.280675,0 days 00:00:10.302190,relu,0.12200526333184115,32,0.07414674231258368,2,True,standard,0.00014478683125862006,COMPLETE
309,143.25448608398438,2026-01-03 19:26:01.288698,2026-01-03 19:26:11.811948,0 days 00:00:10.523250,relu,0.10035997343392837,31,0.06324386419611043,2,True,standard,0.00010524432725517947,COMPLETE
310,144.11585998535156,2026-01-03 19:26:11.821468,2026-01-03 19:26:22.405298,0 days 00:00:10.583830,relu,0.11133873995878654,32,0.0576648751394535,2,True,standard,9.68460832265113e-05,COMPLETE
311,171.84927368164062,2026-01-03 19:26:22.414820,2026-01-03 19:26:32.779276,0 days 00:00:10.364456,relu,0.10434358473431321,28,0.06472885848164192,2,True,none,0.00010364704490451352,COMPLETE
312,144.17173767089844,2026-01-03 19:26:32.789808,2026-01-03 19:26:43.276011,0 days 00:00:10.486203,relu,0.10007629924312411,29,0.07559375993659692,2,True,standard,0.00012780404865630733,COMPLETE
313,198.3174038357205,2026-01-03 19:26:43.285527,2026-01-03 19:26:53.333891,0 days 00:00:10.048364,relu,0.11489901061724762,30,0.0009943811162554362,2,False,standard,0.00014576318646215415,COMPLETE
314,144.6956024169922,2026-01-03 19:26:53.343407,2026-01-03 19:27:03.988047,0 days 00:00:10.644640,relu,0.12288276334940695,30,0.08520813351400044,2,True,standard,0.00011880302681414644,COMPLETE
315,151.10922241210938,2026-01-03 19:27:03.996554,2026-01-03 19:27:14.431213,0 days 00:00:10.434659,relu,0.10859996855251113,32,0.06841542326259245,2,True,standard,0.00018241473069413128,COMPLETE
316,151.27920532226562,2026-01-03 19:27:14.443731,2026-01-03 19:27:24.961861,0 days 00:00:10.518130,relu,0.12535228104260998,31,0.061210941555711974,2,True,robust,8.578309693391446e-05,COMPLETE
317,152.45980834960938,2026-01-03 19:27:24.972380,2026-01-03 19:27:35.351185,0 days 00:00:10.378805,relu,0.11692599873811262,27,0.04941586576900946,2,True,standard,0.00010508291551853957,COMPLETE
318,141.0475616455078,2026-01-03 19:27:35.362700,2026-01-03 19:27:45.818219,0 days 00:00:10.455519,relu,0.10545109091674396,30,0.08535546818145238,2,True,standard,0.0001325287380184397,COMPLETE
319,149.37496948242188,2026-01-03 19:27:45.825224,2026-01-03 19:27:56.844383,0 days 00:00:11.019159,relu,0.10086275815798454,29,0.07722404402898933,2,True,standard,0.00013371207709466314,COMPLETE
320,143.54315185546875,2026-01-03 19:27:56.853409,2026-01-03 19:28:06.883735,0 days 00:00:10.030326,relu,0.10015657480200275,28,0.08681153036429642,2,True,standard,0.00011240420307725941,COMPLETE
321,193.95761108398438,2026-01-03 19:28:06.893254,2026-01-03 19:28:16.557427,0 days 00:00:09.664173,relu,0.10843682499563856,31,0.001317093331033079,2,True,standard,0.0001582323923838148,COMPLETE
322,143.29202270507812,2026-01-03 19:28:16.569944,2026-01-03 19:28:26.227342,0 days 00:00:09.657398,relu,0.11111119299906543,29,0.06768503359817137,2,True,standard,0.00013022928308993028,COMPLETE
323,142.1918487548828,2026-01-03 19:28:26.239863,2026-01-03 19:28:36.362912,0 days 00:00:10.123049,relu,0.1159580585654302,30,0.08796831749681094,2,True,standard,9.184129230186455e-05,COMPLETE
324,163.31455993652344,2026-01-03 19:28:36.374433,2026-01-03 19:28:48.923991,0 days 00:00:12.549558,mish,0.1182380528343986,28,0.07706014085338925,2,True,standard,7.36292760895453e-05,COMPLETE
325,147.35189819335938,2026-01-03 19:28:48.934509,2026-01-03 19:28:59.437245,0 days 00:00:10.502736,relu,0.10789266891119328,27,0.05849513637012246,2,True,standard,8.496040761458741e-05,COMPLETE
326,173.95327758789062,2026-01-03 19:28:59.449280,2026-01-03 19:29:15.104153,0 days 00:00:15.654873,relu,0.11607249683315768,30,0.009091696437239578,2,True,standard,0.00010309991434751418,COMPLETE
327,141.2288360595703,2026-01-03 19:29:15.118193,2026-01-03 19:29:27.233890,0 days 00:00:12.115697,relu,0.1265775382057584,30,0.08509275449960559,2,True,standard,9.554434215617281e-05,COMPLETE
328,166.31980895996094,2026-01-03 19:29:27.247004,2026-01-03 19:29:38.051604,0 days 00:00:10.804600,silu,0.12681981965058253,29,0.0878670940627141,2,True,standard,8.881531175161588e-05,COMPLETE
329,146.06503295898438,2026-01-03 19:29:38.062627,2026-01-03 19:29:48.429953,0 days 00:00:10.367326,relu,0.1275411807402307,30,0.07838675434737696,2,True,standard,0.00017966725041158787,COMPLETE
330,273.90228271484375,2026-01-03 19:29:48.439535,2026-01-03 19:29:58.800499,0 days 00:00:10.360964,relu,0.12226384856923722,28,0.000316922150426254,2,True,minmax,0.00015162600462983978,COMPLETE
331,153.09857177734375,2026-01-03 19:29:58.813610,2026-01-03 19:30:08.967819,0 days 00:00:10.154209,relu,0.23559195142057548,30,0.08817546850386945,2,True,standard,0.00012182798342825947,COMPLETE
332,147.66921997070312,2026-01-03 19:30:08.979336,2026-01-03 19:30:19.386260,0 days 00:00:10.406924,relu,0.11740494768622504,27,0.07424595459966984,2,True,standard,0.00022024139791479666,COMPLETE
333,198.47326741536457,2026-01-03 19:30:19.399359,2026-01-03 19:30:31.106207,0 days 00:00:11.706848,relu,0.1280856015737755,29,0.000994156491543384,2,False,standard,0.00017851151207625755,COMPLETE
334,139.78541564941406,2026-01-03 19:30:31.122731,2026-01-03 19:30:42.588711,0 days 00:00:11.465980,relu,0.11522073960125546,31,0.08779716735846423,2,True,standard,9.899768640140142e-05,COMPLETE
