number,value,datetime_start,datetime_complete,duration,params_activation,params_dropout,params_hidden_size,params_lr,params_n_layers,params_scale_target,params_scaler,params_weight_decay,state
335,144.7105255126953,2026-01-03 03:35:45.399614,2026-01-03 03:36:12.128331,0 days 00:00:26.728717,relu,0.11322147530924156,29,0.06836077675403461,2,True,standard,0.0001652413362462078,COMPLETE
336,163.8791046142578,2026-01-03 03:36:12.138335,2026-01-03 03:36:38.950012,0 days 00:00:26.811677,silu,0.10827454956796874,28,0.08726311523587768,2,True,standard,0.00014934817774420729,COMPLETE
337,176.72427368164062,2026-01-03 03:36:38.958012,2026-01-03 03:37:05.722695,0 days 00:00:26.764683,relu,0.12581918625449826,30,0.00536992251262472,2,True,standard,0.00020061905025335784,COMPLETE
338,168.8675079345703,2026-01-03 03:37:05.730694,2026-01-03 03:37:32.537404,0 days 00:00:26.806710,relu,0.34846361637138556,30,0.08579652056918281,2,True,standard,7.517977797126166e-05,COMPLETE
339,153.87515258789062,2026-01-03 03:37:32.545407,2026-01-03 03:37:59.049596,0 days 00:00:26.504189,relu,0.10014386519671187,26,0.07140933583081129,2,True,robust,1.0909865582189688e-05,COMPLETE
340,145.78689575195312,2026-01-03 03:37:59.056596,2026-01-03 03:38:25.704334,0 days 00:00:26.647738,relu,0.11736817461572019,28,0.07900209669583991,2,True,standard,0.00016918248582785164,COMPLETE
341,198.12950134277344,2026-01-03 03:38:25.712334,2026-01-03 03:38:52.582040,0 days 00:00:26.869706,relu,0.4144457296924435,31,0.00263632678838443,2,True,standard,0.0002193950918474674,COMPLETE
342,149.42332458496094,2026-01-03 03:38:52.590044,2026-01-03 03:39:19.324251,0 days 00:00:26.734207,relu,0.1080505481604986,29,0.08752922559734294,2,True,standard,0.0001402772747589418,COMPLETE
343,172.16476440429688,2026-01-03 03:39:19.332251,2026-01-03 03:39:43.348435,0 days 00:00:24.016184,relu,0.12112958920188514,30,0.0999126933566723,1,True,minmax,6.500066887726893e-05,COMPLETE
344,147.23068237304688,2026-01-03 03:39:43.356436,2026-01-03 03:40:10.028628,0 days 00:00:26.672192,relu,0.10020810029333067,27,0.06943622048837012,2,True,standard,0.00016126150115075327,COMPLETE
345,143.64358520507812,2026-01-03 03:40:10.036627,2026-01-03 03:40:36.851318,0 days 00:00:26.814691,relu,0.11337211750412939,31,0.057594426609439,2,True,standard,0.0001216441422771392,COMPLETE
346,144.6957244873047,2026-01-03 03:40:36.860320,2026-01-03 03:41:03.443029,0 days 00:00:26.582709,relu,0.13888772715924802,28,0.07858144117499137,2,True,standard,0.00019349957290346615,COMPLETE
347,151.1747589111328,2026-01-03 03:41:03.450032,2026-01-03 03:41:30.911210,0 days 00:00:27.461178,mish,0.1307479914756169,29,0.0882657789994498,2,True,standard,8.903351363816813e-05,COMPLETE
348,148.5663299560547,2026-01-03 03:41:30.919207,2026-01-03 03:41:57.478929,0 days 00:00:26.559722,relu,0.10801547809865952,26,0.06912168119829629,2,True,standard,0.00010289217643578488,COMPLETE
349,142.7686309814453,2026-01-03 03:41:57.486929,2026-01-03 03:42:24.374617,0 days 00:00:26.887688,relu,0.11728065038941132,31,0.08705983280833289,2,True,standard,2.3238481796306742e-05,COMPLETE
350,144.01205444335938,2026-01-03 03:42:24.383620,2026-01-03 03:42:51.035824,0 days 00:00:26.652204,relu,0.10877039826537079,28,0.07918777940709287,2,True,standard,0.0001416911842883061,COMPLETE
351,198.15018507215711,2026-01-03 03:42:51.044827,2026-01-03 03:43:17.039556,0 days 00:00:25.994729,relu,0.12474116211499574,30,0.000994170223541526,2,False,standard,7.444303883487422e-05,COMPLETE
352,149.9172821044922,2026-01-03 03:43:17.048555,2026-01-03 03:43:43.865261,0 days 00:00:26.816706,relu,0.10758124650632957,32,0.0636622161093549,2,True,standard,0.00017989025741557994,COMPLETE
353,146.62062072753906,2026-01-03 03:43:43.874260,2026-01-03 03:44:10.691439,0 days 00:00:26.817179,relu,0.115698744703784,27,0.05346445512087336,2,True,standard,1.9852618450583818e-05,COMPLETE
354,142.40087890625,2026-01-03 03:44:10.699440,2026-01-03 03:44:37.239160,0 days 00:00:26.539720,relu,0.10011505444564321,30,0.09927871057855124,2,True,standard,0.00012184201649111617,COMPLETE
355,142.30918884277344,2026-01-03 03:44:37.247160,2026-01-03 03:45:03.886339,0 days 00:00:26.639179,relu,0.12849759159399582,29,0.07678243382589693,2,True,standard,0.0001417543025030971,COMPLETE
356,142.3472900390625,2026-01-03 03:45:03.894339,2026-01-03 03:45:30.519536,0 days 00:00:26.625197,relu,0.11360524902176848,31,0.08817738994987281,2,True,standard,0.00022194639309918208,COMPLETE
357,152.97447204589844,2026-01-03 03:45:30.528536,2026-01-03 03:45:57.467244,0 days 00:00:26.938708,silu,0.12245935051650544,29,0.09989604025115961,2,True,standard,2.7844243782184292e-05,COMPLETE
358,144.42364501953125,2026-01-03 03:45:57.475761,2026-01-03 03:46:24.286427,0 days 00:00:26.810666,relu,0.10768946430614774,27,0.0668360420232056,2,True,standard,0.00010539318082923239,COMPLETE
359,172.78466796875,2026-01-03 03:46:24.295428,2026-01-03 03:46:50.891107,0 days 00:00:26.595679,relu,0.10609722745109099,26,0.07948521355010284,2,True,none,8.788282952595346e-05,COMPLETE
360,155.67916870117188,2026-01-03 03:46:50.901110,2026-01-03 03:47:17.475840,0 days 00:00:26.574730,relu,0.27590374940229423,32,0.08813417606671209,2,True,standard,0.00017117879232719817,COMPLETE
361,140.61892700195312,2026-01-03 03:47:17.483840,2026-01-03 03:47:43.988539,0 days 00:00:26.504699,relu,0.11658260633792393,28,0.07184268868491929,2,True,standard,0.00013345265516585735,COMPLETE
362,186.17318725585938,2026-01-03 03:47:43.996539,2026-01-03 03:48:10.031016,0 days 00:00:26.034477,relu,0.13675119331887342,7,0.07214919320326163,2,True,robust,1.1868389029117082e-06,COMPLETE
363,163.96017456054688,2026-01-03 03:48:10.041017,2026-01-03 03:48:36.720701,0 days 00:00:26.679684,relu,0.3058479925914741,28,0.08810073297066122,2,True,standard,0.00011609193605521863,COMPLETE
364,142.0175323486328,2026-01-03 03:48:36.730700,2026-01-03 03:49:03.482392,0 days 00:00:26.751692,relu,0.12019663940509145,30,0.0771840839477415,2,True,standard,0.00012594192511189046,COMPLETE
365,144.9137725830078,2026-01-03 03:49:03.490391,2026-01-03 03:49:30.367557,0 days 00:00:26.877166,relu,0.12957777096332687,31,0.08871437908562588,2,True,standard,9.409155989367319e-05,COMPLETE
366,143.16970825195312,2026-01-03 03:49:30.376557,2026-01-03 03:49:57.027294,0 days 00:00:26.650737,relu,0.1170783291479065,28,0.0719780282380876,2,True,standard,0.00013746396275506872,COMPLETE
367,196.84286499023438,2026-01-03 03:49:57.035293,2026-01-03 03:50:23.727998,0 days 00:00:26.692705,relu,0.10036855137948338,25,0.017973601119736195,2,True,minmax,0.0001076196101060317,COMPLETE
368,145.34579467773438,2026-01-03 03:50:23.736000,2026-01-03 03:50:50.526186,0 days 00:00:26.790186,relu,0.1130299901048311,30,0.057474828901201626,2,True,standard,6.758446303778862e-05,COMPLETE
369,140.60150146484375,2026-01-03 03:50:50.534186,2026-01-03 03:51:17.276868,0 days 00:00:26.742682,relu,0.12183397386210665,32,0.09997999061298715,2,True,standard,8.041761477429405e-05,COMPLETE
370,198.00585469563802,2026-01-03 03:51:17.284868,2026-01-03 03:51:43.168051,0 days 00:00:25.883183,relu,0.1424434909903616,32,0.0009944272548583614,2,False,standard,8.220054134888864e-05,COMPLETE
371,144.89454650878906,2026-01-03 03:51:43.175053,2026-01-03 03:52:10.800267,0 days 00:00:27.625214,mish,0.13332588925186153,32,0.0993423679580305,2,True,standard,5.512778241593136e-05,COMPLETE
372,178.53640747070312,2026-01-03 03:52:10.809266,2026-01-03 03:52:37.500956,0 days 00:00:26.691690,relu,0.48782289066483836,31,0.08737663014324887,2,True,standard,7.415353456642768e-05,COMPLETE
373,142.34828186035156,2026-01-03 03:52:37.508960,2026-01-03 03:53:04.126662,0 days 00:00:26.617702,relu,0.12620661688938326,27,0.08919139772131507,2,True,standard,9.737180257319165e-05,COMPLETE
374,142.96463012695312,2026-01-03 03:53:04.134663,2026-01-03 03:53:30.780849,0 days 00:00:26.646186,relu,0.12264309223980181,29,0.09823998412767518,2,True,standard,8.062462943644983e-05,COMPLETE
375,142.9769287109375,2026-01-03 03:53:30.788849,2026-01-03 03:53:57.518570,0 days 00:00:26.729721,relu,0.11846127202264936,28,0.09950124702632603,2,True,standard,0.00011157508013840373,COMPLETE
376,173.13363647460938,2026-01-03 03:53:57.526571,2026-01-03 03:54:24.158287,0 days 00:00:26.631716,relu,0.3719180334765045,31,0.07959390422849368,2,True,standard,1.3654376950806803e-05,COMPLETE
377,144.08657836914062,2026-01-03 03:54:24.205283,2026-01-03 03:54:50.890475,0 days 00:00:26.685192,relu,0.12924961319348524,26,0.0800680915135031,2,True,standard,9.135135730843731e-05,COMPLETE
378,189.9493865966797,2026-01-03 03:54:50.899476,2026-01-03 03:55:17.642186,0 days 00:00:26.742710,relu,0.11433405214655366,30,0.001324585300195019,2,True,standard,6.007347192929278e-05,COMPLETE
379,141.99664306640625,2026-01-03 03:55:17.651189,2026-01-03 03:55:44.272871,0 days 00:00:26.621682,relu,0.1239531872514725,32,0.08738782026386299,2,True,standard,1.6552061572502207e-05,COMPLETE
380,143.53271484375,2026-01-03 03:55:44.280871,2026-01-03 03:56:10.939044,0 days 00:00:26.658173,relu,0.11351843152295352,29,0.07811336227099583,2,True,standard,6.679319291545096e-05,COMPLETE
381,148.23098754882812,2026-01-03 03:56:10.948043,2026-01-03 03:56:34.981724,0 days 00:00:24.033681,relu,0.10774822022547942,30,0.09927416981550946,1,True,standard,2.0600313088219747e-05,COMPLETE
382,163.14524841308594,2026-01-03 03:56:34.988724,2026-01-03 03:57:01.741458,0 days 00:00:26.752734,silu,0.13725495124894974,28,0.06817752098036793,2,True,standard,8.026599474601754e-05,COMPLETE
383,138.29159545898438,2026-01-03 03:57:01.750460,2026-01-03 03:57:28.370628,0 days 00:00:26.620168,relu,0.11920494831902574,32,0.08759404592571997,2,True,standard,0.00010159117779170854,COMPLETE
384,172.81497192382812,2026-01-03 03:57:28.378628,2026-01-03 03:57:55.151308,0 days 00:00:26.772680,relu,0.13116863010860952,32,0.08917170296630389,2,True,none,9.575640194125511e-05,COMPLETE
385,142.96510314941406,2026-01-03 03:57:55.159308,2026-01-03 03:58:21.893031,0 days 00:00:26.733723,relu,0.12202584238492067,29,0.08877697624271653,2,True,standard,0.00010563365510622038,COMPLETE
386,143.09388732910156,2026-01-03 03:58:21.900031,2026-01-03 03:58:48.581234,0 days 00:00:26.681203,relu,0.145527276842247,32,0.06441270710703212,2,True,standard,8.507187692393042e-05,COMPLETE
387,140.7230987548828,2026-01-03 03:58:48.589235,2026-01-03 03:59:15.194927,0 days 00:00:26.605692,relu,0.1187069898490883,27,0.09873211455817715,2,True,standard,0.0001167465277094229,COMPLETE
388,146.89730834960938,2026-01-03 03:59:15.202927,2026-01-03 03:59:41.731114,0 days 00:00:26.528187,relu,0.11824990601507362,26,0.09995071061781731,2,True,robust,0.0001286315003764412,COMPLETE
389,196.68130493164062,2026-01-03 03:59:41.739117,2026-01-03 04:00:08.363301,0 days 00:00:26.624184,relu,0.11579042311414522,24,0.0006409740964821759,2,True,standard,0.00011061068169469309,COMPLETE
390,141.1422576904297,2026-01-03 04:00:08.371298,2026-01-03 04:00:34.920993,0 days 00:00:26.549695,relu,0.12520060827823415,28,0.09999197541144354,2,True,standard,0.0001294407099036239,COMPLETE
391,198.1576616075304,2026-01-03 04:00:34.929993,2026-01-03 04:01:00.782185,0 days 00:00:25.852192,relu,0.11003844435245269,27,0.0009946569188659044,2,False,standard,9.992428071845075e-05,COMPLETE
392,172.7356719970703,2026-01-03 04:01:00.791185,2026-01-03 04:01:27.471376,0 days 00:00:26.680191,relu,0.11431090776113499,26,0.07639643705470704,2,True,minmax,0.00010995111065456509,COMPLETE
393,141.17703247070312,2026-01-03 04:01:27.480378,2026-01-03 04:01:54.024070,0 days 00:00:26.543692,relu,0.10774934602304911,27,0.08657998837214921,2,True,standard,0.00012626097280217876,COMPLETE
394,144.0168914794922,2026-01-03 04:01:54.032070,2026-01-03 04:02:20.633291,0 days 00:00:26.601221,relu,0.1223482701035437,28,0.07569478362135985,2,True,standard,2.4182023521055336e-05,COMPLETE
395,150.32615661621094,2026-01-03 04:02:20.642293,2026-01-03 04:02:48.032003,0 days 00:00:27.389710,mish,0.11359710440531245,27,0.09982837952187347,2,True,standard,0.00011877844965283953,COMPLETE
396,145.6965789794922,2026-01-03 04:02:48.040003,2026-01-03 04:03:14.745703,0 days 00:00:26.705700,relu,0.10007322808065487,29,0.08548289714659459,2,True,standard,9.451390361411448e-05,COMPLETE
397,163.39105224609375,2026-01-03 04:03:14.753703,2026-01-03 04:03:41.027886,0 days 00:00:26.274183,relu,0.1302206499102411,14,0.06716232303054874,2,True,standard,3.2998054413454135e-05,COMPLETE
398,147.9536895751953,2026-01-03 04:03:41.035886,2026-01-03 04:04:07.532614,0 days 00:00:26.496728,relu,0.12045766863670214,25,0.07957704974690359,2,True,standard,0.0001417186333845192,COMPLETE
399,171.31326293945312,2026-01-03 04:04:07.540619,2026-01-03 04:04:34.195797,0 days 00:00:26.655178,relu,0.10741484448299393,30,0.0087947230390536,2,True,standard,0.00011789430071270694,COMPLETE
400,145.58680725097656,2026-01-03 04:04:34.204795,2026-01-03 04:05:00.835997,0 days 00:00:26.631202,relu,0.1521072297511923,28,0.0887001516463504,2,True,standard,0.00015143790893198795,COMPLETE
401,146.13632202148438,2026-01-03 04:05:00.843997,2026-01-03 04:05:27.572692,0 days 00:00:26.728695,relu,0.10792972990017656,30,0.061926057816942076,2,True,standard,9.757757744097946e-05,COMPLETE
402,172.49429321289062,2026-01-03 04:05:27.580692,2026-01-03 04:05:53.736435,0 days 00:00:26.155743,relu,0.11853941910389543,9,0.05026831101841126,2,True,standard,8.599304399696653e-05,COMPLETE
403,138.3571014404297,2026-01-03 04:05:53.744435,2026-01-03 04:06:20.494638,0 days 00:00:26.750203,relu,0.10021785604235242,29,0.09993191397828555,2,True,standard,1.1441079473998576e-05,COMPLETE
404,140.56802368164062,2026-01-03 04:06:20.503636,2026-01-03 04:06:47.197814,0 days 00:00:26.694178,relu,0.10006169534113009,29,0.09959123912594331,2,True,standard,8.429559066887504e-06,COMPLETE
405,142.22470092773438,2026-01-03 04:06:47.205814,2026-01-03 04:07:13.916543,0 days 00:00:26.710729,relu,0.1000830278822242,29,0.0996744689690485,2,True,standard,7.576411482707304e-06,COMPLETE
406,169.5513153076172,2026-01-03 04:07:13.924543,2026-01-03 04:07:40.107728,0 days 00:00:26.183185,silu,0.10713292411147116,12,0.0890826290957762,2,True,standard,9.496533018752283e-06,COMPLETE
407,144.5303192138672,2026-01-03 04:07:40.116731,2026-01-03 04:08:06.754412,0 days 00:00:26.637681,relu,0.10080797557844731,25,0.09987050632810884,2,True,standard,1.5260990822050064e-05,COMPLETE
408,145.4764404296875,2026-01-03 04:08:06.762412,2026-01-03 04:08:33.386643,0 days 00:00:26.624231,relu,0.11188825423240863,27,0.07241969727392253,2,True,standard,5.425931781727882e-06,COMPLETE
409,144.18350219726562,2026-01-03 04:08:33.394643,2026-01-03 04:09:00.178826,0 days 00:00:26.784183,relu,0.10801110441976383,29,0.07912973591574395,2,True,standard,6.909482565207735e-06,COMPLETE
410,199.16627678765192,2026-01-03 04:09:00.187827,2026-01-03 04:09:26.221524,0 days 00:00:26.033697,relu,0.253563457869732,30,0.0009945899529273234,2,False,standard,1.1000320471578031e-05,COMPLETE
411,172.2958984375,2026-01-03 04:09:26.229524,2026-01-03 04:09:52.861206,0 days 00:00:26.631682,relu,0.11376833199934976,26,0.08694093165212988,2,True,none,6.8696083950315786e-06,COMPLETE
412,165.8950653076172,2026-01-03 04:09:52.870208,2026-01-03 04:10:18.772870,0 days 00:00:25.902662,relu,0.10815493543243683,10,0.09897837797967354,2,True,standard,1.3856335765034558e-05,COMPLETE
413,151.36874389648438,2026-01-03 04:10:18.780870,2026-01-03 04:10:45.372567,0 days 00:00:26.591697,relu,0.10083301433503916,28,0.07267707105960915,2,True,robust,1.2596596365679463e-05,COMPLETE
414,196.966064453125,2026-01-03 04:10:45.380567,2026-01-03 04:11:12.228282,0 days 00:00:26.847715,relu,0.1164305061270668,31,0.00024178599946692917,2,True,standard,8.697977494512218e-06,COMPLETE
415,153.01925659179688,2026-01-03 04:11:12.236281,2026-01-03 04:11:38.831470,0 days 00:00:26.595189,relu,0.18898399156999124,27,0.0995045116253224,2,True,standard,9.632853002348653e-06,COMPLETE
416,140.27993774414062,2026-01-03 04:11:38.840471,2026-01-03 04:12:05.566645,0 days 00:00:26.726174,relu,0.10714864384116697,29,0.08056168519405679,2,True,standard,1.8746605217061467e-05,COMPLETE
417,143.39968872070312,2026-01-03 04:12:05.574645,2026-01-03 04:12:32.498352,0 days 00:00:26.923707,relu,0.10087988708957717,30,0.08233288393290572,2,True,standard,7.963317172733388e-06,COMPLETE
418,171.35208129882812,2026-01-03 04:12:32.507352,2026-01-03 04:12:59.201550,0 days 00:00:26.694198,relu,0.10019866383036591,32,0.08607817675641573,2,True,minmax,1.5755619764350606e-05,COMPLETE
419,143.32302856445312,2026-01-03 04:12:59.210550,2026-01-03 04:13:25.993278,0 days 00:00:26.782728,relu,0.10821286964819868,29,0.07755059358993323,2,True,standard,3.027926151104862e-06,COMPLETE
420,140.69349670410156,2026-01-03 04:13:26.003280,2026-01-03 04:13:52.807001,0 days 00:00:26.803721,relu,0.10004427532056477,28,0.0999802674277529,2,True,standard,1.7245296785764914e-05,COMPLETE
421,152.5552520751953,2026-01-03 04:13:52.814999,2026-01-03 04:14:20.563190,0 days 00:00:27.748191,mish,0.10046047597486565,30,0.08795696497105158,2,True,standard,1.7322610522119802e-05,COMPLETE
422,171.86080932617188,2026-01-03 04:14:20.571190,2026-01-03 04:14:46.858375,0 days 00:00:26.287185,relu,0.28892148126231776,20,0.07741188774371366,2,True,standard,1.2800095122231043e-05,COMPLETE
423,154.36239624023438,2026-01-03 04:14:46.866373,2026-01-03 04:15:11.036047,0 days 00:00:24.169674,relu,0.1081491665589688,31,0.06331585872988044,1,True,standard,6.078867397649353e-06,COMPLETE
424,141.1497039794922,2026-01-03 04:15:11.046049,2026-01-03 04:15:37.689776,0 days 00:00:26.643727,relu,0.1083988398752878,28,0.08891085056787246,2,True,standard,1.895943662795754e-05,COMPLETE
425,145.93099975585938,2026-01-03 04:15:37.698778,2026-01-03 04:16:04.536501,0 days 00:00:26.837723,relu,0.1771368822631622,32,0.07139693171595726,2,True,standard,1.1167166220260488e-05,COMPLETE
426,142.6247100830078,2026-01-03 04:16:04.544504,2026-01-03 04:16:31.343234,0 days 00:00:26.798730,relu,0.11248050080318488,29,0.08804874322166617,2,True,standard,1.1461494175796622e-05,COMPLETE
427,141.2318878173828,2026-01-03 04:16:31.351232,2026-01-03 04:16:58.161892,0 days 00:00:26.810660,relu,0.10721251313973935,30,0.0997074020957328,2,True,standard,1.8254672775699986e-05,COMPLETE
428,141.1908416748047,2026-01-03 04:16:58.170895,2026-01-03 04:17:24.635574,0 days 00:00:26.464679,relu,0.11388457597554125,28,0.09994425254552922,2,True,standard,1.6770533530523306e-05,COMPLETE
429,143.65069580078125,2026-01-03 04:17:24.643572,2026-01-03 04:17:51.444286,0 days 00:00:26.800714,relu,0.10671883948685781,31,0.07485558234751806,2,True,standard,2.085971266423958e-05,COMPLETE
430,198.62243455674917,2026-01-03 04:17:51.454289,2026-01-03 04:18:17.157980,0 days 00:00:25.703691,relu,0.12223418579600745,24,0.0009945894578149168,2,False,standard,9.292767633728785e-06,COMPLETE
431,169.36544799804688,2026-01-03 04:18:17.165980,2026-01-03 04:18:43.940690,0 days 00:00:26.774710,silu,0.10646733731638519,26,0.05592559414967522,2,True,standard,1.5400697739585024e-05,COMPLETE
432,144.43856811523438,2026-01-03 04:18:43.948690,2026-01-03 04:19:10.684865,0 days 00:00:26.736175,relu,0.10038019053731329,29,0.08453754856470737,2,True,standard,2.5710216696750648e-05,COMPLETE
433,148.52711486816406,2026-01-03 04:19:10.693867,2026-01-03 04:19:37.465045,0 days 00:00:26.771178,relu,0.10044080493325794,32,0.0643464947352699,2,True,standard,0.00021151130503584652,COMPLETE
434,140.48606872558594,2026-01-03 04:19:37.473048,2026-01-03 04:20:04.314738,0 days 00:00:26.841690,relu,0.10016277403779361,30,0.08016913566470682,2,True,standard,1.0110071805373769e-05,COMPLETE
435,170.3557586669922,2026-01-03 04:20:04.322738,2026-01-03 04:20:31.064898,0 days 00:00:26.742160,relu,0.10034042694747569,28,0.0689706325574105,2,True,none,8.28559854821568e-06,COMPLETE
436,141.88681030273438,2026-01-03 04:20:31.073905,2026-01-03 04:20:57.931588,0 days 00:00:26.857683,relu,0.11318002263292569,30,0.07921951908383452,2,True,standard,9.46518222331803e-06,COMPLETE
437,143.81381225585938,2026-01-03 04:20:57.939589,2026-01-03 04:21:24.784287,0 days 00:00:26.844698,relu,0.10023410152633647,29,0.061025398540447126,2,True,standard,1.1033937680790687e-05,COMPLETE
438,142.4020538330078,2026-01-03 04:21:24.793290,2026-01-03 04:21:51.425479,0 days 00:00:26.632189,relu,0.10844330895677706,27,0.07927554045516488,2,True,standard,1.0404479811292034e-05,COMPLETE
439,149.9769744873047,2026-01-03 04:21:51.434480,2026-01-03 04:22:18.104655,0 days 00:00:26.670175,relu,0.11171085783379908,29,0.07091752193311691,2,True,robust,1.3261870871465828e-05,COMPLETE
440,201.00332641601562,2026-01-03 04:22:18.112659,2026-01-03 04:22:44.214342,0 days 00:00:26.101683,relu,0.1066575685123908,5,0.004695320450793003,2,True,standard,8.668082621668058e-06,COMPLETE
441,138.17880249023438,2026-01-03 04:22:44.222341,2026-01-03 04:23:10.923015,0 days 00:00:26.700674,relu,0.10027722537815363,31,0.08699393859612603,2,True,standard,7.968659688367374e-06,COMPLETE
442,164.44290161132812,2026-01-03 04:23:10.932019,2026-01-03 04:23:37.216226,0 days 00:00:26.284207,relu,0.11708798349313115,13,0.06000380107729976,2,True,standard,7.560601349013044e-06,COMPLETE
443,161.3136444091797,2026-01-03 04:23:37.224226,2026-01-03 04:24:04.833926,0 days 00:00:27.609700,mish,0.1134992300102344,32,0.04782784377282054,2,True,standard,7.790295776859041e-06,COMPLETE
444,141.43382263183594,2026-01-03 04:24:04.842928,2026-01-03 04:24:31.533626,0 days 00:00:26.690698,relu,0.10706740880211615,31,0.07897545715758814,2,True,standard,1.0243767309177945e-05,COMPLETE
445,172.6730194091797,2026-01-03 04:24:31.541625,2026-01-03 04:24:58.351313,0 days 00:00:26.809688,relu,0.10015589040835207,30,0.07005507036841166,2,True,minmax,6.7220090174155605e-06,COMPLETE
446,140.41831970214844,2026-01-03 04:24:58.360313,2026-01-03 04:25:25.158031,0 days 00:00:26.797718,relu,0.12569535951449534,31,0.08622291610800543,2,True,standard,5.659118490860037e-06,COMPLETE
