number,value,datetime_start,datetime_complete,duration,params_activation,params_dropout,params_hidden_size,params_lr,params_n_layers,params_scale_target,params_scaler,params_weight_decay,state
223,142.77685546875,2026-01-03 02:45:53.918697,2026-01-03 02:46:20.584393,0 days 00:00:26.665696,relu,0.10001172272662949,28,0.08639240052559431,2,True,standard,0.00013996561011608212,COMPLETE
224,144.46572875976562,2026-01-03 02:46:20.592395,2026-01-03 02:46:47.084081,0 days 00:00:26.491686,relu,0.10751534203579229,30,0.07275873262320666,2,True,standard,0.00016326458271784366,COMPLETE
225,140.4385528564453,2026-01-03 02:46:47.093081,2026-01-03 02:47:13.938287,0 days 00:00:26.845206,relu,0.12033026459874929,31,0.09820519231731291,2,True,standard,0.00011944582019396885,COMPLETE
226,140.71109008789062,2026-01-03 02:47:13.946287,2026-01-03 02:47:40.678504,0 days 00:00:26.732217,relu,0.1206645086396314,31,0.09947002284196382,2,True,standard,0.00011129480775012884,COMPLETE
227,141.36351013183594,2026-01-03 02:47:40.686505,2026-01-03 02:48:07.313193,0 days 00:00:26.626688,relu,0.12181787502365028,31,0.09255190562865938,2,True,standard,0.00011039147530373677,COMPLETE
228,141.690673828125,2026-01-03 02:48:07.322194,2026-01-03 02:48:34.111408,0 days 00:00:26.789214,relu,0.13077063331754593,31,0.09566275941619107,2,True,standard,8.480264482572856e-05,COMPLETE
229,148.46002197265625,2026-01-03 02:48:34.119408,2026-01-03 02:49:00.750570,0 days 00:00:26.631162,relu,0.13363543537950207,31,0.09902886687566112,2,True,robust,6.585580753206314e-05,COMPLETE
230,142.1401824951172,2026-01-03 02:49:00.758568,2026-01-03 02:49:27.547273,0 days 00:00:26.788705,relu,0.12662585267928397,31,0.08694552841309675,2,True,standard,8.633366266034809e-05,COMPLETE
231,140.88400268554688,2026-01-03 02:49:27.555276,2026-01-03 02:49:54.290532,0 days 00:00:26.735256,relu,0.12361382336716534,31,0.0854808036468997,2,True,standard,7.941620294922765e-05,COMPLETE
232,141.05686950683594,2026-01-03 02:49:54.299532,2026-01-03 02:50:20.918701,0 days 00:00:26.619169,relu,0.1336157797439887,31,0.08713732760626797,2,True,standard,7.608039556298157e-05,COMPLETE
233,141.9072723388672,2026-01-03 02:50:20.927701,2026-01-03 02:50:47.548400,0 days 00:00:26.620699,relu,0.13536627211040425,31,0.09783245110860915,2,True,standard,7.431886872940428e-05,COMPLETE
234,141.7330780029297,2026-01-03 02:50:47.556400,2026-01-03 02:51:14.249598,0 days 00:00:26.693198,relu,0.13464293527368262,32,0.08127632918306243,2,True,standard,4.9202348629210916e-05,COMPLETE
235,143.25491333007812,2026-01-03 02:51:14.257598,2026-01-03 02:51:40.784815,0 days 00:00:26.527217,relu,0.1373774798180345,32,0.09956245953938025,2,True,standard,4.4447142896471284e-05,COMPLETE
236,141.4409637451172,2026-01-03 02:51:40.792814,2026-01-03 02:52:07.247509,0 days 00:00:26.454695,relu,0.13233135857310002,30,0.09934612795402784,2,True,standard,4.9343500415181865e-05,COMPLETE
237,189.2248077392578,2026-01-03 02:52:07.256508,2026-01-03 02:52:34.618720,0 days 00:00:27.362212,mish,0.1340423772645413,30,0.081736748704449,2,True,minmax,6.094714272667275e-05,COMPLETE
238,142.5941619873047,2026-01-03 02:52:34.626720,2026-01-03 02:53:01.214423,0 days 00:00:26.587703,relu,0.12410523268268908,32,0.0776496133942806,2,True,standard,5.3461795903797934e-05,COMPLETE
239,142.89114379882812,2026-01-03 02:53:01.222423,2026-01-03 02:53:27.732615,0 days 00:00:26.510192,relu,0.13113270404451802,30,0.09894881255686051,2,True,standard,8.340813175183705e-05,COMPLETE
240,142.78109741210938,2026-01-03 02:53:27.741119,2026-01-03 02:53:54.179836,0 days 00:00:26.438717,relu,0.12209049226948467,29,0.07735016436651099,2,True,standard,4.503425570367074e-05,COMPLETE
241,142.76901245117188,2026-01-03 02:53:54.186837,2026-01-03 02:54:20.731044,0 days 00:00:26.544207,relu,0.14082287043744068,31,0.09825146218172764,2,True,standard,7.639916580464436e-05,COMPLETE
242,142.7306671142578,2026-01-03 02:54:20.739044,2026-01-03 02:54:47.265748,0 days 00:00:26.526704,relu,0.1307097802526186,32,0.08645090974012845,2,True,standard,3.723941816069286e-05,COMPLETE
243,144.22677612304688,2026-01-03 02:54:47.275747,2026-01-03 02:55:13.875457,0 days 00:00:26.599710,relu,0.12087451464763763,30,0.09928231262097376,2,True,standard,7.111399394694348e-05,COMPLETE
244,143.21243286132812,2026-01-03 02:55:13.884458,2026-01-03 02:55:40.408143,0 days 00:00:26.523685,relu,0.13418566830499107,29,0.07214791729690143,2,True,standard,2.7078838648773742e-05,COMPLETE
245,142.19943237304688,2026-01-03 02:55:40.416144,2026-01-03 02:56:06.985844,0 days 00:00:26.569700,relu,0.1191912734559698,31,0.08526474495109601,2,True,standard,0.00010369437441740793,COMPLETE
246,143.93402099609375,2026-01-03 02:56:06.992847,2026-01-03 02:56:33.492534,0 days 00:00:26.499687,relu,0.13819831199213287,32,0.07956192349677423,2,True,standard,5.065966276862524e-05,COMPLETE
247,145.4138946533203,2026-01-03 02:56:33.500534,2026-01-03 02:56:59.988739,0 days 00:00:26.488205,relu,0.12644862811490595,30,0.07049518525491691,2,True,standard,0.00010745243935089165,COMPLETE
248,140.53363037109375,2026-01-03 02:56:59.997739,2026-01-03 02:57:26.573959,0 days 00:00:26.576220,relu,0.1156806250281165,29,0.08794223986712373,2,True,standard,8.123474008491703e-05,COMPLETE
249,144.34669494628906,2026-01-03 02:57:26.582957,2026-01-03 02:57:53.145642,0 days 00:00:26.562685,relu,0.12035285833531664,29,0.08518380398198959,2,True,standard,8.99841303695907e-05,COMPLETE
250,140.87159729003906,2026-01-03 02:57:53.152643,2026-01-03 02:58:19.687862,0 days 00:00:26.535219,relu,0.11570239082231568,29,0.06948347188674507,2,True,standard,2.2115216390629256e-05,COMPLETE
251,163.3886260986328,2026-01-03 02:58:19.695860,2026-01-03 02:58:46.364566,0 days 00:00:26.668706,relu,0.26585323172210396,29,0.06911225073842364,2,True,standard,2.035449892276848e-05,COMPLETE
252,142.50906372070312,2026-01-03 02:58:46.372569,2026-01-03 02:59:12.784262,0 days 00:00:26.411693,relu,0.11819792476811146,29,0.06707025205959827,2,True,standard,0.00011083939204231116,COMPLETE
253,154.6140899658203,2026-01-03 02:59:12.794265,2026-01-03 02:59:39.442988,0 days 00:00:26.648723,silu,0.1153171590423596,30,0.08762868562483188,2,True,standard,2.4095514807044246e-05,COMPLETE
254,197.41239766438804,2026-01-03 02:59:39.450989,2026-01-03 03:00:02.736649,0 days 00:00:23.285660,relu,0.12657080752567035,28,0.0009930757287020407,1,False,standard,4.038234534436512e-05,COMPLETE
255,139.68603515625,2026-01-03 03:00:02.744652,2026-01-03 03:00:29.409372,0 days 00:00:26.664720,relu,0.1155529521200805,32,0.07616425466781243,2,True,standard,1.634499978321529e-05,COMPLETE
256,171.72962951660156,2026-01-03 03:00:29.418375,2026-01-03 03:00:55.917089,0 days 00:00:26.498714,relu,0.11724556775107293,32,0.0078017128766764395,2,True,standard,1.4526956249678143e-05,COMPLETE
257,151.4025421142578,2026-01-03 03:00:55.925089,2026-01-03 03:01:22.630789,0 days 00:00:26.705700,relu,0.22750289168454196,30,0.07669314280664104,2,True,standard,1.5361221859726226e-05,COMPLETE
258,140.24925231933594,2026-01-03 03:01:22.638794,2026-01-03 03:01:49.238952,0 days 00:00:26.600158,relu,0.11449534145807125,28,0.0999467048654109,2,True,standard,6.723778092449208e-05,COMPLETE
259,174.37850952148438,2026-01-03 03:01:49.246955,2026-01-03 03:02:15.830206,0 days 00:00:26.583251,relu,0.11487896890898021,28,0.09993666962036231,2,True,none,1.9886902682375942e-05,COMPLETE
260,143.87765502929688,2026-01-03 03:02:15.839210,2026-01-03 03:02:42.308895,0 days 00:00:26.469685,relu,0.12475769488280146,29,0.08910817267092228,2,True,standard,6.531924619979296e-05,COMPLETE
261,142.69725036621094,2026-01-03 03:02:42.317895,2026-01-03 03:03:10.848607,0 days 00:00:28.530712,gelu,0.11471973793097864,28,0.09052251050845207,2,True,standard,1.2356648767915888e-05,COMPLETE
262,140.47134399414062,2026-01-03 03:03:10.856606,2026-01-03 03:03:37.338328,0 days 00:00:26.481722,relu,0.11402131003300146,30,0.0998936920054815,2,True,standard,8.217202908630011e-05,COMPLETE
263,155.6732940673828,2026-01-03 03:03:37.347330,2026-01-03 03:04:03.977022,0 days 00:00:26.629692,relu,0.11440065769796844,29,0.06515334219587832,2,True,robust,7.163153039300609e-05,COMPLETE
264,145.4807586669922,2026-01-03 03:04:03.985022,2026-01-03 03:04:30.572199,0 days 00:00:26.587177,relu,0.11380876779002125,30,0.07611840301949445,2,True,standard,9.516742531509805e-05,COMPLETE
265,147.8863983154297,2026-01-03 03:04:30.580200,2026-01-03 03:04:57.063393,0 days 00:00:26.483193,relu,0.12166719346440054,28,0.08654885543455378,2,True,standard,0.00011616456074084468,COMPLETE
266,147.2291717529297,2026-01-03 03:04:57.074393,2026-01-03 03:05:23.791070,0 days 00:00:26.716677,relu,0.11219004967675292,27,0.061983238870883056,2,True,standard,5.651913145268857e-05,COMPLETE
267,178.70913696289062,2026-01-03 03:05:23.801071,2026-01-03 03:05:49.791275,0 days 00:00:25.990204,relu,0.1236053004921315,17,0.07754599946147946,2,True,minmax,2.4331588117545665e-05,COMPLETE
268,181.16824340820312,2026-01-03 03:05:49.799277,2026-01-03 03:06:17.232953,0 days 00:00:27.433676,mish,0.11170601678275298,29,0.0038972561180890502,2,True,standard,8.022615752005345e-05,COMPLETE
269,141.7021026611328,2026-01-03 03:06:17.240953,2026-01-03 03:06:43.970667,0 days 00:00:26.729714,relu,0.10553097684670455,30,0.09793136428860993,2,True,standard,0.00010379961883098122,COMPLETE
270,142.26760864257812,2026-01-03 03:06:43.978671,2026-01-03 03:07:10.641371,0 days 00:00:26.662700,relu,0.12009278323515044,28,0.0851168582440152,2,True,standard,1.5833869361287006e-05,COMPLETE
271,199.17028150770398,2026-01-03 03:07:10.649372,2026-01-03 03:07:36.245565,0 days 00:00:25.596193,relu,0.10016403638090213,12,0.0009942241169566158,2,False,standard,3.2435877300303405e-05,COMPLETE
272,175.20021057128906,2026-01-03 03:07:36.252565,2026-01-03 03:08:02.192265,0 days 00:00:25.939700,relu,0.1123221993312086,8,0.09971547947428475,2,True,standard,6.710711764773372e-05,COMPLETE
273,143.74957275390625,2026-01-03 03:08:02.201266,2026-01-03 03:08:29.048010,0 days 00:00:26.846744,relu,0.10775620604363242,31,0.06885318646093669,2,True,standard,9.355125272098109e-05,COMPLETE
274,144.638671875,2026-01-03 03:08:29.057012,2026-01-03 03:08:55.713737,0 days 00:00:26.656725,relu,0.1254915040080459,29,0.07839772237902949,2,True,standard,0.00011813016828163131,COMPLETE
275,174.61544799804688,2026-01-03 03:08:55.723737,2026-01-03 03:09:22.348436,0 days 00:00:26.624699,relu,0.37387375740782924,27,0.08854633500654947,2,True,standard,0.00014517833089150412,COMPLETE
276,195.4462432861328,2026-01-03 03:09:22.356437,2026-01-03 03:09:49.084646,0 days 00:00:26.728209,relu,0.11893762121967094,30,0.0004476713728127356,2,True,standard,1.2466441819574892e-05,COMPLETE
277,162.9334259033203,2026-01-03 03:09:49.092641,2026-01-03 03:10:15.816336,0 days 00:00:26.723695,silu,0.11326943059186997,32,0.07151077968112811,2,True,standard,8.261927152755886e-05,COMPLETE
278,169.23133850097656,2026-01-03 03:10:15.825338,2026-01-03 03:10:42.531549,0 days 00:00:26.706211,relu,0.10687182771786484,30,0.012527634260870401,2,True,standard,0.00010550240796323239,COMPLETE
279,143.47409057617188,2026-01-03 03:10:42.540549,2026-01-03 03:11:09.001736,0 days 00:00:26.461187,relu,0.1282285209725976,26,0.09942560608945122,2,True,standard,0.0001314203503601024,COMPLETE
280,142.68280029296875,2026-01-03 03:11:09.008735,2026-01-03 03:11:35.512415,0 days 00:00:26.503680,relu,0.10713123862378574,29,0.06456280460789489,2,True,standard,9.581871015612047e-06,COMPLETE
281,141.5237274169922,2026-01-03 03:11:35.520415,2026-01-03 03:12:01.963108,0 days 00:00:26.442693,relu,0.1006783784367059,32,0.07906041991614232,2,True,standard,1.7897290319219147e-05,COMPLETE
282,140.34060668945312,2026-01-03 03:12:01.971108,2026-01-03 03:12:28.752308,0 days 00:00:26.781200,relu,0.10013018305914913,31,0.08209019006354032,2,True,standard,2.1401668987519932e-05,COMPLETE
283,169.518310546875,2026-01-03 03:12:28.761310,2026-01-03 03:12:55.476003,0 days 00:00:26.714693,relu,0.11792490681039428,31,0.08688976519273435,2,True,none,2.1041475637580463e-05,COMPLETE
284,140.66064453125,2026-01-03 03:12:55.485003,2026-01-03 03:13:22.058671,0 days 00:00:26.573668,relu,0.10003190330397414,30,0.08740231040700981,2,True,standard,1.7794305912751845e-05,COMPLETE
285,141.364990234375,2026-01-03 03:13:22.067673,2026-01-03 03:13:50.618924,0 days 00:00:28.551251,gelu,0.1020200585019015,30,0.09954396976343016,2,True,standard,1.80447883898216e-05,COMPLETE
286,213.61328125,2026-01-03 03:13:50.626926,2026-01-03 03:14:19.162388,0 days 00:00:28.535462,gelu,0.10013689507470722,27,0.00010107051048329288,2,True,standard,1.8104075666232508e-05,COMPLETE
287,178.0279083251953,2026-01-03 03:14:19.170388,2026-01-03 03:14:47.049106,0 days 00:00:27.878718,gelu,0.2172693776212165,9,0.09743189830729877,2,True,robust,2.759311241695888e-05,COMPLETE
288,153.34564208984375,2026-01-03 03:14:47.057108,2026-01-03 03:15:15.618335,0 days 00:00:28.561227,gelu,0.10112973472679634,28,0.08755073068003932,2,True,standard,2.219544331769166e-05,COMPLETE
289,144.3206787109375,2026-01-03 03:15:15.626335,2026-01-03 03:15:44.295567,0 days 00:00:28.669232,gelu,0.11533160413216612,30,0.09980393648283988,2,True,standard,2.4302577344696748e-05,COMPLETE
290,145.17837524414062,2026-01-03 03:15:44.303567,2026-01-03 03:16:12.841782,0 days 00:00:28.538215,gelu,0.10728411612923731,29,0.09959525227795883,2,True,standard,1.291735390014574e-05,COMPLETE
291,197.9077069769965,2026-01-03 03:16:12.849783,2026-01-03 03:16:40.818475,0 days 00:00:27.968692,gelu,0.12200689609959518,31,0.0009945060505523024,2,False,standard,1.7676361016266992e-05,COMPLETE
292,147.71548461914062,2026-01-03 03:16:40.826478,2026-01-03 03:17:08.374692,0 days 00:00:27.548214,mish,0.10082158437667246,29,0.08498568247692725,2,True,standard,1.708356772788297e-05,COMPLETE
293,173.34133911132812,2026-01-03 03:17:08.381692,2026-01-03 03:17:35.019408,0 days 00:00:26.637716,relu,0.11223911964523801,31,0.07690367550964972,2,True,minmax,1.5005454711504294e-05,COMPLETE
294,143.62460327148438,2026-01-03 03:17:35.026407,2026-01-03 03:18:01.584101,0 days 00:00:26.557694,relu,0.12786203175838606,28,0.0878318107199662,2,True,standard,2.2163623000120586e-05,COMPLETE
295,143.1580352783203,2026-01-03 03:18:01.593102,2026-01-03 03:18:28.180313,0 days 00:00:26.587211,relu,0.10028868925897602,27,0.07594217233235712,2,True,standard,9.303689917189813e-05,COMPLETE
296,185.8050079345703,2026-01-03 03:18:28.188313,2026-01-03 03:18:54.851015,0 days 00:00:26.662702,relu,0.11368087166563352,30,0.001664981554296268,2,True,standard,7.279193054149659e-05,COMPLETE
297,160.69528198242188,2026-01-03 03:18:54.859015,2026-01-03 03:19:21.470746,0 days 00:00:26.611731,relu,0.3272087205265485,32,0.09977634951338653,2,True,standard,2.2223018581271507e-06,COMPLETE
298,193.46852111816406,2026-01-03 03:19:21.479748,2026-01-03 03:19:47.534404,0 days 00:00:26.054656,relu,0.45088308216446366,15,0.08580737068097914,2,True,standard,6.0214357673112194e-05,COMPLETE
299,143.17616271972656,2026-01-03 03:19:47.542404,2026-01-03 03:20:14.173099,0 days 00:00:26.630695,relu,0.12066281773487124,29,0.07520674461422988,2,True,standard,1.9297921480164046e-05,COMPLETE
300,152.7652130126953,2026-01-03 03:20:14.181099,2026-01-03 03:20:40.792311,0 days 00:00:26.611212,relu,0.14609319555666944,26,0.08787122479372678,2,True,standard,4.933572040270017e-06,COMPLETE
301,142.1246337890625,2026-01-03 03:20:40.801314,2026-01-03 03:21:07.431031,0 days 00:00:26.629717,relu,0.1071071794479318,30,0.0719117122079947,2,True,standard,2.9610099644733324e-05,COMPLETE
302,160.710205078125,2026-01-03 03:21:07.438031,2026-01-03 03:21:34.189716,0 days 00:00:26.751685,silu,0.11427147920805557,31,0.08722027426112473,2,True,standard,0.00011143522384242351,COMPLETE
303,149.41693115234375,2026-01-03 03:21:34.197717,2026-01-03 03:21:58.201386,0 days 00:00:24.003669,relu,0.13057895384813953,28,0.09936777917074713,1,True,standard,8.424568636233108e-05,COMPLETE
304,142.29893493652344,2026-01-03 03:21:58.210387,2026-01-03 03:22:24.682077,0 days 00:00:26.471690,relu,0.10947585484710345,32,0.06019240506475212,2,True,standard,9.919953509630873e-05,COMPLETE
305,160.2979736328125,2026-01-03 03:22:24.689076,2026-01-03 03:22:53.246274,0 days 00:00:28.557198,gelu,0.11925135171955142,29,0.07976651802480701,2,True,standard,0.0001268414605011363,COMPLETE
306,143.36460876464844,2026-01-03 03:22:53.254274,2026-01-03 03:23:19.918457,0 days 00:00:26.664183,relu,0.10701915438183074,27,0.0872928764037578,2,True,standard,1.643297519930273e-05,COMPLETE
307,138.19509887695312,2026-01-03 03:23:19.926458,2026-01-03 03:23:46.632678,0 days 00:00:26.706220,relu,0.10086103363772314,30,0.0695268968316239,2,True,standard,0.00011526444321345191,COMPLETE
308,155.15037536621094,2026-01-03 03:23:46.640678,2026-01-03 03:24:13.224368,0 days 00:00:26.583690,relu,0.23726211776804806,28,0.05566262137421248,2,True,standard,0.00012106165519834513,COMPLETE
309,172.5886993408203,2026-01-03 03:24:13.233368,2026-01-03 03:24:39.982547,0 days 00:00:26.749179,relu,0.10021223484695928,31,0.06794396959594899,2,True,none,0.00014722374598144964,COMPLETE
310,143.0306396484375,2026-01-03 03:24:39.990552,2026-01-03 03:25:06.917331,0 days 00:00:26.926779,relu,0.10518298305446196,30,0.07192208830201904,2,True,standard,0.00011183309180514558,COMPLETE
311,198.11912306043837,2026-01-03 03:25:06.926334,2026-01-03 03:25:33.003039,0 days 00:00:26.076705,relu,0.10025511680594602,29,0.0009947518486369796,2,False,standard,9.670957467411819e-05,COMPLETE
312,144.09654235839844,2026-01-03 03:25:33.011039,2026-01-03 03:25:59.518249,0 days 00:00:26.507210,relu,0.11379874902977904,26,0.07737050572598499,2,True,standard,0.00013824844939448936,COMPLETE
313,152.1920623779297,2026-01-03 03:25:59.526249,2026-01-03 03:26:26.197962,0 days 00:00:26.671713,relu,0.10925848001768337,32,0.058863441441513877,2,True,robust,0.00011512932671201934,COMPLETE
314,143.1306610107422,2026-01-03 03:26:26.206962,2026-01-03 03:26:52.826654,0 days 00:00:26.619692,relu,0.12017990612856376,28,0.06260865612821309,2,True,standard,1.4394677872540496e-05,COMPLETE
315,150.8551025390625,2026-01-03 03:26:52.835655,2026-01-03 03:27:19.607852,0 days 00:00:26.772197,relu,0.20316783667457508,31,0.08366059931999846,2,True,standard,8.314408383655253e-05,COMPLETE
316,141.18252563476562,2026-01-03 03:27:19.617852,2026-01-03 03:27:46.391539,0 days 00:00:26.773687,relu,0.10062712093182813,30,0.07135624449297419,2,True,standard,0.00015653965669339346,COMPLETE
317,146.22842407226562,2026-01-03 03:27:46.401540,2026-01-03 03:28:13.131255,0 days 00:00:26.729715,relu,0.10000382520434063,32,0.06956000493490307,2,True,standard,0.0001397172984548963,COMPLETE
318,180.4781036376953,2026-01-03 03:28:13.139255,2026-01-03 03:28:41.036946,0 days 00:00:27.897691,mish,0.11210353758976399,30,0.07645733977975258,2,True,minmax,0.00015332852867130548,COMPLETE
319,142.67367553710938,2026-01-03 03:28:41.045953,2026-01-03 03:29:07.900670,0 days 00:00:26.854717,relu,0.12264109089081328,30,0.0997873910247312,2,True,standard,0.0001243758536605682,COMPLETE
320,141.185546875,2026-01-03 03:29:07.909670,2026-01-03 03:29:34.618380,0 days 00:00:26.708710,relu,0.10843494361529789,29,0.062288055220813474,2,True,standard,0.00018478025499342777,COMPLETE
321,142.72911071777344,2026-01-03 03:29:34.627383,2026-01-03 03:30:01.427070,0 days 00:00:26.799687,relu,0.11582554162205529,29,0.05892698363778242,2,True,standard,0.00017908994004573318,COMPLETE
322,180.46673583984375,2026-01-03 03:30:01.437071,2026-01-03 03:30:28.188251,0 days 00:00:26.751180,relu,0.49875739104117056,31,0.051587941831461336,2,True,standard,0.00018877850939517113,COMPLETE
323,199.54837036132812,2026-01-03 03:30:28.196251,2026-01-03 03:30:53.876955,0 days 00:00:25.680704,relu,0.10963764866678752,4,0.0659994318393455,2,True,standard,0.00015368543248636573,COMPLETE
324,145.2703094482422,2026-01-03 03:30:53.884955,2026-01-03 03:31:20.460137,0 days 00:00:26.575182,relu,0.12174283924477998,28,0.06332717687437653,2,True,standard,0.00010502960923129337,COMPLETE
325,142.54501342773438,2026-01-03 03:31:20.469136,2026-01-03 03:31:47.031843,0 days 00:00:26.562707,relu,0.11313776952209818,32,0.05263757104162036,2,True,standard,0.00021270985219510956,COMPLETE
326,146.8604736328125,2026-01-03 03:31:47.039843,2026-01-03 03:32:13.704516,0 days 00:00:26.664673,relu,0.1269655137318997,29,0.07367476836828232,2,True,standard,0.00016227780777286238,COMPLETE
327,142.64779663085938,2026-01-03 03:32:13.712517,2026-01-03 03:32:40.473708,0 days 00:00:26.761191,relu,0.10784723733786783,29,0.0857075435423236,2,True,standard,0.00013049669083421798,COMPLETE
328,143.0633544921875,2026-01-03 03:32:40.481708,2026-01-03 03:33:07.138943,0 days 00:00:26.657235,relu,0.11660086990350473,27,0.07047365185550893,2,True,standard,9.393293702805455e-05,COMPLETE
329,141.06979370117188,2026-01-03 03:33:07.146942,2026-01-03 03:33:33.934665,0 days 00:00:26.787723,relu,0.10549475021507673,31,0.0791977670643354,2,True,standard,0.00016686953992056227,COMPLETE
330,176.89842224121094,2026-01-03 03:33:33.942665,2026-01-03 03:33:59.720852,0 days 00:00:25.778187,relu,0.10710906801862442,6,0.06091943481476079,2,True,standard,0.0001740221807541965,COMPLETE
331,198.22532565646702,2026-01-03 03:33:59.728849,2026-01-03 03:34:25.644549,0 days 00:00:25.915700,relu,0.10698041278478719,32,0.0009942655637626158,2,False,standard,0.00018475573146167377,COMPLETE
332,139.22943115234375,2026-01-03 03:34:25.662549,2026-01-03 03:34:52.508220,0 days 00:00:26.845671,relu,0.10666852912473117,30,0.07631721420327892,2,True,standard,0.00019940341740848965,COMPLETE
333,144.95713806152344,2026-01-03 03:34:52.516220,2026-01-03 03:35:19.182407,0 days 00:00:26.666187,relu,0.1002625497943979,27,0.07870070463082342,2,True,standard,0.00021255046629378097,COMPLETE
334,173.6854248046875,2026-01-03 03:35:19.191409,2026-01-03 03:35:45.390611,0 days 00:00:26.199202,relu,0.11539567207109416,18,0.07772630944889689,2,True,none,0.00019953290371846035,COMPLETE
