number,value,datetime_start,datetime_complete,duration,params_activation,params_dropout,params_hidden_size,params_lr,params_n_layers,params_scale_target,params_scaler,params_weight_decay,state
1226,142.8164825439453,2026-01-03 10:12:57.427098,2026-01-03 10:13:24.329773,0 days 00:00:26.902675,relu,0.10020893577335815,28,0.07875006262269792,2,True,standard,5.4156037411276464e-05,COMPLETE
1227,143.48533630371094,2026-01-03 10:13:24.338775,2026-01-03 10:13:51.215939,0 days 00:00:26.877164,relu,0.11325351757617712,27,0.08726293616148058,2,True,standard,6.529827561899404e-05,COMPLETE
1228,139.8878631591797,2026-01-03 10:13:51.225938,2026-01-03 10:14:18.156633,0 days 00:00:26.930695,relu,0.1075204505880145,30,0.09025109552263536,2,True,standard,5.1876633749594696e-05,COMPLETE
1229,151.63674926757812,2026-01-03 10:14:18.166633,2026-01-03 10:14:45.081318,0 days 00:00:26.914685,relu,0.11869081727100299,30,0.07746367562622944,2,True,robust,7.834164200130013e-05,COMPLETE
1230,145.0596160888672,2026-01-03 10:14:45.089319,2026-01-03 10:15:11.959982,0 days 00:00:26.870663,relu,0.10021133888883572,29,0.08910050142048438,2,True,standard,4.426367801972894e-05,COMPLETE
1231,140.29855346679688,2026-01-03 10:15:11.968982,2026-01-03 10:15:38.663143,0 days 00:00:26.694161,relu,0.10000201815170069,28,0.07614609027829408,2,True,standard,4.565082721678214e-05,COMPLETE
1232,140.4746551513672,2026-01-03 10:15:38.671143,2026-01-03 10:16:05.632825,0 days 00:00:26.961682,relu,0.11163977667275757,30,0.09809705797781731,2,True,standard,5.620768854522806e-05,COMPLETE
1233,145.58786010742188,2026-01-03 10:16:05.642826,2026-01-03 10:16:32.563514,0 days 00:00:26.920688,relu,0.11909716967596463,29,0.07319020385569118,2,True,standard,8.275864852870881e-05,COMPLETE
1234,147.23898315429688,2026-01-03 10:16:32.571514,2026-01-03 10:17:00.394677,0 days 00:00:27.823163,mish,0.10004728188935924,31,0.09916149999562149,2,True,standard,4.855828490937999e-05,COMPLETE
1235,188.19175720214844,2026-01-03 10:17:00.402677,2026-01-03 10:17:27.368352,0 days 00:00:26.965675,relu,0.36508980566856175,31,0.07955763342017767,2,True,minmax,3.8826465712733084e-05,COMPLETE
1236,139.78823852539062,2026-01-03 10:17:27.376352,2026-01-03 10:17:54.195024,0 days 00:00:26.818672,relu,0.10833528641718808,30,0.08936470903583459,2,True,standard,4.865462115408531e-05,COMPLETE
1237,145.1958770751953,2026-01-03 10:17:54.203024,2026-01-03 10:18:20.986207,0 days 00:00:26.783183,relu,0.11656677425144187,27,0.07067973491519507,2,True,standard,6.885606375316924e-05,COMPLETE
1238,141.63491821289062,2026-01-03 10:18:20.995208,2026-01-03 10:18:47.949923,0 days 00:00:26.954715,relu,0.10773219231311694,30,0.08886681523595312,2,True,standard,3.6432615248359515e-05,COMPLETE
1239,144.49447631835938,2026-01-03 10:18:47.958923,2026-01-03 10:19:14.784605,0 days 00:00:26.825682,relu,0.12164579808611553,28,0.09937529345683328,2,True,standard,9.820398014858535e-05,COMPLETE
1240,198.2003594970703,2026-01-03 10:19:14.792605,2026-01-03 10:19:41.049258,0 days 00:00:26.256653,relu,0.10899883667033324,31,0.0009944336358923495,2,False,standard,0.00011591405234355792,COMPLETE
1241,142.78231811523438,2026-01-03 10:19:41.059258,2026-01-03 10:20:09.805443,0 days 00:00:28.746185,gelu,0.11407549908681042,29,0.09898421242673369,2,True,standard,3.8336430256322426e-05,COMPLETE
1242,140.54576110839844,2026-01-03 10:20:09.813443,2026-01-03 10:20:36.693120,0 days 00:00:26.879677,relu,0.1076105005741031,32,0.09992399819844758,2,True,standard,3.356867902365304e-05,COMPLETE
1243,148.80958557128906,2026-01-03 10:20:36.701123,2026-01-03 10:21:01.048760,0 days 00:00:24.347637,relu,0.12283294841597986,31,0.08176743061531119,1,True,standard,5.8183951852848143e-05,COMPLETE
1244,141.9050750732422,2026-01-03 10:21:01.056762,2026-01-03 10:21:27.943441,0 days 00:00:26.886679,relu,0.10033225923028626,28,0.07187143014512054,2,True,standard,4.842483842961175e-05,COMPLETE
1245,141.25057983398438,2026-01-03 10:21:27.950442,2026-01-03 10:21:54.891135,0 days 00:00:26.940693,relu,0.11356445663622786,30,0.08094416779837883,2,True,standard,4.0531162686472084e-05,COMPLETE
1246,163.3260040283203,2026-01-03 10:21:54.901139,2026-01-03 10:22:22.073813,0 days 00:00:27.172674,silu,0.10826658091547688,32,0.06498537470438186,2,True,standard,3.403381983900083e-05,COMPLETE
1247,144.8489532470703,2026-01-03 10:22:22.083813,2026-01-03 10:22:49.624754,0 days 00:00:27.540941,relu,0.10015524755679986,29,0.08015209538639137,2,True,standard,5.974672384630858e-05,COMPLETE
1248,140.67726135253906,2026-01-03 10:22:49.633759,2026-01-03 10:23:16.653723,0 days 00:00:27.019964,relu,0.11920656023196302,30,0.09912407514954313,2,True,standard,8.021344675141149e-05,COMPLETE
1249,171.58383178710938,2026-01-03 10:23:16.661723,2026-01-03 10:23:43.513389,0 days 00:00:26.851666,relu,0.10766825769349896,32,0.07133416497932463,2,True,none,0.00010823277356114455,COMPLETE
1250,140.23934936523438,2026-01-03 10:23:43.523390,2026-01-03 10:24:10.423048,0 days 00:00:26.899658,relu,0.1159676473933795,29,0.09996521294976721,2,True,standard,3.198080718825106e-05,COMPLETE
1251,141.6531524658203,2026-01-03 10:24:10.431048,2026-01-03 10:24:37.533738,0 days 00:00:27.102690,relu,0.12612022769461015,31,0.08311516164468082,2,True,standard,4.7993401253944404e-05,COMPLETE
1252,138.7165069580078,2026-01-03 10:24:37.541741,2026-01-03 10:25:04.306412,0 days 00:00:26.764671,relu,0.10719765954535701,28,0.09987043945484282,2,True,standard,4.0909520189858125e-05,COMPLETE
1253,145.76260375976562,2026-01-03 10:25:04.315416,2026-01-03 10:25:31.083568,0 days 00:00:26.768152,relu,0.1279572759797209,26,0.08672368237683581,2,True,standard,4.5500864022445395e-05,COMPLETE
1254,151.28485107421875,2026-01-03 10:25:31.092567,2026-01-03 10:25:57.849279,0 days 00:00:26.756712,relu,0.12115322210968944,27,0.09895266949430086,2,True,robust,3.8239962575745326e-05,COMPLETE
1255,141.14102172851562,2026-01-03 10:25:57.858276,2026-01-03 10:26:24.589956,0 days 00:00:26.731680,relu,0.11517666612254597,26,0.0889241555088165,2,True,standard,5.2036585996822845e-05,COMPLETE
1256,182.82260131835938,2026-01-03 10:26:24.597960,2026-01-03 10:26:51.456100,0 days 00:00:26.858140,relu,0.1339338631311265,28,0.0022162341073766467,2,True,standard,4.112562868435309e-05,COMPLETE
1257,142.97848510742188,2026-01-03 10:26:51.465102,2026-01-03 10:27:18.414790,0 days 00:00:26.949688,relu,0.11318048854662258,27,0.09957365938562293,2,True,standard,4.7162163866205774e-05,COMPLETE
1258,150.57545471191406,2026-01-03 10:27:18.422789,2026-01-03 10:27:46.129452,0 days 00:00:27.706663,mish,0.12388431339785222,25,0.09937530433491981,2,True,standard,4.356826918742452e-05,COMPLETE
1259,199.0409634738498,2026-01-03 10:27:46.137453,2026-01-03 10:28:12.230633,0 days 00:00:26.093180,relu,0.10815535127690801,26,0.0009941816908677506,2,False,minmax,5.0982156416563906e-05,COMPLETE
1260,143.27857971191406,2026-01-03 10:28:12.238633,2026-01-03 10:28:39.261241,0 days 00:00:27.022608,relu,0.11980596768155288,28,0.08109787999661272,2,True,standard,4.100029365720521e-05,COMPLETE
1261,143.89312744140625,2026-01-03 10:28:39.269241,2026-01-03 10:29:06.116924,0 days 00:00:26.847683,relu,0.10795022970492159,28,0.07405385974982368,2,True,standard,3.7201720739852306e-05,COMPLETE
1262,144.1734619140625,2026-01-03 10:29:06.126924,2026-01-03 10:29:33.049608,0 days 00:00:26.922684,relu,0.11386775647805439,27,0.08739700748591403,2,True,standard,5.440047622956967e-05,COMPLETE
1263,145.43032836914062,2026-01-03 10:29:33.059607,2026-01-03 10:30:00.138790,0 days 00:00:27.079183,relu,0.17353127474657204,30,0.07889161818883753,2,True,standard,4.12297133341402e-05,COMPLETE
1264,152.25119018554688,2026-01-03 10:30:00.146792,2026-01-03 10:30:28.846476,0 days 00:00:28.699684,gelu,0.12533412926033896,32,0.06353698722336922,2,True,standard,6.199668647202183e-05,COMPLETE
1265,172.9390106201172,2026-01-03 10:30:28.854476,2026-01-03 10:30:55.665143,0 days 00:00:26.810667,relu,0.10756389548438464,29,0.006976999388142216,2,True,standard,4.341740851133845e-05,COMPLETE
1266,150.6732177734375,2026-01-03 10:30:55.674143,2026-01-03 10:31:22.724827,0 days 00:00:27.050684,relu,0.2690312029009457,31,0.08492847731262922,2,True,standard,3.4667978156431136e-05,COMPLETE
1267,145.0583038330078,2026-01-03 10:31:22.733829,2026-01-03 10:31:49.681991,0 days 00:00:26.948162,relu,0.11668133648307115,28,0.07341076796489174,2,True,standard,3.6984157855688384e-05,COMPLETE
1268,144.54673767089844,2026-01-03 10:31:49.689992,2026-01-03 10:32:16.428647,0 days 00:00:26.738655,relu,0.13977492381288106,32,0.09888223514191812,2,True,standard,3.9030802808880494e-05,COMPLETE
1269,151.09197998046875,2026-01-03 10:32:16.436647,2026-01-03 10:32:43.189317,0 days 00:00:26.752670,relu,0.10713187828936213,21,0.0880327877993591,2,True,standard,4.7153672641795325e-05,COMPLETE
1270,159.1997833251953,2026-01-03 10:32:43.198317,2026-01-03 10:33:10.303464,0 days 00:00:27.105147,silu,0.10004662189990643,30,0.09917063486542062,2,True,standard,9.83300218759474e-05,COMPLETE
1271,155.67433166503906,2026-01-03 10:33:10.312463,2026-01-03 10:33:37.171636,0 days 00:00:26.859173,relu,0.11771747609558546,25,0.070181455923125,2,True,standard,5.26541413594781e-05,COMPLETE
1272,146.2244110107422,2026-01-03 10:33:37.179636,2026-01-03 10:34:03.895317,0 days 00:00:26.715681,relu,0.129856047139755,29,0.07873200209917992,2,True,standard,3.32155192238258e-05,COMPLETE
1273,171.2272186279297,2026-01-03 10:34:03.903317,2026-01-03 10:34:30.950478,0 days 00:00:27.047161,relu,0.10746468461993419,31,0.0880497852493126,2,True,none,0.000130040485420358,COMPLETE
1274,144.59117126464844,2026-01-03 10:34:30.960478,2026-01-03 10:34:57.600158,0 days 00:00:26.639680,relu,0.11369425414153675,27,0.09959185049332153,2,True,standard,7.036931434391977e-05,COMPLETE
1275,142.5187225341797,2026-01-03 10:34:57.608156,2026-01-03 10:35:24.227863,0 days 00:00:26.619707,relu,0.12173163681701649,32,0.06353147650977241,2,True,standard,3.448139437725365e-05,COMPLETE
1276,138.13169860839844,2026-01-03 10:35:24.236863,2026-01-03 10:35:51.193040,0 days 00:00:26.956177,relu,0.10670836580347337,29,0.09995137950576537,2,True,standard,3.1080777525221284e-05,COMPLETE
1277,151.9322052001953,2026-01-03 10:35:51.214037,2026-01-03 10:36:18.200207,0 days 00:00:26.986170,relu,0.11317844179468046,30,0.07715529198770281,2,True,robust,3.150636027285921e-05,COMPLETE
1278,198.59311123318142,2026-01-03 10:36:18.209207,2026-01-03 10:36:44.411916,0 days 00:00:26.202709,relu,0.14979417991399932,30,0.0009939351031104336,2,False,standard,2.8937476157694604e-05,COMPLETE
1279,138.0659942626953,2026-01-03 10:36:44.420915,2026-01-03 10:37:11.413063,0 days 00:00:26.992148,relu,0.10809121737788509,31,0.08889380764610046,2,True,standard,3.020400758080877e-05,COMPLETE
1280,142.38563537597656,2026-01-03 10:37:11.421065,2026-01-03 10:37:38.347736,0 days 00:00:26.926671,relu,0.13176471515971447,32,0.07915801263181355,2,True,standard,3.151489267472132e-05,COMPLETE
1281,139.13697814941406,2026-01-03 10:37:38.355737,2026-01-03 10:38:05.374415,0 days 00:00:27.018678,relu,0.12092686849148664,31,0.08844894905878922,2,True,standard,3.101402101562634e-05,COMPLETE
1282,189.0079345703125,2026-01-03 10:38:05.399415,2026-01-03 10:38:30.348099,0 days 00:00:24.948684,mish,0.10017331160355007,32,0.000753080349722531,1,True,standard,3.330272281595143e-05,COMPLETE
1283,179.4390869140625,2026-01-03 10:38:30.356617,2026-01-03 10:38:57.476259,0 days 00:00:27.119642,relu,0.3104986193051405,31,0.09980607358564088,2,True,minmax,3.595959951078532e-05,COMPLETE
1284,142.68380737304688,2026-01-03 10:38:57.484261,2026-01-03 10:39:24.316416,0 days 00:00:26.832155,relu,0.11296353806586693,31,0.06709119256969255,2,True,standard,2.9242204131564285e-05,COMPLETE
1285,140.8181610107422,2026-01-03 10:39:24.325416,2026-01-03 10:39:51.308571,0 days 00:00:26.983155,relu,0.10700849199763826,32,0.07185893763664848,2,True,standard,3.227088585117095e-05,COMPLETE
1286,141.3094024658203,2026-01-03 10:39:51.317572,2026-01-03 10:40:18.267236,0 days 00:00:26.949664,relu,0.1002836022037577,29,0.086887146156602,2,True,standard,9.05952856985209e-05,COMPLETE
1287,145.39723205566406,2026-01-03 10:40:18.276240,2026-01-03 10:40:45.108914,0 days 00:00:26.832674,relu,0.12504464817007385,32,0.05964215582111684,2,True,standard,2.8105882473117553e-05,COMPLETE
1288,148.9071502685547,2026-01-03 10:40:45.116910,2026-01-03 10:41:13.917614,0 days 00:00:28.800704,gelu,0.11532687581092463,31,0.0808604457899093,2,True,standard,8.505367439821126e-06,COMPLETE
1289,142.23587036132812,2026-01-03 10:41:13.927616,2026-01-03 10:41:40.642772,0 days 00:00:26.715156,relu,0.10732588969856739,30,0.08817335137497541,2,True,standard,2.977265079009395e-05,COMPLETE
1290,144.39279174804688,2026-01-03 10:41:40.650771,2026-01-03 10:42:07.575432,0 days 00:00:26.924661,relu,0.10019688974263409,29,0.07382875492771697,2,True,standard,2.895858336809425e-05,COMPLETE
1291,142.53549194335938,2026-01-03 10:42:07.582432,2026-01-03 10:42:34.539097,0 days 00:00:26.956665,relu,0.1173803809042725,32,0.08086359844454112,2,True,standard,0.00012086128810495779,COMPLETE
1292,141.9667510986328,2026-01-03 10:42:34.547101,2026-01-03 10:43:01.452247,0 days 00:00:26.905146,relu,0.1001155645804909,30,0.09984060459999314,2,True,standard,3.3791272489490575e-05,COMPLETE
1293,147.14059448242188,2026-01-03 10:43:01.461249,2026-01-03 10:43:28.487908,0 days 00:00:27.026659,relu,0.15904083290506008,31,0.0669040462585117,2,True,standard,0.00010696025170276617,COMPLETE
1294,143.1422119140625,2026-01-03 10:43:28.495909,2026-01-03 10:43:55.330063,0 days 00:00:26.834154,relu,0.13472594185375047,29,0.09978348820465471,2,True,standard,6.654257724522986e-06,COMPLETE
1295,174.9087677001953,2026-01-03 10:43:55.338062,2026-01-03 10:44:22.535729,0 days 00:00:27.197667,silu,0.42896233753807744,32,0.08768803993683306,2,True,standard,2.77989005972404e-05,COMPLETE
1296,142.8172607421875,2026-01-03 10:44:22.543729,2026-01-03 10:44:50.212925,0 days 00:00:27.669196,relu,0.11463193834237778,31,0.07660786880372157,2,True,standard,3.2672817476102e-05,COMPLETE
1297,197.38791334364151,2026-01-03 10:44:50.221928,2026-01-03 10:45:17.151187,0 days 00:00:26.929259,relu,0.1254137217779264,29,0.0009907454238405361,2,False,none,3.761923040122068e-05,COMPLETE
1298,141.48477172851562,2026-01-03 10:45:17.162188,2026-01-03 10:45:52.837253,0 days 00:00:35.675065,relu,0.10777291441110655,31,0.08790534778734119,2,True,standard,1.00669096920886e-05,COMPLETE
1299,140.87416076660156,2026-01-03 10:45:52.848254,2026-01-03 10:46:27.764807,0 days 00:00:34.916553,relu,0.11246519805278955,30,0.058994841114554074,2,True,standard,7.526522457162488e-05,COMPLETE
1300,140.84695434570312,2026-01-03 10:46:27.776808,2026-01-03 10:47:02.635889,0 days 00:00:34.859081,relu,0.10672967821576343,32,0.07063833302685686,2,True,standard,2.8099387091319508e-05,COMPLETE
1301,171.78953552246094,2026-01-03 10:47:02.645889,2026-01-03 10:47:36.639449,0 days 00:00:33.993560,relu,0.12251982775018272,10,0.08709253162552301,2,True,standard,2.6716720814902422e-05,COMPLETE
1302,142.15896606445312,2026-01-03 10:47:36.650450,2026-01-03 10:48:11.560555,0 days 00:00:34.910105,relu,0.10011212450316218,30,0.076797199342488,2,True,standard,3.724688464586427e-05,COMPLETE
1303,152.45816040039062,2026-01-03 10:48:11.570556,2026-01-03 10:48:44.862079,0 days 00:00:33.291523,relu,0.14325944271450922,29,0.08776197052615074,2,True,robust,8.945775950055718e-05,COMPLETE
1304,142.7284698486328,2026-01-03 10:48:44.871079,2026-01-03 10:49:11.307150,0 days 00:00:26.436071,relu,0.11739154192736415,32,0.06525782555263103,2,True,standard,2.8866662756366502e-05,COMPLETE
1305,138.8602752685547,2026-01-03 10:49:11.315146,2026-01-03 10:49:39.167220,0 days 00:00:27.852074,relu,0.1078954555002739,30,0.09988259221010841,2,True,standard,0.00013279742184808794,COMPLETE
1306,142.6773223876953,2026-01-03 10:49:39.179222,2026-01-03 10:50:08.542162,0 days 00:00:29.362940,relu,0.1274203344259802,32,0.07715425789573423,2,True,standard,3.2899881229968044e-05,COMPLETE
1307,198.46661376953125,2026-01-03 10:50:08.551165,2026-01-03 10:50:35.503168,0 days 00:00:26.952003,relu,0.11217059771505249,28,0.005266376522013789,2,True,minmax,2.7120356813592254e-05,COMPLETE
1308,157.1023712158203,2026-01-03 10:50:35.511168,2026-01-03 10:51:07.894181,0 days 00:00:32.383013,mish,0.11909958315698783,30,0.08746297210176593,2,True,standard,7.864691611566543e-06,COMPLETE
1309,141.94857788085938,2026-01-03 10:51:07.903183,2026-01-03 10:51:35.588421,0 days 00:00:27.685238,relu,0.10779152542155125,31,0.07142026062278665,2,True,standard,2.5822589107347917e-05,COMPLETE
1310,148.36798095703125,2026-01-03 10:51:35.597421,2026-01-03 10:52:06.114462,0 days 00:00:30.517041,relu,0.11279121913904883,29,0.059726359106629594,2,True,standard,6.501733747321572e-05,COMPLETE
1311,138.46131896972656,2026-01-03 10:52:06.125462,2026-01-03 10:52:40.881299,0 days 00:00:34.755837,relu,0.10023589697757507,31,0.08729678143125918,2,True,standard,0.00010488080646675053,COMPLETE
1312,148.6060028076172,2026-01-03 10:52:40.891300,2026-01-03 10:53:18.588865,0 days 00:00:37.697565,gelu,0.12076230731139925,28,0.08014389362038835,2,True,standard,0.0001049260957779472,COMPLETE
1313,140.76002502441406,2026-01-03 10:53:18.597866,2026-01-03 10:53:53.697935,0 days 00:00:35.100069,relu,0.10800561393709772,32,0.09908708907742356,2,True,standard,0.00010006138761903235,COMPLETE
1314,143.77249145507812,2026-01-03 10:53:53.707935,2026-01-03 10:54:28.686491,0 days 00:00:34.978556,relu,0.10722867351304743,30,0.06952026059660742,2,True,standard,0.00011237110957130476,COMPLETE
1315,142.35787963867188,2026-01-03 10:54:28.696489,2026-01-03 10:55:03.750561,0 days 00:00:35.054072,relu,0.10014895100386995,32,0.0890811602552127,2,True,standard,9.289558075756373e-05,COMPLETE
1316,145.20223999023438,2026-01-03 10:55:03.762561,2026-01-03 10:55:33.998501,0 days 00:00:30.235940,relu,0.13368844187581883,29,0.05064501494735036,2,True,standard,0.00010605671500924443,COMPLETE
1317,198.05697197808158,2026-01-03 10:55:34.007501,2026-01-03 10:55:58.763523,0 days 00:00:24.756022,relu,0.11498084329396102,30,0.0009941336129001054,2,False,standard,0.00010096577541984592,COMPLETE
1318,165.84205627441406,2026-01-03 10:55:58.772523,2026-01-03 10:56:25.637768,0 days 00:00:26.865245,silu,0.12551700133616853,31,0.07700950195142552,2,True,standard,0.00011733121775637685,COMPLETE
1319,141.48275756835938,2026-01-03 10:56:25.645768,2026-01-03 10:56:52.932909,0 days 00:00:27.287141,relu,0.10033645669476779,29,0.08858789141743821,2,True,standard,8.287767945407148e-05,COMPLETE
1320,147.32244873046875,2026-01-03 10:56:52.940912,2026-01-03 10:57:23.850469,0 days 00:00:30.909557,relu,0.11377922424257705,32,0.09970942217041423,1,True,standard,8.870531276647904e-05,COMPLETE
1321,169.93714904785156,2026-01-03 10:57:23.859471,2026-01-03 10:57:59.033024,0 days 00:00:35.173553,relu,0.10793607815704828,31,0.06340173198031529,2,True,none,0.000127741142376508,COMPLETE
1322,144.77597045898438,2026-01-03 10:57:59.043027,2026-01-03 10:58:33.944112,0 days 00:00:34.901085,relu,0.12147055809495247,28,0.07935834084169328,2,True,standard,0.00012242529843538305,COMPLETE
1323,144.61306762695312,2026-01-03 10:58:33.955114,2026-01-03 10:59:08.856666,0 days 00:00:34.901552,relu,0.10734205191946583,27,0.09947224044520098,2,True,standard,7.706925693994374e-05,COMPLETE
1324,144.0523681640625,2026-01-03 10:59:08.866667,2026-01-03 10:59:35.021524,0 days 00:00:26.154857,relu,0.13093074145676004,30,0.07088885182436358,2,True,standard,9.287127804916099e-05,COMPLETE
1325,143.2705841064453,2026-01-03 10:59:35.030525,2026-01-03 11:00:02.590988,0 days 00:00:27.560463,relu,0.11672385224480916,32,0.07928810774102737,2,True,standard,0.00013731872467711653,COMPLETE
1326,149.90306091308594,2026-01-03 11:00:02.601990,2026-01-03 11:00:30.280395,0 days 00:00:27.678405,relu,0.10856201178828204,31,0.08938523167984981,2,True,robust,0.00014213382634032574,COMPLETE
1327,141.99850463867188,2026-01-03 11:00:30.288396,2026-01-03 11:00:58.617833,0 days 00:00:28.329437,relu,0.10005025691064981,29,0.06497157507746595,2,True,standard,9.511855541890548e-05,COMPLETE
1328,158.1270294189453,2026-01-03 11:00:58.629831,2026-01-03 11:01:26.944291,0 days 00:00:28.314460,relu,0.30003752329590483,30,0.09949428893035353,2,True,standard,0.0001238006556112498,COMPLETE
1329,141.3866424560547,2026-01-03 11:01:26.969298,2026-01-03 11:01:53.502548,0 days 00:00:26.533250,relu,0.11974509089825094,32,0.07981698079216254,2,True,standard,0.00011359573788396611,COMPLETE
1330,142.25131225585938,2026-01-03 11:01:53.510548,2026-01-03 11:02:21.516955,0 days 00:00:28.006407,relu,0.10014985796309782,30,0.054673170317597754,2,True,standard,8.982373847948656e-06,COMPLETE
1331,148.92189025878906,2026-01-03 11:02:21.527958,2026-01-03 11:02:49.215129,0 days 00:00:27.687171,mish,0.1131190025725177,31,0.09962964318416663,2,True,standard,0.00010459142877375072,COMPLETE
1332,172.4817352294922,2026-01-03 11:02:49.223129,2026-01-03 11:03:21.079869,0 days 00:00:31.856740,relu,0.10018276336426038,27,0.07139104298326816,2,True,minmax,2.6353540018407277e-05,COMPLETE
1333,146.40908813476562,2026-01-03 11:03:21.089871,2026-01-03 11:03:55.650684,0 days 00:00:34.560813,relu,0.1390543944205598,28,0.08803450428361831,2,True,standard,8.562883075606512e-05,COMPLETE
1334,142.88465881347656,2026-01-03 11:03:55.660682,2026-01-03 11:04:31.068332,0 days 00:00:35.407650,relu,0.12499784523113708,30,0.08091352192637428,2,True,standard,0.00013972258206212766,COMPLETE
1335,197.97721123589412,2026-01-03 11:04:31.078335,2026-01-03 11:05:05.105094,0 days 00:00:34.026759,relu,0.1127653428677058,32,0.0009938994796701273,2,False,standard,0.00011379840995190743,COMPLETE
1336,143.27621459960938,2026-01-03 11:05:05.115607,2026-01-03 11:05:39.897438,0 days 00:00:34.781831,relu,0.10738011394011099,31,0.08887997420436786,2,True,standard,7.295108400718186e-06,COMPLETE
