number,value,datetime_start,datetime_complete,duration,params_activation,params_dropout,params_hidden_size,params_lr,params_n_layers,params_scale_target,params_scaler,params_weight_decay,state
1670,164.789306640625,2026-01-03 13:35:35.451663,2026-01-03 13:36:01.910907,0 days 00:00:26.459244,mish,0.26282623604053434,29,0.0892666482829326,2,True,standard,3.120452337666901e-05,COMPLETE
1671,178.36019897460938,2026-01-03 13:36:01.917908,2026-01-03 13:36:27.475282,0 days 00:00:25.557374,relu,0.23816162493905096,30,0.0741535953899209,2,True,minmax,7.371912455206083e-06,COMPLETE
1672,193.6699981689453,2026-01-03 13:36:27.483283,2026-01-03 13:36:52.984268,0 days 00:00:25.500985,relu,0.10043775593392619,32,0.0005110139814116453,2,True,standard,2.5412995311984384e-05,COMPLETE
1673,147.7931671142578,2026-01-03 13:36:52.991776,2026-01-03 13:37:18.450635,0 days 00:00:25.458859,relu,0.10019328614400397,29,0.09965404819758822,2,True,standard,7.472852284481034e-05,COMPLETE
1674,142.70907592773438,2026-01-03 13:37:18.458635,2026-01-03 13:37:43.936536,0 days 00:00:25.477901,relu,0.11947203190996208,27,0.08210094255393587,2,True,standard,1.3199502536744884e-05,COMPLETE
1675,198.28898173014323,2026-01-03 13:37:43.945537,2026-01-03 13:38:08.872861,0 days 00:00:24.927324,relu,0.11399888462901252,32,0.0009941375889286326,2,False,standard,3.8873411214305505e-05,COMPLETE
1676,157.54226684570312,2026-01-03 13:38:08.880863,2026-01-03 13:38:36.311010,0 days 00:00:27.430147,gelu,0.12496777920186271,31,0.06541305647045098,2,True,standard,2.6940519528666957e-05,COMPLETE
1677,137.60430908203125,2026-01-03 13:38:36.319010,2026-01-03 13:39:01.977302,0 days 00:00:25.658292,relu,0.10010160531778443,30,0.09997678981126265,2,True,standard,9.41999969533833e-06,COMPLETE
1678,138.8850860595703,2026-01-03 13:39:01.986303,2026-01-03 13:39:27.624415,0 days 00:00:25.638112,relu,0.10785377022902602,28,0.09936584101585987,2,True,standard,9.453684495354241e-06,COMPLETE
1679,141.7105712890625,2026-01-03 13:39:27.632416,2026-01-03 13:39:53.303500,0 days 00:00:25.671084,relu,0.11308150614536867,28,0.08888347193457542,2,True,standard,7.922431687180744e-06,COMPLETE
1680,142.30264282226562,2026-01-03 13:39:53.313505,2026-01-03 13:40:18.895973,0 days 00:00:25.582468,relu,0.10022935222683796,27,0.0907619449461173,2,True,standard,1.0982422022326821e-05,COMPLETE
1681,142.0749053955078,2026-01-03 13:40:18.902974,2026-01-03 13:40:44.564363,0 days 00:00:25.661389,relu,0.11265202838711089,29,0.08668410735760163,2,True,standard,1.0171021820462363e-05,COMPLETE
1682,161.70840454101562,2026-01-03 13:40:44.572363,2026-01-03 13:41:10.178648,0 days 00:00:25.606285,silu,0.12359694772691086,25,0.08842918464668109,2,True,standard,8.793931556096078e-06,COMPLETE
1683,139.79129028320312,2026-01-03 13:41:10.186648,2026-01-03 13:41:35.832463,0 days 00:00:25.645815,relu,0.10019748122664698,29,0.07671489261469924,2,True,standard,9.872046445154922e-06,COMPLETE
1684,196.92962646484375,2026-01-03 13:41:35.841462,2026-01-03 13:42:01.376875,0 days 00:00:25.535413,relu,0.10747421326928967,28,0.00022671096006914533,2,True,standard,1.1878703482709537e-05,COMPLETE
1685,194.16551208496094,2026-01-03 13:42:01.384875,2026-01-03 13:42:27.017843,0 days 00:00:25.632968,relu,0.11853789961403532,30,0.0006606903287126495,2,True,standard,8.704063135056617e-06,COMPLETE
1686,171.099853515625,2026-01-03 13:42:27.025843,2026-01-03 13:42:52.564890,0 days 00:00:25.539047,relu,0.10009746682201978,26,0.09882542403872323,2,True,none,1.12824263737022e-05,COMPLETE
1687,139.62692260742188,2026-01-03 13:42:52.573892,2026-01-03 13:43:18.151875,0 days 00:00:25.577983,relu,0.11167718401412562,30,0.099935084550211,2,True,standard,6.995753884204228e-06,COMPLETE
1688,141.216064453125,2026-01-03 13:43:18.160397,2026-01-03 13:43:43.809389,0 days 00:00:25.648992,relu,0.10775958298994469,30,0.07828240866770904,2,True,standard,1.1212487357632151e-05,COMPLETE
1689,140.37612915039062,2026-01-03 13:43:43.817389,2026-01-03 13:44:09.703937,0 days 00:00:25.886548,relu,0.12583758810347592,29,0.09967108671066607,2,True,standard,7.948591621705408e-06,COMPLETE
1690,143.13623046875,2026-01-03 13:44:09.712938,2026-01-03 13:44:35.610489,0 days 00:00:25.897551,relu,0.1201821604640721,28,0.0887114110502402,2,True,standard,8.609848691679183e-06,COMPLETE
1691,144.7035369873047,2026-01-03 13:44:35.619489,2026-01-03 13:45:01.420902,0 days 00:00:25.801413,relu,0.11370568996170781,31,0.09996552460679162,2,True,robust,9.23990248091106e-06,COMPLETE
1692,143.98806762695312,2026-01-03 13:45:01.428902,2026-01-03 13:45:27.097323,0 days 00:00:25.668421,relu,0.10716370916402022,30,0.07531309498462811,2,True,standard,1.0558137851903188e-05,COMPLETE
1693,141.935791015625,2026-01-03 13:45:27.105323,2026-01-03 13:45:52.620986,0 days 00:00:25.515663,relu,0.10719949601723802,27,0.08784830650483462,2,True,standard,1.2990721498547148e-05,COMPLETE
1694,198.01910122341582,2026-01-03 13:45:52.628986,2026-01-03 13:46:18.693224,0 days 00:00:26.064238,mish,0.11712775512242962,32,0.000994288618023631,2,False,standard,7.4275545960379165e-06,COMPLETE
1695,172.17149353027344,2026-01-03 13:46:18.702227,2026-01-03 13:46:44.373289,0 days 00:00:25.671062,relu,0.10666072304717238,31,0.07848533427935726,2,True,minmax,2.4768951324836453e-06,COMPLETE
1696,145.8943634033203,2026-01-03 13:46:44.381801,2026-01-03 13:47:10.052291,0 days 00:00:25.670490,relu,0.100012623382045,29,0.06979900630207148,2,True,standard,9.192726262449095e-06,COMPLETE
1697,143.64010620117188,2026-01-03 13:47:10.061295,2026-01-03 13:47:35.623224,0 days 00:00:25.561929,relu,0.12507318112924376,26,0.08879976495607159,2,True,standard,6.495303880643495e-06,COMPLETE
1698,159.8455352783203,2026-01-03 13:47:35.632224,2026-01-03 13:48:01.225645,0 days 00:00:25.593421,relu,0.1136978880241551,31,0.02151322149676396,2,True,standard,8.41477758989116e-06,COMPLETE
1699,145.95449829101562,2026-01-03 13:48:01.234645,2026-01-03 13:48:26.858778,0 days 00:00:25.624133,relu,0.11748898102639656,29,0.07998681346771376,2,True,standard,1.1958385810086776e-05,COMPLETE
1700,142.7156219482422,2026-01-03 13:48:26.866780,2026-01-03 13:48:54.183659,0 days 00:00:27.316879,gelu,0.10782452077820195,32,0.08868784791765098,2,True,standard,6.0749628921577945e-06,COMPLETE
1701,138.67605590820312,2026-01-03 13:48:54.192661,2026-01-03 13:49:19.796973,0 days 00:00:25.604312,relu,0.11294965136799529,30,0.09976436169389737,2,True,standard,1.0681353425682503e-05,COMPLETE
1702,152.3844451904297,2026-01-03 13:49:19.806483,2026-01-03 13:49:42.954724,0 days 00:00:23.148241,relu,0.10025844797679212,28,0.06621182062483673,1,True,standard,7.695986244726454e-06,COMPLETE
1703,161.35020446777344,2026-01-03 13:49:42.963724,2026-01-03 13:50:08.718246,0 days 00:00:25.754522,relu,0.3078536531794161,30,0.09963547390429547,2,True,standard,9.126013069348538e-06,COMPLETE
1704,141.86001586914062,2026-01-03 13:50:08.726246,2026-01-03 13:50:34.209234,0 days 00:00:25.482988,relu,0.12495095135808734,32,0.07832536861919527,2,True,standard,9.603607477045591e-06,COMPLETE
1705,145.62222290039062,2026-01-03 13:50:34.216743,2026-01-03 13:50:59.894279,0 days 00:00:25.677536,relu,0.10022298378247563,31,0.05494374516947597,2,True,standard,1.2243706372397926e-05,COMPLETE
1706,141.98117065429688,2026-01-03 13:50:59.902280,2026-01-03 13:51:25.621915,0 days 00:00:25.719635,relu,0.10817015229318455,29,0.07451584262021149,2,True,standard,1.3669171388603363e-05,COMPLETE
1707,159.34713745117188,2026-01-03 13:51:25.630425,2026-01-03 13:51:51.313113,0 days 00:00:25.682688,silu,0.11857409893121737,32,0.08742569584484836,2,True,standard,6.778432837064484e-06,COMPLETE
1708,144.9044189453125,2026-01-03 13:51:51.321122,2026-01-03 13:52:16.817941,0 days 00:00:25.496819,relu,0.1078296661862644,27,0.06968918374648954,2,True,standard,1.0109891439347469e-05,COMPLETE
1709,176.5651092529297,2026-01-03 13:52:16.826945,2026-01-03 13:52:42.357339,0 days 00:00:25.530394,relu,0.2200778509830747,30,0.08828041487296784,2,True,none,2.1907313231363263e-05,COMPLETE
1710,150.4097900390625,2026-01-03 13:52:42.366342,2026-01-03 13:53:07.938249,0 days 00:00:25.571907,relu,0.1156113210467903,28,0.058023117850586725,2,True,standard,3.3545523840737645e-05,COMPLETE
1711,144.94842529296875,2026-01-03 13:53:07.945758,2026-01-03 13:53:33.591832,0 days 00:00:25.646074,relu,0.12831797806951084,32,0.08763563147451917,2,True,standard,8.372736969259434e-06,COMPLETE
1712,198.04999104817708,2026-01-03 13:53:33.599831,2026-01-03 13:53:58.674783,0 days 00:00:25.074952,relu,0.1066809264956999,30,0.000994189448704966,2,False,standard,2.1282917138616233e-05,COMPLETE
1713,143.07122802734375,2026-01-03 13:53:58.683784,2026-01-03 13:54:24.473846,0 days 00:00:25.790062,relu,0.11182607503791268,31,0.07754049410349954,2,True,standard,2.8908926582955598e-05,COMPLETE
1714,179.75839233398438,2026-01-03 13:54:24.481848,2026-01-03 13:54:49.944244,0 days 00:00:25.462396,relu,0.3531418691278053,22,0.06551300457977757,2,True,robust,2.495791454853494e-05,COMPLETE
1715,144.2933349609375,2026-01-03 13:54:49.953250,2026-01-03 13:55:15.546150,0 days 00:00:25.592900,relu,0.1198225133557845,29,0.08832477119712003,2,True,standard,5.294382846651217e-06,COMPLETE
1716,136.76287841796875,2026-01-03 13:55:15.555154,2026-01-03 13:55:40.998235,0 days 00:00:25.443081,relu,0.10028934364506548,32,0.09995808038623731,2,True,standard,4.2278754203978436e-05,COMPLETE
1717,139.8869171142578,2026-01-03 13:55:41.007240,2026-01-03 13:56:06.666159,0 days 00:00:25.658919,relu,0.10814335498994178,32,0.09980732984939016,2,True,standard,4.393024405862628e-05,COMPLETE
1718,144.8205108642578,2026-01-03 13:56:06.674668,2026-01-03 13:56:33.122626,0 days 00:00:26.447958,mish,0.11390731161819406,32,0.09978077359105017,2,True,standard,4.725636096387842e-05,COMPLETE
1719,172.87576293945312,2026-01-03 13:56:33.131624,2026-01-03 13:56:58.721811,0 days 00:00:25.590187,relu,0.12551255465014322,32,0.07656442897730409,2,True,minmax,4.314943483595494e-05,COMPLETE
1720,140.32855224609375,2026-01-03 13:56:58.729811,2026-01-03 13:57:24.297439,0 days 00:00:25.567628,relu,0.10715982437074857,32,0.07927290330613063,2,True,standard,4.18619399579229e-05,COMPLETE
1721,151.56915283203125,2026-01-03 13:57:24.306440,2026-01-03 13:57:49.937662,0 days 00:00:25.631222,relu,0.11838265240455303,32,0.032754232971631825,2,True,standard,4.149339701768265e-05,COMPLETE
1722,143.3621368408203,2026-01-03 13:57:49.946665,2026-01-03 13:58:15.573349,0 days 00:00:25.626684,relu,0.10662523741939546,31,0.061818202443995766,2,True,standard,5.429812787360272e-05,COMPLETE
1723,142.0496368408203,2026-01-03 13:58:15.582359,2026-01-03 13:58:41.373505,0 days 00:00:25.791146,relu,0.11344160525002396,31,0.09988948827408596,2,True,standard,3.788127762036482e-05,COMPLETE
1724,144.1779327392578,2026-01-03 13:58:41.381508,2026-01-03 13:59:06.993210,0 days 00:00:25.611702,relu,0.13163610383826774,32,0.06976007772056532,2,True,standard,4.244650858655848e-05,COMPLETE
1725,147.53085327148438,2026-01-03 13:59:07.001210,2026-01-03 13:59:32.798045,0 days 00:00:25.796835,relu,0.10716638090359476,31,0.049268859307476286,2,True,standard,4.00357815831848e-05,COMPLETE
1726,142.72293090820312,2026-01-03 13:59:32.806041,2026-01-03 13:59:58.525267,0 days 00:00:25.719226,relu,0.10030795917341581,31,0.08024695309689434,2,True,standard,3.477296560138914e-05,COMPLETE
1727,149.91482543945312,2026-01-03 13:59:58.534267,2026-01-03 14:00:25.837722,0 days 00:00:27.303455,gelu,0.11994438945963568,32,0.08855098946446859,2,True,standard,3.300133476778102e-05,COMPLETE
1728,143.0681915283203,2026-01-03 14:00:25.846726,2026-01-03 14:00:51.487900,0 days 00:00:25.641174,relu,0.10034306117091547,30,0.0716441275412613,2,True,standard,4.931428103174582e-05,COMPLETE
1729,141.34201049804688,2026-01-03 14:00:51.496903,2026-01-03 14:01:17.074530,0 days 00:00:25.577627,relu,0.10000946839192774,30,0.08762608714034298,2,True,standard,3.769127210329936e-05,COMPLETE
1730,143.43026733398438,2026-01-03 14:01:17.082531,2026-01-03 14:01:42.660171,0 days 00:00:25.577640,relu,0.1127496097305439,32,0.08050691042467495,2,True,standard,6.371708946960403e-05,COMPLETE
1731,198.24319803873698,2026-01-03 14:01:42.670171,2026-01-03 14:02:07.962715,0 days 00:00:25.292544,relu,0.12606988892469453,31,0.0009938530254176578,2,False,standard,3.594711939994111e-05,COMPLETE
1732,166.13021850585938,2026-01-03 14:02:07.970715,2026-01-03 14:02:33.714873,0 days 00:00:25.744158,silu,0.10013476880706539,30,0.08824602316721092,2,True,standard,3.127221746252414e-05,COMPLETE
1733,170.22509765625,2026-01-03 14:02:33.722878,2026-01-03 14:02:59.364567,0 days 00:00:25.641689,relu,0.11401534306773974,32,0.062352064301055915,2,True,none,3.646982788446664e-05,COMPLETE
1734,157.21939086914062,2026-01-03 14:02:59.373570,2026-01-03 14:03:24.378227,0 days 00:00:25.004657,relu,0.10768117811673987,15,0.07192499395730578,2,True,standard,4.5462406175140145e-05,COMPLETE
1735,146.37667846679688,2026-01-03 14:03:24.385228,2026-01-03 14:03:50.031312,0 days 00:00:25.646084,relu,0.11930950979517159,30,0.08893897688388083,2,True,standard,2.9829541980203733e-05,COMPLETE
1736,144.2996063232422,2026-01-03 14:03:50.039318,2026-01-03 14:04:15.586888,0 days 00:00:25.547570,relu,0.10715518723188132,29,0.07923502804278958,2,True,standard,2.7549088725939197e-05,COMPLETE
1737,140.95803833007812,2026-01-03 14:04:15.594889,2026-01-03 14:04:41.339565,0 days 00:00:25.744676,relu,0.11335587073693879,31,0.08723401713833392,2,True,standard,3.224041779394623e-05,COMPLETE
1738,154.90908813476562,2026-01-03 14:04:41.347571,2026-01-03 14:05:06.992743,0 days 00:00:25.645172,relu,0.20596632920452565,32,0.07173997890764827,2,True,robust,3.5782106808631246e-05,COMPLETE
1739,141.59828186035156,2026-01-03 14:05:07.000744,2026-01-03 14:05:32.727150,0 days 00:00:25.726406,relu,0.12165812897823894,30,0.09950072904733673,2,True,standard,2.3313006333746412e-05,COMPLETE
1740,166.60317993164062,2026-01-03 14:05:32.735150,2026-01-03 14:05:58.658069,0 days 00:00:25.922919,relu,0.3185790714197738,29,0.0606479392745728,2,True,standard,5.423590682592e-05,COMPLETE
1741,148.20840454101562,2026-01-03 14:05:58.666067,2026-01-03 14:06:21.904193,0 days 00:00:23.238126,relu,0.10732428444295884,32,0.08025958910470056,1,True,standard,2.7004569184215013e-05,COMPLETE
1742,175.746826171875,2026-01-03 14:06:21.912193,2026-01-03 14:06:48.636630,0 days 00:00:26.724437,mish,0.45298710272063253,31,0.09957944191501117,2,True,standard,2.1566308734610837e-05,COMPLETE
1743,145.0902099609375,2026-01-03 14:06:48.644626,2026-01-03 14:07:14.341744,0 days 00:00:25.697118,relu,0.13202245940146773,29,0.07977762692968897,2,True,standard,3.097999786201047e-05,COMPLETE
1744,183.8388214111328,2026-01-03 14:07:14.350744,2026-01-03 14:07:39.971863,0 days 00:00:25.621119,relu,0.273323458319342,31,0.06883164516982289,2,True,minmax,4.2139014247427935e-05,COMPLETE
1745,141.52664184570312,2026-01-03 14:07:39.980867,2026-01-03 14:08:05.487959,0 days 00:00:25.507092,relu,0.10717265106988083,30,0.08822803271730659,2,True,standard,2.6475479324143856e-05,COMPLETE
1746,148.24996948242188,2026-01-03 14:08:05.496470,2026-01-03 14:08:31.094171,0 days 00:00:25.597701,relu,0.11408820645169339,21,0.08878835541422637,2,True,standard,2.375636732687214e-05,COMPLETE
1747,143.96353149414062,2026-01-03 14:08:31.103680,2026-01-03 14:08:56.744356,0 days 00:00:25.640676,relu,0.12538599524449326,28,0.05285355889971866,2,True,standard,2.0384848189701783e-05,COMPLETE
1748,162.25250244140625,2026-01-03 14:08:56.754359,2026-01-03 14:09:23.860436,0 days 00:00:27.106077,gelu,0.10687635265628032,19,0.06992508505385119,2,True,standard,3.653797046430851e-05,COMPLETE
1749,156.5518035888672,2026-01-03 14:09:23.868436,2026-01-03 14:09:49.553237,0 days 00:00:25.684801,relu,0.29418505135686557,32,0.09973934257054055,2,True,standard,3.0166865438438797e-05,COMPLETE
1750,198.1497607421875,2026-01-03 14:09:49.563235,2026-01-03 14:10:14.699196,0 days 00:00:25.135961,relu,0.11564325293005714,30,0.0009942677339795692,2,False,standard,2.5240331768538205e-05,COMPLETE
1751,143.89511108398438,2026-01-03 14:10:14.708200,2026-01-03 14:10:40.522877,0 days 00:00:25.814677,relu,0.10652525580231911,31,0.07949118078873871,2,True,standard,2.1378765053514566e-05,COMPLETE
1752,141.9308624267578,2026-01-03 14:10:40.530876,2026-01-03 14:11:06.129548,0 days 00:00:25.598672,relu,0.11883859119828703,29,0.08834215893825798,2,True,standard,3.427015159531399e-05,COMPLETE
1753,142.37841796875,2026-01-03 14:11:06.137546,2026-01-03 14:11:31.673278,0 days 00:00:25.535732,relu,0.11282111080626842,32,0.06338905654727706,2,True,standard,2.7561182263013773e-05,COMPLETE
1754,143.8616180419922,2026-01-03 14:11:31.682282,2026-01-03 14:11:57.305980,0 days 00:00:25.623698,relu,0.10637536482479112,28,0.09997699589061092,2,True,standard,4.7756160090378496e-05,COMPLETE
1755,144.062744140625,2026-01-03 14:11:57.314990,2026-01-03 14:12:22.980205,0 days 00:00:25.665215,relu,0.1004807454035769,30,0.07863206422805648,2,True,standard,2.4100897713812808e-05,COMPLETE
1756,141.35198974609375,2026-01-03 14:12:22.989206,2026-01-03 14:12:48.646039,0 days 00:00:25.656833,relu,0.1277880346270202,32,0.07187403106463115,2,True,standard,3.081871860021533e-05,COMPLETE
1757,169.8846435546875,2026-01-03 14:12:48.654040,2026-01-03 14:13:14.379149,0 days 00:00:25.725109,silu,0.10021582098006895,27,0.09993533010293203,2,True,none,1.889867283301365e-05,COMPLETE
1758,141.06103515625,2026-01-03 14:13:14.388152,2026-01-03 14:13:40.136754,0 days 00:00:25.748602,relu,0.11990479931813201,30,0.08710965577977982,2,True,standard,4.1354768333534874e-05,COMPLETE
1759,142.59292602539062,2026-01-03 14:13:40.144754,2026-01-03 14:14:05.724309,0 days 00:00:25.579555,relu,0.11303374034257882,28,0.07968796635284162,2,True,standard,2.235736155628947e-05,COMPLETE
1760,140.03372192382812,2026-01-03 14:14:05.732308,2026-01-03 14:14:31.440705,0 days 00:00:25.708397,relu,0.10021180278502369,31,0.060679977304824745,2,True,standard,6.016798787334712e-05,COMPLETE
1761,141.91476440429688,2026-01-03 14:14:31.448708,2026-01-03 14:14:57.144544,0 days 00:00:25.695836,relu,0.11310179577786285,31,0.08784294742013328,2,True,standard,2.6456979314395276e-05,COMPLETE
1762,140.52365112304688,2026-01-03 14:14:57.152542,2026-01-03 14:15:22.786558,0 days 00:00:25.634016,relu,0.10693348509190868,32,0.07335760962388652,2,True,standard,3.000016740150257e-05,COMPLETE
1763,146.6234893798828,2026-01-03 14:15:22.794556,2026-01-03 14:15:48.531047,0 days 00:00:25.736491,relu,0.12347631081042221,29,0.08895247467212014,2,True,robust,3.3155232405254245e-05,COMPLETE
1764,145.69692993164062,2026-01-03 14:15:48.539050,2026-01-03 14:16:14.228875,0 days 00:00:25.689825,relu,0.134051745461654,30,0.06770069809148457,2,True,standard,1.8069905218331407e-05,COMPLETE
1765,143.542236328125,2026-01-03 14:16:14.238876,2026-01-03 14:16:39.864769,0 days 00:00:25.625893,relu,0.1069313671001727,29,0.07939554570066917,2,True,standard,2.0492568361634662e-05,COMPLETE
1766,139.50352478027344,2026-01-03 14:16:39.874272,2026-01-03 14:17:05.553837,0 days 00:00:25.679565,relu,0.10004250654874934,32,0.088672084101751,2,True,standard,2.367912513120909e-05,COMPLETE
1767,146.6802520751953,2026-01-03 14:17:05.562837,2026-01-03 14:17:31.437305,0 days 00:00:25.874468,relu,0.11765527498890502,30,0.05409615252985942,2,True,standard,3.79969067655336e-05,COMPLETE
1768,174.42166137695312,2026-01-03 14:17:31.445306,2026-01-03 14:17:57.145347,0 days 00:00:25.700041,relu,0.1661997569651229,27,0.09926631766677939,2,True,minmax,4.022898545516283e-06,COMPLETE
1769,158.96372985839844,2026-01-03 14:17:57.155351,2026-01-03 14:18:23.444394,0 days 00:00:26.289043,mish,0.1001560388937434,24,0.09995216670194015,2,True,standard,0.000509605052781617,COMPLETE
1770,198.19486463758682,2026-01-03 14:18:23.452396,2026-01-03 14:18:48.515715,0 days 00:00:25.063319,relu,0.1000423973236939,32,0.000994216875438644,2,False,standard,2.9351419159100902e-05,COMPLETE
1771,189.1182403564453,2026-01-03 14:18:48.524715,2026-01-03 14:19:13.393019,0 days 00:00:24.868304,relu,0.11343603124786072,5,0.09992092822496201,2,True,standard,2.5428646549401943e-05,COMPLETE
1772,149.7288360595703,2026-01-03 14:19:13.400527,2026-01-03 14:19:39.068465,0 days 00:00:25.667938,relu,0.12418744810931448,28,0.0729455659146147,2,True,standard,1.4522469087149242e-05,COMPLETE
1773,162.89450073242188,2026-01-03 14:19:39.077468,2026-01-03 14:20:06.727764,0 days 00:00:27.650296,gelu,0.3746874962865522,31,0.08129442157827699,2,True,standard,1.9830608701975778e-05,COMPLETE
1774,147.72276306152344,2026-01-03 14:20:06.736765,2026-01-03 14:20:32.424801,0 days 00:00:25.688036,relu,0.11150587229260525,30,0.061845765122485574,2,True,standard,2.7516992685718476e-05,COMPLETE
1775,143.7671356201172,2026-01-03 14:20:32.431801,2026-01-03 14:20:58.234762,0 days 00:00:25.802961,relu,0.10002018326456248,29,0.07950363227099631,2,True,standard,3.414784725855793e-05,COMPLETE
1776,141.1038055419922,2026-01-03 14:20:58.243762,2026-01-03 14:21:24.168965,0 days 00:00:25.925203,relu,0.10816723624456621,31,0.08774326413165513,2,True,standard,2.160456917931753e-05,COMPLETE
1777,141.90492248535156,2026-01-03 14:21:24.176965,2026-01-03 14:21:49.887383,0 days 00:00:25.710418,relu,0.11980495997143173,32,0.06855440064459493,2,True,standard,2.3485402556455353e-05,COMPLETE
1778,180.5884552001953,2026-01-03 14:21:49.896383,2026-01-03 14:22:12.997821,0 days 00:00:23.101438,relu,0.13086448627466962,30,0.0016545092628021472,1,True,standard,4.065532934947361e-05,COMPLETE
1779,143.6988067626953,2026-01-03 14:22:13.006824,2026-01-03 14:22:38.690393,0 days 00:00:25.683569,relu,0.10807736487101105,28,0.08744086485197335,2,True,standard,1.830024618713818e-05,COMPLETE
1780,166.79415893554688,2026-01-03 14:22:38.698393,2026-01-03 14:23:04.640633,0 days 00:00:25.942240,silu,0.10006539363021887,32,0.07343844053704966,2,True,standard,2.7032733186088073e-05,COMPLETE
