number,value,datetime_start,datetime_complete,duration,params_activation,params_dropout,params_hidden_size,params_lr,params_n_layers,params_scale_target,params_scaler,params_weight_decay,state
1892,140.03897094726562,2026-01-03 15:10:39.479396,2026-01-03 15:11:05.234462,0 days 00:00:25.755066,relu,0.10806294627399053,31,0.0873122501573977,2,True,standard,3.799614468192041e-05,COMPLETE
1893,145.50900268554688,2026-01-03 15:11:05.243466,2026-01-03 15:11:30.810093,0 days 00:00:25.566627,relu,0.11892835715899734,30,0.058399221489392854,2,True,standard,4.1213671777139294e-05,COMPLETE
1894,138.93182373046875,2026-01-03 15:11:30.820097,2026-01-03 15:11:56.399956,0 days 00:00:25.579859,relu,0.10014111842532512,32,0.07985731746335029,2,True,standard,3.3351109881191744e-05,COMPLETE
1895,142.743896484375,2026-01-03 15:11:56.407956,2026-01-03 15:12:22.253847,0 days 00:00:25.845891,relu,0.13687937099196448,30,0.08768451270610136,2,True,standard,5.097992717148881e-05,COMPLETE
1896,168.68069458007812,2026-01-03 15:12:22.262847,2026-01-03 15:12:46.358655,0 days 00:00:24.095808,gelu,0.10774973511605071,31,0.04812230978914645,1,True,standard,3.103318717605574e-05,COMPLETE
1897,186.1114501953125,2026-01-03 15:12:46.366655,2026-01-03 15:13:11.970312,0 days 00:00:25.603657,relu,0.47354914489239375,32,0.01759081491855266,2,True,standard,4.4080388296253906e-05,COMPLETE
1898,144.9664306640625,2026-01-03 15:13:11.979313,2026-01-03 15:13:37.715332,0 days 00:00:25.736019,relu,0.1266229300399087,30,0.06582008464682837,2,True,standard,2.96329114209836e-05,COMPLETE
1899,146.47622680664062,2026-01-03 15:13:37.724335,2026-01-03 15:14:03.487826,0 days 00:00:25.763491,relu,0.11232532017981685,30,0.07290894468241835,2,True,standard,3.6528300723931766e-05,COMPLETE
1900,173.6758270263672,2026-01-03 15:14:03.495831,2026-01-03 15:14:29.110619,0 days 00:00:25.614788,silu,0.32799524410345626,32,0.08674379624331695,2,True,standard,3.0668588499425195e-05,COMPLETE
1901,198.10991556803384,2026-01-03 15:14:29.118618,2026-01-03 15:14:54.260697,0 days 00:00:25.142079,relu,0.11783176922454193,31,0.000994154810154737,2,False,standard,6.0704011331216896e-05,COMPLETE
1902,143.82073974609375,2026-01-03 15:14:54.269699,2026-01-03 15:15:19.969840,0 days 00:00:25.700141,relu,0.10811022843461292,29,0.07822027288591432,2,True,standard,2.902513411115694e-05,COMPLETE
1903,171.7818145751953,2026-01-03 15:15:19.977841,2026-01-03 15:15:45.589900,0 days 00:00:25.612059,relu,0.10743469963929775,32,0.08946197521713854,2,True,none,3.656349209468638e-05,COMPLETE
1904,175.47769165039062,2026-01-03 15:15:45.597900,2026-01-03 15:16:11.332883,0 days 00:00:25.734983,relu,0.4107691129641359,31,0.06052742769696405,2,True,standard,4.17760282167388e-05,COMPLETE
1905,160.19857788085938,2026-01-03 15:16:11.340390,2026-01-03 15:16:36.968446,0 days 00:00:25.628056,relu,0.2562200245346206,30,0.07212506755201288,2,True,standard,4.091297619586456e-06,COMPLETE
1906,140.6478729248047,2026-01-03 15:16:36.976445,2026-01-03 15:17:02.609691,0 days 00:00:25.633246,relu,0.12134411606056948,30,0.0880841106542752,2,True,standard,3.187783117907502e-05,COMPLETE
1907,150.2997283935547,2026-01-03 15:17:02.617691,2026-01-03 15:17:28.240203,0 days 00:00:25.622512,relu,0.13194918208801287,32,0.07714722329000291,2,True,robust,2.7917520017600497e-05,COMPLETE
1908,140.58602905273438,2026-01-03 15:17:28.248714,2026-01-03 15:17:53.904879,0 days 00:00:25.656165,relu,0.10016972250797238,31,0.0862718978732589,2,True,standard,4.993463274897147e-05,COMPLETE
1909,166.32073974609375,2026-01-03 15:17:53.913882,2026-01-03 15:18:19.493523,0 days 00:00:25.579641,relu,0.11381878171815854,29,0.013997830191317165,2,True,standard,2.8844795658952092e-05,COMPLETE
1910,140.4141082763672,2026-01-03 15:18:19.503524,2026-01-03 15:18:45.084954,0 days 00:00:25.581430,relu,0.10008515254874685,32,0.06542357554718015,2,True,standard,3.35910440841749e-05,COMPLETE
1911,141.8602752685547,2026-01-03 15:18:45.092954,2026-01-03 15:19:10.706342,0 days 00:00:25.613388,relu,0.11386275978185782,30,0.07958798484219223,2,True,standard,2.6509952881366138e-05,COMPLETE
1912,156.4141845703125,2026-01-03 15:19:10.714344,2026-01-03 15:19:36.341277,0 days 00:00:25.626933,relu,0.3018246732712317,29,0.08930842675813686,2,True,standard,3.7853143649125355e-05,COMPLETE
1913,187.9963836669922,2026-01-03 15:19:36.351286,2026-01-03 15:20:03.030108,0 days 00:00:26.678822,mish,0.10718723365631884,31,0.056537798712641495,2,True,minmax,2.5101975678234825e-05,COMPLETE
1914,198.64462280273438,2026-01-03 15:20:03.038112,2026-01-03 15:20:28.235635,0 days 00:00:25.197523,relu,0.12280129281888334,13,0.0004210117992354394,2,True,standard,6.887822891335159e-05,COMPLETE
1915,141.1615753173828,2026-01-03 15:20:28.243634,2026-01-03 15:20:53.732179,0 days 00:00:25.488545,relu,0.10729787277119467,30,0.09994605479886169,2,True,standard,4.821594099561556e-06,COMPLETE
1916,150.89256286621094,2026-01-03 15:20:53.741179,2026-01-03 15:21:19.335617,0 days 00:00:25.594438,relu,0.2317705800875405,32,0.0998634866742554,2,True,standard,4.391343423619175e-05,COMPLETE
1917,142.09193420410156,2026-01-03 15:21:19.343617,2026-01-03 15:21:44.937468,0 days 00:00:25.593851,relu,0.10010863568211552,32,0.07257006906164325,2,True,standard,3.122246952626175e-05,COMPLETE
1918,143.21717834472656,2026-01-03 15:21:44.948471,2026-01-03 15:22:12.496724,0 days 00:00:27.548253,gelu,0.11820940953015013,30,0.09985741569550836,2,True,standard,2.371371544501592e-05,COMPLETE
1919,147.25790405273438,2026-01-03 15:22:12.505728,2026-01-03 15:22:38.200787,0 days 00:00:25.695059,relu,0.1135425873440293,29,0.0803781136855189,2,True,standard,3.4150366640288863e-06,COMPLETE
1920,198.23507195366756,2026-01-03 15:22:38.211787,2026-01-03 15:23:03.297326,0 days 00:00:25.085539,relu,0.1298056441346245,31,0.00099506641797164,2,False,standard,2.76836907899597e-05,COMPLETE
1921,140.55384826660156,2026-01-03 15:23:03.306329,2026-01-03 15:23:28.965812,0 days 00:00:25.659483,relu,0.10735330717667399,29,0.06541772937582134,2,True,standard,3.702825409675116e-05,COMPLETE
1922,142.30943298339844,2026-01-03 15:23:28.975812,2026-01-03 15:23:54.675497,0 days 00:00:25.699685,relu,0.11890405939567839,31,0.08611987810006459,2,True,standard,2.2957980565976466e-05,COMPLETE
1923,139.95556640625,2026-01-03 15:23:54.683498,2026-01-03 15:24:20.275970,0 days 00:00:25.592472,relu,0.10835567485303886,32,0.07293241075172359,2,True,standard,3.374033864788641e-05,COMPLETE
1924,166.83226013183594,2026-01-03 15:24:20.283971,2026-01-03 15:24:46.222004,0 days 00:00:25.938033,silu,0.10680468371729111,30,0.052036214153178745,2,True,standard,2.5584342556259723e-05,COMPLETE
1925,144.4325714111328,2026-01-03 15:24:46.232005,2026-01-03 15:25:11.887613,0 days 00:00:25.655608,relu,0.12548858169056445,28,0.08889975535607582,2,True,standard,5.913243093032664e-06,COMPLETE
1926,143.41685485839844,2026-01-03 15:25:11.896623,2026-01-03 15:25:37.542311,0 days 00:00:25.645688,relu,0.1175975331312749,32,0.08033543234386854,2,True,standard,2.9421941454542703e-05,COMPLETE
1927,174.74905395507812,2026-01-03 15:25:37.551310,2026-01-03 15:26:02.788889,0 days 00:00:25.237579,relu,0.11343437738065314,18,0.08806385009495249,2,True,none,2.1657781108771264e-05,COMPLETE
1928,141.7433624267578,2026-01-03 15:26:02.798891,2026-01-03 15:26:28.474981,0 days 00:00:25.676090,relu,0.1066014384896931,29,0.06962745388864312,2,True,standard,4.325068457855919e-05,COMPLETE
1929,141.91677856445312,2026-01-03 15:26:28.483981,2026-01-03 15:26:54.244076,0 days 00:00:25.760095,relu,0.1128309766743959,31,0.08786812820186653,2,True,standard,3.2919140708052605e-05,COMPLETE
1930,140.42831420898438,2026-01-03 15:26:54.252076,2026-01-03 15:27:20.018883,0 days 00:00:25.766807,relu,0.12435412643488279,31,0.09960421926640779,2,True,standard,2.7006276784927143e-05,COMPLETE
1931,214.73880004882812,2026-01-03 15:27:20.028389,2026-01-03 15:27:45.571088,0 days 00:00:25.542699,relu,0.1384228866501998,29,0.00016965013532951607,2,True,robust,2.0707133719051308e-05,COMPLETE
1932,142.40744018554688,2026-01-03 15:27:45.579093,2026-01-03 15:28:11.575823,0 days 00:00:25.996730,relu,0.11323262384485239,30,0.06245652328341192,2,True,standard,2.5198864427047854e-05,COMPLETE
1933,152.653076171875,2026-01-03 15:28:11.586821,2026-01-03 15:28:34.943468,0 days 00:00:23.356647,relu,0.10708521654612937,32,0.03559208296913523,1,True,standard,0.00013213202458122107,COMPLETE
1934,142.47772216796875,2026-01-03 15:28:34.950468,2026-01-03 15:29:00.677518,0 days 00:00:25.727050,relu,0.10028449546757931,28,0.09986645663403794,2,True,standard,5.6435167037367564e-05,COMPLETE
1935,139.7836151123047,2026-01-03 15:29:00.686518,2026-01-03 15:29:26.405916,0 days 00:00:25.719398,relu,0.10021412515676854,30,0.07890034965372253,2,True,standard,3.759579834923894e-05,COMPLETE
1936,141.83340454101562,2026-01-03 15:29:26.413916,2026-01-03 15:29:52.069990,0 days 00:00:25.656074,relu,0.10006953305183347,32,0.07473100111636959,2,True,standard,3.18704642696958e-05,COMPLETE
1937,180.85946655273438,2026-01-03 15:29:52.077990,2026-01-03 15:30:18.820847,0 days 00:00:26.742857,mish,0.12023122894708346,31,0.0884827632979026,2,True,minmax,2.2743888564960294e-05,COMPLETE
1938,369.83487318250866,2026-01-03 15:30:18.828847,2026-01-03 15:30:43.880285,0 days 00:00:25.051438,relu,0.1076058408031011,28,1.245624090994398e-05,2,False,standard,2.8339278968921285e-05,COMPLETE
1939,143.8286895751953,2026-01-03 15:30:43.888285,2026-01-03 15:31:09.983432,0 days 00:00:26.095147,relu,0.12926286235003315,30,0.0707678846987383,2,True,standard,1.9414823237731244e-05,COMPLETE
1940,140.98223876953125,2026-01-03 15:31:09.992429,2026-01-03 15:31:35.816697,0 days 00:00:25.824268,relu,0.1151517369453842,32,0.07976435751090473,2,True,standard,4.893391052514539e-05,COMPLETE
1941,143.41673278808594,2026-01-03 15:31:35.824701,2026-01-03 15:32:01.434183,0 days 00:00:25.609482,relu,0.10663629461840776,29,0.05812615499514334,2,True,standard,2.606767152595839e-05,COMPLETE
1942,145.26840209960938,2026-01-03 15:32:01.442187,2026-01-03 15:32:28.896016,0 days 00:00:27.453829,gelu,0.14764701543489775,30,0.08806318278279555,2,True,standard,0.00014847323377104605,COMPLETE
1943,141.98414611816406,2026-01-03 15:32:28.904016,2026-01-03 15:32:54.570532,0 days 00:00:25.666516,relu,0.11902737270754589,32,0.06688933239422991,2,True,standard,2.3606353125211852e-05,COMPLETE
1944,160.38482666015625,2026-01-03 15:32:54.579533,2026-01-03 15:33:19.686569,0 days 00:00:25.107036,relu,0.1070399831338021,12,0.08887364698221242,2,True,standard,3.275770107332371e-05,COMPLETE
1945,142.0251007080078,2026-01-03 15:33:19.694569,2026-01-03 15:33:45.338678,0 days 00:00:25.644109,relu,0.12504038145599045,31,0.09967731946557823,2,True,standard,2.0313816227402277e-05,COMPLETE
1946,142.78384399414062,2026-01-03 15:33:45.348678,2026-01-03 15:34:10.995784,0 days 00:00:25.647106,relu,0.10018731433167484,30,0.07875568249943475,2,True,standard,4.063806577880263e-05,COMPLETE
1947,146.99606323242188,2026-01-03 15:34:11.002789,2026-01-03 15:34:36.678833,0 days 00:00:25.676044,relu,0.1131807678714822,32,0.07468921480117506,2,True,standard,2.205474947986236e-05,COMPLETE
1948,141.31753540039062,2026-01-03 15:34:36.686344,2026-01-03 15:35:02.240817,0 days 00:00:25.554473,relu,0.11381952933835097,28,0.08860537810306228,2,True,standard,2.959265042564816e-05,COMPLETE
1949,141.74017333984375,2026-01-03 15:35:02.249819,2026-01-03 15:35:27.831327,0 days 00:00:25.581508,relu,0.10001580980151059,29,0.06705926969605568,2,True,standard,1.8562325500708567e-05,COMPLETE
1950,144.12762451171875,2026-01-03 15:35:27.840327,2026-01-03 15:35:53.543791,0 days 00:00:25.703464,relu,0.13607071220163358,31,0.08894811973204607,2,True,standard,2.568204022419271e-05,COMPLETE
1951,159.5947265625,2026-01-03 15:35:53.552787,2026-01-03 15:36:19.652820,0 days 00:00:26.100033,silu,0.12068940013615674,31,0.09970549485219901,2,True,standard,3.0605872406817925e-05,COMPLETE
1952,193.95889282226562,2026-01-03 15:36:19.660820,2026-01-03 15:36:44.553291,0 days 00:00:24.892471,relu,0.11228769353482454,6,0.07747953773915052,2,True,none,3.5872554389765626e-05,COMPLETE
1953,142.98977661132812,2026-01-03 15:36:44.561294,2026-01-03 15:37:10.085322,0 days 00:00:25.524028,relu,0.10777760142163294,29,0.06338841492288354,2,True,standard,2.2411797395997145e-05,COMPLETE
1954,143.95623779296875,2026-01-03 15:37:10.093327,2026-01-03 15:37:35.538749,0 days 00:00:25.445422,relu,0.12969460150386175,32,0.08019402268923707,2,True,standard,2.823437397696697e-05,COMPLETE
1955,154.2664031982422,2026-01-03 15:37:35.547750,2026-01-03 15:38:01.071827,0 days 00:00:25.524077,relu,0.10705944072163949,30,0.049874578640254935,2,True,robust,2.473052757335508e-05,COMPLETE
1956,140.4593505859375,2026-01-03 15:38:01.080829,2026-01-03 15:38:26.624678,0 days 00:00:25.543849,relu,0.11936312351771972,28,0.08824063837437715,2,True,standard,3.702273502766308e-05,COMPLETE
1957,198.21869717068142,2026-01-03 15:38:26.633681,2026-01-03 15:38:51.606492,0 days 00:00:24.972811,relu,0.10015025395573524,32,0.0009947249933966668,2,False,standard,1.7785596906889947e-05,COMPLETE
1958,144.83157348632812,2026-01-03 15:38:51.613492,2026-01-03 15:39:17.242032,0 days 00:00:25.628540,relu,0.11220881716057349,30,0.0708922484168397,2,True,standard,4.391145721851822e-05,COMPLETE
1959,142.89340209960938,2026-01-03 15:39:17.250032,2026-01-03 15:39:42.920106,0 days 00:00:25.670074,relu,0.1072718204671636,30,0.09996432957258217,2,True,standard,3.233792260424495e-05,COMPLETE
1960,139.82113647460938,2026-01-03 15:39:42.928614,2026-01-03 15:40:08.519508,0 days 00:00:25.590894,relu,0.1198687265565061,32,0.08121415975045033,2,True,standard,6.466437130739354e-05,COMPLETE
1961,187.2197723388672,2026-01-03 15:40:08.527512,2026-01-03 15:40:34.987170,0 days 00:00:26.459658,mish,0.10007267519164333,29,0.059629431432563246,2,True,minmax,2.15940849448297e-05,COMPLETE
1962,141.5394744873047,2026-01-03 15:40:34.996170,2026-01-03 15:41:00.613502,0 days 00:00:25.617332,relu,0.11363811036289614,31,0.0886747783486807,2,True,standard,0.0001731802643663187,COMPLETE
1963,146.37156677246094,2026-01-03 15:41:00.622506,2026-01-03 15:41:26.155622,0 days 00:00:25.533116,relu,0.10686618365839586,28,0.07539406189038748,2,True,standard,2.740247212058693e-05,COMPLETE
1964,145.5579071044922,2026-01-03 15:41:26.163622,2026-01-03 15:41:51.787227,0 days 00:00:25.623605,relu,0.12672810248407554,30,0.08742943628130886,2,True,standard,6.110651177421893e-06,COMPLETE
1965,144.00587463378906,2026-01-03 15:41:51.795227,2026-01-03 15:42:17.490732,0 days 00:00:25.695505,relu,0.11418212422716038,31,0.07055961499913518,2,True,standard,7.679028102934764e-05,COMPLETE
1966,144.6134490966797,2026-01-03 15:42:17.499732,2026-01-03 15:42:44.752464,0 days 00:00:27.252732,gelu,0.1002112207975831,32,0.07991867301975934,2,True,standard,1.9037705021195054e-05,COMPLETE
1967,145.8476104736328,2026-01-03 15:42:44.760465,2026-01-03 15:43:10.283501,0 days 00:00:25.523036,relu,0.10756686270932396,28,0.08819630272284248,2,True,standard,0.00013460714443873993,COMPLETE
1968,202.9949493408203,2026-01-03 15:43:10.291499,2026-01-03 15:43:35.809917,0 days 00:00:25.518418,relu,0.10001778228905495,29,0.00012485115158870948,2,True,standard,2.4861830228743255e-05,COMPLETE
1969,142.51626586914062,2026-01-03 15:43:35.818920,2026-01-03 15:44:01.364856,0 days 00:00:25.545936,relu,0.1197113193651479,32,0.06853172398920884,2,True,standard,5.343837240138019e-05,COMPLETE
1970,141.26904296875,2026-01-03 15:44:01.372856,2026-01-03 15:44:27.016838,0 days 00:00:25.643982,relu,0.11302614444228012,30,0.099562246464798,2,True,standard,3.040379353079598e-05,COMPLETE
1971,151.8094482421875,2026-01-03 15:44:27.023838,2026-01-03 15:44:50.224858,0 days 00:00:23.201020,relu,0.12495231889960652,31,0.056363063734988776,1,True,standard,3.684801143086401e-05,COMPLETE
1972,166.89236450195312,2026-01-03 15:44:50.233860,2026-01-03 15:45:15.939413,0 days 00:00:25.705553,silu,0.10838431603955397,27,0.07940046865655138,2,True,standard,2.1039845022139077e-05,COMPLETE
1973,150.9473876953125,2026-01-03 15:45:15.948416,2026-01-03 15:45:41.450372,0 days 00:00:25.501956,relu,0.1306144908905712,25,0.08720368475859928,2,True,standard,1.6873571135658704e-05,COMPLETE
1974,140.66969299316406,2026-01-03 15:45:41.459373,2026-01-03 15:46:07.005241,0 days 00:00:25.545868,relu,0.10770813163225518,31,0.09984674031852411,2,True,standard,2.442419165375423e-05,COMPLETE
1975,172.29869079589844,2026-01-03 15:46:07.013241,2026-01-03 15:46:32.699867,0 days 00:00:25.686626,relu,0.11864435111103998,29,0.09992056982209715,2,True,none,4.150443436995978e-05,COMPLETE
1976,142.54696655273438,2026-01-03 15:46:32.707867,2026-01-03 15:46:58.348409,0 days 00:00:25.640542,relu,0.11362443468299008,32,0.06600283040179898,2,True,standard,2.8121674748959537e-05,COMPLETE
1977,139.9422149658203,2026-01-03 15:46:58.357409,2026-01-03 15:47:24.047985,0 days 00:00:25.690576,relu,0.10747389471106106,30,0.07768275953891993,2,True,standard,3.14445609301519e-05,COMPLETE
1978,198.0226582845052,2026-01-03 15:47:24.055985,2026-01-03 15:47:49.211374,0 days 00:00:25.155389,relu,0.10689799158157451,31,0.0009936369336816621,2,False,standard,2.287931441345599e-05,COMPLETE
1979,142.31326293945312,2026-01-03 15:47:49.220378,2026-01-03 15:48:15.119840,0 days 00:00:25.899462,relu,0.1362226572830746,30,0.08838047539625542,2,True,standard,4.753027621514232e-05,COMPLETE
1980,145.2276153564453,2026-01-03 15:48:15.126840,2026-01-03 15:48:40.764475,0 days 00:00:25.637635,relu,0.12008806474496557,27,0.07496281576608366,2,True,standard,1.968122194974024e-05,COMPLETE
1981,148.8350067138672,2026-01-03 15:48:40.773475,2026-01-03 15:49:06.269846,0 days 00:00:25.496371,relu,0.11397969115655306,32,0.06173461046969152,2,True,robust,2.830316758526672e-05,COMPLETE
1982,141.3299560546875,2026-01-03 15:49:06.278849,2026-01-03 15:49:31.951960,0 days 00:00:25.673111,relu,0.10611556863682016,29,0.08924542940120746,2,True,standard,2.5337640410052708e-05,COMPLETE
1983,143.35743713378906,2026-01-03 15:49:31.959960,2026-01-03 15:49:57.712952,0 days 00:00:25.752992,relu,0.12500154063528673,30,0.07894627385305812,2,True,standard,3.160802314517807e-05,COMPLETE
1984,151.11984252929688,2026-01-03 15:49:57.720955,2026-01-03 15:50:24.340127,0 days 00:00:26.619172,mish,0.10033984515342373,32,0.08876935062821041,2,True,standard,2.1838859497796418e-05,COMPLETE
1985,143.65020751953125,2026-01-03 15:50:24.348128,2026-01-03 15:50:50.094676,0 days 00:00:25.746548,relu,0.11386456200996306,28,0.07020224315986527,2,True,standard,3.5929016448609166e-05,COMPLETE
1986,181.4705047607422,2026-01-03 15:50:50.103190,2026-01-03 15:51:18.849152,0 days 00:00:28.745962,relu,0.10689137411903714,31,0.04205811743652605,2,True,minmax,1.706304156814631e-05,COMPLETE
1987,141.54129028320312,2026-01-03 15:51:18.856153,2026-01-03 15:51:44.555751,0 days 00:00:25.699598,relu,0.11962558903967596,29,0.09952029509139827,2,True,standard,2.631885461666483e-05,COMPLETE
1988,143.32943725585938,2026-01-03 15:51:44.565751,2026-01-03 15:52:10.460958,0 days 00:00:25.895207,relu,0.10710980011110746,31,0.08096641448965376,2,True,standard,3.4107105836107325e-05,COMPLETE
1989,142.1324920654297,2026-01-03 15:52:10.468957,2026-01-03 15:52:36.138618,0 days 00:00:25.669661,relu,0.10008127262352402,32,0.072160721772257,2,True,standard,1.9227744759959664e-05,COMPLETE
1990,178.4432830810547,2026-01-03 15:52:36.145618,2026-01-03 15:53:01.805178,0 days 00:00:25.659560,relu,0.12812884854796108,30,0.004678920363628526,2,True,standard,7.028100894744518e-06,COMPLETE
1991,145.69277954101562,2026-01-03 15:53:01.815178,2026-01-03 15:53:27.124672,0 days 00:00:25.309494,relu,0.11355228081632923,21,0.09967209237922281,2,True,standard,2.3685792697165955e-05,COMPLETE
1992,167.04466247558594,2026-01-03 15:53:27.133674,2026-01-03 15:53:53.894099,0 days 00:00:26.760425,gelu,0.10001309321719665,11,0.05762142358001201,2,True,standard,3.979460388474236e-05,COMPLETE
1993,144.21487426757812,2026-01-03 15:53:53.903100,2026-01-03 15:54:19.534472,0 days 00:00:25.631372,relu,0.11996978442182182,29,0.08832663215076425,2,True,standard,2.819250902417902e-05,COMPLETE
1994,139.76693725585938,2026-01-03 15:54:19.543475,2026-01-03 15:54:45.146392,0 days 00:00:25.602917,relu,0.10755252614434158,32,0.07980365998243373,2,True,standard,2.073324449942644e-05,COMPLETE
1995,198.0309051513672,2026-01-03 15:54:45.155903,2026-01-03 15:55:10.335772,0 days 00:00:25.179869,relu,0.10015961432227831,30,0.0009948995700341146,2,False,standard,0.00014832272978594833,COMPLETE
1996,197.8342742919922,2026-01-03 15:55:10.345778,2026-01-03 15:55:36.153700,0 days 00:00:25.807922,silu,0.14218230846527813,28,0.00034088660844718867,2,True,standard,0.0009919995494658983,COMPLETE
1997,141.0260467529297,2026-01-03 15:55:36.162207,2026-01-03 15:56:01.904189,0 days 00:00:25.741982,relu,0.11306787571028047,31,0.09969591898975527,2,True,standard,3.4407889283513396e-05,COMPLETE
1998,140.345947265625,2026-01-03 15:56:01.912189,2026-01-03 15:56:27.525096,0 days 00:00:25.612907,relu,0.12322478415008814,32,0.06533851005712046,2,True,standard,0.0001251949742873389,COMPLETE
1999,171.15316772460938,2026-01-03 15:56:27.533095,2026-01-03 15:56:53.067160,0 days 00:00:25.534065,relu,0.10013115036630513,27,0.07932515032501307,2,True,none,1.6497700044110003e-05,COMPLETE
