number,value,datetime_start,datetime_complete,duration,params_activation,params_dropout,params_hidden_size,params_lr,params_n_layers,params_scale_target,params_scaler,params_weight_decay,state
781,187.32717895507812,2026-01-03 06:54:15.489377,2026-01-03 06:54:42.284677,0 days 00:00:26.795300,relu,0.11943759543663827,30,0.0019166277832935467,2,True,standard,2.878182050522368e-05,COMPLETE
782,198.14529391818576,2026-01-03 06:54:42.291677,2026-01-03 06:55:08.387477,0 days 00:00:26.095800,relu,0.12650544673396438,29,0.0009947963975870152,2,False,standard,1.9373406674887964e-05,COMPLETE
783,149.486083984375,2026-01-03 06:55:08.396481,2026-01-03 06:55:32.568753,0 days 00:00:24.172272,relu,0.13829593152258743,31,0.08751330987291606,1,True,standard,2.4246040576125364e-05,COMPLETE
784,174.9910125732422,2026-01-03 06:55:32.577751,2026-01-03 06:55:59.419541,0 days 00:00:26.841790,silu,0.1148299790976651,30,0.0045904323419440115,2,True,none,1.7406836502053212e-05,COMPLETE
785,137.81997680664062,2026-01-03 06:55:59.427542,2026-01-03 06:56:26.137851,0 days 00:00:26.710309,relu,0.11897615829665938,32,0.09921703726346581,2,True,standard,2.2034957438819714e-05,COMPLETE
786,141.5208282470703,2026-01-03 06:56:26.145852,2026-01-03 06:56:52.850163,0 days 00:00:26.704311,relu,0.11651473873349227,29,0.0891587097786119,2,True,standard,2.3218137934722855e-05,COMPLETE
787,141.3011474609375,2026-01-03 06:56:52.860166,2026-01-03 06:57:19.707956,0 days 00:00:26.847790,relu,0.11506753692234145,32,0.07419163575811964,2,True,standard,2.837490923354661e-05,COMPLETE
788,143.98904418945312,2026-01-03 06:57:19.715957,2026-01-03 06:57:46.525240,0 days 00:00:26.809283,relu,0.11995556700522676,30,0.09943482656443484,2,True,standard,3.163330861009548e-05,COMPLETE
789,152.05465698242188,2026-01-03 06:57:46.534240,2026-01-03 06:58:13.328533,0 days 00:00:26.794293,relu,0.11469818660712955,29,0.09906882999244816,2,True,robust,2.173980951185167e-05,COMPLETE
790,140.14306640625,2026-01-03 06:58:13.337536,2026-01-03 06:58:40.232327,0 days 00:00:26.894791,relu,0.12412222757867206,31,0.09955867328520931,2,True,standard,2.543943710525035e-05,COMPLETE
791,179.63101196289062,2026-01-03 06:58:40.241326,2026-01-03 06:59:07.000117,0 days 00:00:26.758791,relu,0.1107139316804597,32,0.0034580014356706944,2,True,standard,2.2139351182423537e-05,COMPLETE
792,142.48660278320312,2026-01-03 06:59:07.009115,2026-01-03 06:59:33.781452,0 days 00:00:26.772337,relu,0.11360799402137446,31,0.08023324632887895,2,True,standard,2.5938547942004556e-05,COMPLETE
793,143.70999145507812,2026-01-03 06:59:33.790453,2026-01-03 07:00:00.505226,0 days 00:00:26.714773,relu,0.12111454252902597,29,0.06324924120887199,2,True,standard,0.0004586886445129359,COMPLETE
794,182.3236541748047,2026-01-03 07:00:00.513225,2026-01-03 07:00:28.037532,0 days 00:00:27.524307,mish,0.10988698848259826,30,0.09953536730494382,2,True,minmax,1.8713728546895537e-05,COMPLETE
795,143.59710693359375,2026-01-03 07:00:28.045532,2026-01-03 07:00:54.614821,0 days 00:00:26.569289,relu,0.12754895265946598,32,0.08023706766116369,2,True,standard,3.08930454334811e-05,COMPLETE
796,140.4716339111328,2026-01-03 07:00:54.622825,2026-01-03 07:01:21.423114,0 days 00:00:26.800289,relu,0.11625273417685883,30,0.07150692004025436,2,True,standard,2.2066114718271383e-05,COMPLETE
797,144.3146209716797,2026-01-03 07:01:21.432112,2026-01-03 07:01:48.185885,0 days 00:00:26.753773,relu,0.10791242453832245,29,0.08714126683245299,2,True,standard,1.956648022447359e-05,COMPLETE
798,142.15164184570312,2026-01-03 07:01:48.193885,2026-01-03 07:02:14.973163,0 days 00:00:26.779278,relu,0.11834803111013437,31,0.09999498383016979,2,True,standard,2.4088098444623222e-05,COMPLETE
799,143.16061401367188,2026-01-03 07:02:14.982163,2026-01-03 07:02:41.758964,0 days 00:00:26.776801,relu,0.13270817469774082,32,0.06622275024638624,2,True,standard,2.6220334535548297e-05,COMPLETE
800,168.80819702148438,2026-01-03 07:02:41.767965,2026-01-03 07:03:10.391261,0 days 00:00:28.623296,gelu,0.10852060291040347,28,0.023926340295215724,2,True,standard,1.928956173508743e-05,COMPLETE
801,198.18271314832901,2026-01-03 07:03:10.399257,2026-01-03 07:03:36.550550,0 days 00:00:26.151293,relu,0.12202398804519929,31,0.0009940693129483974,2,False,standard,1.7751754389848445e-05,COMPLETE
802,144.52584838867188,2026-01-03 07:03:36.559553,2026-01-03 07:04:03.352323,0 days 00:00:26.792770,relu,0.10686647723500495,30,0.08651787689551295,2,True,standard,3.30376714109485e-05,COMPLETE
803,141.3999481201172,2026-01-03 07:04:03.360326,2026-01-03 07:04:29.990112,0 days 00:00:26.629786,relu,0.11459173555904995,32,0.07616925238751539,2,True,standard,2.1637471799595234e-05,COMPLETE
804,144.29476928710938,2026-01-03 07:04:30.000115,2026-01-03 07:04:56.599408,0 days 00:00:26.599293,relu,0.1272514192818406,29,0.0867126880652615,2,True,standard,2.7934576390458688e-05,COMPLETE
805,173.6435089111328,2026-01-03 07:04:56.608405,2026-01-03 07:05:22.703692,0 days 00:00:26.095287,silu,0.10878741214213762,6,0.061280580773347346,2,True,standard,1.69708489652789e-05,COMPLETE
806,143.50148010253906,2026-01-03 07:05:22.713695,2026-01-03 07:05:49.450988,0 days 00:00:26.737293,relu,0.11536662352017193,30,0.099974195931379,2,True,standard,2.1642134858269287e-06,COMPLETE
807,142.2818145751953,2026-01-03 07:05:49.459991,2026-01-03 07:06:16.127268,0 days 00:00:26.667277,relu,0.10841629383601974,28,0.07245649683995722,2,True,standard,2.114770649067725e-05,COMPLETE
808,140.2527618408203,2026-01-03 07:06:16.135267,2026-01-03 07:06:42.930542,0 days 00:00:26.795275,relu,0.12183374681430453,32,0.08124792625128015,2,True,standard,2.485516983116318e-05,COMPLETE
809,193.30032348632812,2026-01-03 07:06:42.939543,2026-01-03 07:07:09.768309,0 days 00:00:26.828766,relu,0.2572357237147419,31,0.0012799918857542745,2,True,standard,3.572915291887147e-05,COMPLETE
810,173.41424560546875,2026-01-03 07:07:09.775307,2026-01-03 07:07:36.422574,0 days 00:00:26.647267,relu,0.13385936548622623,30,0.08859634738696288,2,True,none,1.825719466459452e-05,COMPLETE
811,150.10716247558594,2026-01-03 07:07:36.431574,2026-01-03 07:08:03.192332,0 days 00:00:26.760758,relu,0.10634118631278625,28,0.0722106466932332,2,True,standard,2.0310224014586463e-05,COMPLETE
812,141.30984497070312,2026-01-03 07:08:03.200334,2026-01-03 07:08:29.977026,0 days 00:00:26.776692,relu,0.11449587884018171,32,0.086955927099011,2,True,standard,4.0356670843209546e-05,COMPLETE
813,147.7360382080078,2026-01-03 07:08:29.987027,2026-01-03 07:08:56.752275,0 days 00:00:26.765248,relu,0.12504884842700795,31,0.09980989221929168,2,True,robust,1.5958874556047212e-05,COMPLETE
814,143.6256866455078,2026-01-03 07:08:56.761274,2026-01-03 07:09:23.631551,0 days 00:00:26.870277,relu,0.10674503477026727,30,0.05757439030004523,2,True,standard,2.830855243787278e-05,COMPLETE
815,141.7120361328125,2026-01-03 07:09:23.639553,2026-01-03 07:09:50.483297,0 days 00:00:26.843744,relu,0.11531432224257562,29,0.07937729829281695,2,True,standard,2.3612159852681365e-05,COMPLETE
816,142.18991088867188,2026-01-03 07:09:50.492296,2026-01-03 07:10:17.162060,0 days 00:00:26.669764,relu,0.12142549251124883,32,0.06711258464844683,2,True,standard,1.864963159337556e-05,COMPLETE
817,168.87832641601562,2026-01-03 07:10:17.170061,2026-01-03 07:10:43.938327,0 days 00:00:26.768266,relu,0.38176367464382355,28,0.08786342674238545,2,True,standard,1.5858171334895842e-05,COMPLETE
818,178.87515258789062,2026-01-03 07:10:43.946327,2026-01-03 07:11:08.651562,0 days 00:00:24.705235,mish,0.1067575040385861,30,0.07468271684197647,1,True,minmax,2.1054395736046406e-05,COMPLETE
819,177.20327758789062,2026-01-03 07:11:08.659562,2026-01-03 07:11:35.566838,0 days 00:00:26.907276,relu,0.45563633107197665,31,0.08806977388206143,2,True,standard,2.558423580822405e-05,COMPLETE
820,198.24309929741753,2026-01-03 07:11:35.575838,2026-01-03 07:12:01.660130,0 days 00:00:26.084292,relu,0.1382337836533584,29,0.0009943706044281894,2,False,standard,2.9937934417054076e-05,COMPLETE
821,141.6442108154297,2026-01-03 07:12:01.688130,2026-01-03 07:12:28.605371,0 days 00:00:26.917241,relu,0.10042249472152502,32,0.07599112814104379,2,True,standard,2.2729427515805535e-05,COMPLETE
822,148.7123260498047,2026-01-03 07:12:28.613369,2026-01-03 07:12:55.267608,0 days 00:00:26.654239,relu,0.1139785879956546,30,0.09957602462214549,2,True,standard,1.7418935893344886e-05,COMPLETE
823,145.27806091308594,2026-01-03 07:12:55.277609,2026-01-03 07:13:22.005868,0 days 00:00:26.728259,relu,0.12841278332407405,29,0.061913533496580846,2,True,standard,1.9710280108940582e-05,COMPLETE
824,142.01864624023438,2026-01-03 07:13:22.013868,2026-01-03 07:13:50.643641,0 days 00:00:28.629773,gelu,0.10630969589171853,31,0.08599950389105601,2,True,standard,1.5234940403253689e-05,COMPLETE
825,141.92782592773438,2026-01-03 07:13:50.652641,2026-01-03 07:14:17.593938,0 days 00:00:26.941297,relu,0.11934257117411452,31,0.07858109464956195,2,True,standard,2.4126199683854747e-05,COMPLETE
826,143.4905242919922,2026-01-03 07:14:17.601941,2026-01-03 07:14:44.346196,0 days 00:00:26.744255,relu,0.14791208046756898,28,0.09977749337815879,2,True,standard,2.8296073544227286e-05,COMPLETE
827,140.73562622070312,2026-01-03 07:14:44.355197,2026-01-03 07:15:10.963963,0 days 00:00:26.608766,relu,0.10016293624405076,32,0.06720471606122118,2,True,standard,3.455719926602683e-05,COMPLETE
828,140.46609497070312,2026-01-03 07:15:10.972965,2026-01-03 07:15:37.809214,0 days 00:00:26.836249,relu,0.11295085806181075,30,0.0861757355984124,2,True,standard,1.686961171316874e-05,COMPLETE
829,142.98446655273438,2026-01-03 07:15:37.819217,2026-01-03 07:16:04.537001,0 days 00:00:26.717784,relu,0.13036457992585754,32,0.07297421675372218,2,True,standard,2.116376835333121e-05,COMPLETE
830,168.70315551757812,2026-01-03 07:16:04.544999,2026-01-03 07:16:31.462248,0 days 00:00:26.917249,silu,0.11903798990209671,29,0.05716146362398812,2,True,standard,9.136116808461351e-06,COMPLETE
831,139.21713256835938,2026-01-03 07:16:31.471249,2026-01-03 07:16:58.183035,0 days 00:00:26.711786,relu,0.10703823376535819,29,0.09957393610772966,2,True,standard,1.9631903732582403e-05,COMPLETE
832,144.83322143554688,2026-01-03 07:16:58.192038,2026-01-03 07:17:24.754274,0 days 00:00:26.562236,relu,0.12372743303317989,30,0.08830610151350028,2,True,standard,2.4583067969651976e-05,COMPLETE
833,195.14266967773438,2026-01-03 07:17:24.798274,2026-01-03 07:17:51.732034,0 days 00:00:26.933760,relu,0.11253281321708758,31,0.0007609094399707865,2,True,none,1.970031821271431e-05,COMPLETE
834,178.2733154296875,2026-01-03 07:17:51.740032,2026-01-03 07:18:18.531814,0 days 00:00:26.791782,relu,0.419359271574318,32,0.03010920684623441,2,True,standard,3.204743821995155e-05,COMPLETE
835,154.70472717285156,2026-01-03 07:18:18.540814,2026-01-03 07:18:45.345062,0 days 00:00:26.804248,relu,0.21376391081972534,30,0.07508570331407702,2,True,standard,2.7085114967742987e-05,COMPLETE
836,141.24575805664062,2026-01-03 07:18:45.353062,2026-01-03 07:19:12.272310,0 days 00:00:26.919248,relu,0.10656165239227416,31,0.0864351324271473,2,True,standard,2.3410715920542756e-05,COMPLETE
837,144.3363037109375,2026-01-03 07:19:12.281309,2026-01-03 07:19:38.989545,0 days 00:00:26.708236,relu,0.11339019186180035,29,0.09994422013902622,2,True,robust,1.9281269397139315e-05,COMPLETE
838,137.82192993164062,2026-01-03 07:19:38.997549,2026-01-03 07:20:05.824797,0 days 00:00:26.827248,relu,0.10016817229270425,32,0.07924590343104775,2,True,standard,2.206930970049351e-05,COMPLETE
839,145.12307739257812,2026-01-03 07:20:05.832796,2026-01-03 07:20:32.503053,0 days 00:00:26.670257,relu,0.10686249662547952,32,0.0635464199458263,2,True,standard,2.2042643681823737e-05,COMPLETE
840,142.5902862548828,2026-01-03 07:20:32.511053,2026-01-03 07:20:59.050821,0 days 00:00:26.539768,relu,0.10003510483100934,32,0.056033199703098995,2,True,standard,2.725774305611807e-05,COMPLETE
841,362.2090570746528,2026-01-03 07:20:59.059821,2026-01-03 07:21:25.143607,0 days 00:00:26.083786,relu,0.10039822356696049,32,2.7336760249968465e-05,2,False,standard,2.18541430316877e-05,COMPLETE
842,144.55136108398438,2026-01-03 07:21:25.152607,2026-01-03 07:21:51.955879,0 days 00:00:26.803272,relu,0.10023522937247682,31,0.06705800791457421,2,True,standard,1.7979453974033623e-05,COMPLETE
843,189.4005584716797,2026-01-03 07:21:51.963880,2026-01-03 07:22:19.666627,0 days 00:00:27.702747,mish,0.11893511818413044,31,0.07307896417065085,2,True,minmax,2.4901047926766398e-05,COMPLETE
844,137.6847381591797,2026-01-03 07:22:19.674626,2026-01-03 07:22:46.582887,0 days 00:00:26.908261,relu,0.11277500560544633,32,0.07918334006874107,2,True,standard,3.113907499503417e-05,COMPLETE
845,138.81320190429688,2026-01-03 07:22:46.590891,2026-01-03 07:23:13.251426,0 days 00:00:26.660535,relu,0.10739914217636351,32,0.06682870413461107,2,True,standard,3.430849450864879e-05,COMPLETE
846,180.53074645996094,2026-01-03 07:23:13.258425,2026-01-03 07:23:40.041186,0 days 00:00:26.782761,relu,0.1065663885232207,32,0.0022538488233271475,2,True,standard,4.203890689587056e-05,COMPLETE
847,143.7909393310547,2026-01-03 07:23:40.050184,2026-01-03 07:24:06.687441,0 days 00:00:26.637257,relu,0.10781966442239371,32,0.053092985781868544,2,True,standard,2.5753062952157293e-05,COMPLETE
848,143.5032501220703,2026-01-03 07:24:06.695441,2026-01-03 07:24:33.399174,0 days 00:00:26.703733,relu,0.10038274560133569,32,0.05724142947763226,2,True,standard,3.747554807734589e-05,COMPLETE
849,144.64651489257812,2026-01-03 07:24:33.407174,2026-01-03 07:25:00.128899,0 days 00:00:26.721725,relu,0.10003675952613542,31,0.06213007908987379,2,True,standard,3.5624481446622996e-05,COMPLETE
850,146.62936401367188,2026-01-03 07:25:00.136899,2026-01-03 07:25:26.848172,0 days 00:00:26.711273,relu,0.11181597834278015,32,0.05176624868897911,2,True,standard,3.221813043241626e-05,COMPLETE
851,141.86634826660156,2026-01-03 07:25:26.857170,2026-01-03 07:25:53.650901,0 days 00:00:26.793731,relu,0.10721063851007258,30,0.06651020158166034,2,True,standard,2.9844499287851177e-05,COMPLETE
852,142.02340698242188,2026-01-03 07:25:53.658903,2026-01-03 07:26:20.503624,0 days 00:00:26.844721,relu,0.11208552162692621,31,0.06581400161596371,2,True,standard,3.831392866312086e-05,COMPLETE
853,187.67225646972656,2026-01-03 07:26:20.512627,2026-01-03 07:26:49.235363,0 days 00:00:28.722736,gelu,0.10675470647804085,32,0.001559447767878256,2,True,standard,3.137305090861931e-05,COMPLETE
854,145.59140014648438,2026-01-03 07:26:49.244363,2026-01-03 07:27:16.052117,0 days 00:00:26.807754,relu,0.10007934045381738,30,0.07210717512578997,2,True,standard,2.9657148864492186e-05,COMPLETE
855,146.9767608642578,2026-01-03 07:27:16.060113,2026-01-03 07:27:42.671377,0 days 00:00:26.611264,relu,0.11114506411877975,32,0.047033659847463744,2,True,standard,0.00038042372005701224,COMPLETE
856,161.8214874267578,2026-01-03 07:27:42.679377,2026-01-03 07:28:09.517152,0 days 00:00:26.837775,silu,0.11582073354179857,30,0.07853755146174812,2,True,standard,4.78534063330353e-05,COMPLETE
857,139.99844360351562,2026-01-03 07:28:09.527152,2026-01-03 07:28:36.472388,0 days 00:00:26.945236,relu,0.10712837243887606,31,0.060913642742973846,2,True,standard,4.3324175119239524e-05,COMPLETE
858,163.93319702148438,2026-01-03 07:28:36.481388,2026-01-03 07:29:03.338126,0 days 00:00:26.856738,relu,0.10021632971513407,30,0.011099798938316002,2,True,standard,2.6873659263405594e-05,COMPLETE
859,196.46372172037763,2026-01-03 07:29:03.346125,2026-01-03 07:29:26.805342,0 days 00:00:23.459217,relu,0.11529426204049477,32,0.0009943134213671143,1,False,none,2.849327558816969e-05,COMPLETE
860,144.07225036621094,2026-01-03 07:29:26.814342,2026-01-03 07:29:53.695082,0 days 00:00:26.880740,relu,0.12289570094915217,31,0.0686660449329217,2,True,standard,3.613447067074063e-05,COMPLETE
861,140.81759643554688,2026-01-03 07:29:53.703083,2026-01-03 07:30:20.500787,0 days 00:00:26.797704,relu,0.11143149469443094,30,0.0767827104930708,2,True,standard,3.1898067301605476e-05,COMPLETE
862,141.3854522705078,2026-01-03 07:30:20.508785,2026-01-03 07:30:47.254014,0 days 00:00:26.745229,relu,0.1066363182544754,29,0.07966972156355974,2,True,standard,2.423816305316415e-05,COMPLETE
863,143.27218627929688,2026-01-03 07:30:47.262014,2026-01-03 07:31:13.962266,0 days 00:00:26.700252,relu,0.126146712142356,32,0.08093163739606517,2,True,standard,2.6704623539721454e-05,COMPLETE
864,147.67047119140625,2026-01-03 07:31:13.973268,2026-01-03 07:31:40.648483,0 days 00:00:26.675215,relu,0.10007728646516952,29,0.058069085922422825,2,True,robust,3.3063762839121744e-05,COMPLETE
865,142.5843963623047,2026-01-03 07:31:40.658483,2026-01-03 07:32:07.413221,0 days 00:00:26.754738,relu,0.11618670954372205,30,0.06512739570660633,2,True,standard,7.367222118560026e-06,COMPLETE
866,142.19972229003906,2026-01-03 07:32:07.421223,2026-01-03 07:32:34.086956,0 days 00:00:26.665733,relu,0.11313105546489205,32,0.08047114065955013,2,True,standard,2.3739225801444055e-05,COMPLETE
867,154.54251098632812,2026-01-03 07:32:34.094954,2026-01-03 07:33:00.456694,0 days 00:00:26.361740,relu,0.12206523096612457,16,0.07150069184122819,2,True,standard,8.573327018946621e-06,COMPLETE
868,152.95578002929688,2026-01-03 07:33:00.464694,2026-01-03 07:33:28.128942,0 days 00:00:27.664248,mish,0.132183611314177,31,0.08706527909397584,2,True,standard,4.2613995406995335e-05,COMPLETE
869,172.04290771484375,2026-01-03 07:33:28.136938,2026-01-03 07:33:54.872196,0 days 00:00:26.735258,relu,0.10542841753168074,31,0.08636765928291738,2,True,minmax,2.346724058009995e-05,COMPLETE
870,144.1016387939453,2026-01-03 07:33:54.881201,2026-01-03 07:34:21.684922,0 days 00:00:26.803721,relu,0.11341278690924098,29,0.06814604002760245,2,True,standard,2.8379683973782187e-05,COMPLETE
871,170.1350555419922,2026-01-03 07:34:21.692922,2026-01-03 07:34:47.941632,0 days 00:00:26.248710,relu,0.1072914178668205,11,0.05194293230652423,2,True,standard,1.0008933337168924e-05,COMPLETE
872,146.98281860351562,2026-01-03 07:34:47.949632,2026-01-03 07:35:14.740887,0 days 00:00:26.791255,relu,0.1200774607525308,32,0.035793767251355274,2,True,standard,2.1036917123330404e-05,COMPLETE
873,195.6652069091797,2026-01-03 07:35:14.749892,2026-01-03 07:35:41.498620,0 days 00:00:26.748728,relu,0.1274371866667336,30,0.000488070266304002,2,True,standard,2.1949869524033396e-05,COMPLETE
874,145.62307739257812,2026-01-03 07:35:41.505622,2026-01-03 07:36:10.330860,0 days 00:00:28.825238,gelu,0.10703171981178497,30,0.07856453450428483,2,True,standard,3.291081294223072e-05,COMPLETE
875,160.723388671875,2026-01-03 07:36:10.338865,2026-01-03 07:36:36.609582,0 days 00:00:26.270717,relu,0.1173584238591793,14,0.08788208214306986,2,True,standard,2.775696848101372e-05,COMPLETE
876,146.329345703125,2026-01-03 07:36:36.619585,2026-01-03 07:37:03.360842,0 days 00:00:26.741257,relu,0.11315600355362593,32,0.06890607848549309,2,True,standard,2.0547015229341237e-05,COMPLETE
877,142.08126831054688,2026-01-03 07:37:03.367842,2026-01-03 07:37:30.085063,0 days 00:00:26.717221,relu,0.13637866850295496,31,0.08700932851758755,2,True,standard,2.3666891322978136e-05,COMPLETE
878,198.26298129611547,2026-01-03 07:37:30.094063,2026-01-03 07:37:56.097305,0 days 00:00:26.003242,relu,0.10663090708409104,29,0.0009941787788230255,2,False,standard,2.6163380594788988e-05,COMPLETE
879,144.4036865234375,2026-01-03 07:37:56.105309,2026-01-03 07:38:22.827058,0 days 00:00:26.721749,relu,0.12143154061371465,32,0.058349175313144486,2,True,standard,3.605662637864802e-05,COMPLETE
880,171.7593231201172,2026-01-03 07:38:22.836058,2026-01-03 07:38:49.476815,0 days 00:00:26.640757,relu,0.3991648739967772,30,0.07626445271535123,2,True,standard,9.955526568766359e-06,COMPLETE
881,156.9809112548828,2026-01-03 07:38:49.485814,2026-01-03 07:39:16.573074,0 days 00:00:27.087260,silu,0.11293119616987607,29,0.0891379834557329,2,True,standard,6.539326626839751e-06,COMPLETE
882,142.39767456054688,2026-01-03 07:39:16.581075,2026-01-03 07:39:43.217790,0 days 00:00:26.636715,relu,0.12682708665184253,31,0.07160018590775682,2,True,standard,1.930437078393228e-05,COMPLETE
883,145.3601837158203,2026-01-03 07:39:43.225794,2026-01-03 07:40:09.984550,0 days 00:00:26.758756,relu,0.10722801592905626,28,0.08816652663136743,2,True,standard,2.9789755964542073e-05,COMPLETE
884,142.5083770751953,2026-01-03 07:40:09.993550,2026-01-03 07:40:36.751838,0 days 00:00:26.758288,relu,0.10631860551920272,31,0.06137879293333488,2,True,standard,2.372628940961214e-05,COMPLETE
885,173.18719482421875,2026-01-03 07:40:36.759835,2026-01-03 07:41:03.438555,0 days 00:00:26.678720,relu,0.1192057730258823,32,0.07802439140651095,2,True,none,8.90913803821962e-06,COMPLETE
886,137.73562622070312,2026-01-03 07:41:03.447558,2026-01-03 07:41:30.173284,0 days 00:00:26.725726,relu,0.10064461929546666,30,0.0996907980324961,2,True,standard,2.1010379025963092e-05,COMPLETE
887,196.11204528808594,2026-01-03 07:41:30.182285,2026-01-03 07:41:56.881492,0 days 00:00:26.699207,relu,0.10015953565029477,28,0.00022608566707854074,2,True,standard,2.0243921141803173e-05,COMPLETE
888,146.79110717773438,2026-01-03 07:41:56.939492,2026-01-03 07:42:23.858191,0 days 00:00:26.918699,relu,0.10041058573152123,29,0.09924219259433095,2,True,robust,1.841671066192258e-05,COMPLETE
889,141.69918823242188,2026-01-03 07:42:23.866190,2026-01-03 07:42:50.389918,0 days 00:00:26.523728,relu,0.10041485610028225,28,0.09987561845547241,2,True,standard,2.2040324905890396e-05,COMPLETE
890,140.1768035888672,2026-01-03 07:42:50.398921,2026-01-03 07:43:17.195630,0 days 00:00:26.796709,relu,0.10741272424163528,29,0.0884204751363403,2,True,standard,2.601162423873661e-05,COMPLETE
891,140.31895446777344,2026-01-03 07:43:17.202630,2026-01-03 07:43:43.882873,0 days 00:00:26.680243,relu,0.10647179163060612,30,0.08824144176659009,2,True,standard,1.7677165407957463e-05,COMPLETE
