number,value,datetime_start,datetime_complete,duration,params_activation,params_dropout,params_hidden_size,params_lr,params_n_layers,params_scale_target,params_scaler,params_weight_decay,state
1337,149.1173095703125,2026-01-03 11:05:39.906442,2026-01-03 11:06:17.419297,0 days 00:00:37.512855,gelu,0.11848578585285627,28,0.07269300227121898,2,True,standard,2.5105387824534034e-05,COMPLETE
1338,157.3784942626953,2026-01-03 11:06:17.429808,2026-01-03 11:06:46.729892,0 days 00:00:29.300084,relu,0.10856930974610589,13,0.057828843453727956,2,True,standard,9.548825467870469e-06,COMPLETE
1339,142.80279541015625,2026-01-03 11:06:46.737893,2026-01-03 11:07:13.179119,0 days 00:00:26.441226,relu,0.12934628431625042,29,0.08769219602877225,2,True,standard,3.0140573629202582e-05,COMPLETE
1340,142.72174072265625,2026-01-03 11:07:13.189119,2026-01-03 11:07:44.396596,0 days 00:00:31.207477,relu,0.10757288682951271,32,0.06548398445253811,2,True,standard,2.59038509747012e-05,COMPLETE
1341,138.9844970703125,2026-01-03 11:07:44.406598,2026-01-03 11:08:18.685390,0 days 00:00:34.278792,relu,0.10003622170029683,29,0.0804614164266064,2,True,standard,2.555966017668239e-05,COMPLETE
1342,141.83555603027344,2026-01-03 11:08:18.696392,2026-01-03 11:08:53.095161,0 days 00:00:34.398769,relu,0.11740670084794243,30,0.08870914891017333,2,True,standard,7.80961289426035e-05,COMPLETE
1343,166.64024353027344,2026-01-03 11:08:53.107163,2026-01-03 11:09:27.761817,0 days 00:00:34.654654,silu,0.1128034577663097,31,0.07261553348692248,2,True,standard,2.974609180961738e-05,COMPLETE
1344,142.4102020263672,2026-01-03 11:09:27.771816,2026-01-03 11:10:01.952479,0 days 00:00:34.180663,relu,0.12404250410094093,32,0.09986475110711857,2,True,standard,2.4799834980439815e-05,COMPLETE
1345,148.9336700439453,2026-01-03 11:10:01.961989,2026-01-03 11:10:36.174082,0 days 00:00:34.212093,relu,0.16570092194620328,29,0.0795658818207327,2,True,standard,1.0399439598841808e-05,COMPLETE
1346,170.789306640625,2026-01-03 11:10:36.186084,2026-01-03 11:11:05.878037,0 days 00:00:29.691953,relu,0.10725496922358746,9,0.09954467637954072,2,True,standard,5.897043299085144e-06,COMPLETE
1347,172.16845703125,2026-01-03 11:11:05.887040,2026-01-03 11:11:31.383090,0 days 00:00:25.496050,relu,0.11331553997980405,31,0.06353932446537866,2,True,none,3.108034878715348e-05,COMPLETE
1348,144.2572021484375,2026-01-03 11:11:31.392090,2026-01-03 11:11:57.767301,0 days 00:00:26.375211,relu,0.10746926315481356,27,0.08803156314836687,2,True,standard,0.00012043671413088837,COMPLETE
1349,147.15052795410156,2026-01-03 11:11:57.778812,2026-01-03 11:12:23.714271,0 days 00:00:25.935459,relu,0.12051952206853792,30,0.07329469529598907,2,True,standard,9.986553807273458e-05,COMPLETE
1350,149.6063232421875,2026-01-03 11:12:23.723274,2026-01-03 11:12:49.057063,0 days 00:00:25.333789,relu,0.10681500127838171,32,0.09976118988910476,2,True,robust,8.287639216534976e-06,COMPLETE
1351,146.06028747558594,2026-01-03 11:12:49.065058,2026-01-03 11:13:14.478788,0 days 00:00:25.413730,relu,0.10005057391593458,30,0.08070141312102778,2,True,standard,2.379519693510475e-05,COMPLETE
1352,143.62184143066406,2026-01-03 11:13:14.487297,2026-01-03 11:13:39.861846,0 days 00:00:25.374549,relu,0.12858067225642508,31,0.06985848763594406,2,True,standard,3.0789292103247704e-05,COMPLETE
1353,186.3413543701172,2026-01-03 11:13:39.871847,2026-01-03 11:14:05.238619,0 days 00:00:25.366772,relu,0.11620019682967171,28,0.0018117655038555247,2,True,standard,1.151103330707869e-05,COMPLETE
1354,198.22086466471356,2026-01-03 11:14:05.247620,2026-01-03 11:14:30.033663,0 days 00:00:24.786043,relu,0.13650319249185677,32,0.0009946286045857137,2,False,standard,2.2963699063819856e-05,COMPLETE
1355,176.9018096923828,2026-01-03 11:14:30.041663,2026-01-03 11:14:56.291282,0 days 00:00:26.249619,mish,0.1071230170660071,30,0.09993499547939619,2,True,minmax,0.0001380430347271841,COMPLETE
1356,173.0150604248047,2026-01-03 11:14:56.300798,2026-01-03 11:15:21.619131,0 days 00:00:25.318333,relu,0.383567198874985,29,0.08770016855491931,2,True,standard,2.6092142787541275e-05,COMPLETE
1357,141.47805786132812,2026-01-03 11:15:21.628134,2026-01-03 11:15:46.855200,0 days 00:00:25.227066,relu,0.10005296276002512,32,0.07945983349465523,2,True,standard,8.622371596306464e-05,COMPLETE
1358,151.64547729492188,2026-01-03 11:15:46.862200,2026-01-03 11:16:09.744862,0 days 00:00:22.882662,relu,0.11865314840371907,30,0.059941208447722064,1,True,standard,3.4690928332692085e-05,COMPLETE
1359,197.80087280273438,2026-01-03 11:16:09.753862,2026-01-03 11:16:36.386528,0 days 00:00:26.632666,relu,0.25368411003828484,29,0.0005579054354121434,2,True,standard,2.8602602778645132e-05,COMPLETE
1360,142.54318237304688,2026-01-03 11:16:36.394527,2026-01-03 11:17:03.761046,0 days 00:00:27.366519,relu,0.1117240170708038,31,0.08851254364308139,2,True,standard,6.643433300406754e-06,COMPLETE
1361,196.6178436279297,2026-01-03 11:17:03.769046,2026-01-03 11:17:41.019109,0 days 00:00:37.250063,relu,0.12491690979541369,26,0.00038160880893812837,2,True,standard,2.1287951033320134e-05,COMPLETE
1362,156.70590209960938,2026-01-03 11:17:41.029627,2026-01-03 11:18:20.200786,0 days 00:00:39.171159,gelu,0.20414901644006747,31,0.0722103348793514,2,True,standard,1.3117484105395543e-05,COMPLETE
1363,143.68356323242188,2026-01-03 11:18:20.211309,2026-01-03 11:18:56.249759,0 days 00:00:36.038450,relu,0.11427955439689062,28,0.0798124067799309,2,True,standard,2.4611842268304525e-05,COMPLETE
1364,166.51583862304688,2026-01-03 11:18:56.260281,2026-01-03 11:19:32.348783,0 days 00:00:36.088502,relu,0.10739570480619694,32,0.010223016666069264,2,True,standard,3.284166227859669e-05,COMPLETE
1365,169.7959747314453,2026-01-03 11:19:32.360299,2026-01-03 11:20:08.483129,0 days 00:00:36.122830,relu,0.32485364994220556,29,0.08779605994509272,2,True,standard,2.7764711148443028e-05,COMPLETE
1366,166.7740478515625,2026-01-03 11:20:08.494650,2026-01-03 11:20:45.120871,0 days 00:00:36.626221,relu,0.10003436078871777,30,0.019222019412258533,2,True,standard,0.00010834721517667666,COMPLETE
1367,142.1469268798828,2026-01-03 11:20:45.130871,2026-01-03 11:21:20.672490,0 days 00:00:35.541619,relu,0.13260681371565325,32,0.09978601756143755,2,True,standard,9.284791115750474e-06,COMPLETE
1368,169.21847534179688,2026-01-03 11:21:20.684018,2026-01-03 11:21:57.394917,0 days 00:00:36.710899,silu,0.11946303555916976,28,0.04518255480500848,2,True,standard,2.189105353222754e-05,COMPLETE
1369,148.2766876220703,2026-01-03 11:21:57.407441,2026-01-03 11:22:33.768402,0 days 00:00:36.360961,relu,0.14818228158631783,31,0.06519161895891312,2,True,standard,2.4312544131975128e-05,COMPLETE
1370,172.291259765625,2026-01-03 11:22:33.778917,2026-01-03 11:23:06.733311,0 days 00:00:32.954394,relu,0.10723104800687305,31,0.09995134025761147,2,True,none,2.9994471687441795e-05,COMPLETE
1371,142.4247283935547,2026-01-03 11:23:06.741822,2026-01-03 11:23:35.831313,0 days 00:00:29.089491,relu,0.11435702291575947,27,0.07930173446495475,2,True,standard,0.000146134517285429,COMPLETE
1372,198.32017937554255,2026-01-03 11:23:35.839321,2026-01-03 11:24:11.483805,0 days 00:00:35.644484,relu,0.10693921557848123,30,0.000994222955484724,2,False,standard,2.2064320742883453e-05,COMPLETE
1373,145.2881622314453,2026-01-03 11:24:11.496810,2026-01-03 11:24:49.970114,0 days 00:00:38.473304,relu,0.12496283853666224,32,0.053818510131348946,2,True,standard,7.344360834487761e-05,COMPLETE
1374,149.15072631835938,2026-01-03 11:24:49.982111,2026-01-03 11:25:28.540783,0 days 00:00:38.558672,relu,0.11394349487978868,29,0.07161311127122566,2,True,robust,2.7919273791736456e-05,COMPLETE
1375,150.6886444091797,2026-01-03 11:25:28.550781,2026-01-03 11:26:06.357165,0 days 00:00:37.806384,relu,0.10041038473708022,19,0.08753402974896568,2,True,standard,1.2876170735751822e-05,COMPLETE
1376,142.20082092285156,2026-01-03 11:26:06.367680,2026-01-03 11:26:43.332217,0 days 00:00:36.964537,relu,0.10009740598933525,30,0.08817678321716803,2,True,standard,7.799851712643314e-06,COMPLETE
1377,142.62811279296875,2026-01-03 11:26:43.343733,2026-01-03 11:27:19.715050,0 days 00:00:36.371317,relu,0.10007330057224442,32,0.06604720047203556,2,True,standard,3.6036684673198784e-05,COMPLETE
1378,142.35426330566406,2026-01-03 11:27:19.725573,2026-01-03 11:27:55.563347,0 days 00:00:35.837774,relu,0.12072563562328711,29,0.07802937249920258,2,True,standard,2.407238687934654e-05,COMPLETE
1379,175.43991088867188,2026-01-03 11:27:55.573866,2026-01-03 11:28:33.272267,0 days 00:00:37.698401,mish,0.18853026175090132,31,0.015033962753623136,2,True,standard,1.9427819827167198e-05,COMPLETE
1380,142.31781005859375,2026-01-03 11:28:33.282789,2026-01-03 11:29:09.748557,0 days 00:00:36.465768,relu,0.1122033002253506,30,0.08033453168232496,2,True,standard,9.152588062015376e-05,COMPLETE
1381,198.05477905273438,2026-01-03 11:29:09.759591,2026-01-03 11:29:45.798745,0 days 00:00:36.039154,relu,0.10677069084293989,32,0.0037788137886540147,2,True,minmax,3.142981334267852e-05,COMPLETE
1382,145.2068634033203,2026-01-03 11:29:45.811271,2026-01-03 11:30:20.977889,0 days 00:00:35.166618,relu,0.12589610609268828,27,0.058619158311372994,2,True,standard,1.0324761530290914e-05,COMPLETE
1383,163.65370178222656,2026-01-03 11:30:20.988922,2026-01-03 11:30:56.448907,0 days 00:00:35.459985,relu,0.11218824509591115,15,0.08882306430126069,2,True,standard,1.5047054919695483e-05,COMPLETE
1384,142.0853729248047,2026-01-03 11:30:56.458417,2026-01-03 11:31:32.589871,0 days 00:00:36.131454,relu,0.1001585440817535,30,0.07110354081669923,2,True,standard,2.5843246048881722e-05,COMPLETE
1385,197.66213989257812,2026-01-03 11:31:32.600391,2026-01-03 11:32:12.045210,0 days 00:00:39.444819,gelu,0.13884784593407787,29,0.00019367596311146783,2,True,standard,0.00011689349709936847,COMPLETE
1386,141.1244659423828,2026-01-03 11:32:12.057242,2026-01-03 11:32:47.858118,0 days 00:00:35.800876,relu,0.11966892941889334,32,0.08937023322976892,2,True,standard,2.1538325697331853e-05,COMPLETE
1387,142.16830444335938,2026-01-03 11:32:47.868640,2026-01-03 11:33:23.748248,0 days 00:00:35.879608,relu,0.10790704208450605,28,0.07882948314608465,2,True,standard,3.5769408908746553e-05,COMPLETE
1388,140.86544799804688,2026-01-03 11:33:23.758772,2026-01-03 11:33:59.416598,0 days 00:00:35.657826,relu,0.11479434605774161,31,0.08821536718790551,2,True,standard,4.988872275735993e-06,COMPLETE
1389,143.81430053710938,2026-01-03 11:33:59.427117,2026-01-03 11:34:35.222744,0 days 00:00:35.795627,relu,0.10739367839611277,30,0.0680725122724993,2,True,standard,2.721416612646387e-05,COMPLETE
1390,141.38304138183594,2026-01-03 11:34:35.232257,2026-01-03 11:35:11.246321,0 days 00:00:36.014064,relu,0.12534139426654659,28,0.0997542319848296,2,True,standard,1.1443682038782228e-05,COMPLETE
1391,160.91070556640625,2026-01-03 11:35:11.256846,2026-01-03 11:35:46.587846,0 days 00:00:35.331000,silu,0.10780840772355609,32,0.07874747777892847,2,True,standard,1.735154992775047e-05,COMPLETE
1392,198.25838168674045,2026-01-03 11:35:46.595359,2026-01-03 11:36:13.045799,0 days 00:00:26.450440,relu,0.13274071677069618,31,0.0009943487937273084,2,False,standard,2.085496445545695e-05,COMPLETE
1393,141.946044921875,2026-01-03 11:36:13.055309,2026-01-03 11:36:39.775556,0 days 00:00:26.720247,relu,0.11770278210780999,28,0.08816847298252722,2,True,standard,0.00012928950423112814,COMPLETE
1394,142.96595764160156,2026-01-03 11:36:39.785078,2026-01-03 11:37:06.249412,0 days 00:00:26.464334,relu,0.10764352802816027,30,0.06169023958538114,2,True,standard,2.3611479007848223e-05,COMPLETE
1395,147.07484436035156,2026-01-03 11:37:06.258929,2026-01-03 11:37:32.845185,0 days 00:00:26.586256,relu,0.11487512831232759,26,0.07169368110643459,2,True,standard,2.8996451178299316e-05,COMPLETE
1396,173.12210083007812,2026-01-03 11:37:32.853691,2026-01-03 11:37:59.599064,0 days 00:00:26.745373,relu,0.10625002222855745,29,0.09977724987871985,2,True,none,3.391282549646777e-05,COMPLETE
1397,139.73434448242188,2026-01-03 11:37:59.607586,2026-01-03 11:38:27.045333,0 days 00:00:27.437747,relu,0.12083781958044904,32,0.07943258160451126,2,True,standard,1.584890572860007e-05,COMPLETE
1398,151.22036743164062,2026-01-03 11:38:27.053856,2026-01-03 11:38:51.446288,0 days 00:00:24.392432,relu,0.10028896960007386,31,0.08944445236100948,1,True,robust,1.941587900732232e-05,COMPLETE
1399,149.81130981445312,2026-01-03 11:38:51.455311,2026-01-03 11:39:18.896735,0 days 00:00:27.441424,relu,0.10017219008305797,29,0.050953195186519244,2,True,standard,2.3339719606409117e-05,COMPLETE
1400,143.2429962158203,2026-01-03 11:39:18.904737,2026-01-03 11:39:45.277427,0 days 00:00:26.372690,relu,0.11331120106967084,31,0.09960974794977463,2,True,standard,2.6226311394308918e-05,COMPLETE
1401,144.4227752685547,2026-01-03 11:39:45.285427,2026-01-03 11:40:13.308216,0 days 00:00:28.022789,relu,0.127705746623436,30,0.06891927820825555,2,True,standard,0.00010848853211289075,COMPLETE
1402,142.9392852783203,2026-01-03 11:40:13.317216,2026-01-03 11:40:44.031081,0 days 00:00:30.713865,relu,0.11245553295078801,32,0.07939244153269079,2,True,standard,1.4278522781353703e-05,COMPLETE
1403,155.89102172851562,2026-01-03 11:40:44.040081,2026-01-03 11:41:14.727832,0 days 00:00:30.687751,mish,0.12007805461323806,29,0.08768408392783636,2,True,standard,3.1178103209417404e-05,COMPLETE
1404,257.18438720703125,2026-01-03 11:41:14.737832,2026-01-03 11:41:45.058601,0 days 00:00:30.320769,relu,0.10699732117873142,30,0.00014327959095626917,2,True,minmax,8.643096183242432e-05,COMPLETE
1405,186.99598693847656,2026-01-03 11:41:45.069609,2026-01-03 11:42:19.551451,0 days 00:00:34.481842,relu,0.14251707075911066,6,0.09998765648412035,2,True,standard,8.498377063092296e-06,COMPLETE
1406,143.23886108398438,2026-01-03 11:42:19.562451,2026-01-03 11:42:54.491907,0 days 00:00:34.929456,relu,0.10715948116335364,32,0.07480628003994946,2,True,standard,2.0500769739523972e-05,COMPLETE
1407,173.2113494873047,2026-01-03 11:42:54.500418,2026-01-03 11:43:29.530894,0 days 00:00:35.030476,relu,0.13051928850614028,28,0.007829190102761572,2,True,standard,1.7750668663164607e-05,COMPLETE
1408,143.2631378173828,2026-01-03 11:43:29.541898,2026-01-03 11:43:57.220750,0 days 00:00:27.678852,relu,0.10026624383871119,27,0.06382635150964559,2,True,standard,2.4227186434894615e-05,COMPLETE
1409,143.17947387695312,2026-01-03 11:43:57.229265,2026-01-03 11:44:24.935280,0 days 00:00:27.706015,gelu,0.10002237496609273,30,0.0878699103461967,2,True,standard,2.8165110744996654e-05,COMPLETE
1410,198.3656559244792,2026-01-03 11:44:24.943284,2026-01-03 11:44:50.276664,0 days 00:00:25.333380,relu,0.11471969447537707,31,0.0009938783936766572,2,False,standard,2.159337973772206e-05,COMPLETE
1411,148.3504638671875,2026-01-03 11:44:50.284663,2026-01-03 11:45:16.151488,0 days 00:00:25.866825,relu,0.120444455762371,31,0.08005084652572866,2,True,standard,6.653134889458774e-06,COMPLETE
1412,142.84521484375,2026-01-03 11:45:16.160491,2026-01-03 11:45:41.841759,0 days 00:00:25.681268,relu,0.10007151097468706,32,0.09988754912494424,2,True,standard,0.00010034391803353112,COMPLETE
1413,140.5004119873047,2026-01-03 11:45:41.849757,2026-01-03 11:46:07.693574,0 days 00:00:25.843817,relu,0.1129983959688346,29,0.0581666657720052,2,True,standard,3.7454248330863025e-05,COMPLETE
1414,147.1510009765625,2026-01-03 11:46:07.700574,2026-01-03 11:46:33.379846,0 days 00:00:25.679272,relu,0.10672955118639288,30,0.07183891055552528,2,True,standard,1.840489660329621e-05,COMPLETE
1415,142.23153686523438,2026-01-03 11:46:33.387846,2026-01-03 11:46:58.960600,0 days 00:00:25.572754,relu,0.12405039890321275,32,0.09987142379509001,2,True,standard,9.451941622090287e-06,COMPLETE
1416,155.44143676757812,2026-01-03 11:46:58.968604,2026-01-03 11:47:24.744223,0 days 00:00:25.775619,silu,0.112708427253956,31,0.08780704626286862,2,True,standard,0.00015593175346609607,COMPLETE
1417,143.1377410888672,2026-01-03 11:47:24.752218,2026-01-03 11:47:50.378346,0 days 00:00:25.626128,relu,0.10754239828547245,28,0.08075104678530486,2,True,standard,3.083391694056473e-05,COMPLETE
1418,172.82662963867188,2026-01-03 11:47:50.385850,2026-01-03 11:48:16.008583,0 days 00:00:25.622733,relu,0.13384054575689597,29,0.06735092873663268,2,True,none,2.5638674266860042e-05,COMPLETE
1419,142.55667114257812,2026-01-03 11:48:16.016586,2026-01-03 11:48:41.753883,0 days 00:00:25.737297,relu,0.11884185207675999,30,0.08776856439583262,2,True,standard,1.1628629834240688e-05,COMPLETE
1420,143.0083465576172,2026-01-03 11:48:41.762882,2026-01-03 11:49:07.344954,0 days 00:00:25.582072,relu,0.10749457682234827,27,0.099858026376266,2,True,standard,2.25924663718454e-05,COMPLETE
1421,139.92703247070312,2026-01-03 11:49:07.353954,2026-01-03 11:49:33.127754,0 days 00:00:25.773800,relu,0.113255883058372,32,0.07558665276146674,2,True,standard,1.544718174160415e-05,COMPLETE
1422,141.84750366210938,2026-01-03 11:49:33.136756,2026-01-03 11:49:58.943422,0 days 00:00:25.806666,relu,0.12637601954297012,30,0.08146915559399091,2,True,standard,3.38566265511505e-05,COMPLETE
1423,147.5064697265625,2026-01-03 11:49:58.951422,2026-01-03 11:50:24.622125,0 days 00:00:25.670703,relu,0.11877438145242974,31,0.06054740781421632,2,True,robust,7.522996999710646e-05,COMPLETE
1424,147.68869018554688,2026-01-03 11:50:24.632130,2026-01-03 11:50:50.271808,0 days 00:00:25.639678,relu,0.10624547654231076,32,0.031240933678951293,2,True,standard,1.8902453062126948e-05,COMPLETE
1425,137.33096313476562,2026-01-03 11:50:50.281811,2026-01-03 11:51:16.128823,0 days 00:00:25.847012,relu,0.10751340828404705,29,0.08731695770391414,2,True,standard,0.00012557045805619633,COMPLETE
1426,144.11276245117188,2026-01-03 11:51:16.137832,2026-01-03 11:51:41.551601,0 days 00:00:25.413769,relu,0.11353355946287659,26,0.06426427551119904,2,True,standard,0.00013528800353131086,COMPLETE
1427,152.7868194580078,2026-01-03 11:51:41.559601,2026-01-03 11:52:07.130819,0 days 00:00:25.571218,relu,0.106922962224548,25,0.05096383547892925,2,True,standard,0.0001451847496931743,COMPLETE
1428,148.6063232421875,2026-01-03 11:52:07.139822,2026-01-03 11:52:32.659612,0 days 00:00:25.519790,relu,0.12335710861929518,27,0.07074431520928194,2,True,standard,0.0001412959663882349,COMPLETE
1429,175.11868286132812,2026-01-03 11:52:32.668612,2026-01-03 11:52:58.199245,0 days 00:00:25.530633,relu,0.10013890402993175,26,0.05620411204830811,2,True,minmax,0.00011727483471570963,COMPLETE
1430,165.0160369873047,2026-01-03 11:52:58.207244,2026-01-03 11:53:24.679535,0 days 00:00:26.472291,mish,0.11466415912078706,29,0.0731476749085419,2,True,standard,0.00012208652044183813,COMPLETE
1431,198.1920408799913,2026-01-03 11:53:24.687535,2026-01-03 11:53:49.764815,0 days 00:00:25.077280,relu,0.10026174435264126,29,0.0009941757058187367,2,False,standard,0.00013090358715065395,COMPLETE
1432,143.1276092529297,2026-01-03 11:53:49.774327,2026-01-03 11:54:15.328528,0 days 00:00:25.554201,relu,0.10014641486890179,28,0.07210773207298088,2,True,standard,0.00010984114265027295,COMPLETE
1433,147.4158172607422,2026-01-03 11:54:15.336528,2026-01-03 11:54:42.663094,0 days 00:00:27.326566,gelu,0.13248684254094628,28,0.08024430109607486,2,True,standard,9.842443371347811e-05,COMPLETE
1434,152.01272583007812,2026-01-03 11:54:42.672099,2026-01-03 11:55:05.864137,0 days 00:00:23.192038,relu,0.11990271006144516,29,0.06269904432208442,1,True,standard,0.00011330748139262191,COMPLETE
1435,142.59262084960938,2026-01-03 11:55:05.873137,2026-01-03 11:55:31.482022,0 days 00:00:25.608885,relu,0.1110608958111224,32,0.08059551962824843,2,True,standard,0.00012487266127924837,COMPLETE
1436,147.26419067382812,2026-01-03 11:55:31.490022,2026-01-03 11:55:56.941820,0 days 00:00:25.451798,relu,0.10005562406613026,27,0.08688393886550856,2,True,standard,0.00010102536455916458,COMPLETE
1437,143.21913146972656,2026-01-03 11:55:56.949815,2026-01-03 11:56:22.740505,0 days 00:00:25.790690,relu,0.11267508771610943,30,0.06822128038860902,2,True,standard,0.00016174042607777767,COMPLETE
1438,140.90003967285156,2026-01-03 11:56:22.749505,2026-01-03 11:56:48.492093,0 days 00:00:25.742588,relu,0.12304868641773041,31,0.08720990007404775,2,True,standard,0.00014894928647333954,COMPLETE
1439,142.37258911132812,2026-01-03 11:56:48.500092,2026-01-03 11:57:14.187738,0 days 00:00:25.687646,relu,0.10732808861297534,31,0.07395189966158132,2,True,standard,0.00013005348937785704,COMPLETE
1440,144.7847442626953,2026-01-03 11:57:14.197246,2026-01-03 11:57:39.608343,0 days 00:00:25.411097,relu,0.13778775658271347,28,0.08714075639880396,2,True,standard,0.0001557126033012065,COMPLETE
1441,187.01229858398438,2026-01-03 11:57:39.617345,2026-01-03 11:58:05.148544,0 days 00:00:25.531199,relu,0.11724750309329345,32,0.001257111831018867,2,True,standard,0.00013853497888275938,COMPLETE
1442,168.2298126220703,2026-01-03 11:58:05.156547,2026-01-03 11:58:30.866448,0 days 00:00:25.709901,silu,0.10782553242063421,30,0.059369361530460636,2,True,none,9.12328209742964e-05,COMPLETE
1443,182.0520782470703,2026-01-03 11:58:30.875450,2026-01-03 11:58:56.422132,0 days 00:00:25.546682,relu,0.12901738048579126,29,0.0025697247674729856,2,True,standard,0.00010077979796632642,COMPLETE
1444,139.99874877929688,2026-01-03 11:58:56.432135,2026-01-03 11:59:21.967118,0 days 00:00:25.534983,relu,0.10001946503455154,32,0.07790624311783063,2,True,standard,0.00011266456118824231,COMPLETE
1445,144.71926879882812,2026-01-03 11:59:21.974121,2026-01-03 11:59:47.550386,0 days 00:00:25.576265,relu,0.11343230666898044,30,0.04378233580526941,2,True,standard,8.51260149312143e-05,COMPLETE
1446,142.50999450683594,2026-01-03 11:59:47.558387,2026-01-03 12:00:13.234753,0 days 00:00:25.676366,relu,0.11886663349079589,27,0.09996172287972542,2,True,standard,0.00012775815546355287,COMPLETE
1447,198.4754956732856,2026-01-03 12:00:13.243756,2026-01-03 12:00:38.277973,0 days 00:00:25.034217,relu,0.10678696564007509,30,0.0009941729089141128,2,False,robust,0.00011182582920710976,COMPLETE
