number,value,datetime_start,datetime_complete,duration,params_activation,params_dropout,params_hidden_size,params_lr,params_n_layers,params_scale_target,params_scaler,params_weight_decay,state
0,174.56240844726562,2026-01-03 01:07:27.853418,2026-01-03 01:07:53.273589,0 days 00:00:25.420171,silu,0.28887463956209225,31,0.0364050387282162,1,True,none,1.5088426610095162e-05,COMPLETE
1,266.6578070746528,2026-01-03 01:07:53.283591,2026-01-03 01:08:17.037485,0 days 00:00:23.753894,relu,0.385850921208824,9,3.391250285741784e-05,1,False,none,0.0005979982138030138,COMPLETE
2,217.86914293077263,2026-01-03 01:08:17.045490,2026-01-03 01:08:42.319188,0 days 00:00:25.273698,silu,0.33921718907037657,8,0.0001731673336932338,2,False,none,8.834654254015959e-05,COMPLETE
3,216.78158569335938,2026-01-03 01:08:42.326189,2026-01-03 01:09:06.035365,0 days 00:00:23.709176,relu,0.35461692969862724,5,0.0019958758364021605,1,True,minmax,0.00038484455332862697,COMPLETE
4,207.4252166748047,2026-01-03 01:09:06.044364,2026-01-03 01:09:31.784590,0 days 00:00:25.740226,silu,0.1581377723224124,4,0.0018969379910747134,2,True,none,0.0004326162381243324,COMPLETE
5,195.51416015625,2026-01-03 01:09:31.792590,2026-01-03 01:09:56.744782,0 days 00:00:24.952192,gelu,0.1990700962203855,13,0.000440805619894658,1,True,standard,5.018158763551464e-05,COMPLETE
6,263.5629577636719,2026-01-03 01:09:56.751786,2026-01-03 01:10:22.691002,0 days 00:00:25.939216,relu,0.107562947900474,10,0.0001541577378120172,2,True,standard,1.6731386116239597e-06,COMPLETE
7,183.60458374023438,2026-01-03 01:10:22.712005,2026-01-03 01:10:50.580711,0 days 00:00:27.868706,gelu,0.31391602321434886,13,0.04161741976547407,2,True,robust,0.000620467641372572,COMPLETE
8,198.0513916015625,2026-01-03 01:10:50.588711,2026-01-03 01:11:16.884947,0 days 00:00:26.296236,mish,0.21843774577823935,10,0.01009675002200153,2,True,minmax,2.0030290133090068e-06,COMPLETE
9,337.5393459065755,2026-01-03 01:11:16.892947,2026-01-03 01:11:39.985619,0 days 00:00:23.092672,silu,0.13957033728229506,14,1.2868105485753744e-05,1,False,none,1.3220853380980187e-05,COMPLETE
10,355.62784640842017,2026-01-03 01:11:39.993619,2026-01-03 01:12:03.768316,0 days 00:00:23.774697,mish,0.46732079979209135,32,4.955437637840368e-05,1,False,robust,1.0493362130779932e-05,COMPLETE
11,162.01815795898438,2026-01-03 01:12:03.776319,2026-01-03 01:12:32.372038,0 days 00:00:28.595719,gelu,0.2685463134774318,29,0.09203852772410084,2,True,robust,1.0578077980219151e-05,COMPLETE
12,172.90834045410156,2026-01-03 01:12:32.380038,2026-01-03 01:12:57.624230,0 days 00:00:25.244192,gelu,0.25720404887140524,31,0.09692557440441187,1,True,robust,7.121107996045231e-06,COMPLETE
13,167.2569580078125,2026-01-03 01:12:57.632233,2026-01-03 01:13:25.950935,0 days 00:00:28.318702,gelu,0.24742616025407604,21,0.08861749295913475,2,True,robust,3.714573214434724e-06,COMPLETE
14,182.93609619140625,2026-01-03 01:13:25.957936,2026-01-03 01:13:54.152657,0 days 00:00:28.194721,gelu,0.23565685025422142,21,0.01066586111160052,2,True,robust,3.984292079540415e-06,COMPLETE
15,179.48416137695312,2026-01-03 01:13:54.160657,2026-01-03 01:14:22.582421,0 days 00:00:28.421764,gelu,0.43018230049295547,20,0.08807169413463661,2,True,robust,4.209970564680035e-06,COMPLETE
16,181.92257690429688,2026-01-03 01:14:22.590421,2026-01-03 01:14:50.927141,0 days 00:00:28.336720,gelu,0.2722451719235101,21,0.01384297086806499,2,True,robust,2.9486840361240964e-05,COMPLETE
17,177.77207946777344,2026-01-03 01:14:50.935140,2026-01-03 01:15:19.431879,0 days 00:00:28.496739,gelu,0.19384635607862,24,0.029904389514302278,2,True,robust,1.0910019416804575e-06,COMPLETE
18,206.08616956922742,2026-01-03 01:15:19.440882,2026-01-03 01:15:46.672083,0 days 00:00:27.231201,gelu,0.395045670618958,16,0.0005982938302624566,2,False,robust,0.00011423276553629352,COMPLETE
19,198.30604553222656,2026-01-03 01:15:46.680085,2026-01-03 01:16:13.732813,0 days 00:00:27.052728,mish,0.30811212502715274,24,0.005479406599269112,2,True,minmax,4.574382872943069e-06,COMPLETE
20,188.8004913330078,2026-01-03 01:16:13.740815,2026-01-03 01:16:41.651017,0 days 00:00:27.910202,gelu,0.2518376705451516,7,0.020812580084974032,2,True,standard,2.855808732907607e-05,COMPLETE
21,171.04090881347656,2026-01-03 01:16:41.660019,2026-01-03 01:17:06.809702,0 days 00:00:25.149683,gelu,0.26101687082642333,27,0.08735262696573459,1,True,robust,6.171563293490152e-06,COMPLETE
22,173.63064575195312,2026-01-03 01:17:06.817701,2026-01-03 01:17:31.717421,0 days 00:00:24.899720,gelu,0.17236735084567087,26,0.05674373139523627,1,True,robust,2.6944849604324834e-06,COMPLETE
23,169.60015869140625,2026-01-03 01:17:31.725420,2026-01-03 01:17:59.826110,0 days 00:00:28.100690,gelu,0.2259878018902967,17,0.06405924788035804,2,True,robust,7.121981790775302e-06,COMPLETE
24,173.7549285888672,2026-01-03 01:17:59.834110,2026-01-03 01:18:27.933856,0 days 00:00:28.099746,gelu,0.21342512635875427,18,0.05421896677559838,2,True,robust,1.8604125362312758e-05,COMPLETE
25,186.1940155029297,2026-01-03 01:18:27.940855,2026-01-03 01:18:55.760578,0 days 00:00:27.819723,gelu,0.33274690054558553,16,0.02135728745569925,2,True,robust,2.7349476114746615e-06,COMPLETE
26,201.1491231282552,2026-01-03 01:18:55.769582,2026-01-03 01:19:23.058810,0 days 00:00:27.289228,gelu,0.2881753067642687,17,0.0008057890304277326,2,False,robust,1.0533781438461423e-05,COMPLETE
27,197.43228149414062,2026-01-03 01:19:23.067811,2026-01-03 01:19:49.420504,0 days 00:00:26.352693,mish,0.2356203378934914,12,0.0055731386554264736,2,True,robust,8.419446275853122e-06,COMPLETE
28,169.82879638671875,2026-01-03 01:19:49.428500,2026-01-03 01:20:15.595214,0 days 00:00:26.166714,relu,0.17699333675171286,20,0.021720736964525568,2,True,standard,5.822277991972577e-05,COMPLETE
29,196.6764373779297,2026-01-03 01:20:15.606213,2026-01-03 01:20:42.186450,0 days 00:00:26.580237,silu,0.28580758423421276,27,0.05338394290753585,2,True,minmax,1.8057195209541857e-05,COMPLETE
30,177.21588134765625,2026-01-03 01:20:42.195448,2026-01-03 01:21:10.120655,0 days 00:00:27.925207,gelu,0.13773908488487607,15,0.03133502268283422,2,True,robust,1.1567569987586567e-06,COMPLETE
31,166.47193908691406,2026-01-03 01:21:10.129655,2026-01-03 01:21:36.314872,0 days 00:00:26.185217,relu,0.17965945428522512,19,0.06505270673082175,2,True,standard,4.638689513081717e-05,COMPLETE
32,162.73953247070312,2026-01-03 01:21:36.323871,2026-01-03 01:22:02.587570,0 days 00:00:26.263699,relu,0.2304330786299581,24,0.06891252799088628,2,True,standard,0.00017145962864927752,COMPLETE
33,152.6302032470703,2026-01-03 01:22:02.596573,2026-01-03 01:22:28.973245,0 days 00:00:26.376672,relu,0.1020905589509436,23,0.04052668011036633,2,True,standard,0.00019856251916080557,COMPLETE
34,198.21620781792535,2026-01-03 01:22:28.980244,2026-01-03 01:22:54.853393,0 days 00:00:25.873149,relu,0.11746707921766887,28,0.0008141882073411155,2,False,standard,0.00020015371263027072,COMPLETE
35,158.4785614013672,2026-01-03 01:22:54.861397,2026-01-03 01:23:21.238619,0 days 00:00:26.377222,relu,0.1408106255053322,24,0.03976487460948265,2,True,standard,0.00021965506565443103,COMPLETE
36,155.9203643798828,2026-01-03 01:23:21.245619,2026-01-03 01:23:47.652809,0 days 00:00:26.407190,relu,0.1443739872535756,24,0.03735361457937489,2,True,standard,0.00019171655018878622,COMPLETE
37,183.7758026123047,2026-01-03 01:23:47.660809,2026-01-03 01:24:13.634033,0 days 00:00:25.973224,relu,0.1373171767241274,8,0.038330245986883414,2,True,standard,0.0003053237825647197,COMPLETE
38,198.20849853515625,2026-01-03 01:24:13.641034,2026-01-03 01:24:39.594755,0 days 00:00:25.953721,relu,0.10788328011378599,29,0.0008513940980610772,2,False,standard,0.000923291372383529,COMPLETE
39,198.08401489257812,2026-01-03 01:24:39.602756,2026-01-03 01:25:05.247462,0 days 00:00:25.644706,relu,0.10072504594674288,5,0.017123327941774447,2,True,standard,9.590019310864472e-05,COMPLETE
40,182.0220184326172,2026-01-03 01:25:05.256465,2026-01-03 01:25:31.553668,0 days 00:00:26.297203,relu,0.1302697267576919,23,0.006438588976303605,2,True,none,0.00024161143794320335,COMPLETE
41,164.96807861328125,2026-01-03 01:25:31.561668,2026-01-03 01:25:58.054365,0 days 00:00:26.492697,relu,0.16103096137806844,24,0.0319386792886351,2,True,standard,0.00015031856911483952,COMPLETE
42,153.91371154785156,2026-01-03 01:25:58.063365,2026-01-03 01:26:24.543584,0 days 00:00:26.480219,relu,0.15437635817536977,31,0.04516096265094573,2,True,standard,0.00015706532700352098,COMPLETE
43,149.38650512695312,2026-01-03 01:26:24.551588,2026-01-03 01:26:51.012288,0 days 00:00:26.460700,relu,0.1553294750844813,31,0.0421593029741721,2,True,standard,0.0005948607538233904,COMPLETE
44,151.755615234375,2026-01-03 01:26:51.019288,2026-01-03 01:27:17.581977,0 days 00:00:26.562689,relu,0.12308812598778494,32,0.04091689169404017,2,True,standard,0.0004717425310173592,COMPLETE
45,180.80178833007812,2026-01-03 01:27:17.589977,2026-01-03 01:27:44.196179,0 days 00:00:26.606202,relu,0.15847262167315102,30,0.002947008456517783,2,True,standard,0.00045361578356237057,COMPLETE
46,159.41204833984375,2026-01-03 01:27:44.204179,2026-01-03 01:28:10.633903,0 days 00:00:26.429724,relu,0.12254168908682572,32,0.025602538776072627,2,True,standard,0.000644481965743663,COMPLETE
47,198.60488647460937,2026-01-03 01:28:10.642904,2026-01-03 01:28:36.445668,0 days 00:00:25.802764,relu,0.20360325499046805,32,0.0009043473140769934,2,False,standard,0.00032868231104309027,COMPLETE
48,170.03582763671875,2026-01-03 01:28:36.453668,2026-01-03 01:29:00.400326,0 days 00:00:23.946658,relu,0.15001176046329315,26,0.01343193528330663,1,True,standard,0.0009664494484219888,COMPLETE
49,172.63404846191406,2026-01-03 01:29:00.409326,2026-01-03 01:29:26.812556,0 days 00:00:26.403230,silu,0.11863606160723733,22,0.0082043368519895,2,True,none,0.0004787432918312427,COMPLETE
50,158.68161010742188,2026-01-03 01:29:26.819556,2026-01-03 01:29:53.288788,0 days 00:00:26.469232,relu,0.19541380148681725,29,0.040423153059497056,2,True,standard,0.00012667732408471458,COMPLETE
51,151.81494140625,2026-01-03 01:29:53.296788,2026-01-03 01:30:19.738484,0 days 00:00:26.441696,relu,0.14940552084135833,26,0.04572408228681404,2,True,standard,0.0006652644302999932,COMPLETE
52,154.33767700195312,2026-01-03 01:30:19.746484,2026-01-03 01:30:46.177186,0 days 00:00:26.430702,relu,0.10004216612839062,26,0.05139975941380772,2,True,standard,0.0006318341066885619,COMPLETE
53,168.0797119140625,2026-01-03 01:30:46.185186,2026-01-03 01:31:12.569398,0 days 00:00:26.384212,relu,0.10438040499235125,26,0.015653773079314853,2,True,standard,0.000752937144448041,COMPLETE
54,151.50167846679688,2026-01-03 01:31:12.578398,2026-01-03 01:31:39.075099,0 days 00:00:26.496701,relu,0.1641800232405044,30,0.045220960052095,2,True,standard,0.0003389650998797088,COMPLETE
55,150.54507446289062,2026-01-03 01:31:39.083094,2026-01-03 01:32:05.645302,0 days 00:00:26.562208,relu,0.16511500494828382,32,0.025868677942043724,2,True,standard,0.0003177176276951969,COMPLETE
56,187.00534057617188,2026-01-03 01:32:05.653302,2026-01-03 01:32:32.249481,0 days 00:00:26.596179,relu,0.1782111172504892,32,0.025881642082931765,2,True,minmax,0.0003637903569671288,COMPLETE
57,177.47718811035156,2026-01-03 01:32:32.257483,2026-01-03 01:32:59.656178,0 days 00:00:27.398695,mish,0.16379770376291256,29,0.01081132780336492,2,True,standard,0.0002658034034245182,COMPLETE
58,198.3601278347439,2026-01-03 01:32:59.663178,2026-01-03 01:33:25.377889,0 days 00:00:25.714711,silu,0.18589842737632545,28,0.0008981468971318123,2,False,standard,0.00047663077955951494,COMPLETE
59,182.01187133789062,2026-01-03 01:33:25.386891,2026-01-03 01:33:49.247075,0 days 00:00:23.860184,relu,0.1253331105652737,22,0.07924072377435482,1,True,none,0.0003951810959229216,COMPLETE
60,168.24343872070312,2026-01-03 01:33:49.256075,2026-01-03 01:34:16.002283,0 days 00:00:26.746208,relu,0.20940413398797458,30,0.02024422870980716,2,True,standard,0.0005133470762333659,COMPLETE
61,155.36044311523438,2026-01-03 01:34:16.011286,2026-01-03 01:34:42.675494,0 days 00:00:26.664208,relu,0.1556136335809624,32,0.04403254143758878,2,True,standard,0.0007856657639171913,COMPLETE
62,165.86856079101562,2026-01-03 01:34:42.684497,2026-01-03 01:35:08.941666,0 days 00:00:26.257169,relu,0.17033436758518458,26,0.02723844284183943,2,True,standard,7.099823678957688e-05,COMPLETE
63,174.4357452392578,2026-01-03 01:35:08.949665,2026-01-03 01:35:35.506876,0 days 00:00:26.557211,relu,0.38182627639680433,30,0.045989439057172656,2,True,standard,0.00026022789987545673,COMPLETE
64,148.12515258789062,2026-01-03 01:35:35.515879,2026-01-03 01:36:02.051108,0 days 00:00:26.535229,relu,0.14795229491961867,28,0.07246297858818533,2,True,standard,0.000566494542191482,COMPLETE
65,177.46600341796875,2026-01-03 01:36:02.059107,2026-01-03 01:36:28.546821,0 days 00:00:26.487714,relu,0.11785950216629681,27,0.0720943181785745,2,True,minmax,0.0005958123675473429,COMPLETE
66,181.9513702392578,2026-01-03 01:36:28.553818,2026-01-03 01:36:55.546040,0 days 00:00:26.992222,mish,0.4698693082012422,22,0.03201037623228513,2,True,standard,0.00032636361835852555,COMPLETE
67,176.96743774414062,2026-01-03 01:36:55.554045,2026-01-03 01:37:21.500730,0 days 00:00:25.946685,relu,0.1925290014056844,11,0.05763935694577319,2,True,standard,0.0007987784452779293,COMPLETE
68,191.7790069580078,2026-01-03 01:37:21.509730,2026-01-03 01:37:46.982942,0 days 00:00:25.473212,relu,0.13752089658637923,4,0.09854329435557083,2,True,standard,0.0005793066880641044,COMPLETE
69,169.9368438720703,2026-01-03 01:37:46.989939,2026-01-03 01:38:13.544167,0 days 00:00:26.554228,silu,0.1694568683941308,25,0.07084063522025573,2,True,standard,0.0004223410780524462,COMPLETE
70,198.34207634819876,2026-01-03 01:38:13.551167,2026-01-03 01:38:39.233860,0 days 00:00:25.682693,relu,0.1454654252672088,27,0.0009504403636101678,2,False,standard,0.0007105795101338358,COMPLETE
71,150.24819946289062,2026-01-03 01:38:39.242863,2026-01-03 01:39:05.600588,0 days 00:00:26.357725,relu,0.1304385865911178,30,0.04422246951241183,2,True,standard,0.00015313399376722111,COMPLETE
72,157.4347686767578,2026-01-03 01:39:05.609589,2026-01-03 01:39:32.142816,0 days 00:00:26.533227,relu,0.12847186900389598,28,0.03447444111694403,2,True,standard,0.0002894952758564382,COMPLETE
73,154.9505157470703,2026-01-03 01:39:32.150816,2026-01-03 01:39:58.285550,0 days 00:00:26.134734,relu,0.11249584331261442,20,0.05377444174607392,2,True,standard,0.00037045056307594636,COMPLETE
74,161.49317932128906,2026-01-03 01:39:58.292550,2026-01-03 01:40:24.841278,0 days 00:00:26.548728,relu,0.13201462610939382,29,0.02360389029028119,2,True,standard,0.0005358649825449062,COMPLETE
75,169.83726501464844,2026-01-03 01:40:24.849274,2026-01-03 01:40:51.305519,0 days 00:00:26.456245,relu,0.14898328604959502,25,0.01766323609618539,2,True,standard,0.00011201085211802358,COMPLETE
76,176.46267700195312,2026-01-03 01:40:51.314519,2026-01-03 01:41:17.754216,0 days 00:00:26.439697,relu,0.16293083455443894,23,0.080031183468617,2,True,none,0.0002050809162765244,COMPLETE
77,195.7453155517578,2026-01-03 01:41:17.761215,2026-01-03 01:41:45.126435,0 days 00:00:27.365220,mish,0.44121150200909587,30,0.05954186610065098,2,True,minmax,0.0002590130004452728,COMPLETE
78,149.7330322265625,2026-01-03 01:41:45.135435,2026-01-03 01:42:11.541664,0 days 00:00:26.406229,relu,0.11181545699723325,28,0.04707831488528331,2,True,standard,0.0009720049654187381,COMPLETE
79,222.9111785888672,2026-01-03 01:42:11.550667,2026-01-03 01:42:37.464855,0 days 00:00:25.914188,relu,0.18512994131406432,9,0.00018690725378589463,2,True,standard,0.0009274007237415208,COMPLETE
80,144.3790740966797,2026-01-03 01:42:37.473856,2026-01-03 01:43:04.093103,0 days 00:00:26.619247,relu,0.11473794102240503,31,0.04954344519478417,2,True,standard,0.0006880598401721778,COMPLETE
81,145.13113403320312,2026-01-03 01:43:04.102101,2026-01-03 01:43:30.754797,0 days 00:00:26.652696,relu,0.11466481528203806,31,0.04788627186676127,2,True,standard,0.000993531652157785,COMPLETE
82,151.7541961669922,2026-01-03 01:43:30.762796,2026-01-03 01:43:57.314010,0 days 00:00:26.551214,relu,0.11264647525970614,31,0.029224935579889078,2,True,standard,0.0008438978540564201,COMPLETE
83,155.99911499023438,2026-01-03 01:43:57.322007,2026-01-03 01:44:23.814697,0 days 00:00:26.492690,relu,0.11476945210509056,28,0.029076726776157157,2,True,standard,0.000976671197055399,COMPLETE
84,146.47802734375,2026-01-03 01:44:23.823697,2026-01-03 01:44:50.372413,0 days 00:00:26.548716,relu,0.13227735294300014,30,0.0623075159431067,2,True,standard,0.000727245399062146,COMPLETE
85,181.1715850830078,2026-01-03 01:44:50.380411,2026-01-03 01:45:16.839626,0 days 00:00:26.459215,relu,0.49813677779969145,30,0.06467837877789935,2,True,standard,0.0005652896329536945,COMPLETE
86,149.8651885986328,2026-01-03 01:45:16.846627,2026-01-03 01:45:43.507847,0 days 00:00:26.661220,relu,0.13147560842686012,28,0.0910807638342661,2,True,standard,0.0007332688723100024,COMPLETE
87,144.80374145507812,2026-01-03 01:45:43.515849,2026-01-03 01:46:09.851040,0 days 00:00:26.335191,relu,0.13364062172534807,28,0.09522618161666167,2,True,standard,0.0007477018838125836,COMPLETE
88,198.278902859158,2026-01-03 01:46:09.861042,2026-01-03 01:46:35.534750,0 days 00:00:25.673708,silu,0.12859179417587296,25,0.0009533262122227923,2,False,standard,0.0007297503562196751,COMPLETE
89,182.81826782226562,2026-01-03 01:46:35.543750,2026-01-03 01:47:01.245956,0 days 00:00:25.702206,relu,0.13572031016120711,6,0.09990227489790163,2,True,standard,0.0008719385914928518,COMPLETE
90,178.5604248046875,2026-01-03 01:47:01.253956,2026-01-03 01:47:25.149640,0 days 00:00:23.895684,relu,0.1076313117461787,27,0.07862431423188737,1,True,none,0.000691635414642534,COMPLETE
91,143.98345947265625,2026-01-03 01:47:25.157640,2026-01-03 01:47:51.555869,0 days 00:00:26.398229,relu,0.14218316063554337,28,0.08554312624603251,2,True,standard,0.0004264322330570821,COMPLETE
92,150.0751190185547,2026-01-03 01:47:51.563869,2026-01-03 01:48:17.889074,0 days 00:00:26.325205,relu,0.1440926702956537,28,0.08687330779297366,2,True,standard,0.000989664142535298,COMPLETE
93,148.1851348876953,2026-01-03 01:48:17.896074,2026-01-03 01:48:44.527285,0 days 00:00:26.631211,relu,0.14204407998626536,28,0.08922222479920745,2,True,standard,0.0009979017612593687,COMPLETE
94,145.46212768554688,2026-01-03 01:48:44.535284,2026-01-03 01:49:11.140483,0 days 00:00:26.605199,relu,0.12143882050984786,25,0.07247197101320009,2,True,standard,0.0006472910934128297,COMPLETE
95,146.9202423095703,2026-01-03 01:49:11.148485,2026-01-03 01:49:37.677910,0 days 00:00:26.529425,relu,0.12052619722308783,25,0.0634626956434589,2,True,standard,0.0005627421052813029,COMPLETE
96,150.11007690429688,2026-01-03 01:49:37.685910,2026-01-03 01:50:03.889607,0 days 00:00:26.203697,relu,0.12063651487849811,21,0.06607605205144661,2,True,standard,0.00043843107797869607,COMPLETE
97,151.2316436767578,2026-01-03 01:50:03.898608,2026-01-03 01:50:30.298287,0 days 00:00:26.399679,relu,0.153240069369524,25,0.07459073665295449,2,True,standard,0.0005974936961771384,COMPLETE
98,196.2760009765625,2026-01-03 01:50:30.306287,2026-01-03 01:50:57.179488,0 days 00:00:26.873201,mish,0.13998465415255396,19,0.05937752763745058,2,True,minmax,0.0005241253512476419,COMPLETE
99,146.8567352294922,2026-01-03 01:50:57.188488,2026-01-03 01:51:23.563195,0 days 00:00:26.374707,relu,0.120093640149007,23,0.05229815491945466,2,True,standard,0.0008041175516474923,COMPLETE
100,149.46841430664062,2026-01-03 01:51:23.571196,2026-01-03 01:51:49.842864,0 days 00:00:26.271668,relu,0.10109940596211646,24,0.08351009674334758,2,True,standard,0.000826847333968577,COMPLETE
101,160.2061309814453,2026-01-03 01:51:49.851867,2026-01-03 01:52:16.189550,0 days 00:00:26.337683,relu,0.12051350457471963,23,0.0542068722951789,2,True,standard,0.000651636114190317,COMPLETE
102,164.47898864746094,2026-01-03 01:52:16.198552,2026-01-03 01:52:42.212748,0 days 00:00:26.014196,relu,0.14128912458470588,13,0.06625020844191748,2,True,standard,0.00040499477741071137,COMPLETE
103,144.74969482421875,2026-01-03 01:52:42.220747,2026-01-03 01:53:08.731950,0 days 00:00:26.511203,relu,0.12468593124448848,27,0.0995727573769789,2,True,standard,0.0008264636739260208,COMPLETE
104,144.20169067382812,2026-01-03 01:53:08.739947,2026-01-03 01:53:35.192151,0 days 00:00:26.452204,relu,0.12462266503077746,26,0.09647530988867571,2,True,standard,0.000791705993317659,COMPLETE
105,148.41380310058594,2026-01-03 01:53:35.202153,2026-01-03 01:54:01.825345,0 days 00:00:26.623192,relu,0.10837128227976552,25,0.07583980416937636,2,True,standard,0.0008114391959258081,COMPLETE
106,155.8723602294922,2026-01-03 01:54:01.833345,2026-01-03 01:54:28.099522,0 days 00:00:26.266177,relu,0.12360329878222096,22,0.05135241410267098,2,True,standard,0.0005218680978983469,COMPLETE
107,198.56088358561198,2026-01-03 01:54:28.107525,2026-01-03 01:54:53.414211,0 days 00:00:25.306686,relu,0.11465823869592424,14,0.0009656023799259898,2,False,standard,0.0006792113995015785,COMPLETE
108,146.20791625976562,2026-01-03 01:54:53.423211,2026-01-03 01:55:19.699934,0 days 00:00:26.276723,relu,0.12557617645725658,26,0.09778788251105039,2,True,standard,0.00046356874486492514,COMPLETE
109,171.7730255126953,2026-01-03 01:55:19.707934,2026-01-03 01:55:46.027633,0 days 00:00:26.319699,silu,0.12366599705709853,23,0.03562789889976401,2,True,standard,0.00046891497292246857,COMPLETE
110,174.14138793945312,2026-01-03 01:55:46.034633,2026-01-03 01:56:12.342847,0 days 00:00:26.308214,relu,0.31936015884339236,21,0.09669551565471952,2,True,standard,0.0007887705123093096,COMPLETE
111,148.93191528320312,2026-01-03 01:56:12.350848,2026-01-03 01:56:38.687533,0 days 00:00:26.336685,relu,0.10719132898810566,26,0.06101260018268865,2,True,standard,0.0006271457318523841,COMPLETE
