number,value,datetime_start,datetime_complete,duration,params_activation,params_dropout,params_hidden_size,params_lr,params_n_layers,params_scale_target,params_scaler,params_weight_decay,state
447,148.2760467529297,2026-01-03 04:25:25.167031,2026-01-03 04:25:51.905741,0 days 00:00:26.738710,relu,0.12785107029168927,32,0.055622341496243836,2,True,standard,5.753780664809222e-06,COMPLETE
448,143.9107666015625,2026-01-03 04:25:51.914744,2026-01-03 04:26:18.552942,0 days 00:00:26.638198,relu,0.12325579551827101,31,0.08512393757541735,2,True,standard,5.1830164544845875e-06,COMPLETE
449,198.28773878309465,2026-01-03 04:26:18.560944,2026-01-03 04:26:46.244648,0 days 00:00:27.683704,gelu,0.13872800189563017,32,0.0009945459827123825,2,False,standard,8.599295190202314e-06,COMPLETE
450,146.36758422851562,2026-01-03 04:26:46.253645,2026-01-03 04:27:12.935840,0 days 00:00:26.682195,relu,0.12726721059074791,30,0.06929104396665553,2,True,standard,0.00023692505714870596,COMPLETE
451,143.3459930419922,2026-01-03 04:27:12.943839,2026-01-03 04:27:39.738043,0 days 00:00:26.794204,relu,0.11810955712147761,31,0.08731406769800362,2,True,standard,6.380530229246082e-06,COMPLETE
452,181.8946075439453,2026-01-03 04:27:39.747044,2026-01-03 04:28:06.363724,0 days 00:00:26.616680,relu,0.11581566759368991,29,0.0025861482049786256,2,True,standard,3.60085343427809e-06,COMPLETE
453,143.36080932617188,2026-01-03 04:28:06.372724,2026-01-03 04:28:33.380456,0 days 00:00:27.007732,relu,0.13143059689653935,31,0.07760193402770174,2,True,standard,7.660842785962606e-06,COMPLETE
454,149.23190307617188,2026-01-03 04:28:33.389456,2026-01-03 04:29:00.158110,0 days 00:00:26.768654,relu,0.11982340412298914,23,0.06497060551734694,2,True,standard,6.00531276423907e-06,COMPLETE
455,143.3906707763672,2026-01-03 04:29:00.166110,2026-01-03 04:29:26.948844,0 days 00:00:26.782734,relu,0.1115142638581949,28,0.0880849638478347,2,True,standard,0.00019927537380181248,COMPLETE
456,172.17886352539062,2026-01-03 04:29:26.956843,2026-01-03 04:29:52.948237,0 days 00:00:25.991394,silu,0.12527133052082967,6,0.07662285517059797,2,True,standard,8.948192871302792e-06,COMPLETE
457,141.96554565429688,2026-01-03 04:29:52.957238,2026-01-03 04:30:19.824901,0 days 00:00:26.867663,relu,0.11178019859815774,30,0.08669504652867735,2,True,standard,1.0557871162637705e-05,COMPLETE
458,141.76351928710938,2026-01-03 04:30:19.833904,2026-01-03 04:30:46.610621,0 days 00:00:26.776717,relu,0.10792291392926684,32,0.06820827059326522,2,True,standard,0.00015529607730260266,COMPLETE
459,173.50608825683594,2026-01-03 04:30:46.618620,2026-01-03 04:31:13.242314,0 days 00:00:26.623694,relu,0.12064187644225174,29,0.08795167689655861,2,True,none,4.813969567557973e-06,COMPLETE
460,151.2990264892578,2026-01-03 04:31:13.250314,2026-01-03 04:31:39.824994,0 days 00:00:26.574680,relu,0.113103256842804,30,0.05697725397596791,2,True,standard,3.934009851033158e-06,COMPLETE
461,144.3891143798828,2026-01-03 04:31:39.832994,2026-01-03 04:32:06.455691,0 days 00:00:26.622697,relu,0.10718778659814965,27,0.07772316785865448,2,True,standard,4.455291033282013e-06,COMPLETE
462,143.51773071289062,2026-01-03 04:32:06.463692,2026-01-03 04:32:33.471438,0 days 00:00:27.007746,relu,0.13615724889693084,31,0.09943837237993655,2,True,standard,0.0002613555520034219,COMPLETE
463,145.1379852294922,2026-01-03 04:32:33.480437,2026-01-03 04:33:00.081097,0 days 00:00:26.600660,relu,0.12007144831941942,28,0.07361885108616868,2,True,standard,6.58456848721474e-06,COMPLETE
464,146.99197387695312,2026-01-03 04:33:00.089097,2026-01-03 04:33:26.824395,0 days 00:00:26.735298,relu,0.12682797774236962,30,0.08856056447707135,2,True,robust,0.00017997019833340913,COMPLETE
465,168.39505004882812,2026-01-03 04:33:26.832393,2026-01-03 04:33:53.636658,0 days 00:00:26.804265,relu,0.24197823254728312,32,0.022323449788417875,2,True,standard,0.00014016350832320417,COMPLETE
466,149.01951599121094,2026-01-03 04:33:53.644661,2026-01-03 04:34:20.110914,0 days 00:00:26.466253,relu,0.10678170179169764,26,0.06412556443369362,2,True,standard,1.2678804715029331e-05,COMPLETE
467,145.3267364501953,2026-01-03 04:34:20.117915,2026-01-03 04:34:46.848209,0 days 00:00:26.730294,relu,0.11456579642226801,29,0.07922091004226373,2,True,standard,0.0002161097732653578,COMPLETE
468,197.70810431586375,2026-01-03 04:34:46.857209,2026-01-03 04:35:10.300326,0 days 00:00:23.443117,relu,0.10016908204159941,27,0.0009947007279214283,1,False,minmax,7.413343933097066e-06,COMPLETE
469,143.4650421142578,2026-01-03 04:35:10.307327,2026-01-03 04:35:37.005576,0 days 00:00:26.698249,relu,0.1140237836305786,31,0.08936274340943619,2,True,standard,1.1870902335157167e-05,COMPLETE
470,155.65438842773438,2026-01-03 04:35:37.014577,2026-01-03 04:36:04.604925,0 days 00:00:27.590348,mish,0.10806436245452637,29,0.09944938923345698,2,True,standard,0.00016434595070086898,COMPLETE
471,143.572509765625,2026-01-03 04:36:04.613926,2026-01-03 04:36:31.391188,0 days 00:00:26.777262,relu,0.1230140993270307,30,0.0718757066188344,2,True,standard,0.00010095695509334694,COMPLETE
472,146.5529022216797,2026-01-03 04:36:31.399188,2026-01-03 04:36:58.046423,0 days 00:00:26.647235,relu,0.10773178892744416,25,0.0800212980790906,2,True,standard,7.06419107118367e-05,COMPLETE
473,145.8446044921875,2026-01-03 04:36:58.054427,2026-01-03 04:37:26.581312,0 days 00:00:28.526885,gelu,0.13314159448598842,28,0.08935153584876336,2,True,standard,3.845641197760687e-05,COMPLETE
474,175.02243041992188,2026-01-03 04:37:26.594313,2026-01-03 04:37:53.340078,0 days 00:00:26.745765,relu,0.4331202176687682,32,0.06311693974753117,2,True,standard,0.000189232560543513,COMPLETE
475,141.47811889648438,2026-01-03 04:37:53.348083,2026-01-03 04:38:20.106881,0 days 00:00:26.758798,relu,0.11723831223744131,31,0.0999538765490695,2,True,standard,0.00014210596172713888,COMPLETE
476,145.25650024414062,2026-01-03 04:38:20.115885,2026-01-03 04:38:46.791163,0 days 00:00:26.675278,relu,0.10634295355801289,27,0.054504440090281055,2,True,standard,0.0002396942995677465,COMPLETE
477,141.56454467773438,2026-01-03 04:38:46.801164,2026-01-03 04:39:13.652915,0 days 00:00:26.851751,relu,0.10037074578780313,29,0.07651316663451785,2,True,standard,8.954011457857853e-05,COMPLETE
478,163.1056671142578,2026-01-03 04:39:13.661918,2026-01-03 04:39:40.400676,0 days 00:00:26.738758,relu,0.1265784724970037,30,0.013894127559325661,2,True,standard,0.00013133464614799247,COMPLETE
479,145.54568481445312,2026-01-03 04:39:40.408675,2026-01-03 04:40:07.152952,0 days 00:00:26.744277,relu,0.11649825076130405,28,0.08783980101734526,2,True,standard,0.00010678382333817637,COMPLETE
480,167.0111846923828,2026-01-03 04:40:07.161954,2026-01-03 04:40:34.102258,0 days 00:00:26.940304,silu,0.10036696879856799,32,0.06866006804247073,2,True,standard,9.767921781145472e-06,COMPLETE
481,144.4759979248047,2026-01-03 04:40:34.111259,2026-01-03 04:41:00.910040,0 days 00:00:26.798781,relu,0.1130310594317817,30,0.08080739444610736,2,True,standard,0.0001584645337178599,COMPLETE
482,143.1330108642578,2026-01-03 04:41:00.918041,2026-01-03 04:41:27.644309,0 days 00:00:26.726268,relu,0.12109544098672173,29,0.09976729073312364,2,True,standard,0.00012087615126987155,COMPLETE
483,141.6313934326172,2026-01-03 04:41:27.653309,2026-01-03 04:41:54.253055,0 days 00:00:26.599746,relu,0.10760618068569333,32,0.08806337254310044,2,True,standard,0.00020126504865803336,COMPLETE
484,172.81625366210938,2026-01-03 04:41:54.261055,2026-01-03 04:42:20.777790,0 days 00:00:26.516735,relu,0.12958582486796605,26,0.07346788746806772,2,True,none,5.525492999193449e-06,COMPLETE
485,140.32508850097656,2026-01-03 04:42:20.785786,2026-01-03 04:42:47.516554,0 days 00:00:26.730768,relu,0.10006401537993517,30,0.065880268291368,2,True,standard,8.04489077692317e-06,COMPLETE
486,144.7003936767578,2026-01-03 04:42:47.523555,2026-01-03 04:43:14.392835,0 days 00:00:26.869280,relu,0.10611226537967469,31,0.0497928036352566,2,True,standard,8.53398184928068e-06,COMPLETE
487,149.3647918701172,2026-01-03 04:43:14.401834,2026-01-03 04:43:41.258132,0 days 00:00:26.856298,relu,0.10069471499201361,30,0.06048432550550815,2,True,robust,7.768620729865131e-06,COMPLETE
488,200.95855224609375,2026-01-03 04:43:41.267132,2026-01-03 04:44:06.505313,0 days 00:00:25.238181,relu,0.1001836894268253,8,0.0009948671992839571,2,False,standard,6.454643012570486e-06,COMPLETE
489,138.1255645751953,2026-01-03 04:44:06.514313,2026-01-03 04:44:33.372069,0 days 00:00:26.857756,relu,0.1084728458139556,32,0.08804168689958115,2,True,standard,8.89096516712116e-06,COMPLETE
490,142.99855041503906,2026-01-03 04:44:33.380075,2026-01-03 04:45:00.197850,0 days 00:00:26.817775,relu,0.10760892937028758,29,0.06207196109777428,2,True,standard,8.352532980517816e-06,COMPLETE
491,140.5437469482422,2026-01-03 04:45:00.205851,2026-01-03 04:45:26.844584,0 days 00:00:26.638733,relu,0.10799117686036944,30,0.07977499874335957,2,True,standard,7.299796556767473e-06,COMPLETE
492,177.0618896484375,2026-01-03 04:45:26.853584,2026-01-03 04:45:53.703864,0 days 00:00:26.850280,relu,0.11235380698194543,31,0.006593096532047839,2,True,standard,6.844315004965961e-06,COMPLETE
493,182.47341918945312,2026-01-03 04:45:53.711867,2026-01-03 04:46:20.068103,0 days 00:00:26.356236,relu,0.11243074731173375,18,0.054314561978548226,2,True,minmax,1.0116980980065403e-05,COMPLETE
494,146.16787719726562,2026-01-03 04:46:20.075103,2026-01-03 04:46:46.825376,0 days 00:00:26.750273,relu,0.10903366157964005,31,0.042797732897088235,2,True,standard,7.399547872281784e-06,COMPLETE
495,163.2748260498047,2026-01-03 04:46:46.832376,2026-01-03 04:47:13.645656,0 days 00:00:26.813280,relu,0.32018155859604985,32,0.06419537624858876,2,True,standard,5.848239657332389e-06,COMPLETE
496,156.93638610839844,2026-01-03 04:47:13.653658,2026-01-03 04:47:41.280994,0 days 00:00:27.627336,mish,0.1070769255873004,30,0.07184721720217502,2,True,standard,9.904893321803637e-06,COMPLETE
497,163.7384490966797,2026-01-03 04:47:41.289994,2026-01-03 04:48:07.423204,0 days 00:00:26.133210,relu,0.10016807647059767,11,0.0790673149372402,2,True,standard,7.07540719066033e-06,COMPLETE
498,153.85894775390625,2026-01-03 04:48:07.431206,2026-01-03 04:48:36.088604,0 days 00:00:28.657398,gelu,0.11588735403972655,31,0.06808303403835078,2,True,standard,8.799326016802403e-06,COMPLETE
499,141.0535888671875,2026-01-03 04:48:36.096608,2026-01-03 04:49:02.927889,0 days 00:00:26.831281,relu,0.11270692522619374,30,0.08043189378924916,2,True,standard,1.1493830866173344e-05,COMPLETE
500,165.5628662109375,2026-01-03 04:49:02.936892,2026-01-03 04:49:29.685656,0 days 00:00:26.748764,relu,0.2621185000389897,28,0.057575433738473784,2,True,standard,8.335812962359455e-06,COMPLETE
501,143.2605438232422,2026-01-03 04:49:29.692656,2026-01-03 04:49:56.386261,0 days 00:00:26.693605,relu,0.10711473891792778,29,0.08151138677026251,2,True,standard,6.411099961413636e-06,COMPLETE
502,199.70462036132812,2026-01-03 04:49:56.395265,2026-01-03 04:50:23.110092,0 days 00:00:26.714827,relu,0.12010483628729239,32,0.00011263445912863174,2,True,standard,4.614765567805488e-06,COMPLETE
503,148.55111694335938,2026-01-03 04:50:23.119093,2026-01-03 04:50:47.256271,0 days 00:00:24.137178,relu,0.10002338606128025,30,0.06781873138055333,1,True,standard,3.046641953230446e-05,COMPLETE
504,141.89356994628906,2026-01-03 04:50:47.263273,2026-01-03 04:51:14.218083,0 days 00:00:26.954810,relu,0.11337747340204443,29,0.08705575787696239,2,True,standard,5.813090880205205e-06,COMPLETE
505,198.41647338867188,2026-01-03 04:51:14.226083,2026-01-03 04:51:40.982860,0 days 00:00:26.756777,silu,0.10799158627427832,27,0.0003882234259332654,2,True,standard,7.249032208288717e-06,COMPLETE
506,142.74166870117188,2026-01-03 04:51:40.991862,2026-01-03 04:52:07.775689,0 days 00:00:26.783827,relu,0.12186747193224343,31,0.07575486264292236,2,True,standard,9.509339080777225e-06,COMPLETE
507,200.7908996582031,2026-01-03 04:52:07.782693,2026-01-03 04:52:33.772971,0 days 00:00:25.990278,relu,0.33705600783339823,28,0.0009947711180247865,2,False,standard,0.00024943466363432386,COMPLETE
508,173.43975830078125,2026-01-03 04:52:33.779969,2026-01-03 04:52:59.975754,0 days 00:00:26.195785,relu,0.10742194753537411,19,0.048495735650466124,2,True,none,1.0728840038332622e-05,COMPLETE
509,161.07205200195312,2026-01-03 04:52:59.982754,2026-01-03 04:53:26.241546,0 days 00:00:26.258792,relu,0.1162587177394992,15,0.08592879515738874,2,True,standard,7.139920973344588e-06,COMPLETE
510,143.52745056152344,2026-01-03 04:53:26.249546,2026-01-03 04:53:52.981873,0 days 00:00:26.732327,relu,0.12523211929977227,32,0.06506330809663577,2,True,standard,1.3058644352027412e-05,COMPLETE
511,142.39627075195312,2026-01-03 04:53:52.989873,2026-01-03 04:54:19.844188,0 days 00:00:26.854315,relu,0.10845461598586431,30,0.08783953165614088,2,True,standard,0.0002295767024673256,COMPLETE
512,177.6283721923828,2026-01-03 04:54:19.852189,2026-01-03 04:54:46.574519,0 days 00:00:26.722330,relu,0.36180861818695365,22,0.07352884095834694,2,True,standard,8.319484662618655e-06,COMPLETE
513,149.40188598632812,2026-01-03 04:54:46.582519,2026-01-03 04:55:13.233344,0 days 00:00:26.650825,relu,0.11585218688482461,27,0.0584853475969563,2,True,standard,1.455586742359861e-05,COMPLETE
514,143.68453979492188,2026-01-03 04:55:13.241340,2026-01-03 04:55:39.922127,0 days 00:00:26.680787,relu,0.10642127189084179,30,0.08834649429660116,2,True,robust,5.437645615074213e-06,COMPLETE
515,140.79898071289062,2026-01-03 04:55:39.930128,2026-01-03 04:56:06.888964,0 days 00:00:26.958836,relu,0.1001912147262774,31,0.07536207265216538,2,True,standard,9.48849182050795e-06,COMPLETE
516,142.24771118164062,2026-01-03 04:56:06.896963,2026-01-03 04:56:33.464774,0 days 00:00:26.567811,relu,0.11923206634613731,28,0.08764755283149292,2,True,standard,0.0002854192714728217,COMPLETE
517,192.18948364257812,2026-01-03 04:56:33.471775,2026-01-03 04:57:01.108617,0 days 00:00:27.636842,mish,0.10017018329265918,29,0.07116756874283228,2,True,minmax,0.00018082984010065628,COMPLETE
518,171.6474609375,2026-01-03 04:57:01.116618,2026-01-03 04:57:27.757463,0 days 00:00:26.640845,relu,0.39723429740936583,32,0.07925312287256374,2,True,standard,1.1840356577948863e-05,COMPLETE
519,146.84063720703125,2026-01-03 04:57:27.766463,2026-01-03 04:57:54.482792,0 days 00:00:26.716329,relu,0.13308771180512713,26,0.08926469074012386,2,True,standard,6.354417934440713e-06,COMPLETE
520,145.180908203125,2026-01-03 04:57:54.490792,2026-01-03 04:58:21.111120,0 days 00:00:26.620328,relu,0.11213238316421145,28,0.06423871776241775,2,True,standard,9.518735293013314e-05,COMPLETE
521,140.4080047607422,2026-01-03 04:58:21.119120,2026-01-03 04:58:48.014475,0 days 00:00:26.895355,relu,0.1000173247012494,30,0.07895387257682439,2,True,standard,0.0002023309776767252,COMPLETE
522,156.38668823242188,2026-01-03 04:58:48.022474,2026-01-03 04:59:16.713899,0 days 00:00:28.691425,gelu,0.10785676775278082,32,0.05369768125256651,2,True,standard,0.00020488340624901107,COMPLETE
523,178.4215087890625,2026-01-03 04:59:16.721900,2026-01-03 04:59:43.460223,0 days 00:00:26.738323,relu,0.46954848993808734,29,0.08829616723864096,2,True,standard,0.00015983971264508417,COMPLETE
524,139.95445251464844,2026-01-03 04:59:43.468225,2026-01-03 05:00:10.177529,0 days 00:00:26.709304,relu,0.10051538128850578,31,0.067546680217016,2,True,standard,0.00021346776973030473,COMPLETE
525,144.28289794921875,2026-01-03 05:00:10.185533,2026-01-03 05:00:36.939829,0 days 00:00:26.754296,relu,0.11543934691086928,31,0.04753925917634848,2,True,standard,0.00023521692555229432,COMPLETE
526,147.76095581054688,2026-01-03 05:00:36.947829,2026-01-03 05:01:03.749660,0 days 00:00:26.801831,relu,0.10052131119571073,31,0.038927761687999406,2,True,standard,0.00027932368924068633,COMPLETE
527,199.60933566623265,2026-01-03 05:01:03.757661,2026-01-03 05:01:29.230418,0 days 00:00:25.472757,relu,0.12716356283199876,16,0.0009951824712370603,2,False,standard,0.00019330252369814088,COMPLETE
528,141.8325653076172,2026-01-03 05:01:29.239421,2026-01-03 05:01:55.883748,0 days 00:00:26.644327,relu,0.10802443515789827,32,0.05872993962593739,2,True,standard,0.00017561843275294966,COMPLETE
529,167.02468872070312,2026-01-03 05:01:55.891748,2026-01-03 05:02:22.847599,0 days 00:00:26.955851,silu,0.10027722985536441,30,0.068052624689676,2,True,standard,0.00022072937635025233,COMPLETE
530,145.57354736328125,2026-01-03 05:02:22.855599,2026-01-03 05:02:49.568406,0 days 00:00:26.712807,relu,0.1197007135641062,30,0.06195738467209276,2,True,standard,0.00014169205659959815,COMPLETE
531,140.88729858398438,2026-01-03 05:02:49.576411,2026-01-03 05:03:16.208242,0 days 00:00:26.631831,relu,0.11423957897773192,32,0.07044922675145496,2,True,standard,2.1748285745169147e-05,COMPLETE
532,143.02992248535156,2026-01-03 05:03:16.216242,2026-01-03 05:03:43.035558,0 days 00:00:26.819316,relu,0.10741374442784725,30,0.054139644779471266,2,True,standard,3.5138521706917793e-06,COMPLETE
533,152.5797576904297,2026-01-03 05:03:43.043557,2026-01-03 05:04:09.833844,0 days 00:00:26.790287,relu,0.10016834090871103,28,0.03291016095866237,2,True,standard,0.0001170938266850725,COMPLETE
534,175.6937255859375,2026-01-03 05:04:09.843846,2026-01-03 05:04:36.484135,0 days 00:00:26.640289,relu,0.12111963555488721,29,0.09949275264195392,2,True,none,0.0001685159296110687,COMPLETE
535,142.96542358398438,2026-01-03 05:04:36.492135,2026-01-03 05:05:03.243974,0 days 00:00:26.751839,relu,0.13984983238666068,31,0.07742513606271144,2,True,standard,0.0002520623116711926,COMPLETE
536,144.0366973876953,2026-01-03 05:05:03.250974,2026-01-03 05:05:29.906798,0 days 00:00:26.655824,relu,0.11274021337150761,29,0.06992749246414147,2,True,standard,0.0002047815432481167,COMPLETE
537,146.37281799316406,2026-01-03 05:05:29.913799,2026-01-03 05:05:56.757615,0 days 00:00:26.843816,relu,0.12443605832755944,32,0.0995655327781878,2,True,robust,0.00010315512697691943,COMPLETE
538,142.66429138183594,2026-01-03 05:05:56.765616,2026-01-03 05:06:23.378931,0 days 00:00:26.613315,relu,0.10668728887289829,25,0.08027009199782388,2,True,standard,1.4305050883153601e-05,COMPLETE
539,146.90029907226562,2026-01-03 05:06:23.387931,2026-01-03 05:06:50.144248,0 days 00:00:26.756317,relu,0.11395039714448606,27,0.06129111598816768,2,True,standard,0.00014131075737653875,COMPLETE
540,144.2152862548828,2026-01-03 05:06:50.152253,2026-01-03 05:07:16.872283,0 days 00:00:26.720030,relu,0.10695216223012641,30,0.07739875992216257,2,True,standard,8.476148909573257e-05,COMPLETE
541,173.7071075439453,2026-01-03 05:07:16.881286,2026-01-03 05:07:43.647769,0 days 00:00:26.766483,relu,0.100298596663948,28,0.010390710461666855,2,True,standard,4.39901935511715e-05,COMPLETE
542,186.74746704101562,2026-01-03 05:07:43.656771,2026-01-03 05:08:11.411825,0 days 00:00:27.755054,mish,0.12854860530709974,31,0.08852567491836281,2,True,minmax,2.6657533449859148e-05,COMPLETE
543,155.2870635986328,2026-01-03 05:08:11.418825,2026-01-03 05:08:35.459203,0 days 00:00:24.040378,relu,0.10006499589654709,21,0.06772192569944928,1,True,standard,0.00011329915854422765,COMPLETE
544,141.8369598388672,2026-01-03 05:08:35.467203,2026-01-03 05:09:02.319200,0 days 00:00:26.851997,relu,0.11649179971405191,31,0.08736854198364735,2,True,standard,0.00019210517770600402,COMPLETE
545,141.3103485107422,2026-01-03 05:09:02.326199,2026-01-03 05:09:29.015191,0 days 00:00:26.688992,relu,0.1119264955236491,29,0.09994556822593693,2,True,standard,6.253313128654192e-05,COMPLETE
546,145.58026123046875,2026-01-03 05:09:29.024191,2026-01-03 05:09:55.784204,0 days 00:00:26.760013,relu,0.12259931887962727,27,0.07799367192534848,2,True,standard,0.0001539505577790456,COMPLETE
547,198.0233125813802,2026-01-03 05:09:55.793204,2026-01-03 05:10:21.855170,0 days 00:00:26.061966,relu,0.10786236956460968,30,0.0009948259533257891,2,False,standard,1.140678959847242e-05,COMPLETE
548,150.21490478515625,2026-01-03 05:10:21.865172,2026-01-03 05:10:50.512737,0 days 00:00:28.647565,gelu,0.20635437405833712,32,0.062876549283967,2,True,standard,0.0001294212000523659,COMPLETE
549,143.03829956054688,2026-01-03 05:10:50.521740,2026-01-03 05:11:16.998714,0 days 00:00:26.476974,relu,0.11753816363389803,28,0.07257627656926408,2,True,standard,9.759439376252972e-05,COMPLETE
550,147.0074462890625,2026-01-03 05:11:17.007709,2026-01-03 05:11:43.695721,0 days 00:00:26.688012,relu,0.16410321740839423,30,0.052691811277867824,2,True,standard,0.00022283662783407094,COMPLETE
551,181.91506958007812,2026-01-03 05:11:43.704725,2026-01-03 05:12:10.440743,0 days 00:00:26.736018,relu,0.13226190313796707,32,0.002106190939833122,2,True,standard,0.00018109521686888988,COMPLETE
552,145.77200317382812,2026-01-03 05:12:10.448742,2026-01-03 05:12:37.145711,0 days 00:00:26.696969,relu,0.10631306249277007,26,0.08863301833529101,2,True,standard,0.00027476513548552,COMPLETE
553,144.03164672851562,2026-01-03 05:12:37.153711,2026-01-03 05:13:03.887207,0 days 00:00:26.733496,relu,0.1115897156924075,29,0.09988582259918688,2,True,standard,7.479602829809026e-05,COMPLETE
554,158.98971557617188,2026-01-03 05:13:03.895206,2026-01-03 05:13:30.772683,0 days 00:00:26.877477,silu,0.12219020878164863,29,0.0840508472399103,2,True,standard,0.00011223343028136244,COMPLETE
555,142.93572998046875,2026-01-03 05:13:30.781686,2026-01-03 05:13:57.566205,0 days 00:00:26.784519,relu,0.10647315812696125,31,0.06993024402597621,2,True,standard,8.931825687956207e-05,COMPLETE
556,143.31796264648438,2026-01-03 05:13:57.574205,2026-01-03 05:14:24.100191,0 days 00:00:26.525986,relu,0.10030819582227013,27,0.08011943308503189,2,True,standard,0.00012912808020147876,COMPLETE
557,167.9036865234375,2026-01-03 05:14:24.108191,2026-01-03 05:14:50.786661,0 days 00:00:26.678470,relu,0.11525389940486047,30,0.06027476525714191,2,True,none,0.00015924445662122988,COMPLETE
558,142.3534698486328,2026-01-03 05:14:50.795662,2026-01-03 05:15:17.633198,0 days 00:00:26.837536,relu,0.1418958584750994,31,0.08982178767076433,2,True,standard,2.027384561487721e-05,COMPLETE
