number,value,datetime_start,datetime_complete,duration,params_activation,params_dropout,params_hidden_size,params_lr,params_n_layers,params_scale_target,params_scaler,params_weight_decay,state
892,152.75274658203125,2026-01-03 07:43:43.891878,2026-01-03 07:44:11.508109,0 days 00:00:27.616231,mish,0.11192429521338548,27,0.08766566091839773,2,True,standard,2.1564557454519735e-05,COMPLETE
893,171.31076049804688,2026-01-03 07:44:11.516109,2026-01-03 07:44:38.238861,0 days 00:00:26.722752,relu,0.10698414586303438,30,0.09986546390976501,2,True,minmax,1.5160128817353296e-05,COMPLETE
894,153.19297790527344,2026-01-03 07:44:38.246861,2026-01-03 07:45:04.682608,0 days 00:00:26.435747,relu,0.11466134621396559,18,0.09937826441047694,2,True,standard,2.6231761670433563e-05,COMPLETE
895,144.01437377929688,2026-01-03 07:45:04.690608,2026-01-03 07:45:31.611824,0 days 00:00:26.921216,relu,0.10612807359838348,30,0.07898456755156748,2,True,standard,1.7892583323164864e-05,COMPLETE
896,142.07763671875,2026-01-03 07:45:31.619822,2026-01-03 07:45:58.434031,0 days 00:00:26.814209,relu,0.10049417451331034,28,0.08548260445862711,2,True,standard,5.296700484251045e-05,COMPLETE
897,142.8520965576172,2026-01-03 07:45:58.443031,2026-01-03 07:46:25.162240,0 days 00:00:26.719209,relu,0.11905437548090284,31,0.08819065826567568,2,True,standard,3.086018975039836e-05,COMPLETE
898,197.67480828179254,2026-01-03 07:46:25.170240,2026-01-03 07:46:49.744961,0 days 00:00:24.574721,gelu,0.10004362179396017,29,0.0009944070113837755,1,False,standard,2.244329999440184e-05,COMPLETE
899,140.84335327148438,2026-01-03 07:46:49.754961,2026-01-03 07:47:16.647697,0 days 00:00:26.892736,relu,0.10013243790209196,30,0.0736045705731508,2,True,standard,2.003655473681228e-05,COMPLETE
900,161.15060424804688,2026-01-03 07:47:16.656701,2026-01-03 07:47:43.413938,0 days 00:00:26.757237,relu,0.2936838059886455,31,0.08904858847023252,2,True,standard,2.4072336456310193e-05,COMPLETE
901,158.00192260742188,2026-01-03 07:47:43.422940,2026-01-03 07:48:10.236190,0 days 00:00:26.813250,relu,0.20163898966683486,28,0.07131018015627442,2,True,standard,4.08306133792653e-05,COMPLETE
902,195.74111938476562,2026-01-03 07:48:10.245194,2026-01-03 07:48:37.158428,0 days 00:00:26.913234,relu,0.1149668315052665,30,0.0003184580266723219,2,True,standard,1.5763680478743047e-05,COMPLETE
903,143.811279296875,2026-01-03 07:48:37.166433,2026-01-03 07:49:03.895667,0 days 00:00:26.729234,relu,0.12890874504071015,32,0.07928380379338236,2,True,standard,2.8910135679626747e-05,COMPLETE
904,175.71957397460938,2026-01-03 07:49:03.904667,2026-01-03 07:49:30.789897,0 days 00:00:26.885230,silu,0.11359805668035546,27,0.014583097357256304,2,True,standard,1.8612517616598998e-05,COMPLETE
905,141.8835906982422,2026-01-03 07:49:30.798898,2026-01-03 07:49:57.577163,0 days 00:00:26.778265,relu,0.10028660869555989,29,0.08892387218359565,2,True,standard,7.655323830646957e-06,COMPLETE
906,178.86544799804688,2026-01-03 07:49:57.585159,2026-01-03 07:50:23.659885,0 days 00:00:26.074726,relu,0.1886617867410882,12,0.020334397189126847,2,True,standard,2.1067324355288406e-05,COMPLETE
907,171.4471893310547,2026-01-03 07:50:23.667885,2026-01-03 07:50:50.309613,0 days 00:00:26.641728,relu,0.12198624738956117,32,0.09997749628897463,2,True,none,2.3793941330241868e-05,COMPLETE
908,157.4925994873047,2026-01-03 07:50:50.317612,2026-01-03 07:51:17.176332,0 days 00:00:26.858720,relu,0.3046690709137181,31,0.06475161420844175,2,True,standard,3.216418618640209e-05,COMPLETE
909,143.23536682128906,2026-01-03 07:51:17.184334,2026-01-03 07:51:43.893574,0 days 00:00:26.709240,relu,0.11054322919585037,29,0.07833595313354025,2,True,standard,1.463585135726504e-05,COMPLETE
910,141.09278869628906,2026-01-03 07:51:43.901574,2026-01-03 07:52:10.928107,0 days 00:00:27.026533,relu,0.10000117338877777,31,0.09952739914503941,2,True,standard,1.1174822487389643e-05,COMPLETE
911,141.75155639648438,2026-01-03 07:52:10.937103,2026-01-03 07:52:37.667826,0 days 00:00:26.730723,relu,0.13705559954284233,30,0.06982402973047247,2,True,standard,1.7581419986796517e-05,COMPLETE
912,144.04092407226562,2026-01-03 07:52:37.675829,2026-01-03 07:53:04.445064,0 days 00:00:26.769235,relu,0.12074878719637508,28,0.09970626379042904,2,True,standard,2.6616013469548438e-05,COMPLETE
913,139.54544067382812,2026-01-03 07:53:04.454067,2026-01-03 07:53:31.090257,0 days 00:00:26.636190,relu,0.11231636378736001,32,0.08173322489662248,2,True,standard,2.091351244604475e-05,COMPLETE
914,147.876220703125,2026-01-03 07:53:31.099260,2026-01-03 07:53:57.843496,0 days 00:00:26.744236,relu,0.10882505454835398,27,0.08784054395793504,2,True,robust,2.6159106718871795e-05,COMPLETE
915,144.76083374023438,2026-01-03 07:53:57.852496,2026-01-03 07:54:24.613225,0 days 00:00:26.760729,relu,0.12612721123581186,30,0.06403021041352992,2,True,standard,1.629708269169796e-05,COMPLETE
916,198.14503187391492,2026-01-03 07:54:24.620225,2026-01-03 07:54:50.770924,0 days 00:00:26.150699,relu,0.10736465607553065,31,0.0009949379933714333,2,False,standard,1.062802716110792e-06,COMPLETE
917,146.156494140625,2026-01-03 07:54:50.779928,2026-01-03 07:55:17.574651,0 days 00:00:26.794723,relu,0.1186002746544875,32,0.07811879974829115,2,True,standard,3.6129676569725956e-05,COMPLETE
918,174.15713500976562,2026-01-03 07:55:17.582651,2026-01-03 07:55:44.336884,0 days 00:00:26.754233,relu,0.14631274541106667,29,0.05498886106745237,2,True,minmax,2.0306954526554533e-05,COMPLETE
919,142.74200439453125,2026-01-03 07:55:44.344884,2026-01-03 07:56:11.015083,0 days 00:00:26.670199,relu,0.11318757644417786,30,0.0886984191855092,2,True,standard,9.090634095214701e-06,COMPLETE
920,160.9219207763672,2026-01-03 07:56:11.025083,2026-01-03 07:56:38.611312,0 days 00:00:27.586229,mish,0.13120847715322348,32,0.0998681281882768,2,True,standard,1.3004624629538813e-05,COMPLETE
921,163.95217895507812,2026-01-03 07:56:38.619315,2026-01-03 07:57:04.977532,0 days 00:00:26.358217,relu,0.10024433355425104,13,0.07228177760697632,2,True,standard,2.3223655932276e-05,COMPLETE
922,139.0674285888672,2026-01-03 07:57:04.985532,2026-01-03 07:57:31.789252,0 days 00:00:26.803720,relu,0.10710605068732705,29,0.09998481506467075,2,True,standard,1.8061094087439905e-05,COMPLETE
923,146.2573699951172,2026-01-03 07:57:31.797256,2026-01-03 07:58:00.394947,0 days 00:00:28.597691,gelu,0.10002490143030272,27,0.08930781888085992,2,True,standard,1.4464333087786312e-05,COMPLETE
924,144.93893432617188,2026-01-03 07:58:00.402947,2026-01-03 07:58:27.251188,0 days 00:00:26.848241,relu,0.11701342987682065,28,0.07998913305964594,2,True,standard,1.8037222663026445e-05,COMPLETE
925,143.8782501220703,2026-01-03 07:58:27.260191,2026-01-03 07:58:54.016410,0 days 00:00:26.756219,relu,0.12732476040254473,27,0.08937790854461213,2,True,standard,1.6442815397257384e-05,COMPLETE
926,174.65478515625,2026-01-03 07:58:54.025410,2026-01-03 07:59:20.777595,0 days 00:00:26.752185,relu,0.11207699388611128,28,0.00782270069162872,2,True,standard,1.3123546525086811e-05,COMPLETE
927,141.18032836914062,2026-01-03 07:59:20.784594,2026-01-03 07:59:47.581293,0 days 00:00:26.796699,relu,0.12131099076946764,28,0.07646301709357484,2,True,standard,1.4902655434960806e-05,COMPLETE
928,138.8624267578125,2026-01-03 07:59:47.589293,2026-01-03 08:00:14.404535,0 days 00:00:26.815242,relu,0.10788829478778089,29,0.09015210711984102,2,True,standard,1.8886549466941258e-05,COMPLETE
929,143.90628051757812,2026-01-03 08:00:14.413534,2026-01-03 08:00:41.149228,0 days 00:00:26.735694,relu,0.11408547295553287,29,0.09925511887378807,2,True,standard,1.893798408643082e-05,COMPLETE
930,143.01010131835938,2026-01-03 08:00:41.160230,2026-01-03 08:01:07.987925,0 days 00:00:26.827695,relu,0.1226985356377394,28,0.09967114355615166,2,True,standard,2.0177237072361586e-05,COMPLETE
931,168.0819854736328,2026-01-03 08:01:07.996926,2026-01-03 08:01:34.908153,0 days 00:00:26.911227,silu,0.1396970198724783,29,0.045509613709613886,2,True,standard,7.095642134551042e-06,COMPLETE
932,144.927001953125,2026-01-03 08:01:34.917153,2026-01-03 08:02:01.593845,0 days 00:00:26.676692,relu,0.10735676881260615,29,0.0704712036231443,2,True,standard,1.823978697092182e-05,COMPLETE
933,171.8165740966797,2026-01-03 08:02:01.601846,2026-01-03 08:02:28.494553,0 days 00:00:26.892707,relu,0.10001278679771877,30,0.0999437755434164,2,True,none,1.054598786316967e-05,COMPLETE
934,143.0307159423828,2026-01-03 08:02:28.502553,2026-01-03 08:02:55.158252,0 days 00:00:26.655699,relu,0.1323806267534887,30,0.07919219750879948,2,True,standard,2.2618396758114145e-05,COMPLETE
935,145.5438232421875,2026-01-03 08:02:55.166252,2026-01-03 08:03:22.085468,0 days 00:00:26.919216,relu,0.11319832017399623,30,0.06307020135152813,2,True,standard,2.0318097183598192e-05,COMPLETE
936,197.30594156901043,2026-01-03 08:03:22.094467,2026-01-03 08:03:45.682143,0 days 00:00:23.587676,relu,0.10696903145343495,29,0.0009934935092119792,1,False,robust,8.19354030791691e-06,COMPLETE
937,145.62911987304688,2026-01-03 08:03:45.689143,2026-01-03 08:04:12.573382,0 days 00:00:26.884239,relu,0.15471114970640465,31,0.09991450731558742,2,True,standard,1.541971397702582e-05,COMPLETE
938,144.4130096435547,2026-01-03 08:04:12.582382,2026-01-03 08:04:39.336573,0 days 00:00:26.754191,relu,0.11940018336114142,27,0.08086901617999058,2,True,standard,1.5211940074979253e-06,COMPLETE
939,142.39956665039062,2026-01-03 08:04:39.344577,2026-01-03 08:05:06.092799,0 days 00:00:26.748222,relu,0.12569004649881488,28,0.08872739805958271,2,True,standard,1.774094222590865e-05,COMPLETE
940,147.2904510498047,2026-01-03 08:05:06.101798,2026-01-03 08:05:32.849503,0 days 00:00:26.747705,relu,0.17192425858085736,30,0.06855539778122761,2,True,standard,2.2580129875555332e-05,COMPLETE
941,160.49288940429688,2026-01-03 08:05:32.857504,2026-01-03 08:06:00.557202,0 days 00:00:27.699698,mish,0.10012147574559983,31,0.07882467664532977,2,True,standard,5.790336748404618e-05,COMPLETE
942,143.15383911132812,2026-01-03 08:06:00.566202,2026-01-03 08:06:27.272900,0 days 00:00:26.706698,relu,0.11184518892023425,29,0.08553901401839478,2,True,standard,1.2002084722021961e-05,COMPLETE
943,143.0906982421875,2026-01-03 08:06:27.280898,2026-01-03 08:06:53.909095,0 days 00:00:26.628197,relu,0.1193726325464967,31,0.09986570680019206,2,True,standard,2.0292920461436358e-05,COMPLETE
944,179.9505157470703,2026-01-03 08:06:53.918099,2026-01-03 08:07:20.738290,0 days 00:00:26.820191,relu,0.4807273051552893,29,0.058976138937082666,2,True,standard,1.7299940017743917e-05,COMPLETE
945,141.88388061523438,2026-01-03 08:07:20.747291,2026-01-03 08:07:47.507482,0 days 00:00:26.760191,relu,0.11292931118308616,31,0.0687496212249766,2,True,standard,9.858521997621524e-06,COMPLETE
946,138.69509887695312,2026-01-03 08:07:47.514482,2026-01-03 08:08:14.293707,0 days 00:00:26.779225,relu,0.10678380459078987,30,0.08791544668195132,2,True,standard,2.340825909108437e-05,COMPLETE
947,144.67445373535156,2026-01-03 08:08:14.301707,2026-01-03 08:08:42.896440,0 days 00:00:28.594733,gelu,0.1068174235828632,27,0.08747232579172251,2,True,standard,2.873495380327995e-05,COMPLETE
948,144.6354522705078,2026-01-03 08:08:42.906439,2026-01-03 08:09:09.753608,0 days 00:00:26.847169,relu,0.13079409215223364,28,0.08672262490069296,2,True,standard,2.2256630918042364e-05,COMPLETE
949,142.71823120117188,2026-01-03 08:09:09.761611,2026-01-03 08:09:36.375820,0 days 00:00:26.614209,relu,0.10774706666977912,28,0.08941803701178797,2,True,standard,2.4576249865434566e-05,COMPLETE
950,177.09092712402344,2026-01-03 08:09:36.384823,2026-01-03 08:10:03.125507,0 days 00:00:26.740684,relu,0.11940204273745623,29,0.09954373859933051,2,True,minmax,2.9224464150460603e-05,COMPLETE
951,142.4437713623047,2026-01-03 08:10:03.134507,2026-01-03 08:10:29.724717,0 days 00:00:26.590210,relu,0.10002170907004153,27,0.07896119044077678,2,True,standard,2.5180449844972547e-05,COMPLETE
952,142.45594787597656,2026-01-03 08:10:29.733718,2026-01-03 08:10:56.608969,0 days 00:00:26.875251,relu,0.11468817339612127,30,0.0999826405392605,2,True,standard,2.02249683255279e-05,COMPLETE
953,140.97943115234375,2026-01-03 08:10:56.618969,2026-01-03 08:11:23.398691,0 days 00:00:26.779722,relu,0.10806036446347857,29,0.0799135689041141,2,True,standard,2.2926228419194218e-05,COMPLETE
954,169.29086303710938,2026-01-03 08:11:23.407694,2026-01-03 08:11:50.263399,0 days 00:00:26.855705,silu,0.12387823868745526,30,0.08791554651500835,2,True,standard,1.8196969621967275e-05,COMPLETE
955,143.6901397705078,2026-01-03 08:11:50.272402,2026-01-03 08:12:17.188609,0 days 00:00:26.916207,relu,0.1409164886822742,30,0.07901187284923734,2,True,standard,3.109900172340378e-05,COMPLETE
956,143.74673461914062,2026-01-03 08:12:17.197605,2026-01-03 08:12:44.271314,0 days 00:00:27.073709,relu,0.11779457281018413,28,0.08935652799229536,2,True,standard,2.644863133934208e-05,COMPLETE
957,169.8294677734375,2026-01-03 08:12:44.281316,2026-01-03 08:13:10.962999,0 days 00:00:26.681683,relu,0.10027224791336072,26,0.09976607687295092,2,True,none,2.1074924355871704e-05,COMPLETE
958,198.30202209472654,2026-01-03 08:13:10.970999,2026-01-03 08:13:37.140722,0 days 00:00:26.169723,relu,0.10900388817416394,29,0.0009939789901875105,2,False,standard,1.62165721118464e-05,COMPLETE
959,141.77444458007812,2026-01-03 08:13:37.147724,2026-01-03 08:14:03.962424,0 days 00:00:26.814700,relu,0.12699731940282213,31,0.07457360614905648,2,True,standard,3.5012036552831416e-05,COMPLETE
960,140.14984130859375,2026-01-03 08:14:03.970425,2026-01-03 08:14:30.874140,0 days 00:00:26.903715,relu,0.1071772784115779,30,0.08711347378052632,2,True,standard,1.8715998257342368e-05,COMPLETE
961,151.89932250976562,2026-01-03 08:14:30.882140,2026-01-03 08:14:57.635840,0 days 00:00:26.753700,relu,0.11522301619214065,27,0.07793612380709306,2,True,robust,2.3420777788678606e-05,COMPLETE
962,136.91163635253906,2026-01-03 08:14:57.644843,2026-01-03 08:15:24.381060,0 days 00:00:26.736217,relu,0.10025680029048473,31,0.08897650909005579,2,True,standard,2.7749221308278813e-05,COMPLETE
963,140.72055053710938,2026-01-03 08:15:24.389060,2026-01-03 08:15:51.073255,0 days 00:00:26.684195,relu,0.10562724892122702,31,0.08825223989350367,2,True,standard,3.528522623943612e-05,COMPLETE
964,141.76669311523438,2026-01-03 08:15:51.082258,2026-01-03 08:16:17.755983,0 days 00:00:26.673725,relu,0.10655039203614873,32,0.08777892037920991,2,True,standard,2.983938576729026e-05,COMPLETE
965,174.61843872070312,2026-01-03 08:16:17.763981,2026-01-03 08:16:43.920189,0 days 00:00:26.156208,relu,0.10016048440372688,7,0.08815895636822997,2,True,standard,2.7600141502409738e-05,COMPLETE
966,155.83108520507812,2026-01-03 08:16:43.929187,2026-01-03 08:17:11.671876,0 days 00:00:27.742689,mish,0.10001113578856136,32,0.08958002316590188,2,True,standard,2.657803832636021e-05,COMPLETE
967,142.557861328125,2026-01-03 08:17:11.679389,2026-01-03 08:17:38.617599,0 days 00:00:26.938210,relu,0.11376600826022201,31,0.0989427875466915,2,True,standard,3.157570838343387e-05,COMPLETE
968,139.89501953125,2026-01-03 08:17:38.626601,2026-01-03 08:18:05.432290,0 days 00:00:26.805689,relu,0.13409135948696826,29,0.07823829586093803,2,True,standard,2.4210041084154132e-05,COMPLETE
969,173.00363159179688,2026-01-03 08:18:05.441293,2026-01-03 08:18:32.281535,0 days 00:00:26.840242,relu,0.1001988171803475,30,0.09997932407339521,2,True,minmax,3.844533179100749e-05,COMPLETE
970,143.7672882080078,2026-01-03 08:18:32.290538,2026-01-03 08:18:58.983746,0 days 00:00:26.693208,relu,0.12015235560904682,31,0.07118950164114801,2,True,standard,2.1442033163091247e-05,COMPLETE
971,142.3759765625,2026-01-03 08:18:58.992749,2026-01-03 08:19:25.863953,0 days 00:00:26.871204,relu,0.10906575228719671,32,0.0876556781152636,2,True,standard,2.615771243704066e-05,COMPLETE
972,142.39920043945312,2026-01-03 08:19:25.871953,2026-01-03 08:19:52.667973,0 days 00:00:26.796020,relu,0.11542624554673091,29,0.07818806536400048,2,True,standard,3.130774725075745e-05,COMPLETE
973,148.382568359375,2026-01-03 08:19:52.676973,2026-01-03 08:20:21.335646,0 days 00:00:28.658673,gelu,0.12316551073738052,28,0.09948778226431598,2,True,standard,2.2931621343623357e-05,COMPLETE
974,197.62209004720052,2026-01-03 08:20:21.344649,2026-01-03 08:20:45.099339,0 days 00:00:23.754690,relu,0.10794966832159042,30,0.0009942502381962372,1,False,standard,1.854715156896548e-05,COMPLETE
975,141.13653564453125,2026-01-03 08:20:45.107335,2026-01-03 08:21:11.845017,0 days 00:00:26.737682,relu,0.1133027828892474,32,0.07004006057230756,2,True,standard,4.2674424007554746e-05,COMPLETE
976,140.93325805664062,2026-01-03 08:21:11.854019,2026-01-03 08:21:38.617750,0 days 00:00:26.763731,relu,0.12668220826423285,31,0.08748052202242247,2,True,standard,2.735199234492256e-05,COMPLETE
977,139.6968994140625,2026-01-03 08:21:38.625747,2026-01-03 08:22:05.607472,0 days 00:00:26.981725,relu,0.10758995865040151,32,0.07939885979679646,2,True,standard,2.0812436443530266e-05,COMPLETE
978,156.3203887939453,2026-01-03 08:22:05.616472,2026-01-03 08:22:32.505695,0 days 00:00:26.889223,silu,0.11953524449197762,30,0.09924820931046283,2,True,standard,1.5206283406577538e-05,COMPLETE
979,175.22682189941406,2026-01-03 08:22:32.514694,2026-01-03 08:22:59.396778,0 days 00:00:26.882084,relu,0.4277657694293437,29,0.0887213088047498,2,True,standard,3.3559888350319726e-05,COMPLETE
980,138.99232482910156,2026-01-03 08:22:59.405781,2026-01-03 08:23:26.281473,0 days 00:00:26.875692,relu,0.10038424761572946,31,0.07109071573100778,2,True,standard,2.3647467977433266e-05,COMPLETE
981,170.00567626953125,2026-01-03 08:23:26.290468,2026-01-03 08:23:52.973673,0 days 00:00:26.683205,relu,0.10008436397334353,32,0.0581757891306084,2,True,none,3.0140563115491556e-05,COMPLETE
982,141.1481475830078,2026-01-03 08:23:52.983676,2026-01-03 08:24:19.937874,0 days 00:00:26.954198,relu,0.10007734946325855,31,0.06408840113472172,2,True,standard,2.5190473133188618e-05,COMPLETE
983,142.58468627929688,2026-01-03 08:24:19.944874,2026-01-03 08:24:46.658084,0 days 00:00:26.713210,relu,0.1067465474869619,32,0.06307146595767886,2,True,standard,2.7257109991687863e-05,COMPLETE
984,169.6154022216797,2026-01-03 08:24:46.666079,2026-01-03 08:25:12.690757,0 days 00:00:26.024678,relu,0.1003590300703182,9,0.0694875714242216,2,True,standard,2.3695781143499425e-05,COMPLETE
985,176.10787963867188,2026-01-03 08:25:12.700759,2026-01-03 08:25:39.380938,0 days 00:00:26.680179,relu,0.1124645916402363,31,0.005992459741157235,2,True,standard,3.3935862999631067e-05,COMPLETE
986,153.9285430908203,2026-01-03 08:25:39.389938,2026-01-03 08:26:06.163154,0 days 00:00:26.773216,relu,0.11419050857914902,30,0.06619113182683188,2,True,robust,2.9341029340838294e-05,COMPLETE
987,143.59457397460938,2026-01-03 08:26:06.172154,2026-01-03 08:26:32.806839,0 days 00:00:26.634685,relu,0.10814238495309925,32,0.0737705553921076,2,True,standard,2.3865520685765645e-05,COMPLETE
988,148.76507568359375,2026-01-03 08:26:32.814843,2026-01-03 08:26:59.619308,0 days 00:00:26.804465,relu,0.13504760109265315,30,0.056570636637814996,2,True,standard,2.165088357944659e-05,COMPLETE
989,159.19500732421875,2026-01-03 08:26:59.627308,2026-01-03 08:27:25.871540,0 days 00:00:26.244232,relu,0.11705024771212233,17,0.0723529011182815,2,True,standard,3.869960143397469e-05,COMPLETE
990,159.2564697265625,2026-01-03 08:27:25.880535,2026-01-03 08:27:52.917237,0 days 00:00:27.036702,relu,0.2761064223643816,31,0.04959311748141631,2,True,standard,2.6578143042147912e-05,COMPLETE
991,150.9159393310547,2026-01-03 08:27:52.925238,2026-01-03 08:28:20.667946,0 days 00:00:27.742708,mish,0.10717388903881869,32,0.07733816115913392,2,True,standard,2.1172659758432673e-05,COMPLETE
992,144.3496551513672,2026-01-03 08:28:20.675946,2026-01-03 08:28:47.616648,0 days 00:00:26.940702,relu,0.12484620415818289,30,0.07717127761325737,2,True,standard,2.9777902359242913e-05,COMPLETE
993,144.02183532714844,2026-01-03 08:28:47.625650,2026-01-03 08:29:14.470845,0 days 00:00:26.845195,relu,0.10036645459636259,32,0.0684101014993317,2,True,standard,1.902802028293707e-05,COMPLETE
994,199.15310180664062,2026-01-03 08:29:14.478842,2026-01-03 08:29:40.706026,0 days 00:00:26.227184,relu,0.11401658500626449,28,0.0009941138935431629,2,False,minmax,2.5779851592561186e-05,COMPLETE
995,137.3158416748047,2026-01-03 08:29:40.716028,2026-01-03 08:30:07.593742,0 days 00:00:26.877714,relu,0.10023805445956346,31,0.08465843780683166,2,True,standard,2.243288202986232e-05,COMPLETE
996,143.39715576171875,2026-01-03 08:30:07.602742,2026-01-03 08:30:34.333458,0 days 00:00:26.730716,relu,0.10744976794053061,32,0.05963665553160253,2,True,standard,2.354187553517492e-05,COMPLETE
997,143.27145385742188,2026-01-03 08:30:34.341469,2026-01-03 08:31:03.186195,0 days 00:00:28.844726,gelu,0.10035702904309926,31,0.06480853826472864,2,True,standard,2.457766998068018e-05,COMPLETE
998,193.74310302734375,2026-01-03 08:31:03.194191,2026-01-03 08:31:30.075401,0 days 00:00:26.881210,relu,0.10023017066808741,31,0.0005614338742235557,2,True,standard,3.135833265113324e-05,COMPLETE
999,145.10971069335938,2026-01-03 08:31:30.083402,2026-01-03 08:31:56.761102,0 days 00:00:26.677700,relu,0.10715983741300024,32,0.053100437894430016,2,True,standard,2.789149926653207e-05,COMPLETE
1000,141.9914093017578,2026-01-03 08:31:56.770101,2026-01-03 08:32:23.465304,0 days 00:00:26.695203,relu,0.10060565952136648,30,0.07824649392287503,2,True,standard,2.226593185455635e-05,COMPLETE
1001,144.02745056152344,2026-01-03 08:32:23.474303,2026-01-03 08:32:50.151497,0 days 00:00:26.677194,relu,0.10654767966300144,29,0.07093288737300281,2,True,standard,3.285445801316307e-05,COMPLETE
1002,142.47181701660156,2026-01-03 08:32:50.160501,2026-01-03 08:33:17.191703,0 days 00:00:27.031202,relu,0.10816704475158674,31,0.06261436161663621,2,True,standard,2.6964870712281604e-05,COMPLETE
1003,162.1162872314453,2026-01-03 08:33:17.199703,2026-01-03 08:33:44.192402,0 days 00:00:26.992699,silu,0.11185515266711576,30,0.08047042845137094,2,True,standard,2.1297955452459076e-05,COMPLETE
