number,value,datetime_start,datetime_complete,duration,params_activation,params_dropout,params_hidden_size,params_lr,params_n_layers,params_scale_target,params_scaler,params_weight_decay,state
1781,141.78427124023438,2026-01-03 14:23:04.649634,2026-01-03 14:23:30.374161,0 days 00:00:25.724527,relu,0.11781947017669273,31,0.08817824361756457,2,True,standard,3.2444647158034555e-05,COMPLETE
1782,171.60504150390625,2026-01-03 14:23:30.382161,2026-01-03 14:23:55.989561,0 days 00:00:25.607400,relu,0.11220604924876326,29,0.07956513625754572,2,True,none,2.4316829827558975e-05,COMPLETE
1783,143.12989807128906,2026-01-03 14:23:55.997563,2026-01-03 14:24:21.689038,0 days 00:00:25.691475,relu,0.11249452941450641,30,0.06518467385946965,2,True,standard,4.607706191934593e-05,COMPLETE
1784,140.49813842773438,2026-01-03 14:24:21.697038,2026-01-03 14:24:47.284488,0 days 00:00:25.587450,relu,0.12546501856711031,32,0.07979843879010518,2,True,standard,1.6439503480382633e-05,COMPLETE
1785,143.7587890625,2026-01-03 14:24:47.294491,2026-01-03 14:25:12.886012,0 days 00:00:25.591521,relu,0.10738634036061535,28,0.08806638234556453,2,True,standard,2.138725888069913e-05,COMPLETE
1786,181.27420043945312,2026-01-03 14:25:12.894011,2026-01-03 14:25:38.492410,0 days 00:00:25.598399,relu,0.43514414096250703,30,0.041526516548324746,2,True,robust,2.9965532629297894e-05,COMPLETE
1787,198.34984931098091,2026-01-03 14:25:38.500411,2026-01-03 14:26:03.393639,0 days 00:00:24.893228,relu,0.11958704019624428,26,0.0009942099496280366,2,False,standard,3.724552791381812e-05,COMPLETE
1788,141.30606079101562,2026-01-03 14:26:03.401640,2026-01-03 14:26:29.120005,0 days 00:00:25.718365,relu,0.1080406531244732,31,0.09998246776423614,2,True,standard,2.6715112246461513e-05,COMPLETE
1789,141.8824920654297,2026-01-03 14:26:29.128008,2026-01-03 14:26:54.939587,0 days 00:00:25.811579,relu,0.1065977779822308,32,0.07084706654370353,2,True,standard,1.86866636007356e-05,COMPLETE
1790,143.68490600585938,2026-01-03 14:26:54.947589,2026-01-03 14:27:20.544511,0 days 00:00:25.596922,relu,0.11771321283257961,29,0.059723249718885436,2,True,standard,2.1479258653337896e-05,COMPLETE
1791,141.3558807373047,2026-01-03 14:27:20.552516,2026-01-03 14:27:46.198429,0 days 00:00:25.645913,relu,0.11296088819484582,27,0.0998952396953852,2,True,standard,5.1716197563788914e-05,COMPLETE
1792,181.893798828125,2026-01-03 14:27:46.207431,2026-01-03 14:28:12.901554,0 days 00:00:26.694123,mish,0.13433760450516818,31,0.0881532254485191,2,True,minmax,2.531747874665603e-05,COMPLETE
1793,140.15145874023438,2026-01-03 14:28:12.911552,2026-01-03 14:28:38.962645,0 days 00:00:26.051093,relu,0.10006924528228449,29,0.07559985250793827,2,True,standard,1.430438631116613e-05,COMPLETE
1794,185.05331420898438,2026-01-03 14:28:38.970649,2026-01-03 14:29:04.776138,0 days 00:00:25.805489,relu,0.12534939708400067,32,0.0012643528910626872,2,True,standard,3.247127879620486e-05,COMPLETE
1795,141.66696166992188,2026-01-03 14:29:04.785140,2026-01-03 14:29:30.500083,0 days 00:00:25.714943,relu,0.10843193894777488,30,0.08681909725956789,2,True,standard,0.0006991901297628186,COMPLETE
1796,143.2039337158203,2026-01-03 14:29:30.507083,2026-01-03 14:29:56.387601,0 days 00:00:25.880518,relu,0.11814505982578055,31,0.07101166106342476,2,True,standard,2.8861064752359823e-05,COMPLETE
1797,143.12794494628906,2026-01-03 14:29:56.397105,2026-01-03 14:30:22.251640,0 days 00:00:25.854535,relu,0.10720318970407204,30,0.07933366819526091,2,True,standard,2.345997819977131e-05,COMPLETE
1798,141.60189819335938,2026-01-03 14:30:22.260643,2026-01-03 14:30:47.979038,0 days 00:00:25.718395,relu,0.10017811092954935,28,0.08838569623780641,2,True,standard,0.00016788790465195984,COMPLETE
1799,145.84329223632812,2026-01-03 14:30:47.987043,2026-01-03 14:31:13.561309,0 days 00:00:25.574266,relu,0.11346625616111079,32,0.050424544940785195,2,True,standard,1.936338602783986e-05,COMPLETE
1800,139.27975463867188,2026-01-03 14:31:13.569309,2026-01-03 14:31:39.270501,0 days 00:00:25.701192,relu,0.10691851713345502,29,0.09938681360340242,2,True,standard,3.811231617417437e-05,COMPLETE
1801,156.5768585205078,2026-01-03 14:31:39.278501,2026-01-03 14:32:06.736623,0 days 00:00:27.458122,gelu,0.12103611970819167,30,0.06615130433299306,2,True,standard,5.978006696326878e-05,COMPLETE
1802,141.2696990966797,2026-01-03 14:32:06.796622,2026-01-03 14:32:32.642501,0 days 00:00:25.845879,relu,0.11259878061666391,31,0.0995674321252159,2,True,standard,1.6619201884084904e-05,COMPLETE
1803,143.1196746826172,2026-01-03 14:32:32.651505,2026-01-03 14:32:58.471370,0 days 00:00:25.819865,relu,0.12758728078600207,32,0.0791529867836977,2,True,standard,2.818795243978105e-05,COMPLETE
1804,141.69036865234375,2026-01-03 14:32:58.479370,2026-01-03 14:33:24.053623,0 days 00:00:25.574253,relu,0.10003854533315083,27,0.08750239077053851,2,True,standard,2.207595416074971e-05,COMPLETE
1805,169.33444213867188,2026-01-03 14:33:24.061627,2026-01-03 14:33:49.827060,0 days 00:00:25.765433,silu,0.10675647159034204,29,0.0610932740156744,2,True,none,3.4689718294165554e-05,COMPLETE
1806,198.00597045898436,2026-01-03 14:33:49.836569,2026-01-03 14:34:14.963278,0 days 00:00:25.126709,relu,0.10006495898336355,31,0.0009949584936424945,2,False,standard,2.684413644071768e-05,COMPLETE
1807,142.39259338378906,2026-01-03 14:34:14.971279,2026-01-03 14:34:40.661845,0 days 00:00:25.690566,relu,0.11785941041414408,32,0.07392998730610124,2,True,standard,1.9574966394950476e-05,COMPLETE
1808,140.65408325195312,2026-01-03 14:34:40.670843,2026-01-03 14:35:06.446198,0 days 00:00:25.775355,relu,0.11299955318208245,30,0.08772109120338964,2,True,standard,4.391131183042035e-05,COMPLETE
1809,146.85787963867188,2026-01-03 14:35:06.455198,2026-01-03 14:35:32.230087,0 days 00:00:25.774889,relu,0.1381271367417681,29,0.07878802179145815,2,True,standard,1.2686673748201354e-05,COMPLETE
1810,185.60440063476562,2026-01-03 14:35:32.238093,2026-01-03 14:35:57.766877,0 days 00:00:25.528784,relu,0.12532442752546913,25,0.0023754800079940964,2,True,standard,3.0953938212177355e-05,COMPLETE
1811,149.4180908203125,2026-01-03 14:35:57.774881,2026-01-03 14:36:23.403244,0 days 00:00:25.628363,relu,0.1064771176648495,30,0.07020963145169917,2,True,robust,2.428895748221726e-05,COMPLETE
1812,140.52041625976562,2026-01-03 14:36:23.411245,2026-01-03 14:36:49.005930,0 days 00:00:25.594685,relu,0.10010460974351654,32,0.08899843182965625,2,True,standard,2.2408796785180925e-05,COMPLETE
1813,141.53707885742188,2026-01-03 14:36:49.014951,2026-01-03 14:37:14.715658,0 days 00:00:25.700707,relu,0.11303379722780782,31,0.08021061199860058,2,True,standard,1.688325346400367e-05,COMPLETE
1814,146.95823669433594,2026-01-03 14:37:14.723656,2026-01-03 14:37:40.292456,0 days 00:00:25.568800,relu,0.11870223756796942,28,0.0997050036569,2,True,standard,3.313975420597069e-05,COMPLETE
1815,141.78805541992188,2026-01-03 14:37:40.299457,2026-01-03 14:38:06.116786,0 days 00:00:25.817329,relu,0.10748618652423811,30,0.09957186539958403,2,True,standard,2.698480243326396e-05,COMPLETE
1816,169.3418731689453,2026-01-03 14:38:06.126785,2026-01-03 14:38:32.574848,0 days 00:00:26.448063,mish,0.10012337951711461,28,0.055650399933133955,2,True,standard,2.0721153851569072e-05,COMPLETE
1817,175.82376098632812,2026-01-03 14:38:32.582852,2026-01-03 14:38:58.319223,0 days 00:00:25.736371,relu,0.11256035124300319,32,0.06518989189321775,2,True,minmax,1.5016470052602939e-05,COMPLETE
1818,152.44879150390625,2026-01-03 14:38:58.327223,2026-01-03 14:39:21.550865,0 days 00:00:23.223642,relu,0.13035780417782794,29,0.08867786772545398,1,True,standard,2.5275597406092827e-05,COMPLETE
1819,144.78598022460938,2026-01-03 14:39:21.558866,2026-01-03 14:39:47.274528,0 days 00:00:25.715662,relu,0.12099197742999765,31,0.07425751427799239,2,True,standard,1.855579356449065e-05,COMPLETE
1820,140.46949768066406,2026-01-03 14:39:47.282529,2026-01-03 14:40:13.166459,0 days 00:00:25.883930,relu,0.10731598049572724,31,0.08816446734298224,2,True,standard,3.925463279174607e-05,COMPLETE
1821,149.00015258789062,2026-01-03 14:40:13.174461,2026-01-03 14:40:38.498225,0 days 00:00:25.323764,relu,0.10675643047073745,20,0.07798462621406772,2,True,standard,2.9746158805756335e-05,COMPLETE
1822,140.3318328857422,2026-01-03 14:40:38.506225,2026-01-03 14:41:04.177450,0 days 00:00:25.671225,relu,0.11615520454035097,29,0.08787012483900704,2,True,standard,2.4007158650560444e-05,COMPLETE
1823,141.6287078857422,2026-01-03 14:41:04.186454,2026-01-03 14:41:31.753533,0 days 00:00:27.567079,gelu,0.10711780868715208,32,0.09986856853023147,2,True,standard,3.5255491252961196e-05,COMPLETE
1824,144.66114807128906,2026-01-03 14:41:31.761534,2026-01-03 14:41:57.468826,0 days 00:00:25.707292,relu,0.12469765413057837,30,0.06620339821804742,2,True,standard,1.3729214868353541e-05,COMPLETE
1825,198.89464165581597,2026-01-03 14:41:57.477827,2026-01-03 14:42:22.080931,0 days 00:00:24.603104,relu,0.11457793679357733,14,0.0009941349494414604,2,False,standard,2.1629775261476732e-05,COMPLETE
1826,142.73458862304688,2026-01-03 14:42:22.087931,2026-01-03 14:42:47.779957,0 days 00:00:25.692026,relu,0.10677651701416394,30,0.07883533032515586,2,True,standard,5.100931987932932e-05,COMPLETE
1827,139.30776977539062,2026-01-03 14:42:47.787959,2026-01-03 14:43:13.442664,0 days 00:00:25.654705,relu,0.10002617648311045,32,0.07109775510387549,2,True,standard,2.9281221125468498e-05,COMPLETE
1828,169.92153930664062,2026-01-03 14:43:13.452659,2026-01-03 14:43:39.248538,0 days 00:00:25.795879,silu,0.10018447277415998,27,0.05791966530196964,2,True,standard,1.884568685058977e-05,COMPLETE
1829,141.8363037109375,2026-01-03 14:43:39.257539,2026-01-03 14:44:04.794292,0 days 00:00:25.536753,relu,0.11807806537223525,28,0.08840122136509518,2,True,standard,2.523205494009403e-05,COMPLETE
1830,142.96237182617188,2026-01-03 14:44:04.803292,2026-01-03 14:44:30.453634,0 days 00:00:25.650342,relu,0.13120836692114796,30,0.07989646107263866,2,True,standard,6.720511489579534e-05,COMPLETE
1831,174.93649291992188,2026-01-03 14:44:30.461634,2026-01-03 14:44:56.005390,0 days 00:00:25.543756,relu,0.11276212968944613,26,0.006824332519065484,2,True,none,3.168546511195826e-05,COMPLETE
1832,139.53762817382812,2026-01-03 14:44:56.013390,2026-01-03 14:45:21.994373,0 days 00:00:25.980983,relu,0.10756672116307649,31,0.09978530179931702,2,True,standard,2.1806335173210747e-05,COMPLETE
1833,144.40731811523438,2026-01-03 14:45:22.003375,2026-01-03 14:45:47.600693,0 days 00:00:25.597318,relu,0.11352999166594537,29,0.07009705815859324,2,True,standard,4.0673079079800876e-05,COMPLETE
1834,148.2125701904297,2026-01-03 14:45:47.608693,2026-01-03 14:46:13.110437,0 days 00:00:25.501744,relu,0.12090349526430584,32,0.099961044140343,2,True,robust,1.6451219253372316e-05,COMPLETE
1835,145.4376220703125,2026-01-03 14:46:13.119437,2026-01-03 14:46:38.840820,0 days 00:00:25.721383,relu,0.1252107757759036,31,0.08797396510042786,2,True,standard,2.5782976054120362e-05,COMPLETE
1836,214.9205322265625,2026-01-03 14:46:38.850335,2026-01-03 14:47:03.761929,0 days 00:00:24.911594,relu,0.3938283143171078,8,0.07987749646758195,2,True,standard,1.1632921254690179e-05,COMPLETE
1837,140.52096557617188,2026-01-03 14:47:03.769929,2026-01-03 14:47:29.389612,0 days 00:00:25.619683,relu,0.10775593708028518,28,0.09963490451087811,2,True,standard,1.2434950922821132e-06,COMPLETE
1838,143.4953155517578,2026-01-03 14:47:29.398616,2026-01-03 14:47:55.049690,0 days 00:00:25.651074,relu,0.13697907777914767,32,0.06380677491081044,2,True,standard,1.7940652197500016e-06,COMPLETE
1839,170.9898681640625,2026-01-03 14:47:55.056690,2026-01-03 14:48:20.118777,0 days 00:00:25.062087,relu,0.10771483109736914,9,0.08016294711170042,2,True,standard,3.5524051336305575e-05,COMPLETE
1840,187.29563903808594,2026-01-03 14:48:20.126777,2026-01-03 14:48:46.612493,0 days 00:00:26.485716,mish,0.11362618018561083,30,0.0020134894831874235,2,True,standard,2.8459145330844913e-05,COMPLETE
1841,141.78517150878906,2026-01-03 14:48:46.620489,2026-01-03 14:49:12.233518,0 days 00:00:25.613029,relu,0.10035851758358473,29,0.08763843982068092,2,True,standard,2.255954760329288e-05,COMPLETE
1842,145.2918701171875,2026-01-03 14:49:12.241518,2026-01-03 14:49:37.941571,0 days 00:00:25.700053,relu,0.12122788931175657,31,0.07317343714208596,2,True,standard,2.042562714211034e-05,COMPLETE
1843,171.1685028076172,2026-01-03 14:49:37.948572,2026-01-03 14:50:03.680730,0 days 00:00:25.732158,relu,0.10835925604246471,32,0.08865604420119086,2,True,minmax,3.069037618384314e-05,COMPLETE
1844,198.16321214463977,2026-01-03 14:50:03.688730,2026-01-03 14:50:28.848888,0 days 00:00:25.160158,relu,0.11505722579196531,29,0.0009935122489964103,2,False,standard,4.5781950416577654e-05,COMPLETE
1845,151.3079833984375,2026-01-03 14:50:28.857888,2026-01-03 14:50:56.187350,0 days 00:00:27.329462,gelu,0.10675233542456708,27,0.06466360084916772,2,True,standard,1.9116893961648764e-05,COMPLETE
1846,144.04017639160156,2026-01-03 14:50:56.195349,2026-01-03 14:51:21.909643,0 days 00:00:25.714294,relu,0.1288128459276971,30,0.07908676832725886,2,True,standard,2.462700233155897e-05,COMPLETE
1847,140.15060424804688,2026-01-03 14:51:21.917643,2026-01-03 14:51:47.569001,0 days 00:00:25.651358,relu,0.1197046397890119,30,0.08901054523173621,2,True,standard,1.4896016238101258e-05,COMPLETE
1848,141.58343505859375,2026-01-03 14:51:47.577007,2026-01-03 14:52:13.250739,0 days 00:00:25.673732,relu,0.10016431480905336,32,0.0717694896975588,2,True,standard,2.7787870672104106e-05,COMPLETE
1849,146.36155700683594,2026-01-03 14:52:13.259740,2026-01-03 14:52:38.817419,0 days 00:00:25.557679,relu,0.11296294737921259,28,0.046556302082942716,2,True,standard,3.379552545414976e-05,COMPLETE
1850,179.57972717285156,2026-01-03 14:52:38.826422,2026-01-03 14:53:04.715081,0 days 00:00:25.888659,relu,0.10031792974839795,31,0.0034086861962366244,2,True,standard,1.2858982567467015e-05,COMPLETE
1851,143.74130249023438,2026-01-03 14:53:04.723081,2026-01-03 14:53:30.453384,0 days 00:00:25.730303,relu,0.1002549008365011,30,0.05959797101356484,2,True,standard,1.7420768369345224e-05,COMPLETE
1852,160.55953979492188,2026-01-03 14:53:30.461384,2026-01-03 14:53:56.324098,0 days 00:00:25.862714,silu,0.17481775957994294,32,0.08849777803868959,2,True,standard,2.328858742571326e-05,COMPLETE
1853,142.78689575195312,2026-01-03 14:53:56.332097,2026-01-03 14:54:21.954760,0 days 00:00:25.622663,relu,0.11310945582762849,29,0.09933618188468253,2,True,standard,1.030973366398639e-05,COMPLETE
1854,148.36178588867188,2026-01-03 14:54:21.963761,2026-01-03 14:54:45.154375,0 days 00:00:23.190614,relu,0.12309047169636128,31,0.09994491383767395,1,True,standard,0.0001511394239111766,COMPLETE
1855,172.05874633789062,2026-01-03 14:54:45.163376,2026-01-03 14:55:10.825560,0 days 00:00:25.662184,relu,0.10705888354742206,32,0.0796750553934799,2,True,none,2.7491356405138507e-05,COMPLETE
1856,141.18386840820312,2026-01-03 14:55:10.833560,2026-01-03 14:55:36.634966,0 days 00:00:25.801406,relu,0.10006440313269271,27,0.07089441848893233,2,True,standard,1.9368776898872835e-05,COMPLETE
1857,155.15029907226562,2026-01-03 14:55:36.643968,2026-01-03 14:56:02.431284,0 days 00:00:25.787316,relu,0.18847738527030206,30,0.05378900796739615,2,True,standard,3.889320494196408e-05,COMPLETE
1858,155.45872497558594,2026-01-03 14:56:02.439287,2026-01-03 14:56:28.250887,0 days 00:00:25.811600,relu,0.11266537427019588,28,0.0791014141811575,2,True,robust,2.3450637679779814e-05,COMPLETE
1859,143.2652130126953,2026-01-03 14:56:28.259887,2026-01-03 14:56:53.987553,0 days 00:00:25.727666,relu,0.13186347687886976,31,0.08940376083508973,2,True,standard,3.035433307417231e-05,COMPLETE
1860,152.08169555664062,2026-01-03 14:56:53.996557,2026-01-03 14:57:19.067767,0 days 00:00:25.071210,relu,0.11967200586218493,16,0.09953968957933715,2,True,standard,7.226921199482087e-06,COMPLETE
1861,144.3329620361328,2026-01-03 14:57:19.076768,2026-01-03 14:57:44.725004,0 days 00:00:25.648236,relu,0.10745153481531189,29,0.07012490272442874,2,True,standard,3.451561562176464e-05,COMPLETE
1862,140.6165313720703,2026-01-03 14:57:44.734006,2026-01-03 14:58:10.504644,0 days 00:00:25.770638,relu,0.1077226722502877,31,0.07883165300868558,2,True,standard,2.0880402384304587e-05,COMPLETE
1863,198.1006858317057,2026-01-03 14:58:10.513647,2026-01-03 14:58:35.614835,0 days 00:00:25.101188,relu,0.11908950439304142,32,0.000993827529716332,2,False,standard,2.5499509612099835e-05,COMPLETE
1864,171.70997619628906,2026-01-03 14:58:35.623838,2026-01-03 14:59:01.359155,0 days 00:00:25.735317,relu,0.10731758456622652,30,0.09985723643387583,2,True,minmax,5.4936959784975574e-05,COMPLETE
1865,140.64329528808594,2026-01-03 14:59:01.367155,2026-01-03 14:59:27.081818,0 days 00:00:25.714663,relu,0.11350727269148653,30,0.08784846132165484,2,True,standard,1.571387686595662e-05,COMPLETE
1866,160.76173400878906,2026-01-03 14:59:27.089818,2026-01-03 14:59:53.520139,0 days 00:00:26.430321,mish,0.14321814476877803,29,0.06287762641473581,2,True,standard,1.1953191568494531e-05,COMPLETE
1867,165.8347625732422,2026-01-03 14:59:53.528139,2026-01-03 15:00:19.249186,0 days 00:00:25.721047,relu,0.3423350815770167,32,0.07896483889107714,2,True,standard,2.721382225951988e-05,COMPLETE
1868,141.83338928222656,2026-01-03 15:00:19.258190,2026-01-03 15:00:44.920949,0 days 00:00:25.662759,relu,0.10020164517583051,28,0.08748030509877167,2,True,standard,3.182763473228068e-05,COMPLETE
1869,152.35409545898438,2026-01-03 15:00:44.928949,2026-01-03 15:01:12.316396,0 days 00:00:27.387447,gelu,0.10004400555401037,26,0.07139273518282974,2,True,standard,2.235501458635283e-05,COMPLETE
1870,185.49240112304688,2026-01-03 15:01:12.325394,2026-01-03 15:01:38.089197,0 days 00:00:25.763803,relu,0.12622794761869716,31,0.0014171455334414565,2,True,standard,1.7671873701586642e-05,COMPLETE
1871,142.31076049804688,2026-01-03 15:01:38.097197,2026-01-03 15:02:03.827875,0 days 00:00:25.730678,relu,0.11480222543857573,32,0.09999771144082104,2,True,standard,2.491385578226552e-05,COMPLETE
1872,193.4546356201172,2026-01-03 15:02:03.836872,2026-01-03 15:02:29.417445,0 days 00:00:25.580573,relu,0.10713561581444865,30,0.0007869274457655645,2,True,standard,4.390007473175955e-05,COMPLETE
1873,139.26744079589844,2026-01-03 15:02:29.426442,2026-01-03 15:02:55.060636,0 days 00:00:25.634194,relu,0.11690813810503675,29,0.0998249153680375,2,True,standard,2.000796394292419e-05,COMPLETE
1874,140.09347534179688,2026-01-03 15:02:55.069635,2026-01-03 15:03:20.827466,0 days 00:00:25.757831,relu,0.1072405214928972,31,0.0819991859113868,2,True,standard,1.020568055873221e-05,COMPLETE
1875,167.31942749023438,2026-01-03 15:03:20.834466,2026-01-03 15:03:46.605543,0 days 00:00:25.771077,silu,0.1252130196851209,27,0.06537145065463573,2,True,standard,0.0001708037495871139,COMPLETE
1876,137.90750122070312,2026-01-03 15:03:46.613544,2026-01-03 15:04:12.428764,0 days 00:00:25.815220,relu,0.1072765114651231,32,0.08678598091319195,2,True,standard,3.634049100296246e-05,COMPLETE
1877,142.7961883544922,2026-01-03 15:04:12.436762,2026-01-03 15:04:38.149774,0 days 00:00:25.713012,relu,0.13275145769469826,32,0.06651462030124354,2,True,standard,4.8626217512604734e-05,COMPLETE
1878,145.88662719726562,2026-01-03 15:04:38.157774,2026-01-03 15:05:03.888445,0 days 00:00:25.730671,relu,0.12410671620244354,32,0.053496499817341864,2,True,standard,3.7759129877542886e-05,COMPLETE
1879,172.49658203125,2026-01-03 15:05:03.896449,2026-01-03 15:05:29.707588,0 days 00:00:25.811139,relu,0.14022322823770064,32,0.05806169226552059,2,True,none,4.0126648316383585e-05,COMPLETE
1880,139.80758666992188,2026-01-03 15:05:29.715095,2026-01-03 15:05:55.521192,0 days 00:00:25.806097,relu,0.12028964849947196,32,0.072456825679511,2,True,standard,4.439831851200339e-05,COMPLETE
1881,141.43975830078125,2026-01-03 15:05:55.529193,2026-01-03 15:06:21.273244,0 days 00:00:25.744051,relu,0.13160885784472298,32,0.06051121568304756,2,True,standard,4.63284961237825e-05,COMPLETE
1882,198.2724569363064,2026-01-03 15:06:21.281244,2026-01-03 15:06:46.472210,0 days 00:00:25.190966,relu,0.1188033219836241,32,0.0009942554048289463,2,False,standard,4.0972758386047185e-05,COMPLETE
1883,148.05825805664062,2026-01-03 15:06:46.480206,2026-01-03 15:07:12.184781,0 days 00:00:25.704575,relu,0.11393130999946866,31,0.07348672162337716,2,True,robust,3.56018451157722e-05,COMPLETE
1884,144.66786193847656,2026-01-03 15:07:12.193780,2026-01-03 15:07:37.976443,0 days 00:00:25.782663,relu,0.1267006268684279,31,0.07689293956161425,2,True,standard,3.8454384767491964e-05,COMPLETE
1885,166.79083251953125,2026-01-03 15:07:37.984443,2026-01-03 15:08:03.672155,0 days 00:00:25.687712,relu,0.11382933123853306,32,0.009486615261762399,2,True,standard,5.608921387138853e-05,COMPLETE
1886,142.94300842285156,2026-01-03 15:08:03.680154,2026-01-03 15:08:29.451600,0 days 00:00:25.771446,relu,0.11939485052085332,31,0.06612158222268341,2,True,standard,4.170402088494429e-05,COMPLETE
1887,140.82949829101562,2026-01-03 15:08:29.460600,2026-01-03 15:08:55.391318,0 days 00:00:25.930718,relu,0.11251709643853183,30,0.08047727660517737,2,True,standard,3.537625723661254e-05,COMPLETE
1888,140.12338256835938,2026-01-03 15:08:55.399828,2026-01-03 15:09:20.983531,0 days 00:00:25.583703,relu,0.10007753183201118,32,0.08227412444970196,2,True,standard,5.198082321019763e-06,COMPLETE
1889,158.4189453125,2026-01-03 15:09:20.991554,2026-01-03 15:09:47.790678,0 days 00:00:26.799124,mish,0.1083014726385071,31,0.06843212957729282,2,True,standard,3.4794026976381306e-05,COMPLETE
1890,175.77337646484375,2026-01-03 15:09:47.799681,2026-01-03 15:10:13.675860,0 days 00:00:25.876179,relu,0.12442323341053241,30,0.08736384034123061,2,True,minmax,4.8669696517702073e-05,COMPLETE
1891,143.46572875976562,2026-01-03 15:10:13.685370,2026-01-03 15:10:39.468389,0 days 00:00:25.783019,relu,0.11282943082632006,32,0.07340125084262161,2,True,standard,3.3118456128865456e-05,COMPLETE
