number,value,datetime_start,datetime_complete,duration,params_activation,params_dropout,params_hidden_size,params_lr,params_scale_target,params_scaler,params_scaler_post_pca,params_weight_decay,state
455,159.57077026367188,2026-01-02 17:49:34.173614,2026-01-02 17:49:41.959722,0 days 00:00:07.786108,relu,0.12222841589917785,45,0.09993209196642323,True,,none,1.4835239349047138e-05,COMPLETE
456,187.98245239257812,2026-01-02 17:49:41.966724,2026-01-02 17:49:49.541344,0 days 00:00:07.574620,relu,0.11388408093422318,7,0.06882526462166354,True,,none,4.177521160124021e-05,COMPLETE
457,158.78231811523438,2026-01-02 17:49:49.549341,2026-01-02 17:49:57.577999,0 days 00:00:08.028658,relu,0.10879942774818485,59,0.08208538866759858,True,,none,3.0393033312019618e-05,COMPLETE
458,160.29208374023438,2026-01-02 17:49:57.586004,2026-01-02 17:50:05.566696,0 days 00:00:07.980692,relu,0.12005864609611588,51,0.08508089094613368,True,,none,0.00031874768340352515,COMPLETE
459,176.4826202392578,2026-01-02 17:50:05.574696,2026-01-02 17:50:13.405306,0 days 00:00:07.830610,relu,0.10613199474559551,41,0.054630244994458774,True,,minmax,2.2672550692124736e-05,COMPLETE
460,182.184814453125,2026-01-02 17:50:13.413306,2026-01-02 17:50:21.853005,0 days 00:00:08.439699,gelu,0.10048896291946458,47,0.0021197132440941404,True,,none,1.837834349446027e-05,COMPLETE
461,159.7962188720703,2026-01-02 17:50:21.861005,2026-01-02 17:50:29.679098,0 days 00:00:07.818093,relu,0.10013202346252476,44,0.07147364984957114,True,,none,3.802550830838998e-05,COMPLETE
462,157.44589233398438,2026-01-02 17:50:29.686101,2026-01-02 17:50:37.593742,0 days 00:00:07.907641,relu,0.12817525923401368,54,0.08802527979143475,True,,none,2.3951879236125765e-05,COMPLETE
463,159.3771514892578,2026-01-02 17:50:37.603250,2026-01-02 17:50:45.552852,0 days 00:00:07.949602,relu,0.13667270983750293,57,0.0892392082623286,True,,none,2.588060458308446e-05,COMPLETE
464,158.01278686523438,2026-01-02 17:50:45.562852,2026-01-02 17:50:53.505426,0 days 00:00:07.942574,relu,0.12941908910219183,61,0.08973898917531553,True,,none,2.2930477778815875e-05,COMPLETE
465,158.03707885742188,2026-01-02 17:50:53.513426,2026-01-02 17:51:01.486029,0 days 00:00:07.972603,relu,0.12769042172767847,54,0.09993759825707044,True,,none,2.011840317874609e-05,COMPLETE
466,159.17318725585938,2026-01-02 17:51:01.495036,2026-01-02 17:51:09.464208,0 days 00:00:07.969172,relu,0.12071839311377228,55,0.08745990613079989,True,,none,3.0092367594262696e-05,COMPLETE
467,159.90985107421875,2026-01-02 17:51:09.473208,2026-01-02 17:51:17.433832,0 days 00:00:07.960624,relu,0.14259466472828763,52,0.07788915111947006,True,,none,2.5315697602409657e-05,COMPLETE
468,197.5544443088108,2026-01-02 17:51:17.442833,2026-01-02 17:51:25.748011,0 days 00:00:08.305178,mish,0.11421336932845667,58,0.0009933580545245179,False,,none,3.4205354388909334e-05,COMPLETE
469,159.83218383789062,2026-01-02 17:51:25.756011,2026-01-02 17:51:33.688201,0 days 00:00:07.932190,relu,0.12491690096620447,50,0.06264122103359128,True,,none,1.7534825392813103e-05,COMPLETE
470,157.29196166992188,2026-01-02 17:51:33.696208,2026-01-02 17:51:41.619333,0 days 00:00:07.923125,relu,0.11323206228703367,54,0.08859066720015808,True,,none,2.1447200154031505e-05,COMPLETE
471,157.84678649902344,2026-01-02 17:51:41.629333,2026-01-02 17:51:49.562975,0 days 00:00:07.933642,relu,0.13437007387825883,60,0.09924488775201686,True,,none,2.022704310763495e-05,COMPLETE
472,157.86729431152344,2026-01-02 17:51:49.570973,2026-01-02 17:51:57.478622,0 days 00:00:07.907649,relu,0.11690321560294216,56,0.0784338264604622,True,,none,1.3404914366915422e-05,COMPLETE
473,167.8262939453125,2026-01-02 17:51:57.486623,2026-01-02 17:52:05.487324,0 days 00:00:08.000701,silu,0.12460390961223372,64,0.06911934062867459,True,,none,1.5435411831903626e-05,COMPLETE
474,159.12435913085938,2026-01-02 17:52:05.495323,2026-01-02 17:52:13.397387,0 days 00:00:07.902064,relu,0.11302535385178343,53,0.08806724354247576,True,,none,2.7631384934274306e-05,COMPLETE
475,157.52975463867188,2026-01-02 17:52:13.406391,2026-01-02 17:52:21.448495,0 days 00:00:08.042104,relu,0.11862985652424417,57,0.08920778939065654,True,,none,2.2315545169238196e-05,COMPLETE
476,159.67892456054688,2026-01-02 17:52:21.456496,2026-01-02 17:52:29.478645,0 days 00:00:08.022149,relu,0.14785584824471315,59,0.08013032560735568,True,,none,1.8572686440726568e-05,COMPLETE
477,159.5321807861328,2026-01-02 17:52:29.486645,2026-01-02 17:52:37.423330,0 days 00:00:07.936685,relu,0.1323667628643159,58,0.06487719829705801,True,,none,2.244883639572968e-05,COMPLETE
478,159.0850067138672,2026-01-02 17:52:37.433329,2026-01-02 17:52:45.321425,0 days 00:00:07.888096,relu,0.12342665623435296,56,0.0732917203361176,True,,none,1.6620121174221953e-05,COMPLETE
479,169.7508544921875,2026-01-02 17:52:45.329426,2026-01-02 17:52:53.206521,0 days 00:00:07.877095,relu,0.13798051256773963,61,0.08761735005193946,True,,minmax,2.1002939450079073e-05,COMPLETE
480,157.7295684814453,2026-01-02 17:52:53.213522,2026-01-02 17:53:01.179127,0 days 00:00:07.965605,relu,0.11888375560239303,53,0.09983316576124666,True,,none,2.4293133411393318e-05,COMPLETE
481,163.1675262451172,2026-01-02 17:53:01.187126,2026-01-02 17:53:08.998754,0 days 00:00:07.811628,relu,0.12557770849464647,30,0.08131508205935244,True,,none,1.887097506534987e-05,COMPLETE
482,160.12466430664062,2026-01-02 17:53:09.006755,2026-01-02 17:53:17.028365,0 days 00:00:08.021610,relu,0.11432946708706994,55,0.07024125418630343,True,,none,1.2297911680798386e-05,COMPLETE
483,158.02944946289062,2026-01-02 17:53:17.037365,2026-01-02 17:53:24.946028,0 days 00:00:07.908663,relu,0.11808167926093409,62,0.08834356089815053,True,,none,2.1088347513038967e-05,COMPLETE
484,161.9291534423828,2026-01-02 17:53:24.954027,2026-01-02 17:53:32.957688,0 days 00:00:08.003661,relu,0.13066693647991856,57,0.0604460228460844,True,,none,2.578304413002975e-05,COMPLETE
485,191.44845581054688,2026-01-02 17:53:32.993687,2026-01-02 17:53:40.636277,0 days 00:00:07.642590,relu,0.11114663957032865,14,0.003379086597269277,True,,none,1.679269245595975e-05,COMPLETE
486,158.2146759033203,2026-01-02 17:53:40.644277,2026-01-02 17:53:48.548367,0 days 00:00:07.904090,relu,0.1204051366857371,52,0.07794494481389147,True,,none,1.4234262652100865e-05,COMPLETE
487,160.75006103515625,2026-01-02 17:53:48.556367,2026-01-02 17:53:57.059024,0 days 00:00:08.502657,gelu,0.10821653660112457,54,0.08917539259410684,True,,none,2.240492508754777e-05,COMPLETE
488,198.21995958116318,2026-01-02 17:53:57.068530,2026-01-02 17:54:04.830152,0 days 00:00:07.761622,relu,0.2793748658849879,50,0.0009938285340766462,False,,none,1.0938085160516587e-05,COMPLETE
489,159.00460815429688,2026-01-02 17:54:04.838663,2026-01-02 17:54:12.824270,0 days 00:00:07.985607,relu,0.1274309653699519,58,0.07125935123611744,True,,none,2.826710808363254e-05,COMPLETE
490,156.951171875,2026-01-02 17:54:12.832772,2026-01-02 17:54:20.683336,0 days 00:00:07.850564,relu,0.11345261958220373,49,0.09927516211930203,True,,none,8.68593701654147e-06,COMPLETE
491,158.47116088867188,2026-01-02 17:54:20.691338,2026-01-02 17:54:28.676498,0 days 00:00:07.985160,relu,0.1368432042768694,52,0.08996957745712306,True,,none,8.841714770270824e-06,COMPLETE
492,163.78627014160156,2026-01-02 17:54:28.683499,2026-01-02 17:54:37.008195,0 days 00:00:08.324696,mish,0.11663859728776663,56,0.08908467668837325,True,,none,7.174950601868839e-06,COMPLETE
493,168.62954711914062,2026-01-02 17:54:37.017196,2026-01-02 17:54:44.637797,0 days 00:00:07.620601,relu,0.1266657356519595,16,0.08928616405541753,True,,none,7.71878303105299e-06,COMPLETE
494,158.10452270507812,2026-01-02 17:54:44.644796,2026-01-02 17:54:52.600980,0 days 00:00:07.956184,relu,0.11309129528692967,50,0.09836188265774604,True,,none,1.0260302016628027e-05,COMPLETE
495,173.57681274414062,2026-01-02 17:54:52.608981,2026-01-02 17:55:00.536683,0 days 00:00:07.927702,relu,0.477152586189144,54,0.09888023487787224,True,,none,1.245570400784976e-05,COMPLETE
496,157.73585510253906,2026-01-02 17:55:00.545192,2026-01-02 17:55:08.523332,0 days 00:00:07.978140,relu,0.10726201240321075,64,0.07718583540243021,True,,none,1.0394108549781752e-05,COMPLETE
497,157.4833984375,2026-01-02 17:55:08.532337,2026-01-02 17:55:16.332855,0 days 00:00:07.800518,relu,0.10031649678066978,48,0.07931943223308768,True,,none,8.566402631473312e-06,COMPLETE
498,179.73001098632812,2026-01-02 17:55:16.339855,2026-01-02 17:55:24.208973,0 days 00:00:07.869118,silu,0.10030852865724843,47,0.09955411461456472,True,,minmax,6.28582151877769e-06,COMPLETE
499,167.8787078857422,2026-01-02 17:55:24.215973,2026-01-02 17:55:32.061645,0 days 00:00:07.845672,relu,0.33671264153820807,48,0.0656228378632205,True,,none,8.929718170660316e-06,COMPLETE
500,160.84536743164062,2026-01-02 17:55:32.068643,2026-01-02 17:55:39.982801,0 days 00:00:07.914158,relu,0.10038991597040699,51,0.07728920684339674,True,,none,6.2544592871993266e-06,COMPLETE
501,161.7345733642578,2026-01-02 17:55:39.990802,2026-01-02 17:55:47.838868,0 days 00:00:07.848066,relu,0.10772419933815996,48,0.04612487930504815,True,,none,7.836922690623148e-06,COMPLETE
502,202.9027862548828,2026-01-02 17:55:47.847376,2026-01-02 17:55:55.723044,0 days 00:00:07.875668,relu,0.44578386175848617,49,0.000642096103507701,True,,none,8.138020607559266e-06,COMPLETE
503,160.11233520507812,2026-01-02 17:55:55.730044,2026-01-02 17:56:03.581171,0 days 00:00:07.851127,relu,0.11215100782348014,45,0.05373147278021614,True,,none,1.1268578210664921e-05,COMPLETE
504,164.70675659179688,2026-01-02 17:56:03.589170,2026-01-02 17:56:11.498762,0 days 00:00:07.909592,relu,0.10731887230844073,51,0.02683080137875636,True,,none,1.3607759434394228e-05,COMPLETE
505,159.83670043945312,2026-01-02 17:56:11.506762,2026-01-02 17:56:19.418868,0 days 00:00:07.912106,relu,0.10086370932733872,43,0.07965118353728945,True,,none,8.938477458156153e-06,COMPLETE
506,160.53823852539062,2026-01-02 17:56:19.426867,2026-01-02 17:56:27.307042,0 days 00:00:07.880175,relu,0.11303622911755173,47,0.06622355080058213,True,,none,9.992471113519725e-06,COMPLETE
507,197.70834343804253,2026-01-02 17:56:27.314043,2026-01-02 17:56:35.070640,0 days 00:00:07.756597,relu,0.12053479991809381,53,0.0009937691322657281,False,,none,8.461827360957634e-06,COMPLETE
508,158.16502380371094,2026-01-02 17:56:35.114642,2026-01-02 17:56:43.135794,0 days 00:00:08.021152,relu,0.10048819060771234,49,0.07975370829201803,True,,none,9.837750282896364e-06,COMPLETE
509,156.80657958984375,2026-01-02 17:56:43.142800,2026-01-02 17:56:51.015013,0 days 00:00:07.872213,relu,0.11245024963822717,45,0.09945249878281079,True,,none,5.673339713048733e-06,COMPLETE
510,160.2574005126953,2026-01-02 17:56:51.023013,2026-01-02 17:56:59.365175,0 days 00:00:08.342162,gelu,0.1294861765806888,38,0.09921719013961273,True,,none,4.554667776075223e-05,COMPLETE
511,157.77597045898438,2026-01-02 17:56:59.373175,2026-01-02 17:57:07.327745,0 days 00:00:07.954570,relu,0.1201418600952742,51,0.08837206553709946,True,,none,7.334567484864434e-06,COMPLETE
512,194.3424072265625,2026-01-02 17:57:07.334746,2026-01-02 17:57:15.166384,0 days 00:00:07.831638,relu,0.1136179839386897,42,0.0003757917454596883,True,,none,5.359887834828975e-06,COMPLETE
513,159.03858947753906,2026-01-02 17:57:15.174381,2026-01-02 17:57:23.061552,0 days 00:00:07.887171,relu,0.14355850728220418,46,0.09850370671911711,True,,none,3.5027903967914613e-06,COMPLETE
514,180.26467895507812,2026-01-02 17:57:23.069554,2026-01-02 17:57:31.017180,0 days 00:00:07.947626,relu,0.11213818768804931,53,0.005003450228837568,True,,none,5.151450973835799e-06,COMPLETE
515,181.2357635498047,2026-01-02 17:57:31.026182,2026-01-02 17:57:38.531744,0 days 00:00:07.505562,relu,0.12248986939433297,9,0.09936314564634623,True,,none,4.7554664096862196e-06,COMPLETE
516,160.57949829101562,2026-01-02 17:57:38.539752,2026-01-02 17:57:46.419363,0 days 00:00:07.879611,relu,0.13170441596359678,49,0.073719501569513,True,,none,4.213959900163627e-06,COMPLETE
517,167.76950073242188,2026-01-02 17:57:46.428362,2026-01-02 17:57:54.415480,0 days 00:00:07.987118,relu,0.10744453614812857,55,0.08238695530777307,True,,minmax,3.987435728255423e-05,COMPLETE
518,167.70730590820312,2026-01-02 17:57:54.424481,2026-01-02 17:58:02.687575,0 days 00:00:08.263094,mish,0.11676386123811755,44,0.05862819378553846,True,,none,1.525760547763047e-05,COMPLETE
519,158.79620361328125,2026-01-02 17:58:02.695573,2026-01-02 17:58:10.471625,0 days 00:00:07.776052,relu,0.10647620171982793,40,0.09937868347106536,True,,none,3.535201048115693e-05,COMPLETE
520,159.3767852783203,2026-01-02 17:58:10.479625,2026-01-02 17:58:18.454713,0 days 00:00:07.975088,relu,0.10034386148697812,47,0.0729687119102365,True,,none,4.316076536545937e-05,COMPLETE
521,159.2847442626953,2026-01-02 17:58:18.462714,2026-01-02 17:58:26.383321,0 days 00:00:07.920607,relu,0.12080670984448941,50,0.09992885278788455,True,,none,6.2318962763853475e-06,COMPLETE
522,156.945556640625,2026-01-02 17:58:26.391321,2026-01-02 17:58:34.315419,0 days 00:00:07.924098,relu,0.11191574634266191,53,0.08507504728733042,True,,none,1.2283845042850168e-05,COMPLETE
523,160.1287078857422,2026-01-02 17:58:34.324418,2026-01-02 17:58:42.037991,0 days 00:00:07.713573,relu,0.11379293292884941,28,0.08593241983466951,True,,none,1.2962626395374093e-05,COMPLETE
524,163.5888214111328,2026-01-02 17:58:42.045993,2026-01-02 17:58:50.132128,0 days 00:00:08.086135,silu,0.10649569013136785,59,0.08649970337213209,True,,none,1.1715379061041288e-05,COMPLETE
525,175.05508422851562,2026-01-02 17:58:50.139127,2026-01-02 17:58:57.675723,0 days 00:00:07.536596,relu,0.11136719649740685,12,0.07022497378280937,True,,none,1.1706807230611554e-05,COMPLETE
526,158.38003540039062,2026-01-02 17:58:57.682723,2026-01-02 17:59:05.515888,0 days 00:00:07.833165,relu,0.1068443365614833,43,0.09996110481346725,True,,none,2.991345553827784e-06,COMPLETE
527,197.4656477186415,2026-01-02 17:59:05.523889,2026-01-02 17:59:13.340536,0 days 00:00:07.816647,relu,0.10017844828891885,54,0.0009944005059893241,False,,none,1.4837403435648102e-05,COMPLETE
528,158.74929809570312,2026-01-02 17:59:13.349537,2026-01-02 17:59:21.247166,0 days 00:00:07.897629,relu,0.11456176808509458,47,0.08422636226588258,True,,none,6.0782058082701565e-06,COMPLETE
529,158.86502075195312,2026-01-02 17:59:21.256165,2026-01-02 17:59:29.244861,0 days 00:00:07.988696,relu,0.12515221987280534,51,0.07871251853951872,True,,none,7.185936087972592e-06,COMPLETE
530,161.0481719970703,2026-01-02 17:59:29.253863,2026-01-02 17:59:37.151949,0 days 00:00:07.898086,relu,0.11274537063527182,45,0.06457059745878485,True,,none,8.866912903529712e-06,COMPLETE
531,157.2943115234375,2026-01-02 17:59:37.159947,2026-01-02 17:59:45.057087,0 days 00:00:07.897140,relu,0.10733356566776696,41,0.08611947525782565,True,,none,1.8457263199238123e-05,COMPLETE
532,159.46856689453125,2026-01-02 17:59:45.066093,2026-01-02 17:59:52.878143,0 days 00:00:07.812050,relu,0.12818109125117913,39,0.08890766079049171,True,,none,1.6962206298416045e-05,COMPLETE
533,160.4124298095703,2026-01-02 17:59:52.886654,2026-01-02 18:00:00.673238,0 days 00:00:07.786584,relu,0.11938590093885698,36,0.08726842843647305,True,,none,1.791457558565479e-05,COMPLETE
534,161.04898071289062,2026-01-02 18:00:00.681741,2026-01-02 18:00:08.568337,0 days 00:00:07.886596,relu,0.13563058009900322,39,0.08896777228828226,True,,none,1.887098150281297e-05,COMPLETE
535,162.63780212402344,2026-01-02 18:00:08.576337,2026-01-02 18:00:16.789520,0 days 00:00:08.213183,gelu,0.11850803923397622,24,0.07159995030004326,True,,none,1.9738599580276568e-05,COMPLETE
536,169.4091339111328,2026-01-02 18:00:16.798521,2026-01-02 18:00:24.654130,0 days 00:00:07.855609,relu,0.3574804579292402,34,0.0997746460931367,True,,none,1.4807710776207387e-05,COMPLETE
537,170.70245361328125,2026-01-02 18:00:24.664130,2026-01-02 18:00:32.489729,0 days 00:00:07.825599,relu,0.11015168950204059,42,0.0878550462946926,True,,minmax,1.369958757521655e-05,COMPLETE
538,161.23583984375,2026-01-02 18:00:32.497729,2026-01-02 18:00:40.339315,0 days 00:00:07.841586,relu,0.12435934267285363,42,0.07542729787528996,True,,none,1.5922897759362904e-05,COMPLETE
539,159.9754180908203,2026-01-02 18:00:40.347312,2026-01-02 18:00:48.438039,0 days 00:00:08.090727,relu,0.10741363808673325,36,0.08752688801363785,True,,none,2.3653839363518244e-05,COMPLETE
540,163.49838256835938,2026-01-02 18:00:48.818090,2026-01-02 18:00:56.823202,0 days 00:00:08.005112,relu,0.11255513250145993,41,0.06493913821469971,True,,none,1.677532474805571e-05,COMPLETE
541,157.6338348388672,2026-01-02 18:00:56.831207,2026-01-02 18:01:04.855896,0 days 00:00:08.024689,relu,0.11975625835857862,60,0.07952866518734825,True,,none,2.64644212203652e-05,COMPLETE
542,161.16824340820312,2026-01-02 18:01:04.862896,2026-01-02 18:01:13.253590,0 days 00:00:08.390694,mish,0.10717858831602592,54,0.09907935462427771,True,,none,1.9330761077893974e-05,COMPLETE
543,159.43118286132812,2026-01-02 18:01:13.264591,2026-01-02 18:01:21.166193,0 days 00:00:07.901602,relu,0.12958675844489156,44,0.07421797583926194,True,,none,3.041019372063217e-05,COMPLETE
544,155.69955444335938,2026-01-02 18:01:21.174197,2026-01-02 18:01:29.171810,0 days 00:00:07.997613,relu,0.10005196832770014,57,0.08823231872915589,True,,none,1.300742953658083e-05,COMPLETE
545,160.6850128173828,2026-01-02 18:01:29.180812,2026-01-02 18:01:37.197409,0 days 00:00:08.016597,relu,0.11490827976003118,59,0.0586372690833864,True,,none,1.2519201337471441e-05,COMPLETE
546,158.37704467773438,2026-01-02 18:01:37.204408,2026-01-02 18:01:45.285528,0 days 00:00:08.081120,relu,0.10622799657667659,57,0.0677117802865698,True,,none,1.4053066365643383e-05,COMPLETE
547,157.3656005859375,2026-01-02 18:01:45.293528,2026-01-02 18:01:53.220128,0 days 00:00:07.926600,relu,0.10099244305977455,61,0.08036780540397899,True,,none,1.1199013995950378e-05,COMPLETE
548,197.15657836914065,2026-01-02 18:01:53.229128,2026-01-02 18:02:00.948144,0 days 00:00:07.719016,relu,0.10018812703616681,64,0.0009947258977033625,False,,none,1.197605051886124e-05,COMPLETE
549,167.74081420898438,2026-01-02 18:02:00.956652,2026-01-02 18:02:08.912210,0 days 00:00:07.955558,silu,0.12118909113769455,60,0.07815466781379943,True,,none,1.3022445245073371e-05,COMPLETE
550,159.09573364257812,2026-01-02 18:02:08.920211,2026-01-02 18:02:16.866857,0 days 00:00:07.946646,relu,0.11358513392328032,62,0.05742522627216018,True,,none,1.5105492585826332e-05,COMPLETE
551,159.9852294921875,2026-01-02 18:02:16.873857,2026-01-02 18:02:24.884511,0 days 00:00:08.010654,relu,0.1382984613831334,57,0.06828307559463098,True,,none,1.132429279188632e-05,COMPLETE
552,157.10531616210938,2026-01-02 18:02:24.893511,2026-01-02 18:02:32.792109,0 days 00:00:07.898598,relu,0.1273128855240439,64,0.0813217298098957,True,,none,1.715039424825651e-05,COMPLETE
553,164.8032684326172,2026-01-02 18:02:32.799109,2026-01-02 18:02:40.701228,0 days 00:00:07.902119,relu,0.26577936248980294,64,0.05123944471989246,True,,none,1.5689718860843148e-05,COMPLETE
554,158.58932495117188,2026-01-02 18:02:40.709226,2026-01-02 18:02:48.642911,0 days 00:00:07.933685,relu,0.10780133599264329,61,0.06870988761289663,True,,none,1.3086636395676133e-05,COMPLETE
555,157.46560668945312,2026-01-02 18:02:48.651913,2026-01-02 18:02:56.635533,0 days 00:00:07.983620,relu,0.1153072075506496,64,0.09991766594616024,True,,none,1.062313380750333e-05,COMPLETE
556,157.6525115966797,2026-01-02 18:02:56.644536,2026-01-02 18:03:04.599174,0 days 00:00:07.954638,relu,0.12038518587241787,64,0.07925874873278561,True,,none,1.7847383493251688e-05,COMPLETE
557,159.42941284179688,2026-01-02 18:03:04.606174,2026-01-02 18:03:12.597842,0 days 00:00:07.991668,relu,0.10746073379546985,60,0.06264550469315348,True,,none,1.6710134721233194e-05,COMPLETE
558,158.09750366210938,2026-01-02 18:03:12.605842,2026-01-02 18:03:20.582962,0 days 00:00:07.977120,relu,0.10022635553926339,59,0.08082989914236563,True,,none,1.3926023135729906e-05,COMPLETE
559,177.15402221679688,2026-01-02 18:03:20.590962,2026-01-02 18:03:28.514598,0 days 00:00:07.923636,relu,0.3019909399783059,62,0.0871722957340863,True,,minmax,1.4895091679332878e-05,COMPLETE
560,160.8961639404297,2026-01-02 18:03:28.522600,2026-01-02 18:03:37.104822,0 days 00:00:08.582222,gelu,0.12694285350352003,58,0.07284150422433221,True,,none,1.9401992589788936e-05,COMPLETE
561,156.2997283935547,2026-01-02 18:03:37.113822,2026-01-02 18:03:45.075426,0 days 00:00:07.961604,relu,0.11380131417888274,61,0.09958070114718082,True,,none,1.2720149767289518e-05,COMPLETE
562,158.14553833007812,2026-01-02 18:03:45.084426,2026-01-02 18:03:53.062525,0 days 00:00:07.978099,relu,0.1115096331975116,61,0.09997993490823726,True,,none,1.1606296404456443e-05,COMPLETE
563,157.48605346679688,2026-01-02 18:03:53.071032,2026-01-02 18:04:01.021604,0 days 00:00:07.950572,relu,0.10749317877135335,61,0.087020013491266,True,,none,1.30954321750719e-05,COMPLETE
564,170.35552978515625,2026-01-02 18:04:01.029604,2026-01-02 18:04:09.004219,0 days 00:00:07.974615,relu,0.3999444847028039,61,0.07711387428560507,True,,none,1.0904722500106205e-05,COMPLETE
565,156.6653289794922,2026-01-02 18:04:09.012218,2026-01-02 18:04:16.919300,0 days 00:00:07.907082,relu,0.11874237019180675,64,0.0883949484746259,True,,none,1.2625679023646381e-05,COMPLETE
566,157.38075256347656,2026-01-02 18:04:16.927302,2026-01-02 18:04:24.962855,0 days 00:00:08.035553,relu,0.10000379771054799,64,0.08660071597868554,True,,none,1.2352613421053339e-05,COMPLETE
567,156.59190368652344,2026-01-02 18:04:24.971358,2026-01-02 18:04:32.926985,0 days 00:00:07.955627,relu,0.10581063302190656,63,0.09944801880489584,True,,none,1.0448631061228037e-05,COMPLETE
568,197.48948655870225,2026-01-02 18:04:32.935984,2026-01-02 18:04:41.264342,0 days 00:00:08.328358,relu,0.10064622488287507,63,0.000994895089662904,False,,none,1.0718567763574151e-05,COMPLETE
