number,value,datetime_start,datetime_complete,duration,params_activation,params_dropout,params_hidden_size,params_lr,params_scale_target,params_scaler,params_scaler_post_pca,params_weight_decay,state
0,371.5840592447916,2026-01-02 16:49:08.338720,2026-01-02 16:49:17.619075,0 days 00:00:09.280355,gelu,0.3697360720354653,6,5.023058441790649e-05,False,,minmax,3.9079267041533746e-06,COMPLETE
1,364.80379191080726,2026-01-02 16:49:17.629080,2026-01-02 16:49:24.904015,0 days 00:00:07.274935,mish,0.43389370634731217,4,0.00012068563598371108,False,,none,6.7796367108236165e-06,COMPLETE
2,200.62022399902344,2026-01-02 16:49:24.915015,2026-01-02 16:49:33.925271,0 days 00:00:09.010256,gelu,0.48382164662506455,64,0.00039374517640674585,True,,none,0.00022133102511358456,COMPLETE
3,340.82896226671005,2026-01-02 16:49:33.936793,2026-01-02 16:49:42.759710,0 days 00:00:08.822917,relu,0.1584671177597492,46,0.00014180233566538083,False,,none,1.6578323308797475e-06,COMPLETE
4,200.4600372314453,2026-01-02 16:49:42.768223,2026-01-02 16:49:50.994316,0 days 00:00:08.226093,silu,0.1878352719062491,22,0.0065983274289766036,True,,minmax,1.2343781962411445e-05,COMPLETE
5,371.968088921441,2026-01-02 16:49:51.002824,2026-01-02 16:49:58.707675,0 days 00:00:07.704851,silu,0.44200512317775487,9,6.171216903455718e-05,False,,minmax,0.00040282216747904983,COMPLETE
6,319.9034402126736,2026-01-02 16:49:58.717192,2026-01-02 16:50:06.315046,0 days 00:00:07.597854,relu,0.2707563171434917,12,0.0002765008841022193,False,,none,0.0002423026524970828,COMPLETE
7,220.4684295654297,2026-01-02 16:50:06.324557,2026-01-02 16:50:14.165795,0 days 00:00:07.841238,silu,0.25378890148628447,6,0.0012381249647209036,True,,none,1.5730756346669236e-06,COMPLETE
8,186.785888671875,2026-01-02 16:50:14.174308,2026-01-02 16:50:22.567138,0 days 00:00:08.392830,relu,0.3882042727611523,53,0.0157878824358996,True,,minmax,1.455738845544354e-06,COMPLETE
9,224.9434814453125,2026-01-02 16:50:22.575651,2026-01-02 16:50:30.664687,0 days 00:00:08.089036,mish,0.4748189231194462,17,0.0034097432614697432,True,,minmax,0.0007500681774520004,COMPLETE
10,185.2971954345703,2026-01-02 16:50:30.672195,2026-01-02 16:50:38.790044,0 days 00:00:08.117849,relu,0.3519102805057441,32,0.042029035860323825,True,,minmax,3.559703296243511e-05,COMPLETE
11,185.56378173828125,2026-01-02 16:50:38.798560,2026-01-02 16:50:46.872341,0 days 00:00:08.073781,relu,0.35571735614264455,30,0.05387515993887737,True,,minmax,5.422933524566049e-05,COMPLETE
12,184.7034454345703,2026-01-02 16:50:46.880856,2026-01-02 16:50:54.919545,0 days 00:00:08.038689,relu,0.3438266269213853,30,0.09291656394917447,True,,minmax,5.391047894879359e-05,COMPLETE
13,181.2157745361328,2026-01-02 16:50:54.928063,2026-01-02 16:51:03.039792,0 days 00:00:08.111729,relu,0.3143477248988766,36,0.09168261297642945,True,,minmax,5.1386200297628566e-05,COMPLETE
14,182.71054077148438,2026-01-02 16:51:03.047306,2026-01-02 16:51:11.144029,0 days 00:00:08.096723,relu,0.29785817470529513,34,0.09449694622324618,True,,minmax,8.961163681502314e-05,COMPLETE
15,185.16323852539062,2026-01-02 16:51:11.151542,2026-01-02 16:51:19.567275,0 days 00:00:08.415733,relu,0.2265834214585022,40,0.017613023432737667,True,,minmax,9.755396716174536e-05,COMPLETE
16,201.11500549316406,2026-01-02 16:51:19.574789,2026-01-02 16:51:27.464048,0 days 00:00:07.889259,relu,0.29602138279541196,18,0.021151131019920024,True,,minmax,1.5632697232721945e-05,COMPLETE
17,179.85646057128906,2026-01-02 16:51:27.473079,2026-01-02 16:51:36.054153,0 days 00:00:08.581074,gelu,0.1244549953773692,21,0.08551750533964471,True,,minmax,0.00013391249491292526,COMPLETE
18,198.4876251220703,2026-01-02 16:51:36.062668,2026-01-02 16:51:44.650242,0 days 00:00:08.587574,gelu,0.144153655442862,23,0.007169959069456227,True,,minmax,0.0001450940074083553,COMPLETE
19,189.42576599121094,2026-01-02 16:51:44.659250,2026-01-02 16:51:53.160295,0 days 00:00:08.501045,gelu,0.21868306645568714,13,0.03263871781397411,True,,minmax,2.0329266856926372e-05,COMPLETE
20,285.31842041015625,2026-01-02 16:51:53.167811,2026-01-02 16:52:01.911113,0 days 00:00:08.743302,gelu,0.12566631797043876,24,0.0014188629375199234,True,,minmax,0.00047401558560286724,COMPLETE
21,181.56394958496094,2026-01-02 16:52:01.918114,2026-01-02 16:52:10.403168,0 days 00:00:08.485054,mish,0.2937665601423648,42,0.057990255970032226,True,,minmax,9.994696330196147e-05,COMPLETE
22,183.3787841796875,2026-01-02 16:52:10.410674,2026-01-02 16:52:19.091264,0 days 00:00:08.680590,mish,0.3228571643500301,41,0.05623391093522043,True,,minmax,3.720603256772589e-05,COMPLETE
23,179.58297729492188,2026-01-02 16:52:19.099772,2026-01-02 16:52:27.835105,0 days 00:00:08.735333,mish,0.1852199444243027,59,0.09010544475094272,True,,minmax,0.00010075052735158259,COMPLETE
24,184.34646606445312,2026-01-02 16:52:27.842614,2026-01-02 16:52:36.585024,0 days 00:00:08.742410,mish,0.10522067017900671,60,0.026135964763061834,True,,minmax,0.00019620678542760141,COMPLETE
25,194.78067016601562,2026-01-02 16:52:36.592538,2026-01-02 16:52:45.337312,0 days 00:00:08.744774,mish,0.18027293785959406,53,0.010500629734265623,True,,minmax,6.48239041031503e-05,COMPLETE
26,369.97139526367187,2026-01-02 16:52:45.346827,2026-01-02 16:52:53.738027,0 days 00:00:08.391200,gelu,0.21420885598117376,26,1.442859579509928e-05,False,,none,2.4290263598288802e-05,COMPLETE
27,180.1571502685547,2026-01-02 16:52:53.746543,2026-01-02 16:53:02.299727,0 days 00:00:08.553184,mish,0.10107335366026912,37,0.07935630107115403,True,,minmax,0.00037398170434405737,COMPLETE
28,187.7776641845703,2026-01-02 16:53:02.308741,2026-01-02 16:53:10.371946,0 days 00:00:08.063205,mish,0.10422884416909507,19,0.034059872264308455,True,,minmax,0.000802207536320695,COMPLETE
29,315.063984375,2026-01-02 16:53:10.380454,2026-01-02 16:53:18.240499,0 days 00:00:07.860045,mish,0.1450446426764594,9,0.0007820627240099758,False,,minmax,0.0003274393925845208,COMPLETE
30,199.30960083007812,2026-01-02 16:53:18.248505,2026-01-02 16:53:27.028368,0 days 00:00:08.779863,gelu,0.17678744708761573,49,0.0038173093342676236,True,,minmax,0.0001470128447174334,COMPLETE
31,179.8108367919922,2026-01-02 16:53:27.036883,2026-01-02 16:53:35.441321,0 days 00:00:08.404438,mish,0.13189787648222928,35,0.0930765755432128,True,,minmax,0.00014568947191631091,COMPLETE
32,180.03652954101562,2026-01-02 16:53:35.449316,2026-01-02 16:53:44.010820,0 days 00:00:08.561504,mish,0.12400404101690045,37,0.0663679031688224,True,,minmax,0.0006074476678470333,COMPLETE
33,180.2880859375,2026-01-02 16:53:44.020338,2026-01-02 16:53:52.865455,0 days 00:00:08.845117,mish,0.13243949984843895,64,0.0513076764510525,True,,minmax,0.00014435451662731506,COMPLETE
34,199.34498291015626,2026-01-02 16:53:52.872971,2026-01-02 16:54:01.025958,0 days 00:00:08.152987,mish,0.16490948273165557,27,0.0008678877259822047,False,,none,0.0006131533215746357,COMPLETE
35,194.44241333007812,2026-01-02 16:54:01.033478,2026-01-02 16:54:08.707907,0 days 00:00:07.674429,mish,0.19632853658693297,4,0.06513173320055743,True,,minmax,6.625208330064274e-06,COMPLETE
36,170.92184448242188,2026-01-02 16:54:08.716926,2026-01-02 16:54:17.552251,0 days 00:00:08.835325,gelu,0.1195920134723173,47,0.03307869662881943,True,,none,0.00027348026872677205,COMPLETE
37,197.77821824815538,2026-01-02 16:54:17.560766,2026-01-02 16:54:26.108480,0 days 00:00:08.547714,gelu,0.15721907293331613,48,0.0008642012938901611,False,,none,0.00022225862737097735,COMPLETE
38,181.67105102539062,2026-01-02 16:54:26.116996,2026-01-02 16:54:34.649638,0 days 00:00:08.532642,gelu,0.20186877219262178,15,0.03648305707991837,True,,none,0.0002844419539889353,COMPLETE
39,181.67637634277344,2026-01-02 16:54:34.658147,2026-01-02 16:54:42.963773,0 days 00:00:08.305626,silu,0.23572703986741217,56,0.01000885202532574,True,,none,0.00017320778502047805,COMPLETE
40,369.7838155110677,2026-01-02 16:54:42.972789,2026-01-02 16:54:51.320162,0 days 00:00:08.347373,gelu,0.16212883990081683,21,2.5362111890147747e-05,False,,none,0.00010298726596451527,COMPLETE
41,165.7746124267578,2026-01-02 16:54:51.328673,2026-01-02 16:54:59.952209,0 days 00:00:08.623536,mish,0.1363687066429379,47,0.07209810335077721,True,,none,0.0005506765213057212,COMPLETE
42,175.7270965576172,2026-01-02 16:54:59.961718,2026-01-02 16:55:08.605648,0 days 00:00:08.643930,gelu,0.1219061561297052,43,0.025103897736617215,True,,none,0.00046055723070254344,COMPLETE
43,180.11672973632812,2026-01-02 16:55:08.612670,2026-01-02 16:55:16.864806,0 days 00:00:08.252136,silu,0.12165319022496611,45,0.013896986602371068,True,,none,0.0004846174995096833,COMPLETE
44,174.11923217773438,2026-01-02 16:55:16.872318,2026-01-02 16:55:25.633702,0 days 00:00:08.761384,mish,0.14576927477288232,53,0.02688268813700453,True,,none,0.0009266768427460225,COMPLETE
45,174.83230590820312,2026-01-02 16:55:25.641727,2026-01-02 16:55:34.522832,0 days 00:00:08.881105,gelu,0.1521403901059657,53,0.02249931981733364,True,,none,0.0009222888274411232,COMPLETE
46,180.65489196777344,2026-01-02 16:55:34.531346,2026-01-02 16:55:43.267745,0 days 00:00:08.736399,gelu,0.40263183686295234,45,0.0246903456624532,True,,none,0.0009417002302845219,COMPLETE
47,178.44088745117188,2026-01-02 16:55:43.276264,2026-01-02 16:55:52.138048,0 days 00:00:08.861784,gelu,0.14898274826392666,51,0.013638546098248707,True,,none,0.0006185906095534657,COMPLETE
48,180.31129455566406,2026-01-02 16:55:52.146055,2026-01-02 16:56:00.809759,0 days 00:00:08.663704,gelu,0.2466176729715277,29,0.019908012755599554,True,,none,0.0009241750486293337,COMPLETE
49,181.21926879882812,2026-01-02 16:56:00.816757,2026-01-02 16:56:09.647959,0 days 00:00:08.831202,gelu,0.17033944759946484,57,0.004720142125341721,True,,none,0.0004498916370504088,COMPLETE
50,185.28407287597656,2026-01-02 16:56:09.655971,2026-01-02 16:56:17.947578,0 days 00:00:08.291607,silu,0.11240466293780862,41,0.0021780777413928473,True,,none,0.0002792107711437761,COMPLETE
51,178.70510864257812,2026-01-02 16:56:17.955090,2026-01-02 16:56:26.926529,0 days 00:00:08.971439,gelu,0.14909297236061275,51,0.010733537269500222,True,,none,0.000602711700525835,COMPLETE
52,173.87232971191406,2026-01-02 16:56:26.936562,2026-01-02 16:56:35.712439,0 days 00:00:08.775877,gelu,0.1430543278394556,64,0.027782747675219238,True,,none,0.0006676897231317533,COMPLETE
53,168.68380737304688,2026-01-02 16:56:35.720954,2026-01-02 16:56:44.553392,0 days 00:00:08.832438,gelu,0.13781974597105023,56,0.044024448384109204,True,,none,0.0009866664376580792,COMPLETE
54,168.11898803710938,2026-01-02 16:56:44.560902,2026-01-02 16:56:53.386312,0 days 00:00:08.825410,gelu,0.20152306229441008,64,0.04130419455538716,True,,none,0.0007780950716581659,COMPLETE
55,169.26690673828125,2026-01-02 16:56:53.393830,2026-01-02 16:57:02.379460,0 days 00:00:08.985630,gelu,0.1975857575317183,63,0.04779824825070446,True,,none,0.0007335028192596978,COMPLETE
56,167.19384765625,2026-01-02 16:57:02.388484,2026-01-02 16:57:11.117749,0 days 00:00:08.729265,gelu,0.27205562884098616,64,0.047310424027984674,True,,none,2.436803020083026e-06,COMPLETE
57,169.91949462890625,2026-01-02 16:57:11.125759,2026-01-02 16:57:20.134055,0 days 00:00:09.008296,gelu,0.2732355995837208,64,0.04252538502738239,True,,none,2.5754561498983663e-06,COMPLETE
58,170.79122924804688,2026-01-02 16:57:20.142569,2026-01-02 16:57:29.045742,0 days 00:00:08.903173,gelu,0.2728603845798955,59,0.044471416347686324,True,,none,1.0543495749854155e-06,COMPLETE
59,334.75476738823784,2026-01-02 16:57:29.054262,2026-01-02 16:57:37.672193,0 days 00:00:08.617931,gelu,0.26333262942261676,61,0.0001458743585735139,False,,none,3.429809558739157e-06,COMPLETE
60,167.7267608642578,2026-01-02 16:57:37.679711,2026-01-02 16:57:46.498909,0 days 00:00:08.819198,gelu,0.2741710731935026,64,0.04826128426680536,True,,none,4.208926491701099e-06,COMPLETE
61,173.4896240234375,2026-01-02 16:57:46.508418,2026-01-02 16:57:55.838750,0 days 00:00:09.330332,gelu,0.3240448587068001,64,0.04334471153004619,True,,none,3.133950874405066e-06,COMPLETE
62,166.06198120117188,2026-01-02 16:57:55.846750,2026-01-02 16:58:04.364696,0 days 00:00:08.517946,gelu,0.2735191540115037,55,0.07104716257481096,True,,none,2.4435343678687846e-06,COMPLETE
63,163.5525665283203,2026-01-02 16:58:04.372205,2026-01-02 16:58:12.811912,0 days 00:00:08.439707,gelu,0.24258773905021652,57,0.07241167085820874,True,,none,5.302410273977211e-06,COMPLETE
64,164.02508544921875,2026-01-02 16:58:12.821911,2026-01-02 16:58:21.415766,0 days 00:00:08.593855,gelu,0.28599662313600577,56,0.07239102068862913,True,,none,5.5868909137289525e-06,COMPLETE
65,183.29513549804688,2026-01-02 16:58:21.423764,2026-01-02 16:58:29.447547,0 days 00:00:08.023783,gelu,0.25581080921898075,10,0.06682377525883403,True,,none,5.864216726129005e-06,COMPLETE
66,171.90872192382812,2026-01-02 16:58:29.455547,2026-01-02 16:58:37.730774,0 days 00:00:08.275227,gelu,0.2836325796783912,38,0.06348550237927086,True,,none,1.0473263901445951e-05,COMPLETE
67,167.05445861816406,2026-01-02 16:58:37.739775,2026-01-02 16:58:45.503909,0 days 00:00:07.764134,relu,0.305063757722402,48,0.07238605900642908,True,,none,2.26615570164613e-06,COMPLETE
68,166.35940551757812,2026-01-02 16:58:45.511908,2026-01-02 16:58:53.282568,0 days 00:00:07.770660,relu,0.3076238616775102,48,0.07710194123187958,True,,none,2.218558252915193e-06,COMPLETE
69,172.47802734375,2026-01-02 16:58:53.291568,2026-01-02 16:59:01.042164,0 days 00:00:07.750596,relu,0.31414641525244275,33,0.07903110253861767,True,,none,2.1530915404110532e-06,COMPLETE
70,167.85910034179688,2026-01-02 16:59:01.051164,2026-01-02 16:59:08.783773,0 days 00:00:07.732609,relu,0.3487038593136594,47,0.07856645090657616,True,,none,1.8358554385782143e-06,COMPLETE
71,164.57962036132812,2026-01-02 16:59:08.791773,2026-01-02 16:59:16.625889,0 days 00:00:07.834116,relu,0.3334892926962625,54,0.09732432212060008,True,,none,5.219057465473111e-06,COMPLETE
72,170.07003784179688,2026-01-02 16:59:16.632888,2026-01-02 16:59:24.549044,0 days 00:00:07.916156,relu,0.3730670898863439,41,0.09512045221541111,True,,none,4.922259189690372e-06,COMPLETE
73,166.07073974609375,2026-01-02 16:59:24.557044,2026-01-02 16:59:32.433205,0 days 00:00:07.876161,relu,0.3117347015051468,55,0.07380516503344793,True,,none,1.1995117437682932e-06,COMPLETE
74,169.06927490234375,2026-01-02 16:59:32.441207,2026-01-02 16:59:40.356804,0 days 00:00:07.915597,relu,0.33447621825747725,49,0.06955726137592787,True,,none,1.0160577457913976e-05,COMPLETE
75,166.5458984375,2026-01-02 16:59:40.365805,2026-01-02 16:59:48.223904,0 days 00:00:07.858099,relu,0.3084958098759562,55,0.054760700490118955,True,,none,1.3267882598874034e-06,COMPLETE
76,198.71515279134115,2026-01-02 16:59:48.231905,2026-01-02 16:59:55.899507,0 days 00:00:07.667602,relu,0.33417655172571886,54,0.0009632114855495813,False,,none,8.523448512195809e-06,COMPLETE
77,168.616455078125,2026-01-02 16:59:55.908506,2026-01-02 17:00:03.659113,0 days 00:00:07.750607,relu,0.35987841465321413,43,0.09983636530895584,True,,none,1.272719150504721e-06,COMPLETE
78,171.00778198242188,2026-01-02 17:00:03.667113,2026-01-02 17:00:11.329709,0 days 00:00:07.662596,relu,0.2854522481436044,38,0.056493509784749124,True,,none,1.4438859848178855e-06,COMPLETE
79,168.72991943359375,2026-01-02 17:00:11.336709,2026-01-02 17:00:19.162301,0 days 00:00:07.825592,relu,0.3062106375668046,57,0.05758548043319197,True,,none,1.8074150484774458e-06,COMPLETE
80,164.57920837402344,2026-01-02 17:00:19.169301,2026-01-02 17:00:26.967426,0 days 00:00:07.798125,relu,0.2430705599944729,45,0.0792409843466839,True,,none,1.0640765090561322e-06,COMPLETE
81,162.10903930664062,2026-01-02 17:00:26.975424,2026-01-02 17:00:34.772069,0 days 00:00:07.796645,relu,0.23879549446549825,52,0.08300134296914932,True,,none,3.073987329867274e-06,COMPLETE
82,162.52362060546875,2026-01-02 17:00:34.781078,2026-01-02 17:00:42.677664,0 days 00:00:07.896586,relu,0.2215613950344923,44,0.08113563219553985,True,,none,1.0093388486555945e-06,COMPLETE
83,165.13038635253906,2026-01-02 17:00:42.686666,2026-01-02 17:00:50.367793,0 days 00:00:07.681127,relu,0.23604911380259674,44,0.08276877308756761,True,,none,1.0507982482703244e-06,COMPLETE
84,176.22276306152344,2026-01-02 17:00:50.375793,2026-01-02 17:00:57.931346,0 days 00:00:07.555553,relu,0.24034160991263967,32,0.034597848947325496,True,,none,3.0951638371675647e-06,COMPLETE
85,162.67193603515625,2026-01-02 17:00:57.939347,2026-01-02 17:01:05.771423,0 days 00:00:07.832076,relu,0.22732169684323678,44,0.08689789959843969,True,,none,1.5920890140054392e-05,COMPLETE
86,162.78060913085938,2026-01-02 17:01:05.779423,2026-01-02 17:01:13.493566,0 days 00:00:07.714143,relu,0.22270053313835425,44,0.09656633306615284,True,,none,1.6995816212943322e-05,COMPLETE
87,198.2779610188802,2026-01-02 17:01:13.502075,2026-01-02 17:01:21.262207,0 days 00:00:07.760132,relu,0.21700456642643828,45,0.0009604261604837612,False,,none,1.5023833996442317e-05,COMPLETE
88,201.5629119873047,2026-01-02 17:01:21.270210,2026-01-02 17:01:28.670228,0 days 00:00:07.400018,relu,0.22956549646468388,6,0.08632739299718718,True,,none,2.7397498329848078e-05,COMPLETE
89,161.69053649902344,2026-01-02 17:01:28.678227,2026-01-02 17:01:36.777043,0 days 00:00:08.098816,relu,0.22394983703659038,39,0.0995518389951745,True,,none,1.8250644605922384e-05,COMPLETE
90,163.18502807617188,2026-01-02 17:01:36.785039,2026-01-02 17:01:44.593155,0 days 00:00:07.808116,relu,0.21050408499435283,38,0.09945486437454283,True,,none,7.850203559319599e-06,COMPLETE
91,163.77947998046875,2026-01-02 17:01:44.601155,2026-01-02 17:01:52.339857,0 days 00:00:07.738702,relu,0.20988838631455872,35,0.09620439848818066,True,,none,1.6666765366692362e-05,COMPLETE
92,165.54312133789062,2026-01-02 17:01:52.349857,2026-01-02 17:02:00.084939,0 days 00:00:07.735082,relu,0.22601223542368817,35,0.06106868557162314,True,,none,1.6682257191312708e-05,COMPLETE
93,162.9537353515625,2026-01-02 17:02:00.092944,2026-01-02 17:02:07.896086,0 days 00:00:07.803142,relu,0.20599810774251412,40,0.08641013781994847,True,,none,7.477757784614413e-06,COMPLETE
94,166.86843872070312,2026-01-02 17:02:07.904088,2026-01-02 17:02:15.583634,0 days 00:00:07.679546,relu,0.20988300645201202,29,0.09929653798860297,True,,none,7.506105111438293e-06,COMPLETE
95,166.52658081054688,2026-01-02 17:02:15.590635,2026-01-02 17:02:23.275818,0 days 00:00:07.685183,relu,0.18623253107842502,31,0.0544078170148761,True,,none,1.9788018681992162e-05,COMPLETE
96,166.76632690429688,2026-01-02 17:02:23.282815,2026-01-02 17:02:31.073288,0 days 00:00:07.790473,relu,0.253427827439437,38,0.06312797615963674,True,,none,1.3757787622592356e-05,COMPLETE
97,171.42965698242188,2026-01-02 17:02:31.080288,2026-01-02 17:02:38.814903,0 days 00:00:07.734615,relu,0.20894415554778978,40,0.03818698314941838,True,,none,3.4126042348103504e-05,COMPLETE
98,169.74197387695312,2026-01-02 17:02:38.823903,2026-01-02 17:02:46.521550,0 days 00:00:07.697647,silu,0.2217935547132187,26,0.09929305493437364,True,,none,1.1124802828062458e-05,COMPLETE
99,164.4666290283203,2026-01-02 17:02:46.528549,2026-01-02 17:02:54.323178,0 days 00:00:07.794629,relu,0.19095734447699914,35,0.08277652737807835,True,,none,8.441574311764975e-06,COMPLETE
100,170.8038330078125,2026-01-02 17:02:54.331178,2026-01-02 17:03:02.242795,0 days 00:00:07.911617,relu,0.20865074744910458,51,0.030735162684699145,True,,none,1.7840040785434842e-05,COMPLETE
101,161.886962890625,2026-01-02 17:03:02.251794,2026-01-02 17:03:10.132911,0 days 00:00:07.881117,relu,0.19393343217317532,39,0.08638664104289816,True,,none,8.391474721562407e-06,COMPLETE
102,195.3600616455078,2026-01-02 17:03:10.140911,2026-01-02 17:03:17.828438,0 days 00:00:07.687527,relu,0.22883012611944623,39,0.00038424467111190477,True,,none,4.270053155829102e-05,COMPLETE
103,163.99827575683594,2026-01-02 17:03:17.836437,2026-01-02 17:03:25.745065,0 days 00:00:07.908628,relu,0.24998677640172848,42,0.08673929461076448,True,,none,1.2342990188016018e-05,COMPLETE
104,162.1922607421875,2026-01-02 17:03:25.753065,2026-01-02 17:03:33.474629,0 days 00:00:07.721564,relu,0.17852019935926597,36,0.08741984701748591,True,,none,2.4913300452121946e-05,COMPLETE
105,165.89942932128906,2026-01-02 17:03:33.482628,2026-01-02 17:03:41.229292,0 days 00:00:07.746664,relu,0.1784593710835835,33,0.060540399439317605,True,,none,2.5006939204255632e-05,COMPLETE
106,197.90939954969616,2026-01-02 17:03:41.237292,2026-01-02 17:03:48.763465,0 days 00:00:07.526173,relu,0.17139990144408074,35,0.0009786230194520512,False,,none,4.1388695871137305e-06,COMPLETE
107,166.39987182617188,2026-01-02 17:03:48.770466,2026-01-02 17:03:56.565063,0 days 00:00:07.794597,relu,0.19571317155856632,37,0.05018533739815474,True,,none,6.946073896602192e-06,COMPLETE
108,166.96360778808594,2026-01-02 17:03:56.572063,2026-01-02 17:04:04.340701,0 days 00:00:07.768638,relu,0.2184562674885855,28,0.08868543163852481,True,,none,2.219120031983186e-05,COMPLETE
109,169.98211669921875,2026-01-02 17:04:04.348701,2026-01-02 17:04:11.965320,0 days 00:00:07.616619,relu,0.20443331035207382,25,0.0645207625125364,True,,none,2.856727598802302e-05,COMPLETE
110,188.9800567626953,2026-01-02 17:04:11.974319,2026-01-02 17:04:19.809452,0 days 00:00:07.835133,relu,0.2613437827426913,40,0.002523883014532818,True,,none,9.440909126545241e-06,COMPLETE
111,164.64181518554688,2026-01-02 17:04:19.817456,2026-01-02 17:04:27.716637,0 days 00:00:07.899181,relu,0.23245992277729507,43,0.08426305676446406,True,,none,1.2330161016548328e-05,COMPLETE
112,164.74624633789062,2026-01-02 17:04:27.726141,2026-01-02 17:04:35.462705,0 days 00:00:07.736564,relu,0.24487518712578235,42,0.07159099656053204,True,,none,1.2953657869423904e-05,COMPLETE
