number,value,datetime_start,datetime_complete,duration,params_activation,params_dropout,params_hidden_size,params_lr,params_scale_target,params_scaler,params_scaler_post_pca,params_weight_decay,state
569,197.3370819091797,2026-01-02 18:04:41.277855,2026-01-02 18:04:49.860098,0 days 00:00:08.582243,mish,0.10038606921017136,64,0.00012935949088021384,True,,none,1.0325829506182608e-05,COMPLETE
570,169.31068420410156,2026-01-02 18:04:49.867098,2026-01-02 18:04:57.805770,0 days 00:00:07.938672,relu,0.100052047495403,62,0.019623413544764982,True,,none,1.2397675751558871e-05,COMPLETE
571,157.6465606689453,2026-01-02 18:04:57.813769,2026-01-02 18:05:05.825451,0 days 00:00:08.011682,relu,0.10792501375517949,62,0.08891543304183393,True,,none,9.930728349327776e-06,COMPLETE
572,162.4328155517578,2026-01-02 18:05:05.833451,2026-01-02 18:05:13.803157,0 days 00:00:07.969706,relu,0.10826917705332657,59,0.0350927105333578,True,,none,1.1903437644596223e-05,COMPLETE
573,157.30328369140625,2026-01-02 18:05:13.811157,2026-01-02 18:05:21.820283,0 days 00:00:08.009126,relu,0.10741120063184764,63,0.0995368931226059,True,,none,1.028097910833906e-05,COMPLETE
574,157.4833984375,2026-01-02 18:05:21.829284,2026-01-02 18:05:29.804911,0 days 00:00:07.975627,relu,0.11315223474478715,64,0.09821247852971982,True,,none,9.761357302223522e-06,COMPLETE
575,158.96434020996094,2026-01-02 18:05:29.813913,2026-01-02 18:05:37.692026,0 days 00:00:07.878113,relu,0.11468633826081634,64,0.0886817124648138,True,,none,1.1546965070239581e-05,COMPLETE
576,165.770751953125,2026-01-02 18:05:37.701021,2026-01-02 18:05:45.731674,0 days 00:00:08.030653,silu,0.10763384514042802,60,0.09952873571209535,True,,none,9.565055282747537e-06,COMPLETE
577,157.49313354492188,2026-01-02 18:05:45.739673,2026-01-02 18:05:53.739258,0 days 00:00:07.999585,relu,0.11798001011921108,59,0.07261443293622169,True,,none,1.3592426905644408e-05,COMPLETE
578,180.58924865722656,2026-01-02 18:05:53.746260,2026-01-02 18:06:01.720911,0 days 00:00:07.974651,relu,0.10754964840073686,64,0.013424899219599088,True,,minmax,9.921452314011216e-06,COMPLETE
579,160.0203399658203,2026-01-02 18:06:01.729913,2026-01-02 18:06:09.754998,0 days 00:00:08.025085,relu,0.1164926176993284,58,0.08044788751564307,True,,none,1.5074044384068722e-05,COMPLETE
580,156.2778778076172,2026-01-02 18:06:09.762996,2026-01-02 18:06:17.712641,0 days 00:00:07.949645,relu,0.11002186912997376,60,0.0889266919818094,True,,none,1.087835805955681e-05,COMPLETE
581,160.0628204345703,2026-01-02 18:06:17.719642,2026-01-02 18:06:25.676820,0 days 00:00:07.957178,relu,0.12376799424391967,61,0.06824903731579789,True,,none,1.0753352072009384e-05,COMPLETE
582,158.08143615722656,2026-01-02 18:06:25.684819,2026-01-02 18:06:33.732507,0 days 00:00:08.047688,relu,0.11109383528489553,58,0.07848757467677628,True,,none,9.712490438301127e-06,COMPLETE
583,157.9624481201172,2026-01-02 18:06:33.747510,2026-01-02 18:06:41.715139,0 days 00:00:07.967629,relu,0.1000639959363442,64,0.09977711729178351,True,,none,8.501569728857067e-06,COMPLETE
584,157.5155029296875,2026-01-02 18:06:41.723137,2026-01-02 18:06:49.798832,0 days 00:00:08.075695,relu,0.11688128712093707,60,0.09994291675848263,True,,none,1.1501354431286589e-05,COMPLETE
585,159.87387084960938,2026-01-02 18:06:49.807831,2026-01-02 18:06:57.980026,0 days 00:00:08.172195,relu,0.1297165329507901,59,0.06426720841341454,True,,none,1.26083427296137e-05,COMPLETE
586,157.15924072265625,2026-01-02 18:06:57.989022,2026-01-02 18:07:05.922619,0 days 00:00:07.933597,relu,0.10758987017818371,64,0.07994251153261298,True,,none,1.3141005153967387e-05,COMPLETE
587,161.3395233154297,2026-01-02 18:07:05.931621,2026-01-02 18:07:14.451809,0 days 00:00:08.520188,gelu,0.1226845729216564,57,0.08641927658011171,True,,none,1.3978922976806165e-05,COMPLETE
588,197.33698818630643,2026-01-02 18:07:14.460809,2026-01-02 18:07:22.221948,0 days 00:00:07.761139,relu,0.11533481425845145,61,0.0009929404567870195,False,,none,1.359469182323994e-05,COMPLETE
589,161.18972778320312,2026-01-02 18:07:22.230948,2026-01-02 18:07:30.337262,0 days 00:00:08.106314,relu,0.1322275027609211,57,0.06060834610026793,True,,none,1.532549867657099e-05,COMPLETE
590,158.76779174804688,2026-01-02 18:07:30.345261,2026-01-02 18:07:38.266813,0 days 00:00:07.921552,relu,0.1116577608504792,64,0.07276617396016402,True,,none,1.1967703983726212e-05,COMPLETE
591,157.85568237304688,2026-01-02 18:07:38.275812,2026-01-02 18:07:46.190925,0 days 00:00:07.915113,relu,0.12219796476460053,64,0.0875327106741065,True,,none,1.6925074443211728e-05,COMPLETE
592,158.40548706054688,2026-01-02 18:07:46.198929,2026-01-02 18:07:54.112558,0 days 00:00:07.913629,relu,0.1094017820363619,56,0.07342188985696609,True,,none,9.499970344646326e-06,COMPLETE
593,156.4338836669922,2026-01-02 18:07:54.120557,2026-01-02 18:08:02.120626,0 days 00:00:08.000069,relu,0.10741254524169515,60,0.08737964035301465,True,,none,1.3610151682950553e-05,COMPLETE
594,160.4447784423828,2026-01-02 18:08:02.127626,2026-01-02 18:08:10.223326,0 days 00:00:08.095700,relu,0.12111941320321863,57,0.056940069252073795,True,,none,1.5229770844302488e-05,COMPLETE
595,182.10977172851562,2026-01-02 18:08:10.230328,2026-01-02 18:08:18.723059,0 days 00:00:08.492731,mish,0.1145084485771508,57,0.004131737378197482,True,,none,1.4034953522189549e-05,COMPLETE
596,159.28033447265625,2026-01-02 18:08:18.733062,2026-01-02 18:08:26.760218,0 days 00:00:08.027156,relu,0.12847835704848595,60,0.06617728140860452,True,,none,1.622691758413625e-05,COMPLETE
597,168.4113006591797,2026-01-02 18:08:26.770218,2026-01-02 18:08:34.660831,0 days 00:00:07.890613,relu,0.10783389491902673,56,0.0799400423946602,True,,minmax,1.2964597257521055e-05,COMPLETE
598,160.05349731445312,2026-01-02 18:08:34.668831,2026-01-02 18:08:42.686567,0 days 00:00:08.017736,relu,0.14022677416291718,60,0.07202348688467833,True,,none,1.3017166154769201e-05,COMPLETE
599,163.60887145996094,2026-01-02 18:08:42.694577,2026-01-02 18:08:50.736268,0 days 00:00:08.041691,relu,0.11770470030674453,57,0.04127823080885963,True,,none,1.6981220566420402e-05,COMPLETE
600,158.04098510742188,2026-01-02 18:08:50.744270,2026-01-02 18:08:58.670375,0 days 00:00:07.926105,relu,0.10007207171376034,60,0.08780917043669187,True,,none,1.4768454882924998e-05,COMPLETE
601,199.65182495117188,2026-01-02 18:08:58.677375,2026-01-02 18:09:06.758548,0 days 00:00:08.081173,silu,0.10774511646510558,64,0.00010119427400284135,True,,none,1.7122965368663843e-05,COMPLETE
602,159.36288452148438,2026-01-02 18:09:06.766548,2026-01-02 18:09:14.835778,0 days 00:00:08.069230,relu,0.12421426876973453,55,0.07998066942070758,True,,none,1.255493935732218e-05,COMPLETE
603,158.528076171875,2026-01-02 18:09:14.845780,2026-01-02 18:09:22.890932,0 days 00:00:08.045152,relu,0.11455851965353914,57,0.08770788932329356,True,,none,1.406397710628426e-05,COMPLETE
604,187.31967163085938,2026-01-02 18:09:22.899941,2026-01-02 18:09:30.485052,0 days 00:00:07.585111,relu,0.1070563150743749,5,0.0998525730231487,True,,none,1.8154519264881147e-05,COMPLETE
605,184.94178771972656,2026-01-02 18:09:30.494051,2026-01-02 18:09:38.493630,0 days 00:00:07.999579,relu,0.14952413019095084,60,0.0012722764655604846,True,,none,1.5639037305572924e-05,COMPLETE
606,184.09176635742188,2026-01-02 18:09:38.500629,2026-01-02 18:09:46.123732,0 days 00:00:07.623103,relu,0.13332258693619198,10,0.050155508139405815,True,,none,3.947918899787115e-06,COMPLETE
607,197.58599636501737,2026-01-02 18:09:46.132735,2026-01-02 18:09:53.838875,0 days 00:00:07.706140,relu,0.11632613158678995,64,0.0009935912922577907,False,,none,1.111864530411478e-05,COMPLETE
608,158.5303192138672,2026-01-02 18:09:53.846875,2026-01-02 18:10:01.908567,0 days 00:00:08.061692,relu,0.1064234204663832,55,0.06602415298065563,True,,none,1.2655964129965434e-05,COMPLETE
609,160.3794403076172,2026-01-02 18:10:01.916571,2026-01-02 18:10:09.908681,0 days 00:00:07.992110,relu,0.11875992131283591,60,0.07741358725885476,True,,none,1.6186762349055638e-06,COMPLETE
610,157.4733123779297,2026-01-02 18:10:09.916680,2026-01-02 18:10:17.918450,0 days 00:00:08.001770,relu,0.12558636624528383,57,0.08758295127873543,True,,none,1.1284311849158737e-05,COMPLETE
611,157.7106170654297,2026-01-02 18:10:17.925967,2026-01-02 18:10:25.925640,0 days 00:00:07.999673,relu,0.11176597839327813,55,0.07089512444627648,True,,none,1.737085677968726e-05,COMPLETE
612,161.1109619140625,2026-01-02 18:10:25.933641,2026-01-02 18:10:34.047341,0 days 00:00:08.113700,relu,0.10682025043057974,59,0.05632429300284368,True,,none,1.4497205164753793e-05,COMPLETE
613,155.65518188476562,2026-01-02 18:10:34.055341,2026-01-02 18:10:42.072960,0 days 00:00:08.017619,relu,0.12172645005506642,64,0.08845327728139026,True,,none,1.9899789172670626e-05,COMPLETE
614,162.0081024169922,2026-01-02 18:10:42.080960,2026-01-02 18:10:50.659667,0 days 00:00:08.578707,gelu,0.14318769820448926,64,0.08851898302682336,True,,none,2.020938932213464e-05,COMPLETE
615,182.01121520996094,2026-01-02 18:10:50.668667,2026-01-02 18:10:58.709872,0 days 00:00:08.041205,relu,0.13364424698237576,61,0.001909751253590255,True,,none,8.901106906968082e-06,COMPLETE
616,158.6304473876953,2026-01-02 18:10:58.717877,2026-01-02 18:11:06.664536,0 days 00:00:07.946659,relu,0.12517980432270473,60,0.07602262431512193,True,,none,1.2542700921803418e-05,COMPLETE
617,167.20855712890625,2026-01-02 18:11:06.672536,2026-01-02 18:11:14.660223,0 days 00:00:07.987687,relu,0.12585806452310905,64,0.08968673471585775,True,,minmax,1.6117001741274522e-05,COMPLETE
618,165.04837036132812,2026-01-02 18:11:14.668223,2026-01-02 18:11:23.107357,0 days 00:00:08.439134,mish,0.12018203869573359,61,0.064174914601434,True,,none,1.0319908846984066e-05,COMPLETE
619,159.8880157470703,2026-01-02 18:11:23.115357,2026-01-02 18:11:30.990474,0 days 00:00:07.875117,relu,0.13728832018885456,56,0.07890710028108601,True,,none,6.9424979586274545e-06,COMPLETE
620,157.2037353515625,2026-01-02 18:11:30.999475,2026-01-02 18:11:38.936614,0 days 00:00:07.937139,relu,0.11558849607583942,64,0.08800167850626543,True,,none,1.4125445415660428e-05,COMPLETE
621,159.61776733398438,2026-01-02 18:11:38.946616,2026-01-02 18:11:47.031755,0 days 00:00:08.085139,relu,0.13060652615201013,64,0.09995512456120574,True,,none,1.365916317251934e-05,COMPLETE
622,157.8127899169922,2026-01-02 18:11:47.041265,2026-01-02 18:11:55.042390,0 days 00:00:08.001125,relu,0.10022722401872824,64,0.07353644340809097,True,,none,1.1597406830337426e-05,COMPLETE
623,157.95094299316406,2026-01-02 18:11:55.051390,2026-01-02 18:12:02.972985,0 days 00:00:07.921595,relu,0.1188239655837567,61,0.08804049595564899,True,,none,1.4248876457567238e-05,COMPLETE
624,159.8148193359375,2026-01-02 18:12:02.980987,2026-01-02 18:12:11.005635,0 days 00:00:08.024648,relu,0.11435057690898862,61,0.06229993310301815,True,,none,1.1048059619600372e-05,COMPLETE
625,165.0498504638672,2026-01-02 18:12:11.013635,2026-01-02 18:12:19.031841,0 days 00:00:08.018206,silu,0.12736019722912773,64,0.09988658029204724,True,,none,1.2998010789393818e-05,COMPLETE
626,197.67200920952692,2026-01-02 18:12:19.039344,2026-01-02 18:12:26.985035,0 days 00:00:07.945691,relu,0.10001015178704677,59,0.000994241415502487,False,,none,5.540985551745714e-06,COMPLETE
627,158.38912963867188,2026-01-02 18:12:26.993036,2026-01-02 18:12:35.145204,0 days 00:00:08.152168,relu,0.1211790945046419,58,0.08026258486685577,True,,none,1.593612994756933e-05,COMPLETE
628,186.89891052246094,2026-01-02 18:12:35.153203,2026-01-02 18:12:43.104365,0 days 00:00:07.951162,relu,0.3856113205501725,64,0.008330165862462368,True,,none,9.053418678553872e-06,COMPLETE
629,158.65866088867188,2026-01-02 18:12:43.113365,2026-01-02 18:12:51.142579,0 days 00:00:08.029214,relu,0.112814358420085,60,0.07381874352382026,True,,none,1.2399196990569576e-05,COMPLETE
630,158.46560668945312,2026-01-02 18:12:51.152089,2026-01-02 18:12:59.148303,0 days 00:00:07.996214,relu,0.13253503908709466,58,0.08801222249092264,True,,none,1.549403818519057e-05,COMPLETE
631,156.89041137695312,2026-01-02 18:12:59.155303,2026-01-02 18:13:07.128844,0 days 00:00:07.973541,relu,0.10007547471271107,61,0.09957696472817415,True,,none,1.0340960314142193e-05,COMPLETE
632,161.15426635742188,2026-01-02 18:13:07.137849,2026-01-02 18:13:15.129988,0 days 00:00:07.992139,relu,0.10604231327789129,64,0.06960564421809819,True,,none,1.0254064157544302e-05,COMPLETE
633,157.58419799804688,2026-01-02 18:13:15.137992,2026-01-02 18:13:23.120614,0 days 00:00:07.982622,relu,0.10051479466081426,61,0.08016596719898186,True,,none,8.813953420423152e-06,COMPLETE
634,181.73841857910156,2026-01-02 18:13:23.129615,2026-01-02 18:13:31.183300,0 days 00:00:08.053685,relu,0.106992618561683,61,0.002969596116094543,True,,none,9.844649868909379e-06,COMPLETE
635,155.7786407470703,2026-01-02 18:13:31.191300,2026-01-02 18:13:39.234451,0 days 00:00:08.043151,relu,0.10757752548595093,57,0.09918334601312402,True,,none,7.687168470720458e-06,COMPLETE
636,162.5377655029297,2026-01-02 18:13:39.242455,2026-01-02 18:13:47.319087,0 days 00:00:08.076632,relu,0.2890222275601889,59,0.09981261492771663,True,,none,8.330997573860762e-06,COMPLETE
637,176.74087524414062,2026-01-02 18:13:47.326085,2026-01-02 18:13:55.846362,0 days 00:00:08.520277,gelu,0.11354609244374493,57,0.08652075799466818,True,,minmax,9.281972799582353e-06,COMPLETE
638,160.0392608642578,2026-01-02 18:13:55.854868,2026-01-02 18:14:03.952505,0 days 00:00:08.097637,relu,0.11114509157425195,64,0.05833302243472582,True,,none,7.465568142489287e-06,COMPLETE
639,158.68499755859375,2026-01-02 18:14:03.963014,2026-01-02 18:14:12.005151,0 days 00:00:08.042137,relu,0.10698923831703328,57,0.06982592273529344,True,,none,7.953993175986656e-06,COMPLETE
640,158.54063415527344,2026-01-02 18:14:12.014152,2026-01-02 18:14:20.043311,0 days 00:00:08.029159,relu,0.10025917677865515,61,0.08823364572484921,True,,none,4.821997162909512e-06,COMPLETE
641,156.2085723876953,2026-01-02 18:14:20.052313,2026-01-02 18:14:28.093018,0 days 00:00:08.040705,relu,0.11698591329784717,57,0.09942900726625316,True,,none,7.459153955939424e-06,COMPLETE
642,168.6303253173828,2026-01-02 18:14:28.102017,2026-01-02 18:14:36.150205,0 days 00:00:08.048188,relu,0.4103160469364343,55,0.09881581550579266,True,,none,6.735541410896345e-06,COMPLETE
643,165.03085327148438,2026-01-02 18:14:36.159206,2026-01-02 18:14:44.207838,0 days 00:00:08.048632,relu,0.31899931733016856,55,0.09977892361274468,True,,none,5.747858180976287e-06,COMPLETE
644,156.9494171142578,2026-01-02 18:14:44.215839,2026-01-02 18:14:52.240017,0 days 00:00:08.024178,relu,0.10000633788947584,57,0.07894921602000331,True,,none,7.02013665459235e-06,COMPLETE
645,159.0026092529297,2026-01-02 18:14:52.248021,2026-01-02 18:15:00.330245,0 days 00:00:08.082224,relu,0.1210306457283179,57,0.06361306354685403,True,,none,6.35526331986348e-06,COMPLETE
646,165.0364532470703,2026-01-02 18:15:00.339243,2026-01-02 18:15:08.813954,0 days 00:00:08.474711,mish,0.11243330678016007,57,0.07754952668940665,True,,none,6.710110781546865e-06,COMPLETE
647,197.57562676323784,2026-01-02 18:15:08.822955,2026-01-02 18:15:16.659044,0 days 00:00:07.836089,relu,0.10683131676825072,54,0.0009943676605910804,False,,none,7.119704073544228e-06,COMPLETE
648,178.14260864257812,2026-01-02 18:15:16.666563,2026-01-02 18:15:24.601174,0 days 00:00:07.934611,relu,0.11762138913575683,59,0.0057822856731399724,True,,none,7.4328509920674455e-06,COMPLETE
649,160.1413116455078,2026-01-02 18:15:24.609175,2026-01-02 18:15:32.570293,0 days 00:00:07.961118,relu,0.10834493592951727,55,0.05325385215805618,True,,none,5.835838323440341e-06,COMPLETE
650,158.36007690429688,2026-01-02 18:15:32.579293,2026-01-02 18:15:40.626888,0 days 00:00:08.047595,relu,0.12447086258281524,60,0.06985334595920871,True,,none,7.438136323014639e-06,COMPLETE
651,159.55723571777344,2026-01-02 18:15:40.636887,2026-01-02 18:15:48.661987,0 days 00:00:08.025100,relu,0.1133070524283683,57,0.07875064174543508,True,,none,6.757946379336427e-06,COMPLETE
652,164.33428955078125,2026-01-02 18:15:48.670497,2026-01-02 18:15:56.762628,0 days 00:00:08.092131,silu,0.10786473152465688,53,0.08009768140713326,True,,none,5.39120876739245e-06,COMPLETE
653,161.00332641601562,2026-01-02 18:15:56.769628,2026-01-02 18:16:04.686187,0 days 00:00:07.916559,relu,0.11883094025219643,60,0.06194445094879705,True,,none,8.496472103423996e-06,COMPLETE
654,157.65640258789062,2026-01-02 18:16:04.693187,2026-01-02 18:16:12.673864,0 days 00:00:07.980677,relu,0.10034144503104185,55,0.0999727591051574,True,,none,7.871845580030604e-06,COMPLETE
655,156.8723602294922,2026-01-02 18:16:12.682862,2026-01-02 18:16:20.818640,0 days 00:00:08.135778,relu,0.1262352226220929,58,0.0715863375971664,True,,none,7.6274187563987965e-06,COMPLETE
656,194.77676391601562,2026-01-02 18:16:20.826640,2026-01-02 18:16:28.773245,0 days 00:00:07.946605,relu,0.14272903709828683,53,0.00026333459143650784,True,,none,5.750085159789851e-06,COMPLETE
657,171.4949951171875,2026-01-02 18:16:28.780755,2026-01-02 18:16:36.757891,0 days 00:00:07.977136,relu,0.15363352659032603,60,0.06879816151608459,True,,minmax,6.194595903440722e-06,COMPLETE
658,196.74380493164062,2026-01-02 18:16:36.765894,2026-01-02 18:16:44.233498,0 days 00:00:07.467604,relu,0.13151638444702193,4,0.047308261864502606,True,,none,6.9644841450795325e-06,COMPLETE
659,158.8869171142578,2026-01-02 18:16:44.242497,2026-01-02 18:16:52.260746,0 days 00:00:08.018249,relu,0.13884625265301404,61,0.08585001080331775,True,,none,7.88770600802794e-06,COMPLETE
660,158.84303283691406,2026-01-02 18:16:52.267749,2026-01-02 18:17:00.320982,0 days 00:00:08.053233,relu,0.12675354924362472,57,0.07719482869035904,True,,none,7.635957788950994e-06,COMPLETE
661,160.75772094726562,2026-01-02 18:17:00.329983,2026-01-02 18:17:08.282050,0 days 00:00:07.952067,relu,0.13201137402841143,53,0.07012495717032642,True,,none,4.7922151267146574e-06,COMPLETE
662,160.15554809570312,2026-01-02 18:17:08.290050,2026-01-02 18:17:16.912322,0 days 00:00:08.622272,gelu,0.12196576576535995,57,0.0877334241662852,True,,none,8.074046359389602e-06,COMPLETE
663,158.05667114257812,2026-01-02 18:17:16.922322,2026-01-02 18:17:24.869889,0 days 00:00:07.947567,relu,0.12355264887161341,64,0.08775266554823258,True,,none,8.612182637889744e-06,COMPLETE
664,159.2978973388672,2026-01-02 18:17:24.877891,2026-01-02 18:17:32.912510,0 days 00:00:08.034619,relu,0.1346263808535393,61,0.06233927541448674,True,,none,6.699226273256405e-06,COMPLETE
665,158.8824005126953,2026-01-02 18:17:32.922510,2026-01-02 18:17:40.982163,0 days 00:00:08.059653,relu,0.11389402747188175,55,0.07725872813196062,True,,none,9.302425177582215e-06,COMPLETE
666,198.17530646430123,2026-01-02 18:17:40.989672,2026-01-02 18:17:48.499182,0 days 00:00:07.509510,relu,0.11685985887976266,21,0.0009941320753933216,False,,none,5.979075317440719e-06,COMPLETE
667,157.77374267578125,2026-01-02 18:17:48.507182,2026-01-02 18:17:56.566709,0 days 00:00:08.059527,relu,0.12529999424830887,58,0.0868473015409215,True,,none,9.737856408832619e-06,COMPLETE
668,159.40963745117188,2026-01-02 18:17:56.574720,2026-01-02 18:18:04.577424,0 days 00:00:08.002704,relu,0.11398086839462288,52,0.09988473404587672,True,,none,8.11325500562069e-06,COMPLETE
669,160.60733032226562,2026-01-02 18:18:04.585422,2026-01-02 18:18:12.651129,0 days 00:00:08.065707,relu,0.10776039095174783,61,0.07078499203569949,True,,none,9.333938259299754e-06,COMPLETE
670,166.09469604492188,2026-01-02 18:18:12.685135,2026-01-02 18:18:21.189311,0 days 00:00:08.504176,mish,0.11947384399796515,55,0.054844303818872356,True,,none,6.952431513712269e-06,COMPLETE
671,188.5290985107422,2026-01-02 18:18:21.197821,2026-01-02 18:18:28.833857,0 days 00:00:07.636036,relu,0.10693123273248055,6,0.08842629459883414,True,,none,1.0632057871241644e-05,COMPLETE
672,157.21388244628906,2026-01-02 18:18:28.841860,2026-01-02 18:18:36.807518,0 days 00:00:07.965658,relu,0.12828562299320317,61,0.07747206232224842,True,,none,8.694135628608093e-06,COMPLETE
673,157.41590881347656,2026-01-02 18:18:36.816518,2026-01-02 18:18:44.840213,0 days 00:00:08.023695,relu,0.100034192428412,58,0.09938596966432738,True,,none,5.681091497271737e-06,COMPLETE
674,177.88119506835938,2026-01-02 18:18:44.848211,2026-01-02 18:18:52.810400,0 days 00:00:07.962189,relu,0.24874658898628507,64,0.015827511631910894,True,,none,1.0958992280121593e-05,COMPLETE
675,158.66964721679688,2026-01-02 18:18:52.818400,2026-01-02 18:19:00.878539,0 days 00:00:08.060139,relu,0.1167336744583956,53,0.08754278578589632,True,,none,7.579917976537361e-06,COMPLETE
676,168.57571411132812,2026-01-02 18:19:00.886545,2026-01-02 18:19:09.031204,0 days 00:00:08.144659,silu,0.10718583322495363,57,0.06446686708100968,True,,none,1.0021443648649401e-05,COMPLETE
677,194.02345275878906,2026-01-02 18:19:09.039204,2026-01-02 18:19:16.641773,0 days 00:00:07.602569,relu,0.1232500346250046,8,0.07799706630676985,True,,minmax,4.5551188186943266e-06,COMPLETE
678,158.75064086914062,2026-01-02 18:19:16.649773,2026-01-02 18:19:24.574414,0 days 00:00:07.924641,relu,0.1368896127510022,52,0.08666245816062007,True,,none,6.485506378878679e-06,COMPLETE
679,158.4443817138672,2026-01-02 18:19:24.583414,2026-01-02 18:19:32.548048,0 days 00:00:07.964634,relu,0.11288813993176335,61,0.07191603132027012,True,,none,9.20977156130862e-06,COMPLETE
680,157.57325744628906,2026-01-02 18:19:32.556046,2026-01-02 18:19:40.525237,0 days 00:00:07.969191,relu,0.10717915049838247,64,0.09014856058085347,True,,none,1.0643909197961867e-05,COMPLETE
681,158.45523071289062,2026-01-02 18:19:40.534238,2026-01-02 18:19:48.539382,0 days 00:00:08.005144,relu,0.14379259914097348,55,0.09923188535993809,True,,none,7.926255343369868e-06,COMPLETE
682,158.32235717773438,2026-01-02 18:19:48.548385,2026-01-02 18:19:56.610019,0 days 00:00:08.061634,relu,0.11799454696344801,58,0.08068306321938351,True,,none,8.626278600142246e-06,COMPLETE
