number,value,datetime_start,datetime_complete,duration,params_activation,params_dropout,params_hidden_size,params_lr,params_scale_target,params_scaler,params_scaler_post_pca,params_weight_decay,state
683,159.7672119140625,2026-01-02 18:19:56.618020,2026-01-02 18:20:04.592611,0 days 00:00:07.974591,relu,0.12774714012642435,52,0.059975732189608034,True,,none,1.124615538392667e-05,COMPLETE
684,157.8666534423828,2026-01-02 18:20:04.599611,2026-01-02 18:20:12.624826,0 days 00:00:08.025215,relu,0.1007715142076757,60,0.09944302521661547,True,,none,5.088886064278154e-06,COMPLETE
685,197.51394999186198,2026-01-02 18:20:12.632827,2026-01-02 18:20:20.424956,0 days 00:00:07.792129,relu,0.11484462055029776,56,0.0009946423878067466,False,,none,1.1933400759285518e-05,COMPLETE
686,158.82522583007812,2026-01-02 18:20:20.432960,2026-01-02 18:20:28.418085,0 days 00:00:07.985125,relu,0.10722300243927303,64,0.07026402181028345,True,,none,9.657408989453094e-06,COMPLETE
687,159.3502197265625,2026-01-02 18:20:28.426085,2026-01-02 18:20:36.489202,0 days 00:00:08.063117,relu,0.12154505961971397,58,0.07937543695922675,True,,none,7.491116820437011e-06,COMPLETE
688,160.2135009765625,2026-01-02 18:20:36.498208,2026-01-02 18:20:45.006932,0 days 00:00:08.508724,gelu,0.1325289531090933,53,0.08538761677543484,True,,none,6.45994854978837e-06,COMPLETE
689,157.13803100585938,2026-01-02 18:20:45.015440,2026-01-02 18:20:53.030096,0 days 00:00:08.014656,relu,0.11283051816094955,60,0.06940345318786847,True,,none,1.0880650748165773e-05,COMPLETE
690,159.30178833007812,2026-01-02 18:20:53.038096,2026-01-02 18:21:01.017231,0 days 00:00:07.979135,relu,0.1269192204547332,53,0.05661559482313408,True,,none,8.24639741474487e-06,COMPLETE
691,161.72645568847656,2026-01-02 18:21:01.024231,2026-01-02 18:21:09.067366,0 days 00:00:08.043135,relu,0.1722884922918282,55,0.06637132347020977,True,,none,9.84119109432467e-06,COMPLETE
692,160.3721466064453,2026-01-02 18:21:09.075366,2026-01-02 18:21:17.276546,0 days 00:00:08.201180,relu,0.1500290833102825,58,0.09983369577207696,True,,none,1.0381764625960995e-05,COMPLETE
693,162.1656036376953,2026-01-02 18:21:17.285547,2026-01-02 18:21:25.333212,0 days 00:00:08.047665,relu,0.11473331229737144,51,0.05015099814312795,True,,none,7.2444386513172115e-06,COMPLETE
694,174.95330810546875,2026-01-02 18:21:25.342213,2026-01-02 18:21:33.901448,0 days 00:00:08.559235,mish,0.12050653072815215,55,0.029474881689871807,True,,none,8.827241622953454e-06,COMPLETE
695,168.8497314453125,2026-01-02 18:21:33.909453,2026-01-02 18:21:41.924050,0 days 00:00:08.014597,relu,0.10047097494966328,60,0.0703359068651913,True,,minmax,1.1862956850618056e-05,COMPLETE
696,176.5475616455078,2026-01-02 18:21:41.932050,2026-01-02 18:21:49.943199,0 days 00:00:08.011149,relu,0.11236734192900523,52,0.01163428987156076,True,,none,1.10146142181641e-05,COMPLETE
697,159.03781127929688,2026-01-02 18:21:49.951198,2026-01-02 18:21:57.852279,0 days 00:00:07.901081,relu,0.13405326840529944,56,0.08779121803203498,True,,none,5.495551587197079e-06,COMPLETE
698,156.53782653808594,2026-01-02 18:21:57.861280,2026-01-02 18:22:05.943421,0 days 00:00:08.082141,relu,0.1003798808875709,60,0.09971242336004393,True,,none,9.110126960299562e-06,COMPLETE
699,158.0177001953125,2026-01-02 18:22:05.951421,2026-01-02 18:22:13.942079,0 days 00:00:07.990658,relu,0.10086665048707878,51,0.08918114124701479,True,,none,6.495760948908617e-06,COMPLETE
700,164.93606567382812,2026-01-02 18:22:13.950078,2026-01-02 18:22:22.093232,0 days 00:00:08.143154,silu,0.10641987287710347,58,0.09927268333509628,True,,none,8.522866539030044e-06,COMPLETE
701,156.0780487060547,2026-01-02 18:22:22.100232,2026-01-02 18:22:30.160370,0 days 00:00:08.060138,relu,0.10029617741288983,55,0.08901890849201585,True,,none,7.128107644649869e-06,COMPLETE
702,158.1591796875,2026-01-02 18:22:30.168368,2026-01-02 18:22:38.099528,0 days 00:00:07.931160,relu,0.1008103677381676,54,0.08925045654132915,True,,none,6.305591047507046e-06,COMPLETE
703,168.14566040039062,2026-01-02 18:22:38.108525,2026-01-02 18:22:45.827728,0 days 00:00:07.719203,relu,0.10011185993551464,13,0.09926836959988103,True,,none,7.4100157153805835e-06,COMPLETE
704,157.5817413330078,2026-01-02 18:22:45.836240,2026-01-02 18:22:53.800867,0 days 00:00:07.964627,relu,0.1001489350346503,52,0.08925097279591152,True,,none,5.761387192772417e-06,COMPLETE
705,197.75195692274306,2026-01-02 18:22:53.808864,2026-01-02 18:23:01.688467,0 days 00:00:07.879603,relu,0.1000537493872837,55,0.000993558338612096,False,,none,7.096004124981597e-06,COMPLETE
706,158.53652954101562,2026-01-02 18:23:01.696468,2026-01-02 18:23:09.693149,0 days 00:00:07.996681,relu,0.10963456528798847,51,0.08718660571813946,True,,none,8.31522841271087e-06,COMPLETE
707,183.61639404296875,2026-01-02 18:23:09.702149,2026-01-02 18:23:17.385235,0 days 00:00:07.683086,relu,0.10783341571020147,18,0.007880956072657114,True,,none,9.251968401688866e-06,COMPLETE
708,158.75387573242188,2026-01-02 18:23:17.393235,2026-01-02 18:23:25.382415,0 days 00:00:07.989180,relu,0.10825366826033747,50,0.07758602463962182,True,,none,7.510837279925482e-06,COMPLETE
709,157.59365844726562,2026-01-02 18:23:25.389414,2026-01-02 18:23:33.448543,0 days 00:00:08.059129,relu,0.10738302933370833,55,0.09894801007016754,True,,none,6.305196837708679e-06,COMPLETE
710,157.9158935546875,2026-01-02 18:23:33.458543,2026-01-02 18:23:41.601169,0 days 00:00:08.142626,relu,0.100454006881344,57,0.08840918358806113,True,,none,7.940678710336935e-06,COMPLETE
711,193.01321411132812,2026-01-02 18:23:41.609168,2026-01-02 18:23:50.116440,0 days 00:00:08.507272,gelu,0.11371024409400725,50,0.00047721880356146917,True,,none,9.155890533464492e-06,COMPLETE
712,156.35079956054688,2026-01-02 18:23:50.125447,2026-01-02 18:23:58.162166,0 days 00:00:08.036719,relu,0.10012380242141959,54,0.09917062589998826,True,,none,5.048502811512436e-06,COMPLETE
713,188.66885375976562,2026-01-02 18:23:58.171166,2026-01-02 18:24:06.258341,0 days 00:00:08.087175,relu,0.10714320857359193,54,0.0007690158353944367,True,,none,4.202979386444041e-06,COMPLETE
714,158.9862060546875,2026-01-02 18:24:06.265341,2026-01-02 18:24:14.353506,0 days 00:00:08.088165,relu,0.10703901296536435,57,0.09956446287677032,True,,none,5.19136909106689e-06,COMPLETE
715,167.71273803710938,2026-01-02 18:24:14.362504,2026-01-02 18:24:22.368658,0 days 00:00:08.006154,relu,0.10042825080848843,53,0.07718060817073731,True,,minmax,5.826995706354709e-06,COMPLETE
716,158.74172973632812,2026-01-02 18:24:22.378659,2026-01-02 18:24:30.484849,0 days 00:00:08.106190,relu,0.11469924980038311,59,0.08022889402142191,True,,none,3.429399076377763e-06,COMPLETE
717,157.0042724609375,2026-01-02 18:24:30.494848,2026-01-02 18:24:38.497023,0 days 00:00:08.002175,relu,0.10003330316296205,55,0.08915908228085564,True,,none,5.154549283507092e-06,COMPLETE
718,157.28746032714844,2026-01-02 18:24:38.505025,2026-01-02 18:24:46.469704,0 days 00:00:07.964679,relu,0.11229366453927514,60,0.09986464064927887,True,,none,4.722233300088897e-06,COMPLETE
719,173.7459259033203,2026-01-02 18:24:46.476704,2026-01-02 18:24:55.002971,0 days 00:00:08.526267,mish,0.3686889306504567,57,0.07661175380663487,True,,none,5.519871829065053e-06,COMPLETE
720,157.6282196044922,2026-01-02 18:24:55.010971,2026-01-02 18:25:03.001056,0 days 00:00:07.990085,relu,0.10721417798331365,52,0.08712043880836187,True,,none,3.881310003830778e-06,COMPLETE
721,159.8134765625,2026-01-02 18:25:03.009056,2026-01-02 18:25:10.951767,0 days 00:00:07.942711,relu,0.11693599063599242,61,0.07839133358394834,True,,none,6.751955906455244e-06,COMPLETE
722,158.64254760742188,2026-01-02 18:25:10.960768,2026-01-02 18:25:19.081399,0 days 00:00:08.120631,relu,0.10013919167582858,55,0.09950400731802207,True,,none,4.749664692623899e-06,COMPLETE
723,158.35313415527344,2026-01-02 18:25:19.088401,2026-01-02 18:25:27.015483,0 days 00:00:07.927082,relu,0.11801591517289944,51,0.08785498544919762,True,,none,7.2462050546818235e-06,COMPLETE
724,197.58233391655818,2026-01-02 18:25:27.023482,2026-01-02 18:25:34.909150,0 days 00:00:07.885668,relu,0.10778024200760122,58,0.0009937660142650038,False,,none,4.341013443265541e-06,COMPLETE
725,165.83465576171875,2026-01-02 18:25:34.917663,2026-01-02 18:25:43.121890,0 days 00:00:08.204227,silu,0.11261038707861873,54,0.07018868138825342,True,,none,6.095036147701978e-06,COMPLETE
726,174.6494140625,2026-01-02 18:25:43.129890,2026-01-02 18:25:50.754012,0 days 00:00:07.624122,relu,0.12069720100336567,11,0.09976493485990592,True,,none,8.147576238415035e-06,COMPLETE
727,157.23391723632812,2026-01-02 18:25:50.762525,2026-01-02 18:25:58.797712,0 days 00:00:08.035187,relu,0.10682255584799549,61,0.07999456091172437,True,,none,9.540959222538342e-06,COMPLETE
728,158.82205200195312,2026-01-02 18:25:58.805711,2026-01-02 18:26:06.806853,0 days 00:00:08.001142,relu,0.11399160263522991,57,0.06405706112250811,True,,none,6.79099738628019e-06,COMPLETE
729,159.166259765625,2026-01-02 18:26:06.814851,2026-01-02 18:26:14.815014,0 days 00:00:08.000163,relu,0.10652279571406079,50,0.08839793455076479,True,,none,5.411324230820073e-06,COMPLETE
730,157.60079956054688,2026-01-02 18:26:14.822014,2026-01-02 18:26:22.825179,0 days 00:00:08.003165,relu,0.11857313350305261,61,0.07411507858993976,True,,none,8.327847953512357e-06,COMPLETE
731,169.4725799560547,2026-01-02 18:26:22.833179,2026-01-02 18:26:30.850884,0 days 00:00:08.017705,relu,0.43182838323523853,53,0.08728554339894928,True,,none,9.62344193829434e-06,COMPLETE
732,158.14651489257812,2026-01-02 18:26:30.858884,2026-01-02 18:26:38.872563,0 days 00:00:08.013679,relu,0.10661289594464428,58,0.07913394018717668,True,,none,7.184365012634395e-06,COMPLETE
733,159.8844451904297,2026-01-02 18:26:38.880566,2026-01-02 18:26:46.904200,0 days 00:00:08.023634,relu,0.12169806968527584,56,0.06231096670426216,True,,none,6.252233678485144e-06,COMPLETE
734,165.24497985839844,2026-01-02 18:26:46.912200,2026-01-02 18:26:54.864320,0 days 00:00:07.952120,relu,0.10082857346595307,61,0.09963694683022846,True,,minmax,8.852091255809911e-06,COMPLETE
735,158.3702850341797,2026-01-02 18:26:54.873832,2026-01-02 18:27:02.784467,0 days 00:00:07.910635,relu,0.11170612154911908,50,0.0725209351118637,True,,none,1.0537502524575247e-05,COMPLETE
736,160.91384887695312,2026-01-02 18:27:02.792470,2026-01-02 18:27:11.324673,0 days 00:00:08.532203,gelu,0.11334131283491232,53,0.08719647011221277,True,,none,8.075280116175896e-06,COMPLETE
737,156.90826416015625,2026-01-02 18:27:11.332670,2026-01-02 18:27:19.441322,0 days 00:00:08.108652,relu,0.10003348066230155,59,0.08894583236107953,True,,none,1.0282501031082358e-05,COMPLETE
738,157.13992309570312,2026-01-02 18:27:19.450323,2026-01-02 18:27:27.553428,0 days 00:00:08.103105,relu,0.10069304631234818,59,0.08822995444279007,True,,none,1.019652075164862e-05,COMPLETE
739,156.256103515625,2026-01-02 18:27:27.561431,2026-01-02 18:27:35.512072,0 days 00:00:07.950641,relu,0.10091286520621591,61,0.08948989630091753,True,,none,1.1644150479481353e-05,COMPLETE
740,155.79351806640625,2026-01-02 18:27:35.521075,2026-01-02 18:27:43.459725,0 days 00:00:07.938650,relu,0.10055983654769056,64,0.09968813256257748,True,,none,1.1924168114950946e-05,COMPLETE
741,156.96484375,2026-01-02 18:27:43.467725,2026-01-02 18:27:51.439899,0 days 00:00:07.972174,relu,0.1005940098595726,64,0.07057133135927877,True,,none,1.1506756792960906e-05,COMPLETE
742,157.33372497558594,2026-01-02 18:27:51.448899,2026-01-02 18:27:59.492109,0 days 00:00:08.043210,relu,0.10075488216767307,64,0.07951573732142447,True,,none,1.1283834892437664e-05,COMPLETE
743,157.1425018310547,2026-01-02 18:27:59.501109,2026-01-02 18:28:07.545714,0 days 00:00:08.044605,relu,0.10711548452282253,64,0.08800471792027333,True,,none,9.632255209760792e-06,COMPLETE
744,158.4822998046875,2026-01-02 18:28:07.554715,2026-01-02 18:28:15.540865,0 days 00:00:07.986150,relu,0.11284452065795425,61,0.06559142128780297,True,,none,1.2038333953040264e-05,COMPLETE
745,163.60816955566406,2026-01-02 18:28:15.548865,2026-01-02 18:28:24.180200,0 days 00:00:08.631335,mish,0.10645364075225622,61,0.07869671289884797,True,,none,1.0497432125372216e-05,COMPLETE
746,197.49057840983073,2026-01-02 18:28:24.188201,2026-01-02 18:28:32.026362,0 days 00:00:07.838161,relu,0.10032703236189477,60,0.0009943572077690335,False,,none,1.2150183927933536e-05,COMPLETE
747,157.1109161376953,2026-01-02 18:28:32.034363,2026-01-02 18:28:40.123014,0 days 00:00:08.088651,relu,0.11885138612982225,61,0.09951542751753895,True,,none,8.905404149845712e-06,COMPLETE
748,158.04054260253906,2026-01-02 18:28:40.133017,2026-01-02 18:28:48.271155,0 days 00:00:08.138138,relu,0.10746958639509628,58,0.09988042281225444,True,,none,9.957046761238226e-06,COMPLETE
749,158.42208862304688,2026-01-02 18:28:48.280156,2026-01-02 18:28:56.277833,0 days 00:00:07.997677,relu,0.10016751260033838,61,0.07232236206163739,True,,none,1.1248459486912448e-05,COMPLETE
750,156.6220245361328,2026-01-02 18:28:56.285340,2026-01-02 18:29:04.359957,0 days 00:00:08.074617,relu,0.10006936399167753,64,0.08766071055794918,True,,none,1.243763247157856e-05,COMPLETE
751,156.79733276367188,2026-01-02 18:29:04.368955,2026-01-02 18:29:12.383041,0 days 00:00:08.014086,relu,0.106707110581179,64,0.056905672467030696,True,,none,1.2800085871531343e-05,COMPLETE
752,171.96380615234375,2026-01-02 18:29:12.391552,2026-01-02 18:29:20.418727,0 days 00:00:08.027175,silu,0.10822536635255832,64,0.043303017895502505,True,,none,1.2691963930977944e-05,COMPLETE
753,158.3413848876953,2026-01-02 18:29:20.427729,2026-01-02 18:29:28.462327,0 days 00:00:08.034598,relu,0.10047192569749758,64,0.06136929683107888,True,,none,1.2942281267793836e-05,COMPLETE
754,158.10250854492188,2026-01-02 18:29:28.470327,2026-01-02 18:29:36.530456,0 days 00:00:08.060129,relu,0.11377301075805131,61,0.05949812725853064,True,,none,1.2697290350860202e-05,COMPLETE
755,158.8979949951172,2026-01-02 18:29:36.539456,2026-01-02 18:29:44.600169,0 days 00:00:08.060713,relu,0.12228955613065007,64,0.054695010981196314,True,,none,1.1801017029363667e-05,COMPLETE
756,168.2054901123047,2026-01-02 18:29:44.608169,2026-01-02 18:29:52.657863,0 days 00:00:08.049694,relu,0.10817848837556476,64,0.06902609957969522,True,,minmax,1.266037138858551e-05,COMPLETE
757,157.97616577148438,2026-01-02 18:29:52.665864,2026-01-02 18:30:00.664039,0 days 00:00:07.998175,relu,0.10027272464233612,61,0.08038758443392391,True,,none,1.0806926670795521e-05,COMPLETE
758,158.26382446289062,2026-01-02 18:30:00.673037,2026-01-02 18:30:08.661218,0 days 00:00:07.988181,relu,0.1142816500425322,61,0.07097305502565728,True,,none,1.3166106068097497e-05,COMPLETE
759,171.2659149169922,2026-01-02 18:30:08.668218,2026-01-02 18:30:16.796419,0 days 00:00:08.128201,relu,0.4603752268975221,64,0.08578762231128217,True,,none,1.1163109864769652e-05,COMPLETE
760,157.51617431640625,2026-01-02 18:30:16.804419,2026-01-02 18:30:24.847574,0 days 00:00:08.043155,relu,0.12163214868525657,59,0.08829240611731957,True,,none,1.3896763169329187e-05,COMPLETE
761,157.6776123046875,2026-01-02 18:30:24.855574,2026-01-02 18:30:32.845737,0 days 00:00:07.990163,relu,0.1090896072068763,64,0.06754994809025153,True,,none,1.02487146540902e-05,COMPLETE
762,157.40838623046875,2026-01-02 18:30:32.854735,2026-01-02 18:30:40.952896,0 days 00:00:08.098161,relu,0.1135281711772973,59,0.0784502786337964,True,,none,1.1826742374753794e-05,COMPLETE
763,161.5226593017578,2026-01-02 18:30:40.960896,2026-01-02 18:30:49.580098,0 days 00:00:08.619202,gelu,0.10721965524510423,61,0.08618718032397876,True,,none,1.3428703005570877e-05,COMPLETE
764,158.7351837158203,2026-01-02 18:30:49.587101,2026-01-02 18:30:57.569278,0 days 00:00:07.982177,relu,0.12533526225687508,64,0.06408936953063162,True,,none,1.0223894643849627e-05,COMPLETE
765,197.44843078613283,2026-01-02 18:30:57.578276,2026-01-02 18:31:05.453878,0 days 00:00:07.875602,relu,0.11688177766474868,58,0.0009944180631577598,False,,none,1.2139647998707163e-05,COMPLETE
766,156.25958251953125,2026-01-02 18:31:05.462877,2026-01-02 18:31:13.478958,0 days 00:00:08.016081,relu,0.10043904113420891,61,0.08861652748077539,True,,none,1.3832796826521644e-05,COMPLETE
767,194.5264129638672,2026-01-02 18:31:13.486959,2026-01-02 18:31:21.538594,0 days 00:00:08.051635,relu,0.10647173740738004,61,0.00018920818230383317,True,,none,1.4185703762177715e-05,COMPLETE
768,157.60804748535156,2026-01-02 18:31:21.546594,2026-01-02 18:31:29.612793,0 days 00:00:08.066199,relu,0.1001520880952969,61,0.08875047451710921,True,,none,1.4305114355514317e-05,COMPLETE
769,158.65597534179688,2026-01-02 18:31:29.621794,2026-01-02 18:31:37.569873,0 days 00:00:07.948079,relu,0.10663443238212582,58,0.073929165945917,True,,none,9.419556286263216e-06,COMPLETE
770,156.12631225585938,2026-01-02 18:31:37.577871,2026-01-02 18:31:45.640551,0 days 00:00:08.062680,relu,0.10017987222717552,64,0.0999605113256121,True,,none,1.1130502158181245e-05,COMPLETE
771,163.29190063476562,2026-01-02 18:31:45.649551,2026-01-02 18:31:54.191800,0 days 00:00:08.542249,mish,0.1075763091161576,64,0.09873113345119672,True,,none,1.3947333680290635e-05,COMPLETE
772,157.51527404785156,2026-01-02 18:31:54.198806,2026-01-02 18:32:02.197963,0 days 00:00:07.999157,relu,0.1001099717956889,61,0.08863467610653522,True,,none,1.1916970117383158e-05,COMPLETE
773,156.61776733398438,2026-01-02 18:32:02.205963,2026-01-02 18:32:10.226560,0 days 00:00:08.020597,relu,0.10036082798889405,61,0.09955787093032374,True,,none,1.0856548049513238e-05,COMPLETE
774,168.9981689453125,2026-01-02 18:32:10.235561,2026-01-02 18:32:18.255250,0 days 00:00:08.019689,relu,0.11440121491148883,64,0.07802559422036531,True,,minmax,1.3776504900194555e-05,COMPLETE
775,157.14012145996094,2026-01-02 18:32:18.262251,2026-01-02 18:32:26.274949,0 days 00:00:08.012698,relu,0.10777515626760487,64,0.08929305217383197,True,,none,1.1545616727412497e-05,COMPLETE
776,156.2756805419922,2026-01-02 18:32:26.281948,2026-01-02 18:32:34.263100,0 days 00:00:07.981152,relu,0.11949394755899737,64,0.09952857958883389,True,,none,3.976088094866275e-06,COMPLETE
777,159.2604522705078,2026-01-02 18:32:34.271100,2026-01-02 18:32:42.322318,0 days 00:00:08.051218,relu,0.11785048502731744,64,0.09946279161503963,True,,none,3.629870268895734e-06,COMPLETE
778,155.97805786132812,2026-01-02 18:32:42.331318,2026-01-02 18:32:50.346643,0 days 00:00:08.015325,relu,0.1071756407501213,64,0.08870405947819321,True,,none,2.8559595903237466e-06,COMPLETE
779,179.20697021484375,2026-01-02 18:32:50.355645,2026-01-02 18:32:58.442800,0 days 00:00:08.087155,silu,0.1074256835617231,64,0.022503912178368324,True,,none,2.71813397538533e-06,COMPLETE
780,157.1385955810547,2026-01-02 18:32:58.450801,2026-01-02 18:33:06.444947,0 days 00:00:07.994146,relu,0.10010257985960806,64,0.09887527733192812,True,,none,3.0562124038268743e-06,COMPLETE
781,158.11119079589844,2026-01-02 18:33:06.452947,2026-01-02 18:33:14.406556,0 days 00:00:07.953609,relu,0.11374066158510888,64,0.08939420200352287,True,,none,2.1867633698526204e-06,COMPLETE
782,156.64462280273438,2026-01-02 18:33:14.413557,2026-01-02 18:33:22.426644,0 days 00:00:08.013087,relu,0.10022706080404895,61,0.09916957013809491,True,,none,2.953787330416391e-06,COMPLETE
783,156.80795288085938,2026-01-02 18:33:22.434644,2026-01-02 18:33:30.474319,0 days 00:00:08.039675,relu,0.10694029194663135,61,0.08711117828938106,True,,none,2.0355381596139653e-06,COMPLETE
784,156.76541137695312,2026-01-02 18:33:30.482317,2026-01-02 18:33:38.554992,0 days 00:00:08.072675,relu,0.10592071569239274,61,0.09957590779576861,True,,none,2.681650639080832e-06,COMPLETE
785,197.3101136610243,2026-01-02 18:33:38.562992,2026-01-02 18:33:46.378596,0 days 00:00:07.815604,relu,0.10026577330654196,61,0.0009938430089911972,False,,none,3.0280881212843475e-06,COMPLETE
786,157.0724639892578,2026-01-02 18:33:46.387597,2026-01-02 18:33:54.342268,0 days 00:00:07.954671,relu,0.100597394614503,64,0.09931480991040234,True,,none,3.333372011610175e-06,COMPLETE
787,158.50962829589844,2026-01-02 18:33:54.350268,2026-01-02 18:34:02.423441,0 days 00:00:08.073173,relu,0.10044712570446795,61,0.08808378034447202,True,,none,2.59220816624393e-06,COMPLETE
788,161.60787963867188,2026-01-02 18:34:02.431954,2026-01-02 18:34:11.178742,0 days 00:00:08.746788,gelu,0.10684269061741171,60,0.08019490268893502,True,,none,2.584856897792145e-06,COMPLETE
789,156.2592315673828,2026-01-02 18:34:11.187743,2026-01-02 18:34:19.202370,0 days 00:00:08.014627,relu,0.10669589273389736,61,0.09903538735725628,True,,none,2.454978668890901e-06,COMPLETE
790,165.5891571044922,2026-01-02 18:34:19.210367,2026-01-02 18:34:27.282576,0 days 00:00:08.072209,relu,0.3405085033694244,59,0.09888122470723841,True,,none,2.3769986980767276e-06,COMPLETE
791,156.44171142578125,2026-01-02 18:34:27.291576,2026-01-02 18:34:35.377334,0 days 00:00:08.085758,relu,0.10026502457571973,59,0.08797279020511907,True,,none,3.802213282367342e-06,COMPLETE
792,157.6131591796875,2026-01-02 18:34:35.386342,2026-01-02 18:34:43.521491,0 days 00:00:08.135149,relu,0.1077236704903912,58,0.0821447318887161,True,,none,3.0971798816445475e-06,COMPLETE
793,158.50656127929688,2026-01-02 18:34:43.529492,2026-01-02 18:34:51.671659,0 days 00:00:08.142167,relu,0.10007722583245113,58,0.0875060522670029,True,,none,2.272830515198423e-06,COMPLETE
794,157.03994750976562,2026-01-02 18:34:51.680658,2026-01-02 18:34:59.668723,0 days 00:00:07.988065,relu,0.10044945059822775,61,0.0803056728481426,True,,none,3.7082862157279234e-06,COMPLETE
795,166.73953247070312,2026-01-02 18:34:59.677723,2026-01-02 18:35:07.835001,0 days 00:00:08.157278,relu,0.1117425645934373,58,0.07822923961517855,True,,minmax,3.090203471491408e-06,COMPLETE
796,162.58126831054688,2026-01-02 18:35:07.843514,2026-01-02 18:35:16.241138,0 days 00:00:08.397624,mish,0.10047845961944614,64,0.0996566258618237,True,,none,2.637480691252654e-06,COMPLETE
