number,value,datetime_start,datetime_complete,duration,params_activation,params_dropout,params_hidden_size,params_lr,params_scale_target,params_scaler,params_scaler_post_pca,params_weight_decay,state
911,193.04002380371094,2026-01-02 18:50:38.994422,2026-01-02 18:50:46.680576,0 days 00:00:07.686154,relu,0.13328829866916814,9,0.08909184174791206,True,,minmax,2.6952850636802644e-06,COMPLETE
912,157.51022338867188,2026-01-02 18:50:46.689575,2026-01-02 18:50:54.696826,0 days 00:00:08.007251,relu,0.12694113999423803,53,0.0906045529321938,True,,none,3.229722748537895e-06,COMPLETE
913,158.8578643798828,2026-01-02 18:50:54.705827,2026-01-02 18:51:02.787976,0 days 00:00:08.082149,relu,0.12071283258239535,55,0.07691852578379678,True,,none,2.9406038005860817e-06,COMPLETE
914,159.60574340820312,2026-01-02 18:51:02.795975,2026-01-02 18:51:11.461274,0 days 00:00:08.665299,gelu,0.12054134306061579,61,0.08942434259770071,True,,none,2.8770967310974516e-06,COMPLETE
915,162.24319458007812,2026-01-02 18:51:11.470274,2026-01-02 18:51:19.430888,0 days 00:00:07.960614,relu,0.1281175818505812,27,0.0989325026162419,True,,none,3.0795057245570575e-06,COMPLETE
916,158.6555938720703,2026-01-02 18:51:19.439888,2026-01-02 18:51:27.502027,0 days 00:00:08.062139,relu,0.10009176707298298,57,0.07901287862904982,True,,none,2.6999880834463746e-06,COMPLETE
917,157.15740966796875,2026-01-02 18:51:27.510026,2026-01-02 18:51:35.474129,0 days 00:00:07.964103,relu,0.13912374243394962,64,0.09897980322083358,True,,none,3.997375013399309e-06,COMPLETE
918,157.02293395996094,2026-01-02 18:51:35.483129,2026-01-02 18:51:43.615253,0 days 00:00:08.132124,relu,0.11359956631021968,60,0.09984266310574956,True,,none,5.02335002593704e-06,COMPLETE
919,158.14913940429688,2026-01-02 18:51:43.627253,2026-01-02 18:51:51.827436,0 days 00:00:08.200183,relu,0.10020970823824578,54,0.07214953545416831,True,,none,3.6442503716486198e-06,COMPLETE
920,197.41822347005206,2026-01-02 18:51:51.835435,2026-01-02 18:52:00.199606,0 days 00:00:08.364171,mish,0.11976262306690454,58,0.0009930984025223774,False,,none,2.4634094626309877e-06,COMPLETE
921,160.3233184814453,2026-01-02 18:52:00.207606,2026-01-02 18:52:08.312755,0 days 00:00:08.105149,relu,0.22479322233350668,61,0.09994057548650338,True,,none,2.918619742374646e-06,COMPLETE
922,159.76649475097656,2026-01-02 18:52:08.321751,2026-01-02 18:52:16.490337,0 days 00:00:08.168586,relu,0.11243521692119121,64,0.07822235245054275,True,,none,2.193602841894458e-06,COMPLETE
923,173.74998474121094,2026-01-02 18:52:16.499339,2026-01-02 18:52:24.510922,0 days 00:00:08.011583,relu,0.10689695750739428,56,0.01648910176864661,True,,none,3.291570261216219e-06,COMPLETE
924,161.12185668945312,2026-01-02 18:52:24.519926,2026-01-02 18:52:32.545592,0 days 00:00:08.025666,relu,0.10007342300759314,53,0.05472967067676526,True,,none,4.5175911338570335e-06,COMPLETE
925,166.98214721679688,2026-01-02 18:52:32.553595,2026-01-02 18:52:40.677261,0 days 00:00:08.123666,silu,0.11928648988293689,61,0.08792262799337476,True,,none,2.4733382357329702e-06,COMPLETE
926,159.43687438964844,2026-01-02 18:52:40.685264,2026-01-02 18:52:48.825402,0 days 00:00:08.140138,relu,0.11311640107698509,58,0.06639729949104466,True,,none,2.9551287165161347e-06,COMPLETE
927,167.62539672851562,2026-01-02 18:52:48.834402,2026-01-02 18:52:57.003544,0 days 00:00:08.169142,relu,0.39140895963360045,61,0.0814660718798551,True,,none,1.8278090074249213e-06,COMPLETE
928,158.43495178222656,2026-01-02 18:52:57.012546,2026-01-02 18:53:05.197882,0 days 00:00:08.185336,relu,0.12601720960313306,57,0.08766151269675485,True,,none,3.7043008672403906e-06,COMPLETE
929,182.23928833007812,2026-01-02 18:53:05.206883,2026-01-02 18:53:13.242103,0 days 00:00:08.035220,relu,0.10018851444519868,64,0.002219769813661252,True,,none,2.664795420756226e-06,COMPLETE
930,159.54957580566406,2026-01-02 18:53:13.251102,2026-01-02 18:53:21.377799,0 days 00:00:08.126697,relu,0.10816730273240577,53,0.07135239574154127,True,,none,2.1926675127424855e-06,COMPLETE
931,167.51345825195312,2026-01-02 18:53:21.386799,2026-01-02 18:53:29.499410,0 days 00:00:08.112611,relu,0.11317073848338914,59,0.09980568604560067,True,,minmax,4.162579696425697e-06,COMPLETE
932,157.9456329345703,2026-01-02 18:53:29.508409,2026-01-02 18:53:37.609584,0 days 00:00:08.101175,relu,0.12119595357732629,61,0.0800996222980913,True,,none,3.375114252263262e-06,COMPLETE
933,155.75608825683594,2026-01-02 18:53:37.617585,2026-01-02 18:53:45.812387,0 days 00:00:08.194802,relu,0.10758756918242843,57,0.09974087993812684,True,,none,1.659769688084337e-06,COMPLETE
934,159.6560516357422,2026-01-02 18:53:45.822385,2026-01-02 18:53:53.817534,0 days 00:00:07.995149,relu,0.13351770275595268,54,0.06437687825469758,True,,none,1.2901052831050784e-06,COMPLETE
935,157.87124633789062,2026-01-02 18:53:53.825535,2026-01-02 18:54:01.884136,0 days 00:00:08.058601,relu,0.1236009804236718,56,0.08692952650923735,True,,none,1.8690100992816356e-06,COMPLETE
936,161.2274627685547,2026-01-02 18:54:01.892136,2026-01-02 18:54:10.554385,0 days 00:00:08.662249,gelu,0.11492856498825788,54,0.08047009090349455,True,,none,1.457886566026174e-06,COMPLETE
937,178.94589233398438,2026-01-02 18:54:10.563385,2026-01-02 18:54:18.772647,0 days 00:00:08.209262,relu,0.12696595550191025,57,0.005805379040081198,True,,none,1.533213158661757e-06,COMPLETE
938,156.95753479003906,2026-01-02 18:54:18.781646,2026-01-02 18:54:26.931801,0 days 00:00:08.150155,relu,0.1110270198257805,53,0.09962652864790844,True,,none,1.5951728035884483e-06,COMPLETE
939,197.54647772894964,2026-01-02 18:54:26.939808,2026-01-02 18:54:34.779443,0 days 00:00:07.839635,relu,0.11785649533605598,64,0.0009940602625489415,False,,none,1.1059333674517539e-06,COMPLETE
940,161.59896850585938,2026-01-02 18:54:34.787445,2026-01-02 18:54:42.883095,0 days 00:00:08.095650,relu,0.23263849831473718,58,0.06961623808531107,True,,none,1.3715986292711273e-06,COMPLETE
941,157.45162963867188,2026-01-02 18:54:42.891096,2026-01-02 18:54:50.985402,0 days 00:00:08.094306,relu,0.1076641374686855,56,0.08902218156610078,True,,none,1.7688941324953603e-06,COMPLETE
942,157.2462158203125,2026-01-02 18:54:50.994402,2026-01-02 18:54:59.061068,0 days 00:00:08.066666,relu,0.13547863419541273,61,0.09968422257569144,True,,none,1.6989537682469382e-06,COMPLETE
943,170.40394592285156,2026-01-02 18:54:59.069068,2026-01-02 18:55:07.119708,0 days 00:00:08.050640,relu,0.1138736096502378,52,0.025418525442013177,True,,none,2.0275237960692195e-06,COMPLETE
944,159.3522491455078,2026-01-02 18:55:07.128707,2026-01-02 18:55:15.140910,0 days 00:00:08.012203,relu,0.10828867137663581,64,0.07766392486145882,True,,none,1.992658730414703e-06,COMPLETE
945,166.6063995361328,2026-01-02 18:55:15.149915,2026-01-02 18:55:23.743693,0 days 00:00:08.593778,mish,0.11980101928357023,58,0.05714181736258517,True,,none,2.457055132078766e-06,COMPLETE
946,156.53366088867188,2026-01-02 18:55:23.751693,2026-01-02 18:55:31.731801,0 days 00:00:07.980108,relu,0.10750284138978435,61,0.08741257932296274,True,,none,4.817648372361679e-06,COMPLETE
947,160.28990173339844,2026-01-02 18:55:31.739800,2026-01-02 18:55:39.688897,0 days 00:00:07.949097,relu,0.12870547060977913,56,0.07037443789263859,True,,none,1.6835721843777682e-06,COMPLETE
948,158.20477294921875,2026-01-02 18:55:39.695896,2026-01-02 18:55:47.800082,0 days 00:00:08.104186,relu,0.10755970969574004,60,0.08063594818257301,True,,none,2.236414250125311e-06,COMPLETE
949,194.88766479492188,2026-01-02 18:55:47.808081,2026-01-02 18:55:55.905278,0 days 00:00:08.097197,relu,0.10021589749141027,53,0.00019956958184835796,True,,none,1.1922885956884402e-06,COMPLETE
950,166.796875,2026-01-02 18:55:55.913282,2026-01-02 18:56:04.059377,0 days 00:00:08.146095,silu,0.11806598442751633,64,0.08877072511363891,True,,none,2.838158378209939e-06,COMPLETE
951,167.49903869628906,2026-01-02 18:56:04.065885,2026-01-02 18:56:12.094992,0 days 00:00:08.029107,relu,0.11396150539886601,58,0.07264614740945853,True,,minmax,3.0403676841353913e-06,COMPLETE
952,156.27621459960938,2026-01-02 18:56:12.102992,2026-01-02 18:56:20.168714,0 days 00:00:08.065722,relu,0.10697662223041801,61,0.08811297815864422,True,,none,1.92543995919934e-06,COMPLETE
953,158.3284912109375,2026-01-02 18:56:20.176716,2026-01-02 18:56:28.143303,0 days 00:00:07.966587,relu,0.1254836071278522,64,0.08827690446671235,True,,none,1.3983229575893416e-06,COMPLETE
954,181.1415557861328,2026-01-02 18:56:28.155306,2026-01-02 18:56:36.169974,0 days 00:00:08.014668,relu,0.12201008817812106,61,0.0035570420719763553,True,,none,1.5699380117108704e-06,COMPLETE
955,158.0320587158203,2026-01-02 18:56:36.178974,2026-01-02 18:56:44.169111,0 days 00:00:07.990137,relu,0.13252835489775328,56,0.06003945936292761,True,,none,2.0538777191538234e-06,COMPLETE
956,158.7338409423828,2026-01-02 18:56:44.178116,2026-01-02 18:56:52.265294,0 days 00:00:08.087178,relu,0.14079659177535048,61,0.09984718309478023,True,,none,2.203262779450111e-06,COMPLETE
957,161.73707580566406,2026-01-02 18:56:52.272806,2026-01-02 18:57:00.134373,0 days 00:00:07.861567,relu,0.11394147248652155,23,0.09991387739125111,True,,none,1.8131284381706285e-06,COMPLETE
958,366.59586046006945,2026-01-02 18:57:00.142373,2026-01-02 18:57:07.960451,0 days 00:00:07.818078,relu,0.11901442482110518,64,3.168440229284394e-05,False,,none,1.918892366525719e-06,COMPLETE
959,189.5428009033203,2026-01-02 18:57:07.969451,2026-01-02 18:57:16.016149,0 days 00:00:08.046698,relu,0.10766345526057397,56,0.0007299509776875393,True,,none,0.0009928648610425272,COMPLETE
960,160.9586944580078,2026-01-02 18:57:16.023149,2026-01-02 18:57:24.737911,0 days 00:00:08.714762,gelu,0.11317475591050302,59,0.07842253225095133,True,,none,1.8550987473452803e-06,COMPLETE
961,177.2609100341797,2026-01-02 18:57:24.745912,2026-01-02 18:57:32.794573,0 days 00:00:08.048661,relu,0.47324494046662935,53,0.06810277071975128,True,,none,1.5889893152415309e-06,COMPLETE
962,191.2354736328125,2026-01-02 18:57:32.803575,2026-01-02 18:57:40.774124,0 days 00:00:07.970549,relu,0.12472666597300887,61,0.0004618236360481857,True,,none,1.7580808633895e-06,COMPLETE
963,157.823974609375,2026-01-02 18:57:40.782634,2026-01-02 18:57:48.959800,0 days 00:00:08.177166,relu,0.10807115342122357,58,0.08116762313095541,True,,none,2.4112833988701644e-06,COMPLETE
964,157.93209838867188,2026-01-02 18:57:48.967807,2026-01-02 18:57:56.995895,0 days 00:00:08.028088,relu,0.1178988107445207,64,0.08879001896704035,True,,none,1.286355543142118e-06,COMPLETE
965,157.45155334472656,2026-01-02 18:57:57.003894,2026-01-02 18:58:05.028019,0 days 00:00:08.024125,relu,0.10832401640453787,56,0.07325842086997203,True,,none,2.368739657503582e-06,COMPLETE
966,159.780517578125,2026-01-02 18:58:05.036018,2026-01-02 18:58:13.085667,0 days 00:00:08.049649,relu,0.13202214879291382,61,0.0888813924632313,True,,none,2.0916396652989846e-06,COMPLETE
967,161.5377960205078,2026-01-02 18:58:13.093667,2026-01-02 18:58:21.191299,0 days 00:00:08.097632,relu,0.10710058316358007,53,0.0475146105142911,True,,none,2.5109048828082843e-06,COMPLETE
968,165.83677673339844,2026-01-02 18:58:21.199299,2026-01-02 18:58:29.227889,0 days 00:00:08.028590,relu,0.12075649344895216,64,0.09999776246514938,True,,minmax,2.0536458056243354e-06,COMPLETE
969,158.77304077148438,2026-01-02 18:58:29.236886,2026-01-02 18:58:37.335086,0 days 00:00:08.098200,relu,0.10003216168657049,59,0.06442549647510289,True,,none,1.5181688993244215e-06,COMPLETE
970,164.24327087402344,2026-01-02 18:58:37.343083,2026-01-02 18:58:45.830795,0 days 00:00:08.487712,mish,0.10011086299516089,55,0.0803720672931764,True,,none,2.660761519100592e-06,COMPLETE
971,168.45584106445312,2026-01-02 18:58:45.838795,2026-01-02 18:58:53.574846,0 days 00:00:07.736051,relu,0.11424434256593129,14,0.0997297638301668,True,,none,2.2057643715597475e-06,COMPLETE
972,158.85824584960938,2026-01-02 18:58:53.582845,2026-01-02 18:59:01.688515,0 days 00:00:08.105670,relu,0.112614579599105,61,0.08046221297245361,True,,none,1.843902989794735e-06,COMPLETE
973,157.49063110351562,2026-01-02 18:59:01.697520,2026-01-02 18:59:09.787599,0 days 00:00:08.090079,relu,0.10004529746990497,58,0.0872246896098809,True,,none,2.7410844448628295e-06,COMPLETE
974,166.00775146484375,2026-01-02 18:59:09.796108,2026-01-02 18:59:17.899792,0 days 00:00:08.103684,silu,0.12686349741858866,52,0.07191981343279057,True,,none,2.2967368832605546e-06,COMPLETE
975,156.55116271972656,2026-01-02 18:59:17.909791,2026-01-02 18:59:25.938407,0 days 00:00:08.028616,relu,0.10921016437341814,64,0.09974426609004289,True,,none,2.560694255883105e-06,COMPLETE
976,159.98501586914062,2026-01-02 18:59:25.947407,2026-01-02 18:59:33.997018,0 days 00:00:08.049611,relu,0.11568299159984519,56,0.0795624871470172,True,,none,1.6967831156378165e-06,COMPLETE
977,157.5714874267578,2026-01-02 18:59:34.006018,2026-01-02 18:59:42.068736,0 days 00:00:08.062718,relu,0.1075686424090502,60,0.06278839276417916,True,,none,2.983289208362799e-06,COMPLETE
978,197.78803622775607,2026-01-02 18:59:42.076736,2026-01-02 18:59:49.806893,0 days 00:00:07.730157,relu,0.12136692322743248,29,0.000994031826040203,False,,none,1.4146145709874764e-06,COMPLETE
979,157.49839782714844,2026-01-02 18:59:49.814891,2026-01-02 18:59:57.877443,0 days 00:00:08.062552,relu,0.10004652261681501,61,0.08784169967836039,True,,none,1.1118745651434546e-06,COMPLETE
980,158.65090942382812,2026-01-02 18:59:57.884442,2026-01-02 19:00:05.955062,0 days 00:00:08.070620,relu,0.10702732764882615,55,0.0728302628642904,True,,none,2.0899277105800008e-06,COMPLETE
981,158.02264404296875,2026-01-02 19:00:05.963062,2026-01-02 19:00:14.062769,0 days 00:00:08.099707,relu,0.12857860900211296,58,0.0883147435531426,True,,none,1.9452778968255277e-06,COMPLETE
982,164.16632080078125,2026-01-02 19:00:14.069768,2026-01-02 19:00:22.082978,0 days 00:00:08.013210,relu,0.28431814048299664,64,0.07833486479358208,True,,none,2.347377880265401e-06,COMPLETE
983,156.26263427734375,2026-01-02 19:00:22.091984,2026-01-02 19:00:30.195096,0 days 00:00:08.103112,relu,0.11602290777840014,52,0.08812956824735982,True,,none,1.6745715487762466e-06,COMPLETE
984,163.41810607910156,2026-01-02 19:00:30.204612,2026-01-02 19:00:38.221753,0 days 00:00:08.017141,relu,0.17496732802290982,52,0.053308437566952416,True,,none,1.4198299344099238e-06,COMPLETE
985,157.86251831054688,2026-01-02 19:00:38.230754,2026-01-02 19:00:46.237421,0 days 00:00:08.006667,relu,0.1313649384343406,52,0.09931582887005011,True,,none,1.2305786677956398e-06,COMPLETE
986,162.5829620361328,2026-01-02 19:00:46.246419,2026-01-02 19:00:54.796141,0 days 00:00:08.549722,gelu,0.12486808194794691,52,0.06576045325312574,True,,none,1.726381916579548e-06,COMPLETE
987,158.92434692382812,2026-01-02 19:00:54.804645,2026-01-02 19:01:02.921832,0 days 00:00:08.117187,relu,0.14740237731736605,55,0.0881214228410639,True,,none,1.0026886536697589e-06,COMPLETE
988,158.56134033203125,2026-01-02 19:01:02.929830,2026-01-02 19:01:10.910891,0 days 00:00:07.981061,relu,0.13712281293638723,55,0.09987580116713435,True,,none,1.5332667807216244e-06,COMPLETE
989,159.6037139892578,2026-01-02 19:01:10.918893,2026-01-02 19:01:18.825503,0 days 00:00:07.906610,relu,0.11794922871828838,51,0.07322520540065085,True,,none,1.6721434920725525e-06,COMPLETE
990,157.7606964111328,2026-01-02 19:01:18.833504,2026-01-02 19:01:26.918649,0 days 00:00:08.085145,relu,0.11920597869354178,58,0.09975208086716914,True,,none,1.6104258197347302e-06,COMPLETE
991,158.95095825195312,2026-01-02 19:01:26.926649,2026-01-02 19:01:34.992744,0 days 00:00:08.066095,relu,0.11389692090665639,55,0.07916909303995673,True,,none,1.9043596494875191e-06,COMPLETE
992,169.010009765625,2026-01-02 19:01:35.000751,2026-01-02 19:01:43.080400,0 days 00:00:08.079649,relu,0.12112996720642444,58,0.08590920508051812,True,,minmax,1.4092632645311283e-06,COMPLETE
993,168.53768920898438,2026-01-02 19:01:43.087401,2026-01-02 19:01:51.628159,0 days 00:00:08.540758,mish,0.266354998516779,61,0.06920016747356487,True,,none,2.113547359698533e-06,COMPLETE
994,162.06869506835938,2026-01-02 19:01:51.636161,2026-01-02 19:01:59.691293,0 days 00:00:08.055132,relu,0.13932110354084012,64,0.05910534436141989,True,,none,1.8053170620939886e-06,COMPLETE
995,157.97718811035156,2026-01-02 19:01:59.699299,2026-01-02 19:02:07.665930,0 days 00:00:07.966631,relu,0.11251247533423088,52,0.08751611736183021,True,,none,2.5747180041961806e-06,COMPLETE
996,197.37021809895833,2026-01-02 19:02:07.672930,2026-01-02 19:02:15.529572,0 days 00:00:07.856642,relu,0.127805044590528,58,0.0009944380991982497,False,,none,1.9376849528846003e-06,COMPLETE
997,158.6414794921875,2026-01-02 19:02:15.538572,2026-01-02 19:02:23.519693,0 days 00:00:07.981121,relu,0.10712255408747275,61,0.0783417850116085,True,,none,1.2655858294912526e-06,COMPLETE
998,164.16488647460938,2026-01-02 19:02:23.528693,2026-01-02 19:02:31.583454,0 days 00:00:08.054761,relu,0.2972553817518093,55,0.09976521101650729,True,,none,2.2897805825501968e-06,COMPLETE
999,186.901123046875,2026-01-02 19:02:31.591454,2026-01-02 19:02:39.205587,0 days 00:00:07.614133,silu,0.11431177011592618,4,0.08652675640672429,True,,none,3.142886458318622e-06,COMPLETE
1000,142.81024169921875,2026-01-03 00:55:29.662429,2026-01-03 00:55:39.025729,0 days 00:00:09.363300,relu,0.10795953813121982,58,0.07134472109482987,True,standard,,2.79495060909614e-06,COMPLETE
1001,144.0585479736328,2026-01-03 00:55:39.035730,2026-01-03 00:55:47.639493,0 days 00:00:08.603763,relu,0.1237130549743937,51,0.0689964231243497,True,standard,,1.5558616969907933e-06,COMPLETE
1002,144.38507080078125,2026-01-03 00:55:47.647492,2026-01-03 00:55:56.044329,0 days 00:00:08.396837,relu,0.13232993232199314,51,0.05435426933772815,True,standard,,1.8590161460833438e-06,COMPLETE
1003,149.04258728027344,2026-01-03 00:55:56.052330,2026-01-03 00:56:04.316701,0 days 00:00:08.264371,relu,0.13675489239917393,50,0.04666908803446446,True,standard,,1.5360293376805404e-06,COMPLETE
1004,145.46987915039062,2026-01-03 00:56:04.329701,2026-01-03 00:56:12.089867,0 days 00:00:07.760166,relu,0.14445382564300194,50,0.056939805892803945,True,standard,,1.5306598392137248e-06,COMPLETE
1005,151.64041137695312,2026-01-03 00:56:12.097867,2026-01-03 00:56:19.997520,0 days 00:00:07.899653,relu,0.15620172684194691,49,0.04712415223786607,True,standard,,1.1887210166026393e-06,COMPLETE
1006,157.8657684326172,2026-01-03 00:56:20.007032,2026-01-03 00:56:28.304281,0 days 00:00:08.297249,relu,0.15607605602197958,51,0.03309826483260342,True,standard,,1.1394854115401686e-06,COMPLETE
1007,,2026-01-03 00:56:28.314281,,,relu,0.14603881496829918,49,0.044124881986987954,True,standard,,1.2644945703626262e-06,RUNNING
